by,descendants,id,kids,score,time,title,type,url,text
ignoramous,25.0,40264352,"[40264969, 40264799, 40264795, 40264859, 40264792, 40264933]",69,1714912244,Machine unlearning: ML model minus the information to be unlearned,story,https://ai.stanford.edu/~kzliu/blog/unlearning,
gulced,10.0,40264337,"[40265025, 40265315, 40265105, 40265208, 40264754, 40265361]",45,1714912110,"A History of C Compilers – Part 1: Performance, Portability and Freedom",story,https://thechipletter.substack.com/p/a-history-of-c-compilers-part-1-performance,
logicallee,9.0,40234584,"[40264890, 40264705, 40264702, 40264817]",43,1714645601,Rewriting the Technical Interview (2020),story,https://aphyr.com/posts/353-rewriting-the-technical-interview,
spirit23,25.0,40262236,"[40262655, 40262942, 40264146, 40263917, 40263378, 40263253, 40264221, 40262955, 40262763]",150,1714883170,Time-Based CSS Animations,story,https://yuanchuan.dev/time-based-css-animations,
danny00,33.0,40261681,"[40262369, 40262640, 40262263, 40265218, 40262393, 40262928, 40262402, 40263221, 40263059, 40263300, 40265169, 40262522, 40262386, 40262191, 40262149, 40263155, 40263768]",219,1714873145,Automated integer hash function discovery,story,https://github.com/skeeto/hash-prospector,
stanulilic,72.0,40263017,"[40265166, 40263361, 40263676, 40263690, 40263443, 40264903, 40263680, 40264729]",92,1714894727,Rusty.hpp: A Borrow Checker and Memory Ownership System for C++20,story,https://github.com/Jaysmito101/rusty.hpp,
q2loyp,50.0,40264042,"[40265478, 40264887, 40264932, 40265363, 40265058, 40265319, 40264726, 40265256, 40264846, 40265265, 40265029, 40265023, 40264811, 40264841, 40264691, 40265097, 40265285]",78,1714908677,"Take a look at traefik, even if you don't use containers",story,https://j6b72.de/article/why-you-should-take-a-look-at-traefik/,
gtt,53.0,40233938,"[40265450, 40264453, 40264058, 40265385, 40264530, 40264335, 40265405, 40263288, 40263248, 40263451, 40263136, 40264150, 40264689, 40264302, 40263811, 40264333, 40264386, 40263218, 40265188, 40264546]",86,1714638491,Computers Reduce Efficiency: Case Studies of the Solow Paradox (2023),story,https://scottlocklin.wordpress.com/2023/11/21/computers-reduce-efficiency-case-studies-of-the-solow-paradox/,
dkraj,57.0,40263027,"[40263591, 40265453, 40263612, 40263334, 40263770, 40265398, 40264632, 40263428, 40265205]",104,1714894933,Show HN: I built a website to share files and messages without any server,story,https://neighbor-share.vercel.app/,"NeighborHoodShare: It is a p2p files and messages sharing platform without involvement of any server. It has end-to-end encryption, ensuring your messages and files remain confidential.<p>These are some features:
- Share photos, documents, videos, and more with ease, no matter the size.
- Connect instantly with anyone for speedy and reliable file transfers, bypassing the need for centralized servers.
- Get started in minutes with our intuitive interface designed for seamless communication. No registration.
- Easily connect with others using QR codes, simplifying the sharing process further.<p>The inspiration behind NeighborHoodShare stemmed from a common dilemma: the reluctance to share personal contact details like phone numbers or email addresses when sharing photos or messages with strangers. With NeighborHoodShare, you can share content securely without compromising your privacy.<p>I would be happy to hear your feedback and suggestions for improving NeighborHoodShare.<p>I had written a blog on how p2p networking in browsers work: <a href=""https:&#x2F;&#x2F;dikshantraj2001.medium.com&#x2F;nat-stun-turn-and-ice-466dabbc2fdb"" rel=""nofollow"">https:&#x2F;&#x2F;dikshantraj2001.medium.com&#x2F;nat-stun-turn-and-ice-466...</a>"
speckx,13.0,40260210,"[40260872, 40261251, 40261878, 40264226, 40263951, 40263600, 40265045, 40264268, 40263646]",213,1714856162,Atari's Mike Jang,story,https://arcadeblogger.com/2024/02/13/ataris-mike-jang/,
gz09,85.0,40259185,"[40261562, 40261546, 40260398, 40261037, 40260721, 40264358, 40263021, 40260733, 40263018, 40260912, 40261844, 40260396, 40260391]",238,1714845053,Verified Rust for low-level systems code,story,https://github.com/verus-lang/verus,
flexagoon,85.0,40262779,"[40263189, 40264220, 40264282, 40263634, 40264393, 40265334, 40263472, 40263379, 40264263, 40263962, 40263902, 40263449, 40264137, 40265014, 40263849, 40263296, 40263170, 40264944, 40264073]",132,1714891660,Xmake: A cross-platform build utility based on Lua,story,https://github.com/xmake-io/xmake,
bikenaga,33.0,40261001,"[40261827, 40261414, 40261741, 40261700, 40261409, 40264494, 40261852, 40262441, 40262887, 40261507, 40261805]",134,1714863750,Vera Rubin's primary mirror gets its first reflective coating,story,https://www.universetoday.com/166842/vera-rubins-primary-mirror-gets-its-first-reflective-coating/,
nateb2022,24.0,40262115,"[40263924, 40262943, 40262455, 40263039, 40264293, 40262662, 40262486, 40263131, 40263169, 40264718]",53,1714880764,"Cylon: JavaScript framework for robotics, drones, and the Internet of Things",story,https://github.com/hybridgroup/cylon,
pabs3,16.0,40261926,"[40263474, 40263734, 40264129]",38,1714877547,Digital Telecommunication in HF band - WWWAN - World-Wide Wireless Area Network,story,https://pretalx.sysmocom.de/osmodevcon2024/talk/BBZBGM/,
thunderbong,5.0,40262643,"[40263526, 40264715, 40264187]",48,1714889155,New scanning electron microscope tech sees magnetic field with 100nm resolution,story,https://papers.ssrn.com/sol3/papers.cfm?abstract_id=4812984,
nicowaltz,137.0,40260259,"[40263157, 40260788, 40265337, 40261194, 40263636, 40263065, 40260832, 40262957, 40264371, 40260968, 40261289, 40260789, 40261308, 40264211, 40262871, 40261069, 40264155, 40261129, 40261492, 40262557, 40260805, 40263710, 40260785, 40261281, 40260690, 40262340, 40261258, 40262046, 40261790, 40261998, 40260916, 40261603, 40261391, 40261658, 40261394, 40261125, 40261227, 40261064, 40261966, 40262453, 40260851, 40261343, 40261349]",214,1714856635,"Show HN: gpudeploy.com – ""Airbnb"" for GPUs",story,https://www.gpudeploy.com,"Hi HN,<p>YC w24 company here. We just pivoted from drone delivery to build gpudeploy.com, a website that routes on-demand traffic for GPU instances to idle compute resources.<p>The experience is similar to lambda labs, which we’ve really enjoyed for training our robotics models, but their GPUs are never available for on-demand. We are also trying to make it more no-nonsense (no hidden fees, no H100 behind “contact sales”, etc.).<p>The tech to make this work is actually kind of nifty, we may do an in-depth HN post on that soon.<p>Right now, we have H100s, a few RTX 4090s and a GTX 1080 Ti online. Feel free to try it out!<p>Also, if you’ve got compute sitting around (a GPU cluster, a crypto mining operation or just a GPU) or if you’re an AI company with idle compute (hopefully not in a Stability AI way) and want to see some ROI, it’s very simple and flexible to hook it up to our site and you’ll maybe get a few researchers using your compute.<p>Nice rest of the week!"
LinuxBender,210.0,40234871,"[40259594, 40261986, 40261905, 40237334, 40260335, 40237257, 40262968, 40237967, 40259843, 40264848, 40264657, 40263341, 40264675, 40263935, 40263333, 40265217, 40259942, 40242461, 40264920, 40262718, 40259549, 40263429, 40262293, 40261959, 40262478, 40264405, 40263200, 40259964, 40261709, 40263137, 40262450, 40237214]",176,1714648849,AM radio law opposed by tech and auto industries is close to passing,story,https://arstechnica.com/cars/2024/05/am-radio-is-a-lifeline-lawmakers-say-tech-and-auto-industries-disagree/,
jshchnz,,40262846,,1,1714892407,Emerge (YC W21) is hiring senior engineers to automate dead code deletion,job,https://www.emergetools.com/careers,
okl,18.0,40263479,"[40264149, 40264826, 40264246, 40264613, 40264032]",69,1714902268,Debian 64-bit-time transition,story,https://wiki.debian.org/ReleaseGoals/64bit-time,
ulrischa,11.0,40244205,"[40264994, 40258105, 40258528, 40262051, 40262048]",38,1714712283,A year of publishing the MDN Blog,story,https://developer.mozilla.org/en-US/blog/mdn-blog-one-year-on/,
robertvc,15.0,40261550,"[40264384, 40262698, 40264505, 40263051, 40262342]",69,1714870865,Understanding Stein's Paradox (2021),story,https://joe-antognini.github.io/machine-learning/steins-paradox,
edward,102.0,40263194,"[40263432, 40265406, 40263416, 40263807, 40263656, 40263786, 40263654, 40263752, 40263716, 40263723, 40263458, 40263422, 40263521, 40263616, 40263736, 40263701, 40263445]",64,1714898369,Flags Are Not Languages,story,https://www.flagsarenotlanguages.com/blog/,
spenrose,78.0,40258037,"[40259830, 40265067, 40263062, 40259928, 40261804, 40261635, 40259904, 40264005, 40263401, 40260408, 40263244, 40262471, 40261178, 40260429, 40259899, 40260544]",275,1714833764,How to build a $20B semiconductor fab,story,https://www.construction-physics.com/p/how-to-build-a-20-billion-semiconductor,
jsiepkes,89.0,40260399,"[40262892, 40265101, 40261710, 40265428, 40265223, 40265293, 40261698, 40265262, 40262803, 40264913, 40262459, 40263251, 40261851, 40263785, 40261713, 40262623]",129,1714857874,Superfest – The almost unbreakable East German Glass (2021),story,https://digitalcosmonaut.com/superfest-ceverit-glass-ddr/,
botanical,157.0,40262190,"[40263203, 40262327, 40262250, 40262309, 40262379, 40263362, 40264950, 40264023, 40262518, 40262350, 40263936, 40264183, 40262406, 40262304, 40262330, 40262307, 40262428, 40263114, 40264531]",174,1714882436,Judge mulls sanctions over Google's destruction of internal chats,story,https://arstechnica.com/tech-policy/2024/05/judge-mulls-sanctions-over-googles-shocking-destruction-of-internal-chats/,
IMSAI8080,61.0,40262883,"[40265476, 40263684, 40263339, 40263592, 40263064, 40263540, 40263329, 40265281, 40263822, 40263731, 40263813, 40262884, 40263437, 40263360, 40263347, 40263311, 40263285]",53,1714892876,Council Bans Apostrophes on Street Signs to Avoid Database Issues,story,https://www.bbc.co.uk/news/uk-england-york-north-yorkshire-68942321,
rodarima,96.0,40260035,"[40263313, 40260597, 40260167, 40260193, 40262631, 40260188, 40260520, 40261861, 40260513, 40261791, 40260634, 40260621, 40260329, 40260829, 40261606, 40260157, 40260174, 40260604, 40261625, 40261614, 40260770, 40260215, 40260163, 40260909, 40260265, 40260668, 40260781]",394,1714854174,Show HN: Dillo 3.1.0 released after 9 years,story,https://dillo-browser.github.io/latest.html,"As commented before[1], I&#x27;ve been working on the past months to get the Dillo
back to life and today I&#x27;m happy to release the 3.1.0 version, after almost 9
years since the last one.<p>[1]: <a href=""https:&#x2F;&#x2F;news.ycombinator.com&#x2F;item?id=38847613"">https:&#x2F;&#x2F;news.ycombinator.com&#x2F;item?id=38847613</a><p>During this time:<p>- A new mailing list was created[2] which is beginning to get
some messages and patches. It is available in gmane via NNTP at
gmane.comp.web.dillo.devel.<p>[2]: <a href=""https:&#x2F;&#x2F;lists.mailman3.com&#x2F;hyperkitty&#x2F;list&#x2F;dillo-dev@mailman3.com&#x2F;"" rel=""nofollow"">https:&#x2F;&#x2F;lists.mailman3.com&#x2F;hyperkitty&#x2F;list&#x2F;dillo-dev@mailman...</a><p>- A LiberaPay page[3] which received the first donations (thanks!).<p>[3]: <a href=""https:&#x2F;&#x2F;liberapay.com&#x2F;dillo&#x2F;"" rel=""nofollow"">https:&#x2F;&#x2F;liberapay.com&#x2F;dillo&#x2F;</a><p>- Some more bugs where fixed and new features where added (details in the
release page and&#x2F;or changelog).<p>Thanks to all the people that contributed with patches and tests. Now let&#x27;s see
if we can make it land in some distros!"
not_a_boat,74.0,40257843,"[40258156, 40259351, 40258726, 40258733, 40257939, 40259630, 40258169, 40257942, 40258789, 40258484, 40258912, 40259091, 40258626, 40257960, 40257902, 40258933]",117,1714832221,The Mirror Fusion Test Facility (2023),story,https://www.beautifulpublicdata.com/the-mirror-fusion-test-facility/,
arcanus,27.0,40258804,"[40260079, 40259545, 40262886, 40260324]",90,1714841237,Porting HPC Applications to AMD Instinct MI300A Using Unified Memory and OpenMP,story,https://arxiv.org/abs/2405.00436,
alexmolas,46.0,40245261,"[40262622, 40261540, 40261833, 40260370, 40262990, 40261840, 40261821, 40245530, 40261860, 40264131, 40261900, 40262879, 40262905, 40254565, 40262023]",84,1714722712,Drink Me: (Ab)Using a LLM to Compress Text,story,https://o565.com/llm-text-compression/,
fanf2,28.0,40257601,"[40260372, 40260048, 40258500, 40258738, 40259450, 40259120]",96,1714830122,CBMC: C bounded model checker (2021),story,http://www.cprover.org/cbmc/,
tiniuclx,49.0,40235345,"[40262762, 40261666, 40262012, 40263661, 40263035, 40264462, 40263123, 40263354, 40262676, 40262265, 40261345, 40261615, 40261677]",99,1714652653,The business of wallets,story,https://www.bitsaboutmoney.com/archive/the-business-of-wallets/,
redbell,14.0,40263948,"[40264496, 40264912, 40264660, 40264205, 40264625, 40264173, 40264574]",21,1714907529,"Firefox Power User Keeps 7,400 Browser Tabs Open for 2 Years",story,https://me.pcmag.com/en/browsers/23391/firefox-power-user-keeps-7400-browser-tabs-open-for-2-years,
commspam,4.0,40261023,"[40263117, 40261039, 40262465, 40262749]",29,1714863984,Hymn for Walpurgisnacht,story,https://themillions.com/2024/04/hymn-for-walpurgisnacht.html,
Brajeshwar,111.0,40258273,"[40259154, 40262658, 40261676, 40258669, 40261675, 40264148, 40259478, 40259689, 40259123, 40261719, 40259223, 40258902]",72,1714835748,Was the Stone Age the Wood Age?,story,https://www.nytimes.com/2024/05/04/science/archaeology-neanderthals-wood.html,
zinccat,58.0,40261965,"[40262090, 40262534, 40262041, 40262144, 40263055, 40262058, 40262156, 40262192]",118,1714878229,SEQUOIA: Exact Llama2-70B on an RTX4090 with half-second per-token latency,story,https://infini-ai-lab.github.io/Sequoia-Page/,
doener,61.0,40263100,"[40264322, 40263881, 40263391, 40263262, 40265317, 40263735, 40263627, 40263489, 40263631, 40263739, 40263637, 40263470, 40263226, 40263795, 40263414, 40264087, 40263724, 40263914, 40263303, 40263609, 40263340, 40263271, 40263357]",87,1714896278,They Live,story,https://en.wikipedia.org/wiki/They_Live,
randycupertino,38.0,40262396,"[40264433, 40264380, 40264538, 40264592, 40264410, 40264960, 40265063, 40264336, 40264424, 40264699, 40264678]",59,1714885561,"Zebra remains on the loose in Washington state, officials close trailheads",story,https://apnews.com/article/zebra-missing-washington-state-2f46a5c4e344f385ba11e3ad2ae41c87,
prismatic,1.0,40262289,[40264875],5,1714883984,"Frank Stella, Towering Artist and Master of Reinvention, Dies at 87",story,https://www.nytimes.com/2024/05/04/arts/frank-stella-dead.html,
calebjosue,4.0,40260862,"[40263947, 40260977, 40263420]",71,1714862272,Tell HN: A note of gratitude to the people providing answers over here,story,,A couple of days ago I explained my current job situation and asked for a job.<p>Here&#x27;s a note of gratitude to the people answering questions all over the world.<p>Thanks!<p>https:&#x2F;&#x2F;calebjosue.gigalixirapp.com&#x2F;blog.html#gratitude
jksk61,0.0,40262728,,4,1714890844,The Promise of SGLT2 Inhibitors,story,https://worksinprogress.co/issue/the-future-of-kidney-treatment/,
Hooke,0.0,40236462,,21,1714658650,Professor Megalow's Dinosaur Bones: Richard Owen and Victorian literature,story,https://publicdomainreview.org/essay/richard-owen-and-victorian-literature,
thunderbong,13.0,40262082,"[40263095, 40263025, 40263134, 40263530]",44,1714880173,"Google Fit dev APIs shutdown set, fate of Android, Wear OS apps go unannounced",story,https://9to5google.com/2024/05/04/google-fit-api-shutdown/,
YeGoblynQueenne,116.0,40257064,"[40258571, 40257243, 40258054, 40258093, 40263943, 40258416, 40263873, 40259125, 40261684, 40258396, 40259973, 40258936, 40258588, 40258712, 40260243, 40258051]",179,1714824799,Vulture shortage threatens Zoroastrian burial rites,story,https://www.theguardian.com/world/article/2024/may/04/vulture-shortage-threatens-zoroastrian-burial-rites-india-iran-pakistan,
tosh,1.0,40255649,"[40262912, 40261743]",38,1714807366,CookingSense: A Culinary Knowledgebase with Multidisciplinary Assertions,story,https://arxiv.org/abs/2405.00523,
kungfudoi,3.0,40261705,[40262367],37,1714873598,Moving the largest camera from California lab to Andes mountaintop,story,https://www.scientificamerican.com/article/how-to-move-the-worlds-largest-camera-from-a-california-lab-to-an-andes/,
stoniejohnson,10.0,40256173,"[40256840, 40260450, 40261299, 40256833, 40256824, 40257007, 40260502]",131,1714814865,The Matrix: A Bayesian learning model for LLMs,story,https://arxiv.org/abs/2402.03175,
TotalCrackpot,97.0,40257677,"[40259831, 40260266, 40259509, 40259815, 40260198, 40260108, 40260822, 40259724, 40259968, 40259518, 40260582, 40261777, 40260180, 40261084, 40260089, 40259546, 40260461, 40260184, 40261701, 40261221, 40261143, 40261163, 40261772, 40260279, 40259510]",239,1714830718,In Praise of Idleness (1932),story,https://harpers.org/archive/1932/10/in-praise-of-idleness/,
lermontov,2.0,40253494,[40255350],19,1714779479,Art and Memory,story,https://www.lrb.co.uk/the-paper/v46/n09/julian-barnes/diary,
Lammy,23.0,40261451,"[40263008, 40261807, 40261957, 40261759, 40262086, 40261613, 40261797]",56,1714869417,Preliminary Macintosh Business Plan (12 July 1981) [pdf],story,http://archive.computerhistory.org/resources/text/2009/102712692.05.01acc.pdf,
the-mitr,1.0,40264080,[40265316],6,1714909084,Destination Amaltheia – Soviet Science Fiction (1962),story,https://archive.org/details/destination-amalthea-flph-1962,
rcarmo,1.0,40263404,[40265189],8,1714901477,Connect up to 4M.2 NVMe SSDs to a Raspberry Pi 5 with the Geekwork X1011 board,story,https://liliputing.com/connect-up-to-4-m-2-nvme-ssds-to-a-raspberry-pi-5-with-the-geekwork-x1011-boar/,
sandwichukulele,8.0,40262206,"[40264243, 40264167, 40264236, 40264349, 40263348, 40263737, 40264306, 40263101, 40262599]",18,1714882579,Ask HN: Affordable hardware for running local large language models?,story,,"A while back there was a post about running stable diffusion on a Raspberry Pi Zero 2 [1] which was slow but incredibly impressive! And that sparked my curiosity with this question, what is considered affordable hardware for running large language models locally today? I&#x27;m aware that there&#x27;s a lot of work underway to make inference cheap to run at the edge but I&#x27;m curious to understand the landscape at present that anyone could purchase. I seen people running models on flagship smartphones but those are more expensive then a mac mini with worse performance.<p>By affordable I mean no greater then the cost of a current gen base model mac mini ($599) but ideally around the price of a raspberry pi 5 ($79) which when searching for budget PC gets mentioned[2]. Both devices have the same amount of ram in my case (8gb) but different performance observed given the importance of memory bandwidth. I mention these two because I&#x27;ve had experience running llama 3 via ollama on both with success although of slower speeds compared to a full workstation with a commodity GPU i.e. RTX 4090 which starts at ($1599). I&#x27;m interested in learning about what other devices are out there that people consider cheap and use for LLMs locally.<p>[1]: https:&#x2F;&#x2F;news.ycombinator.com&#x2F;item?id=38646969<p>[2]: https:&#x2F;&#x2F;www.pcmag.com&#x2F;picks&#x2F;the-best-budget-desktop-computers"
gmac,20.0,40234398,"[40264001, 40264082, 40263763, 40264881, 40264507, 40263864, 40263905, 40265249]",90,1714643560,Hacking on PostgreSQL Is Hard,story,http://rhaas.blogspot.com/2024/05/hacking-on-postgresql-is-really-hard.html,
lproven,5.0,40234430,"[40264035, 40264980]",80,1714643875,"Got a spare Pi 1/2/3? Try RISC OS Open 5.30 It is, literally, something else",story,https://www.theregister.com/2024/05/02/rool_530_is_here/,
thelastgallon,24.0,40262059,"[40263858, 40263557, 40262520, 40262735, 40262400]",38,1714879773,Elegant Wind Turbine Blades Made of Wood Can Outperform Composites,story,https://cleantechnica.com/2024/05/03/elegant-wind-turbine-blades-made-of-wood-can-outperform-composites/,
synthetictask,3.0,40255634,"[40261875, 40261201]",15,1714807179,A Debate about Words,story,https://dstrohmaier.com/A-Debatte-about-Words/,
keepamovin,46.0,40245843,"[40261898, 40246245, 40247185, 40247803, 40246097, 40254548, 40247830, 40246219, 40253221]",71,1714729627,Auckland: A city with a labyrinth of underground caves,story,https://www.bbc.com/future/article/20240501-the-new-zealand-city-with-a-labyrinth-of-underground-caves,
leashless,11.0,40261882,"[40262028, 40262076, 40262801, 40261883]",4,1714876709,"Bird flu in Texas: many human cases, no certainty about human to human spread?",story,https://www.science.org/content/article/u-s-government-hot-seat-response-growing-cow-flu-outbreak,
gulced,14.0,40261408,"[40261508, 40261968, 40261834, 40262660, 40261908, 40262267, 40261593, 40261725, 40261534, 40262394, 40261669]",111,1714868759,"Dick Rutan, pilot of the first nonstop around-the-world flight, has died",story,https://www.independent.co.uk/news/ap-voyager-ronald-reagan-california-idaho-b2539832.html,
accrual,16.0,40264182,"[40265159, 40264866, 40265267, 40264971, 40264481, 40264858, 40265283, 40265289, 40265280]",39,1714910326,A Visual History of Windows Icons: From Windows 1 to 11 (2021),story,https://www.howtogeek.com/733912/a-visual-history-of-windows-icons-from-windows-1-to-11/,
jasim,184.0,40239164,"[40239834, 40240387, 40258642, 40240656, 40240736, 40243446, 40245310, 40243811, 40242468, 40241166, 40242695, 40243124, 40240481, 40240021, 40243310, 40243293, 40240922, 40243206, 40239645, 40244341, 40240822, 40246896, 40243729, 40242912, 40241599, 40240309, 40240921, 40240130, 40249930, 40240857, 40257282, 40245546, 40245223, 40243198]",662,1714672094,Making a 3D modeler in C in a week,story,https://danielchasehooper.com/posts/shapeup/,
sebg,85.0,40243168,"[40244002, 40243906, 40246236, 40250624, 40247186, 40245186, 40243851, 40243740, 40244568, 40244410, 40249711, 40245085, 40245171, 40247018, 40244182, 40245364, 40254337, 40251295, 40251617, 40245074, 40245576, 40245027]",508,1714700670,I’m writing a new vector search SQLite Extension,story,https://alexgarcia.xyz/blog/2024/building-new-vector-search-sqlite/index.html,
osm3000,61.0,40263168,"[40263614, 40263855, 40264317, 40263845, 40263630, 40263804, 40263662, 40263531]",64,1714897884,US prepares to exempt AUKUS nations from ITAR,story,https://www.naval-technology.com/news/us-prepares-to-scrap-itar-for-aukus-nations/,
apitman,5.0,40250318,"[40264224, 40263729, 40260541, 40261531, 40261427, 40258270]",54,1714758526,"Tview – Golang Terminal UI library with rich, interactive widgets",story,https://github.com/rivo/tview,
rolph,1.0,40261340,[40263638],25,1714867614,Ditch the Torch and Use Induction Heat to Break Free Rusted Bolts,story,https://www.popularmechanics.com/home/tools/a44764536/induction-heat-bolt-remover/,
rntn,10.0,40260666,"[40264722, 40262639, 40260893, 40262054]",30,1714860377,Why significant numbers of US PhD students rely on donated and discounted food,story,https://www.nature.com/articles/d41586-024-01279-y,
vinnyglennon,0.0,40265242,[40265367],9,1714920120,Occupy Wall Street,story,https://en.wikipedia.org/wiki/Occupy_Wall_Street,
coreyp_1,2.0,40254729,"[40261932, 40260600]",89,1714795742,Websites Every Aspiring Programmer Should Visit at Least Once,story,https://cscrunch.com/content/websites-every-aspiring-programmer-should-visit-least-once,
jc_811,20.0,40257463,"[40261819, 40263584, 40262131, 40261764, 40261616, 40262123, 40261497, 40261738]",66,1714828893,"U.S. vs. Google: As landmark monopoly trial closes, here's what to look for",story,https://www.npr.org/2024/05/02/1248152695/google-doj-monopoly-trial-antitrust-closing-arguments,
dchest,55.0,40234383,"[40237704, 40236855, 40240868, 40236905, 40236761, 40258641, 40259255, 40236489, 40244332, 40236875, 40241155, 40245297, 40238284, 40237381, 40235815, 40238137, 40245383, 40237651]",523,1714643375,Teranoptia – a typeface that allows you to imagine chimeric creatures,story,https://www.tunera.xyz/fonts/teranoptia/,
ementally,362.0,40247604,"[40247762, 40247917, 40248123, 40249429, 40249383, 40247858, 40248020, 40250046, 40251443, 40248699, 40248779, 40247982, 40257898, 40248144, 40248028, 40258803, 40248893, 40247787, 40248334, 40250437, 40248133, 40262425, 40248051, 40248862, 40251233, 40248690, 40249878, 40251967, 40257108, 40248945, 40250514, 40253758, 40252543, 40247786]",807,1714744001,DNS traffic can leak outside the VPN tunnel on Android,story,https://mullvad.net/en/blog/dns-traffic-can-leak-outside-the-vpn-tunnel-on-android,
wglb,0.0,40261337,,16,1714867580,China sends a probe to get samples from the less-explored far side of the moon,story,https://phys.org/news/2024-05-china-probe-samples-explored-side.html,
domdomegg,173.0,40256868,"[40258200, 40257924, 40259205, 40257941, 40258130, 40259077, 40258378, 40261619, 40259436, 40259358, 40258213, 40259841, 40258109, 40259363, 40259272, 40258049, 40258220, 40258832, 40261980, 40261586, 40258995, 40259687, 40258112, 40258953, 40259321, 40258527, 40257897, 40258047, 40259795, 40258125, 40259236, 40259405, 40262325, 40259852, 40259428, 40259802, 40256932, 40257922]",297,1714822608,I don't want to fill out your contact form,story,https://adamjones.me/blog/dont-use-contact-forms/,
Luc,91.0,40248721,"[40249084, 40249046, 40259146, 40250118, 40248881, 40249136, 40251079, 40249137, 40249329, 40248944, 40249694, 40249114, 40259476, 40249149, 40250814, 40249298, 40250590, 40250279, 40249232, 40250541, 40249697]",142,1714749737,Manta Ray UUV prototype completes in-water testing,story,https://www.darpa.mil/news-events/2024-05-01,
