by,descendants,id,kids,score,text,time,title,type,url
kiwicopple,95.0,40028111,"[40028894, 40031524, 40028694, 40029226, 40029335, 40029004, 40031713, 40029409, 40029971, 40029276, 40028821, 40028879, 40030302, 40031943, 40029209, 40031774, 40031306, 40029083, 40032061, 40028112, 40030132]",402,"This is a Postgres extension that can determine if a query should have an index. For example, for this table:<p><pre><code>    create table book(
      id int primary key,
      title text not null
    );
</code></pre>
You can run `index_advisor()` to see if there should be an index on a select statement:<p><pre><code>    select *
    from index_advisor(&#x27;select book.id from book where title = $1&#x27;);
</code></pre>
And it will return (summarized):<p><pre><code>    {&quot;CREATE INDEX ON public.book USING btree (title)&quot;}
</code></pre>
It works particularly well with pg_stat_statements[0] which tracks execution statistics of all SQL statements executed on your Postgres database.<p>It leans heavily on HypoPG[1], an excellent extension to determine if PostgreSQL will use a given index without spending resources to create them.<p>[0] pg_stat_statements: <a href=""https:&#x2F;&#x2F;www.postgresql.org&#x2F;docs&#x2F;current&#x2F;pgstatstatements.html"" rel=""nofollow"">https:&#x2F;&#x2F;www.postgresql.org&#x2F;docs&#x2F;current&#x2F;pgstatstatements.htm...</a><p>[1] <a href=""https:&#x2F;&#x2F;github.com&#x2F;HypoPG&#x2F;hypopg"">https:&#x2F;&#x2F;github.com&#x2F;HypoPG&#x2F;hypopg</a>",1713060876,Show HN: PostgreSQL index advisor,story,https://github.com/supabase/index_advisor
ksec,63.0,40020984,"[40038848, 40036628, 40036403, 40037057, 40037793, 40037761, 40036780, 40036811, 40036622, 40039995, 40039864, 40038762]",141,,1712989672,"Swift for C++ Practitioners, Part 1: Intro and Value Types",story,https://www.douggregor.net/posts/swift-for-cxx-practitioners-value-types/
ilikecinnamon,26.0,40039689,"[40045516, 40042474, 40047335, 40047266, 40043839]",44,,1713184109,Apple loses top phonemaker spot to Samsung,story,https://www.reuters.com/technology/apple-loses-top-phonemaker-spot-samsung-iphone-shipments-drop-idc-says-2024-04-15/
bookofjoe,234.0,40033646,"[40033987, 40034801, 40034660, 40038472, 40034183, 40034118, 40034093, 40038292, 40035721, 40034538, 40035681, 40040779, 40044916, 40046294, 40035753, 40037029, 40034127, 40033960, 40035027, 40035802, 40047567, 40036177, 40036698, 40038115, 40035685, 40038535, 40039026, 40036907, 40035396, 40035024, 40034635, 40034552, 40038586, 40034194, 40034032, 40033977, 40035054, 40035581, 40034092]",159,,1713122742,AI made these movies sharper – critics say it ruined them,story,https://www.nytimes.com/2024/04/13/movies/ai-blu-ray-true-lies.html
gone35,9.0,40017539,"[40045572, 40025802, 40024872, 40025368, 40039964]",73,,1712955222,Common pitfalls of digital health startups and how to avoid them (2023),story,https://bettychang.xyz/advice-for-digital-health-founders/
impish9208,33.0,40040694,"[40046179, 40044205, 40044663, 40043579, 40043582, 40044463, 40042502, 40042342, 40041413, 40042699, 40043553, 40047022, 40043241, 40043971]",48,,1713189868,Smishing scam regarding debt for road toll services,story,https://www.ic3.gov/Media/Y2024/PSA240412
DeathArrow,46.0,40037781,"[40038563, 40047323, 40046225, 40037822, 40039285, 40042680, 40038261, 40044584, 40041291]",69,,1713165460,WD launches 4TB SD card,story,https://www.techradar.com/pro/wd-launches-enormous-4tb-sd-card-for-creative-pros-smashes-world-record-for-largest-removable-memory-card-to-smithereens-at-twice-the-capacity-of-biggest-microsd-cards
tambourine_man,33.0,40037330,"[40038322, 40037636, 40037943, 40037620]",68,,1713158859,From L3 to seL4: 20 years of L4 microkernels (2013) [video],story,https://www.youtube.com/watch?v=RdoaFc5-1Rk
thunderbong,38.0,40039020,"[40039763, 40041217, 40040313, 40039585, 40040028, 40046866, 40039559, 40040076, 40039486, 40041328, 40040242, 40042943]",149,,1713179864,A proof-of-concept Python executable built on Cosmopolitan Libc (2021),story,https://ahgamut.github.io/2021/07/13/ape-python/
rbanffy,86.0,40034140,"[40037651, 40035492, 40037018, 40035453, 40036290, 40038154, 40037189, 40035655, 40035810, 40036191, 40043294, 40035606, 40036243, 40037947, 40036844, 40038550, 40035818, 40035844, 40036271, 40037942, 40035733]",134,,1713126247,The Airship to Orbit Project,story,https://www.jpaerospace.com/ATO/ATO.html
vinni2,0.0,40044912,[40047685],24,,1713210952,Colorado funeral home where 190 bodies were found charged with Covid fraud,story,https://www.theguardian.com/us-news/2024/apr/15/colorado-funeral-home-owners-charged-covid-fraud
conanxin,277.0,40028643,"[40029387, 40029188, 40029242, 40029515, 40032894, 40032127, 40029176, 40029225, 40029286, 40029075, 40029159, 40029239, 40029102, 40033427, 40038870, 40032051, 40029118, 40030015, 40029830, 40030824, 40034477, 40042999, 40029235, 40032762, 40032744, 40031480, 40029288, 40030553, 40035170, 40036231, 40031032, 40033312, 40032866, 40037397, 40031027, 40029185, 40032128, 40029688, 40032895, 40036533]",1375,,1713068678,Obituary for a quiet life (2023),story,https://bittersoutherner.com/feature/2023/obituary-for-a-quiet-life
Gooblebrai,89.0,40034972,"[40035400, 40041153, 40035348, 40048517, 40035273, 40035574, 40038898, 40047362, 40035161, 40035550, 40041538, 40035425, 40035165, 40041713, 40035301, 40040836, 40044188, 40035183, 40035764, 40035502, 40036173, 40035134, 40038233, 40037691, 40035341, 40041259, 40038730, 40035554, 40035215, 40035148, 40035488, 40035345, 40035682, 40036415, 40042776, 40036256, 40036322, 40035619]",108,It seems to be in vogue that RAG is one of the best solutions to reduce the problem of hallucinations in LLMs.<p>What do you think? Are there any other alternatives or solutions on sight?,1713133143,Ask HN: Is RAG the Future of LLMs?,story,
mfiguiere,4.0,40046425,"[40046455, 40047134]",7,,1713220091,Los Angeles Warehouse Vacancies Climb to Highest in a Decade,story,https://www.bloomberg.com/news/articles/2024-04-15/los-angeles-warehouse-vacancies-climb-to-highest-in-a-decade
rbanffy,1.0,40038383,"[40048052, 40047029]",23,,1713173516,SpaceX's most-flown reusable rocket will go for its 20th launch tonight,story,https://arstechnica.com/space/2024/04/spacexs-most-flown-reusable-rocket-will-go-for-its-20th-launch-tonight/
beckthompson,24.0,40034869,"[40036801, 40038252, 40037284, 40043129, 40041922, 40040854]",89,,1713132188,Integral Calculator,story,https://www.integral-calculator.com/
LexSiga,3.0,40044355,"[40044898, 40045899, 40044895, 40044930, 40044927]",34,,1713207535,We have no idea how models will behave in production until production,story,https://arxiv.org/abs/2403.16795
n2d4,67.0,40031090,"[40033615, 40033493, 40033260, 40034912, 40033252, 40031213, 40033251, 40034722, 40038587, 40033006, 40033002, 40036418, 40033337, 40034931, 40033402, 40033449, 40035211, 40033273, 40036024, 40033478, 40033693, 40036992, 40034785, 40033513, 40039670, 40035777, 40033186, 40031463, 40033059]",137,"Hey HN! Happy to finally launch Stack. We made it because we like to put apps into production quickly, and authentication &amp; user management was taking up way too much time.<p>We have components like &lt;SignIn &#x2F;&gt; and &lt;AccountSettings &#x2F;&gt; that automatically adapt to whatever theme &amp; design system you&#x27;re using. Check the blog post to see the example with Radix UI and Joy UI.<p>Also, there&#x27;s an admin dashboard for monitoring and editing accounts. Stack is 100% AGPL&#x2F;MIT-licensed, so you can self-host it.<p>Cheers!",1713103211,"Show HN: Stack, an open-source Clerk/Firebase Auth alternative",story,https://stack-auth.com/blog/introducing-stack
fanf2,2.0,40044801,"[40048306, 40047054]",13,,1713210124,"Dun, Dun Duuun Where did pop culture's most dramatic sound come from? (2022)",story,https://www.theguardian.com/music/2022/jan/18/dun-dun-duuun-where-did-pop-cultures-most-dramatic-sound-come-from
luu,1.0,40037885,[40045374],5,,1713166893,Goto,story,http://www.azillionmonkeys.com/qed/goto.html
peutetre,68.0,40039391,"[40044189, 40044741, 40042236, 40043921, 40048508, 40046064, 40044384, 40044299, 40043922, 40044874, 40046328, 40042864, 40046375, 40040699, 40044054]",106,,1713182573,The hero tax: Why 'selfless' workers are professionally exploited,story,https://www.bbc.com/worklife/article/20240409-heroic-jobs-earn-less-money
hn72774,2.0,40047947,"[40047961, 40047948]",12,,1713236142,All 'Reporting from Ukraine' channels are being deleted by YouTube,story,https://old.reddit.com/r/ukraine/comments/1c53mzo/all_reporting_from_ukraine_channels_are_being/
goranmoomin,28.0,40029036,"[40037211, 40036800, 40036875, 40036837, 40036998, 40046057, 40036691, 40036950, 40036981, 40037323, 40037137]",109,,1713074725,How Shazam Works (2003) [pdf],story,https://ismir2003.ismir.net/presentations/Wang.pdf
peutetre,161.0,40037046,"[40037216, 40037707, 40037525, 40037360, 40046194, 40037257, 40042277, 40037442, 40046191, 40040281, 40038909, 40038044, 40038101, 40037446, 40037317, 40037148, 40037510, 40037527, 40038084, 40037425, 40040912, 40037804, 40038125, 40037529, 40037454, 40037334, 40037601, 40040970, 40038034]",211,,1713154855,"Sleep apnea: Mouthguards less invasive, just as effective as CPAP",story,https://newatlas.com/medical/sleep-apnea-mouthguard-cpap-blood-pressure/
sohkamyung,112.0,40039752,"[40042933, 40044180, 40040194, 40045009, 40042455, 40040554, 40043393, 40043629, 40040857, 40040172, 40040340]",108,,1713184454,Getting the Grid to Net Zero,story,https://spectrum.ieee.org/electric-inverter
nalgeon,17.0,40038712,"[40044685, 40043707, 40046190, 40044619, 40045436, 40038750, 40045221, 40047877, 40045643]",38,,1713177272,The origin and virtues of semicolons in programming languages,story,https://ntietz.com/blog/researching-why-we-use-semicolons-as-statement-terminators/
chapulin,198.0,40020626,"[40032839, 40032891, 40025480, 40022522, 40033766, 40023535, 40022374, 40030343, 40027752, 40023342, 40022352, 40030837, 40023151, 40023271]",273,,1712984414,"Identical twins both grew up with autism, but took different paths",story,https://www.npr.org/sections/health-shots/2024/04/04/1242264274/siblings-science-identical-twin-brothers-autism-spectrum
voisin,45.0,40016888,"[40022342, 40018553, 40018869, 40019476, 40026930, 40021032, 40025400, 40019112, 40023171, 40019945, 40020446, 40019231, 40027861, 40021899, 40020534, 40018988, 40019941, 40018659, 40018676, 40018646]",156,,1712951140,Green's Dictionary of Slang,story,https://greensdictofslang.com/
Alex3917,82.0,40033261,"[40035193, 40035342, 40034813, 40035008, 40041448, 40036654, 40034348, 40036422, 40036510, 40037451, 40035803, 40035612, 40034995, 40036287]",77,,1713119749,The Battle to Define Mental Illness (2010),story,https://www.wired.com/2010/12/ff-dsmv/
aragonite,0.0,40047946,[40048148],4,,1713236126,A cartoon intro to DNS over HTTPS (2018),story,https://hacks.mozilla.org/2018/05/a-cartoon-intro-to-dns-over-https/
kklisura,5.0,40045905,"[40046859, 40047849]",8,,1713216931,Tesla postpones $25k electric car,story,https://electrek.co/2024/04/15/tesla-puts-electric-car-codenamed-nv9-back-burner-despite-elon-musk-said/
fargle,15.0,40036138,"[40038070, 40036146, 40040307, 40038380, 40040559, 40037810]",51,,1713144017,1800-2023 – IEEE Standard for SystemVerilog,story,https://ieeexplore.ieee.org/document/10458102
BerislavLopac,15.0,40045318,"[40047305, 40047092, 40047687, 40047125, 40047368, 40047564, 40047495]",28,,1713213831,An unbiased evaluation of Python environment and packaging tools (2023),story,https://alpopkes.com/posts/python/packaging_tools/
cullmann,127.0,40032869,"[40034742, 40033399, 40033591, 40034964, 40034603, 40037271, 40033453, 40033408, 40035676, 40033679, 40034691, 40033443, 40034069, 40033764, 40034765, 40034946, 40034737, 40033586, 40035486, 40034579, 40037234, 40033877, 40037764, 40033978, 40036989, 40036818, 40037623, 40032870, 40034956]",292,,1713116820,Kate editor on all platforms,story,https://cullmann.io/posts/kate-on-all-platforms-2024/
fanf2,104.0,40033497,"[40034293, 40033903, 40035888, 40040193, 40035158, 40034347, 40034920, 40037983, 40037130, 40037830, 40047774, 40038482, 40034799, 40036214, 40034070, 40035357, 40036395, 40035062, 40034842]",157,,1713121459,Sandboxing all the things with Flatpak and BubbleBox,story,https://www.ralfj.de/blog/2024/04/14/bubblebox.html
lonk,22.0,40029849,"[40042712, 40030356, 40030593, 40041220, 40042631, 40044683, 40044059, 40042462, 40042440, 40035706, 40041148, 40030460]",138,,1713086302,I ported thousands of apps to Windows 95 [video],story,https://www.youtube.com/watch?v=CTUMNtKQLl8
msolujic,98.0,40020601,"[40028791, 40025796, 40025459, 40027233, 40027730, 40029215, 40025504, 40025491, 40039977, 40025215, 40028242, 40027685, 40027734, 40026963, 40028223, 40025408, 40028362, 40033163, 40033702, 40024783]",340,,1712984141,The Arc Product-Market Fit Framework,story,https://www.sequoiacap.com/article/pmf-framework/
jamesfisher,0.0,40045623,,10,,1713215412,Statistical Rethinking: a course on Bayesian data analysis [video],story,https://www.youtube.com/watch?v=FdnMWdICdRs&list=PLDcUM9US4XdPz-KxHM4XHt7uUVGWWVSus&index=1
hbarka,30.0,40036431,"[40036538, 40037028, 40042380, 40036432, 40038065, 40039142, 40036842, 40037640, 40036994]",67,,1713147001,The Wallis Annenberg Wildlife Crossing,story,https://101wildlifecrossing.org/
panabee,0.0,40035185,,12,,1713134856,Patchscopes: A framework for viewing hidden representations of language models,story,https://research.google/blog/patchscopes-a-unifying-framework-for-inspecting-hidden-representations-of-language-models/
tim_sw,27.0,40020516,"[40033634, 40034050, 40032531, 40031796, 40037235, 40032740, 40034067, 40033170]",92,,1712982814,How Convex Works,story,https://stack.convex.dev/how-convex-works
sthlmb,49.0,40042820,"[40045215, 40045954, 40045168, 40046040, 40045288, 40045300, 40045437, 40045819, 40045354, 40045171, 40045792, 40045779, 40045349]",35,,1713199178,Radxa Rock 5 ITX: 8-Core ARM Mini ITX Board with LPDDR5 RAM,story,https://bret.dk/radxa-rock-5-itx-first-look/
tosh,14.0,40041986,"[40042729, 40042942, 40044079, 40043356, 40043891]",56,,1713195454,Pile-T5,story,https://blog.eleuther.ai/pile-t5/
mihaich,4.0,40035919,"[40038832, 40037612]",25,"If you&#x27;ve ever used CTRL+F on websites or documentation, you&#x27;ll love this functionality.",1713142090,Show HN: Semantic Search React Component,story,https://github.com/Mihaiii/semantic-autocomplete
nihaals,83.0,40040043,"[40043618, 40040436, 40044214, 40043594, 40043644, 40043904, 40043699, 40046945, 40044536, 40043859, 40043474, 40045058, 40040223, 40044918, 40044124, 40043741, 40043567, 40044446, 40044191, 40045204, 40042096, 40045503, 40041918, 40044465, 40044047]",95,,1713186274,"Limitless: Personalized AI powered by what you've seen, said, and heard",story,https://www.limitless.ai/
rurounijones,1.0,40047698,[40047699],26,,1713233088,YouTube algorithm weaponised to shut down Russia-Ukraine war reporting channel [video],story,https://www.youtube.com/watch?v=2v063wuJtM0
asadalt,96.0,40033490,"[40035347, 40035144, 40034771, 40034908, 40037027, 40035654, 40033654, 40047620, 40034344, 40037269, 40034921, 40033706, 40034020, 40035111, 40036878, 40034472, 40034094, 40036587, 40033720, 40034327, 40035014, 40034176, 40035123, 40034963, 40037011, 40034413, 40037354, 40034102, 40035110, 40033894, 40038526, 40038269, 40038225, 40033872, 40034151, 40033514, 40036524, 40035254, 40034397]",409,"My partner usually writes substack posts which I then mirror to our website’s blog section.<p>To automate this, I made a simple tool to scrape the post and clean it so that I can drop it to our blog easily. This might be useful to others as well.<p>Oh and ofcourse you can instruct GPT to make any final edits :D",1713121438,Show HN: I made a tool to clean and convert any webpage to Markdown,story,https://markdowndown.vercel.app/
vitplister,13.0,40035636,"[40036870, 40036925]",38,,1713139077,Dumping Parallel NAND with Glasgow,story,https://colinoflynn.com/2024/04/dumping-parallel-nand-with-glasgow/
luu,0.0,40037589,,6,,1713162650,Trap spaces of Boolean networks are conflict-free siphons of their Petri net [pdf],story,https://amu.hal.science/hal-04167028/file/tcs2023-1.pdf
manibaur,18.0,40036536,"[40037383, 40037107, 40039358, 40037705, 40043271, 40037363, 40037161, 40037903, 40037332, 40037073, 40037142, 40038310, 40039186, 40037126, 40046462, 40037218]",48,"Say you&#x27;re an engineer that needs to deploy a SQL script to a production database; you need it peer-reviewed and (hopefully) approved by a chain of approvers who gate-keep production databases; what tool do you currently use?<p>I&#x27;m assuming you&#x27;ll also need this script&#x2F;change to go through QA and staging before it reaches Prod. The only tool I found, short of daisy chaining a bunch of GitHub actions, that does this is RedGate Deploy.<p>Curious to learn how y&#x27;all are achieving this today.",1713148163,Ask HN: What tool(s) do you use to code review and deploy SQL scripts?,story,
belter,5.0,40043155,[40043939],23,,1713201134,California has set a benchmark for renewable energy,story,https://www.thecooldown.com/green-tech/california-renewable-energy-100-percent-grid/
catatsuy,29.0,40020779,"[40037814, 40034698, 40038981, 40034651, 40037688, 40036556, 40038255, 40036300, 40034821, 40036959, 40020780, 40034807]",67,"Hello HN community,<p>I&#x27;m excited to share a new command-line tool I developed called purl, inspired by the simplicity of Perl one-liners for efficient text processing. Purl features include Perl-like regex that simplifies text manipulation, it&#x27;s cross-platform so works equally well on macOS, Linux, etc., and it&#x27;s quick and easy to install. The tool also supports simple commands such as -replace, -filter, and -exclude, and offers optional color output to enhance readability.<p>Purl is a practical alternative to traditional tools like sed and grep, designed to address some of their common limitations.<p>For more information and to try purl yourself, visit: <a href=""https:&#x2F;&#x2F;github.com&#x2F;catatsuy&#x2F;purl"">https:&#x2F;&#x2F;github.com&#x2F;catatsuy&#x2F;purl</a><p>I appreciate any feedback!",1712986749,Show HN: Purl – A Simple Tool for Text Processing,story,https://github.com/catatsuy/purl
willmeyers,2.0,40037476,"[40044049, 40043902]",9,,1713160968,Show HN: Little Guys,story,https://willmeye.rs/bin/little-guys/
CShorten,1.0,40040794,[40041190],13,"Hey everyone! I am SUPER excited to publish our newest Weaviate podcast with Kyle Davis, the creator of RAGKit!<p>At a high-level, the podcast covers our understanding of RAG systems through 4 key areas: (1) Ingest &#x2F; ETL, (2) Search, (3) Generate &#x2F; Agents, and (4) Evaluation.<p>Discussing these lead to all sorts of topics from Knowledge Graph RAG, to Function Calling and Tool Selection, Re-ranking, Quantization, and many more!<p>This discussion forced me to re-think many of my previously held beliefs about the current RAG stack, particularly the definition of “Agents”. I came in believing that the best way of viewing “Agents” is an abstraction on top of multiple pipelines, such as an “Email Agent”, but Kyle presented the idea of looking at “Agents” as scoping the tools each LLM call is connected to, such as `read_email` or `calculator`. Would love to know what people think about this one, as I think getting a consensus definition of “Agents” can clarify a lot of the current confusion for people building with LLMs &#x2F; Generative AI.<p>I hope you find the podcast useful, this was such a fun one! Thank you so much for joining Kyle!<p>https:&#x2F;&#x2F;youtu.be&#x2F;oEsJqMLYAfc",1713190405,RAGKit with Kyle Davis – Weaviate Podcast #93,story,
kamikaz1k,42.0,40033659,"[40034455, 40034317, 40034248, 40034453, 40036756, 40035815, 40034096]",106,,1713122821,A primer on x86 by Casey Muratori and The Primeagen [video],story,https://www.youtube.com/watch?v=xCBrtopAG80
userbinator,17.0,40029592,"[40030247, 40031459, 40032559, 40031458, 40030361]",80,,1713082990,Getting into way too much detail with the Z80 netlist simulation (2021),story,https://floooh.github.io/2021/12/06/z80-instruction-timing.html#table-of-content
jbegley,33.0,40035630,"[40035796, 40040292, 40047293, 40040408, 40037675, 40038760, 40039167, 40037258, 40039309, 40040603, 40044090, 40037909, 40038715, 40036923]",59,,1713139052,The Intercept Is Running Out of Cash,story,https://www.semafor.com/article/04/14/2024/the-intercept-is-running-out-of-cash
gone35,0.0,40045855,,4,,1713216640,Refal,story,https://en.wikipedia.org/wiki/Refal
dguo,104.0,40034045,"[40034746, 40036421, 40034899, 40035482, 40035409, 40048567, 40035491, 40035153, 40040106, 40034627, 40035890, 40041225, 40034793, 40034764, 40034887, 40034688, 40038778, 40034626, 40035219, 40036606, 40035641, 40035189, 40037610]",264,,1713125547,My cat alerted me to a DDoS attack,story,https://www.dannyguo.com/blog/my-cat-alerted-me-to-a-ddos-attack
ahaucnx,47.0,40020402,"[40029816, 40033086, 40034107, 40037697, 40032993, 40031686, 40029842, 40029903, 40029829, 40030648, 40031992, 40035717]",126,,1712981204,How to Determine the Error of an Air Quality Sensor?,story,https://www.airgradient.com/blog/how-to-determine-error-of-sensor/
camblomquist,65.0,40033378,"[40034217, 40033751, 40033828, 40038480, 40034399, 40038617, 40034386, 40033692]",54,,1713120628,Mysterious Moving Pointers,story,https://blomqu.ist/posts/2024/move/
Rinzler89,0.0,40045744,,6,,1713216051,Why the limitations of the N64 and PS1 help create unique gameplay [video],story,https://www.youtube.com/watch?v=nUjoMdWH-JI
safaa1993,107.0,40034699,"[40035106, 40034973, 40035186, 40041626, 40035307, 40034992, 40035298]",64,,1713130551,U.S. Steel Shareholders Approve Sale to Japan's Nippon Steel,story,https://www.wsj.com/business/deals/u-s-steel-shareholders-approve-sale-to-japans-nippon-steel-3e1dec9e
rbanffy,0.0,40034112,,9,,1713126027,Ascender High Altitude Airships,story,https://www.jpaerospace.com/ascender175.html
refset,207.0,40040593,"[40041351, 40041657, 40041600, 40042291, 40041940, 40040966, 40040976, 40042207, 40042074, 40041314, 40041110, 40041129, 40041305, 40043740, 40041279, 40045211, 40041248, 40046302, 40042132, 40044219, 40041629, 40040994, 40042094, 40041923, 40041640, 40040998, 40041856, 40042009, 40040978, 40041455, 40040993, 40042162, 40042041, 40041007, 40042576, 40044615, 40042217, 40041973, 40040950, 40041046, 40041095, 40041322, 40041354, 40043450, 40041963, 40043391, 40042228, 40041766, 40041176, 40048123, 40041147, 40046341, 40041055, 40040949]",306,,1713189353,Neon Serverless Postgres is generally available,story,https://neon.tech/blog/neon-ga
SkyMarshal,2.0,40033984,"[40038153, 40033985]",11,,1713125083,Warp Factory: numerical toolkit for analyzing warp drive spacetimes,story,https://github.com/NerdsWithAttitudes/WarpFactory
prakhar897,10.0,40030411,"[40047552, 40030727, 40048079, 40036117, 40036648, 40038830, 40037202]",23,,1713094798,Show HN: I made a tool which fixes broken JSONs,story,https://prakhar897.github.io/json-fixer/
Stratoscope,33.0,40037959,"[40038331, 40039301, 40041561, 40041278, 40039066, 40040335]",46,,1713168001,Mid-level Nvidia employee gets $62M in stock options; another lost it all,story,https://www.tomshardware.com/pc-components/gpus/nvidia-employees-make-fortunes-and-foul-ups-with-their-stock-options-a-story-of-millionaire-winners-and-losers
mooreds,43.0,40031054,"[40039354, 40039701, 40037792, 40037540, 40041634, 40038436, 40037481, 40038170, 40043156, 40045146, 40042246, 40038433, 40038320, 40042143, 40042437]",52,,1713102919,The unwritten laws of engineering at Stedi,story,https://www.stedi.com/blog/the-unwritten-laws-of-engineering-at-stedi
bookofjoe,350.0,40040100,"[40040102, 40040578, 40040228, 40041540, 40040905, 40040396, 40040884, 40040210, 40040456, 40040124, 40040493, 40040756, 40043458, 40041851, 40041701, 40040677, 40041617, 40040574, 40042128, 40041104, 40041799, 40040378, 40041327, 40040665, 40041596, 40043651, 40040356, 40040347, 40041203, 40040453]",282,,1713186648,Tesla Cybertruck deliveries halted for 7 days,story,https://www.barrons.com/articles/tesla-cybertruck-production-halted-ac750c17
andsoitis,143.0,40023319,"[40023606, 40023541, 40024001, 40023625, 40024093, 40023761, 40024843, 40023854, 40024349, 40029304, 40023681, 40027839, 40025249, 40027140, 40023752, 40026263, 40023806, 40025597, 40023862, 40023817, 40023636]",241,,1713018020,"Tree-shaking, the horticulturally misguided algorithm (2023)",story,https://wingolog.org/archives/2023/11/24/tree-shaking-the-horticulturally-misguided-algorithm
downboots,19.0,40020343,"[40034095, 40034211, 40034618, 40035334, 40035385, 40035285, 40034164, 40033846]",52,,1712980325,Program synthesis,story,https://en.wikipedia.org/wiki/Program_synthesis
ingve,53.0,40030125,"[40037711, 40039511, 40039633, 40041371, 40038786, 40041047, 40038986, 40041227, 40042170, 40041334]",115,,1713090493,Why good external SSDs are faster with Apple Silicon,story,https://eclecticlight.co/2024/04/14/last-week-on-my-mac-why-good-external-ssds-are-faster-with-apple-silicon/
paulpauper,16.0,40047498,"[40047720, 40047561, 40047640, 40047550, 40048147]",14,,1713230856,Elon Musk says new X users have to pay to tweet,story,https://qz.com/elon-musk-twitter-spam-bots-annual-fee-tweet-1851411201
todsacerdoti,7.0,40044243,"[40044926, 40045355, 40045325, 40044643, 40044783]",85,,1713206983,XZ Utils review notes,story,https://tukaani.org/xz-backdoor/review.html
Intralexical,38.0,40027866,"[40030194, 40029170, 40027867, 40032589, 40042584, 40032646, 40029983, 40029645, 40030796, 40029274, 40030154]",154,,1713057769,Fast and secure translation on your local machine with a GUI,story,https://github.com/XapaJIaMnu/translateLocally
