by,descendants,id,kids,score,time,title,type,url,text
uncertainrhymes,140.0,40263711,"[40274842, 40264773, 40272645, 40273719, 40274755, 40272277, 40273533, 40276428, 40271751, 40273041, 40271876, 40275887, 40279916, 40273063, 40275878, 40275666, 40273653]",141,1714904897,A company is building a giant compressed-air battery in the Australian outback,story,https://www.wired.com/story/hydrostor-compressed-air-battery-california-australia-energy-climate/,
nateb2022,2.0,40267367,"[40272408, 40280245]",74,1714936433,Comprehensive Rust: free Rust course developed by the Android team at Google,story,https://google.github.io/comprehensive-rust/,
alnvdl,27.0,40267182,"[40268679, 40267560, 40275724, 40279593, 40267709, 40269922, 40267567, 40270151, 40269492, 40268278, 40267486, 40270637, 40267483, 40267183, 40267500]",161,1714934866,Designing furniture using the CSS grid (2023),story,https://alnvdl.github.io/2023/01/07/designing-furniture-using-the-css-grid.html,"At one point during the construction of my house, we needed designs for the kitchen and bathroom cabinets and a bedroom wardrobe.<p>I wanted full control of the design process. Doing it in vector illustration software was too painful and it was taking too long. But I didn&#x27;t have the time to learn any complex CAD tool either.<p>So I developed a small HTML&#x2F;JS&#x2F;CSS tool for designing MDF furniture by writing my own little language that transpiles into a CSS grid layout.<p>Take a look at the blog post for details:
<a href=""https:&#x2F;&#x2F;alnvdl.github.io&#x2F;2023&#x2F;01&#x2F;07&#x2F;designing-furniture-using-the-css-grid.html"" rel=""nofollow"">https:&#x2F;&#x2F;alnvdl.github.io&#x2F;2023&#x2F;01&#x2F;07&#x2F;designing-furniture-usin...</a><p>Or go directly to the tool (works best on desktop or tablet): <a href=""https:&#x2F;&#x2F;alnvdl.github.io&#x2F;squareplanner&#x2F;"" rel=""nofollow"">https:&#x2F;&#x2F;alnvdl.github.io&#x2F;squareplanner&#x2F;</a>"
smartmic,80.0,40267559,"[40274800, 40274031, 40268532, 40275645, 40271585, 40272734, 40269321]",125,1714938041,TheDesk desktop environment,story,https://github.com/theCheeseboard/thedesk,
nsagent,51.0,40266791,"[40267719, 40268196, 40267471, 40268025, 40268504, 40269850, 40268273, 40273036, 40272051, 40267863, 40269216, 40268793, 40267637, 40269867, 40267829, 40271880, 40268376, 40267766]",136,1714931893,Infini-Gram: Scaling unbounded n-gram language models to a trillion tokens,story,https://arxiv.org/abs/2401.17377,
softwaredoug,0.0,40265537,,16,1714922600,Faster sorted array intersections,story,https://softwaredoug.com/blog/2024/05/05/faster-intersect,
g0xA52A2A,20.0,40263394,"[40266435, 40268331, 40273123, 40276117]",106,1714901339,Decoding UTF8 with parallel extract,story,https://nrk.neocities.org/articles/utf8-pext,
robblack,4.0,40281785,"[40282134, 40282196]",8,1715049608,AI Will Be Like a Super Smart Person Who Knows Everything About Your Life,story,https://futurism.com/the-byte/sam-altman-future-ai-knows-everything,
7d7n,238.0,40266464,"[40266804, 40267052, 40271458, 40266961, 40273596, 40266745, 40269787, 40267197, 40266720, 40266844, 40267378, 40274758, 40266815, 40266748, 40273446, 40266619, 40276077, 40275206, 40270240, 40276407, 40266864, 40267915, 40268418, 40266579, 40270964, 40266872, 40276646, 40270543, 40274918, 40276390, 40268766, 40266789, 40270559, 40270477, 40266904, 40276411, 40272152, 40266879, 40266695, 40269456, 40276323, 40267361, 40271488, 40266631]",341,1714929427,Simplicity is an advantage but sadly complexity sells better (2022),story,https://eugeneyan.com/writing/simplicity/,
SLHamlet,2.0,40281395,"[40282104, 40281730]",10,1715046251,Helldivers 2 players knew how to mobilize against Sony after training in-game,story,https://www.polygon.com/24150510/helldivers-2-psn-account-sony-response-controversy-steam-review-bombing-refunds,
alessiodm,46.0,40269489,"[40269490, 40270005, 40270264, 40271218, 40274970, 40270177, 40274632, 40275661, 40275012, 40271015, 40272218, 40274786, 40270421]",493,1714950748,Deep Reinforcement Learning: Zero to Hero,story,https://github.com/alessiodm/drl-zh,
typeofhuman,84.0,40269592,"[40272241, 40270444, 40271189, 40277457, 40271565, 40273316, 40271872, 40280988, 40272573, 40275590, 40271963, 40271491, 40272612, 40270374, 40270500]",237,1714951940,Drug resistant bacteria found on ISS mutating to become functionally distinct,story,https://www.nasa.gov/centers-and-facilities/ames/ames-science/ames-space-biosciences/multi-drug-resistant-bacteria-found-on-iss-mutating-to-become-functionally-distinct/,
ecolonsmak,14.0,40276273,"[40279587, 40276340]",29,1715011935,Alzheimer's disease may be inherited more often than previously known,story,https://www.cnn.com/2024/05/06/health/alzheimers-apoe4-gene-risk/index.html,
p1esk,1.0,40281455,[40281466],9,1715046717,Managers have no human rights,story,https://yosefk.com/blog/managers-have-no-human-rights.html,
geephroh,1.0,40281415,[40281490],5,1715046399,Boeing Starliner Flight of NASA Astronauts Is Scrubbed,story,https://www.nytimes.com/live/2024/05/06/science/boeing-starliner-launch,
jger15,90.0,40265552,"[40266193, 40271844, 40265857, 40266486, 40266964, 40266461, 40266216, 40270978, 40266048, 40266595, 40267028, 40275091, 40265696, 40266111, 40266215, 40266617, 40267546]",170,1714922719,Small Things,story,https://rishad.substack.com/p/small-things,
mpweiher,109.0,40262897,"[40274077, 40274017, 40273735, 40274134, 40274102, 40275275, 40273776, 40273829, 40277332, 40274645, 40273815, 40274333, 40273445, 40274644, 40274582, 40277251, 40275925]",139,1714893036,Swift's native Clocks are inefficient,story,https://wadetregaskis.com/swifts-native-clocks-are-very-inefficient/,
hddherman,182.0,40266845,"[40267441, 40268729, 40267790, 40268131, 40267731, 40267396, 40268716, 40267849, 40279912, 40267139, 40274381, 40267346, 40267971, 40274425, 40267172, 40273953, 40267119, 40268638, 40267242, 40271791, 40267713, 40267498, 40272475]",335,1714932331,"Monitoring energy usage with smart plugs, Prometheus and Grafana",story,https://ounapuu.ee/posts/2024/05/02/smartplugs/,
LVB,39.0,40276515,"[40279846, 40278355, 40280571, 40280114, 40282821, 40277624, 40280728, 40279278, 40277927, 40279404, 40279875, 40279017, 40280395, 40278218, 40278911, 40278683, 40278154, 40277722, 40278767, 40279423, 40277749, 40279832, 40278724, 40278434, 40277540, 40277400, 40279366, 40279457, 40279826, 40278125]",37,1715013466,Ask HN: Good sources of math exercises for ~10-17 y/o?,story,,"I have two kids, 10 &amp; 12, and I&#x27;d like to provide them with some math homework that is at least somewhat tracking their current and upcoming &quot;Common Core&quot; work. The school isn&#x27;t assigning any homework, and I am disappointed at how thin their knowledge of the topics is despite getting good grades. The market, both online and in print, is awash with material, but much of it is really poor quality. Often it is trying way too hard to put some new&#x2F;cute&#x2F;fun spin on topics that really just need pen, paper, and practice. So many videos, contrived stories, artwork, ... my kid is 12, not 5.<p>Looking for any sites or book series folks have found useful. Ideally, these would be printable since they have to show their work on tests and are quite weak at this, especially with so much of their work exclusively on Chromebooks."
doener,15.0,40267558,"[40272044, 40273838, 40268806]",70,1714938032,Tasmota: Open-source firmware for ESP devices,story,https://tasmota.github.io/docs/,
feikname,5.0,40276464,"[40279557, 40278821, 40279357, 40278666]",29,1715013063,"Robert Dennard, father of DRAM, is deceased",story,https://www.tomshardware.com/tech-industry/semiconductors/robert-dennard-father-of-dram-is-deceased-also-known-for-his-foundational-dennard-scaling-theory,
paulpauper,14.0,40265986,"[40268524, 40269983, 40268309, 40268680]",52,1714925873,The Trouble with Soho,story,https://www.edwest.co.uk/p/the-trouble-with-soho,
cporios,24.0,40275969,"[40277040, 40282133, 40277187, 40277353, 40277429, 40277278, 40278348, 40277159, 40275970]",25,1715010346,Show HN: Touvlo – Technical Interviewing for Hardware Engineers (By Humans),story,https://touvlo.co,"Hi HN! Touvlo is a platform where you can delegate your technical interviewing for hardware engineers to us, so that you can focus on building your product instead.<p>Our interviews test real-world engineering skills, largely via a collaborative CAD session through our in-browser platform. You can think of it as a pair-coding session between the interviewer and the interviewee, but for hardware. Interviews are conducted by real hardware engineers with industry experience (currently my co-founder, Danae). After each interview, you get a detailed score card, as well as full, timestamped recording of the interview.<p>There&#x27;s no pricing page yet, but we charge 220$ per interview, with discounts for monthly packages for 10 interviews or more.<p>If you&#x27;re a hardware&#x2F;robotics startup, give us a try: we can help you hire better and save you time. Drop us an email (founders@touvlo.co), or sign up for a demo interview on <a href=""https:&#x2F;&#x2F;touvlo.co"" rel=""nofollow"">https:&#x2F;&#x2F;touvlo.co</a>. We offer a money-back guarantee and a free trial for our next few customers.<p>We&#x27;re also applying to YC – we went from an idea to a product with users in 2 months.<p>We would highly appreciate any feedback."
PaulHoule,3.0,40275966,"[40280538, 40281376, 40279970]",9,1715010341,Making light 'feel' a magnetic field like an electron would,story,https://phys.org/news/2024-04-magnetic-field-electron.html,
hiatus,2.0,40281411,"[40281797, 40281412]",6,1715046386,"Exploit for Minecraft uses LLL lattice reduction, to locate all players in world [video]",story,https://www.youtube.com/watch?v=maMpMOnIJDE,
mooreds,435.0,40267675,"[40268948, 40268209, 40269093, 40268353, 40269232, 40268862, 40271655, 40268213, 40268432, 40268690, 40268359, 40281203, 40268670, 40280354, 40268919, 40276710, 40268055, 40276063, 40268287, 40269934, 40269629, 40270173, 40269094, 40269105, 40269713, 40268771, 40276497, 40275675, 40269660, 40268337, 40268110, 40280197, 40269549, 40269823, 40270393, 40271006, 40268068, 40268740, 40270995, 40268352, 40279251, 40269004, 40269278, 40270217, 40269335, 40268871]",478,1714938886,Bollards: Why and What,story,https://josh.works/bollards,
mfiguiere,150.0,40266728,"[40267413, 40271047, 40269354, 40267584, 40267226, 40267701, 40268381, 40267252, 40267608, 40267286, 40267562, 40267528]",312,1714931412,Microsoft CTO: Thoughts on OpenAI (2019),story,https://twitter.com/techemails/status/1787176471146156193,
tech234a,0.0,40280479,,6,1715036524,CoolStar makes many jailbreak tweaks open source after being hired by Apple,story,https://www.idownloadblog.com/2024/05/06/coolstar-hired-by-apple/,
brad0,1.0,40281312,[40281982],3,1715045109,New Seventh-Generation General Purpose Amazon EC2 Instances (M7i-Flex and M7i),story,https://aws.amazon.com/blogs/aws/new-seventh-generation-general-purpose-amazon-ec2-instances-m7i-flex-and-m7i/,
TheRealPomax,63.0,40267164,"[40273545, 40273259, 40267732, 40272088, 40269491, 40268157, 40270664, 40273698, 40270785, 40267762, 40269877, 40275876, 40267895, 40270146, 40269423, 40268268, 40267796, 40267165, 40271171]",272,1714934704,Flying planes in Microsoft Flight Simulator with a JavaScript autopilot (2023),story,https://pomax.github.io/are-we-flying/,"A (lengthy!) tutorial on how to write your own JS-based autopilot code to fly planes in Microsoft Flight Simulator with a web page to both visualize the flight and control the AP.<p>Note that this is a complete do-over of a previous page that used a combination of Python and JavaScript, and only covered basic autopilot functionality. This rewrite threw all of that out, and goes much, much further:<p>you just want to have the plane take off without having to do anything? Check, this tutorial covers auto-takeoff.<p>Flying with waypoint-based navigation, not by &quot;programming airports and radio beacons one letter at a time with a jog-dial&quot; but by just placing markers on a map and dragging those around as you please, mid-flight, Google Maps style? Check. After all, why would we not, putting a map on a webpage is super easy (barely an inconvenience).<p>In fact, let&#x27;s throw in flight plan saving and loading, so others can fly the same route!<p>And maybe you want the plane to fly a fixed distance above the ground, instead of at a fixed altitude... well: check. You&#x27;ll learn about terrain-follow using free Digital Elevation Model datasets for planet Earth.<p>And of course the big one, for the ultimate &quot;click button, JS flies the plane start to finish&quot; experience: ever wished the in-game autopilot could just land the plane for you? Well, it&#x27;s a video game, and we know programming, so: why not? We&#x27;re also implementing auto-landing and it&#x27;s going to be amazing.<p>If you play MSFS, and you&#x27;re a developer&#x2F;programmer, and you&#x27;ve always thought how cool it would be if you could just do some scripting for it... you can, there&#x27;s a <i>lot</i> of cool stuff you can do!<p>And of course if you don&#x27;t want to follow along and just want to have everything set up and ready to fly your plane, just clone <a href=""https:&#x2F;&#x2F;github.com&#x2F;Pomax&#x2F;are-we-flying"">https:&#x2F;&#x2F;github.com&#x2F;Pomax&#x2F;are-we-flying</a> and have fun."
gulced,0.0,40281264,,5,1715044625,Microsoft reportedly developing MAI-1 AI model with 500B,story,https://siliconangle.com/2024/05/06/microsoft-reportedly-developing-mai-1-llm-500b-parameters/,
q2loyp,242.0,40264042,"[40265558, 40266054, 40265643, 40273912, 40264932, 40265478, 40264726, 40266623, 40264887, 40275045, 40264846, 40265319, 40266576, 40273341, 40271185, 40266562, 40265023, 40266192, 40265058, 40264811, 40266327, 40265363, 40267222, 40267350, 40267950, 40272170, 40272652, 40265256, 40265029, 40268561, 40265770, 40265265, 40264841, 40279425, 40264691, 40265988, 40265097, 40265285, 40272352, 40274342]",374,1714908677,"Take a look at Traefik, even if you don't use containers",story,https://j6b72.de/article/why-you-should-take-a-look-at-traefik/,
ignoramous,87.0,40264352,"[40264969, 40265846, 40267469, 40268906, 40271700, 40264795, 40269830, 40265882, 40264859, 40264792, 40265516, 40264933, 40275776, 40267239, 40264799]",313,1714912244,Machine Unlearning in 2024,story,https://ai.stanford.edu/~kzliu/blog/unlearning,
nateb2022,50.0,40262115,"[40263924, 40262455, 40265849, 40263039, 40263169, 40262486, 40263131, 40264293, 40262662, 40262943, 40264718]",86,1714880764,"Cylon: JavaScript framework for robotics, drones, and the Internet of Things",story,https://github.com/hybridgroup/cylon,
robertvc,47.0,40261550,"[40266093, 40264384, 40262698, 40264505, 40265974, 40263051, 40266194, 40265517, 40266795, 40262342]",95,1714870865,Understanding Stein's Paradox (2021),story,https://joe-antognini.github.io/machine-learning/steins-paradox,
mooreds,348.0,40267666,"[40268920, 40270598, 40268284, 40268294, 40268700, 40271360, 40269357, 40273674, 40268265, 40272056, 40282082, 40271719, 40269126, 40282643, 40268630, 40268649, 40272545, 40281873, 40272844, 40270306, 40270305, 40268742, 40268980, 40279868, 40273482, 40274127, 40279032, 40272646, 40272093, 40269962, 40273825, 40269883, 40272355, 40269088, 40271727, 40270147, 40268883, 40269281, 40269876, 40271372, 40269788, 40270257, 40271445, 40269879, 40270441, 40272782, 40271157, 40270082, 40270020, 40269919, 40272850, 40268255, 40271299, 40273834, 40271209, 40269070, 40270482]",779,1714938828,Social engineering takeovers of open source projects,story,https://openssf.org/blog/2024/04/15/open-source-security-openssf-and-openjs-foundations-issue-alert-for-social-engineering-takeovers-of-open-source-projects/,
jsiepkes,139.0,40260399,"[40262892, 40261710, 40265101, 40265223, 40261698, 40265428, 40261851, 40264913, 40262803, 40265293, 40266293, 40269098, 40262459, 40265262, 40263251, 40263785, 40262623, 40261713]",183,1714857874,Superfest – The almost unbreakable East German Glass (2021),story,https://digitalcosmonaut.com/superfest-ceverit-glass-ddr/,
jnord,1.0,40280222,[40280237],9,1715034375,The Computers of Voyager,story,https://hackaday.com/2024/05/06/the-computers-of-voyager/,
happybuy,24.0,40280119,"[40282356, 40282444, 40282414, 40282048, 40282294, 40282563, 40280142]",17,1715033621,Apple should end their Google search partnership (2023),story,https://www.magiclasso.co/insights/apple-google-search-partnership/,
ementally,3.0,40279634,"[40279840, 40281059]",18,1715030423,Novel attack against virtually all VPN apps neuters their entire purpose,story,https://arstechnica.com/security/2024/05/novel-attack-against-virtually-all-vpn-apps-neuters-their-entire-purpose/,
jasondavies,2.0,40280930,[40281067],7,1715040639,"DeepSeek-V2: A Strong, Economical, and Efficient Moe Language Model",story,https://github.com/deepseek-ai/DeepSeek-V2,
pabs3,25.0,40261926,"[40265779, 40263474, 40263734, 40264129]",61,1714877547,Digital Telecommunication in HF band - WWWAN - World-Wide Wireless Area Network,story,https://pretalx.sysmocom.de/osmodevcon2024/talk/BBZBGM/,
pausing,2.0,40260985,[40268485],17,1714863585,The robustness of some fossil leaf venation networks to simulated damage,story,https://royalsocietypublishing.org/doi/10.1098/rsos.240086,
ingve,4.0,40266214,"[40275001, 40269643, 40271575, 40275315]",26,1714927682,Minimalist Guide to AV1 Video Encoding,story,https://tech.marksblogg.com/av1-video-encoding.html,
Jtsummers,2.0,40278704,"[40282522, 40280997]",14,1715024574,The surprise is not that Boeing lost commercial crew but that it finished at all,story,https://arstechnica.com/space/2024/05/the-surprise-is-not-that-boeing-lost-commercial-crew-but-that-it-finished-at-all/,
danny00,40.0,40261681,"[40262369, 40262640, 40262263, 40262149, 40262393, 40262928, 40262191, 40262402, 40265218, 40275238, 40263221, 40263059, 40262522, 40262386, 40263300, 40263155, 40263768, 40265169]",266,1714873145,Automated integer hash function discovery,story,https://github.com/skeeto/hash-prospector,
mr_tyzic,0.0,40260996,,25,1714863697,Variations on the theme of silence,story,https://commonreader.wustl.edu/c/variations-on-the-theme-of-silence/,
IMSAI8080,202.0,40262883,"[40265929, 40265509, 40272687, 40267180, 40263540, 40263684, 40263592, 40263339, 40265559, 40272552, 40272125, 40263064, 40263329, 40263822, 40267708, 40262884, 40268203, 40268836, 40266714, 40272554, 40263437, 40263285, 40271416, 40268567, 40263813, 40269761, 40263360, 40272712, 40267456, 40268632, 40263311, 40265852, 40265801, 40263731, 40269052, 40269300, 40266059, 40265281, 40265476, 40263347, 40267865]",160,1714892876,North Yorkshire Council to phase out apostrophe use on street signs,story,https://www.bbc.co.uk/news/uk-england-york-north-yorkshire-68942321,
benbreen,0.0,40271057,,10,1714968369,Laudatio Turiae,story,https://en.wikipedia.org/wiki/Laudatio_Turiae,
spirit23,44.0,40262236,"[40262655, 40265908, 40262942, 40266407, 40263378, 40264146, 40266351, 40263253, 40262955, 40263917, 40264221, 40269519, 40262763, 40269303]",231,1714883170,Time-Based CSS Animations,story,https://yuanchuan.dev/time-based-css-animations,
password4321,0.0,40273245,,4,1714993376,Decompiling Hyper-V Manager to rebuild it from source,story,https://awakecoding.com/posts/decompiling-hyper-v-manager-to-rebuild-it-from-source/,
flexagoon,122.0,40262779,"[40263189, 40263634, 40264282, 40264393, 40263472, 40263379, 40264220, 40263962, 40264263, 40265759, 40268723, 40263449, 40263902, 40264137, 40269654, 40263849, 40263296, 40265334, 40265014, 40263170, 40264944, 40264073, 40268106]",191,1714891660,Xmake: A cross-platform build utility based on Lua,story,https://github.com/xmake-io/xmake,
doctorhandshake,92.0,40276957,"[40277263, 40277539, 40277079, 40277414, 40278121, 40277699, 40277550, 40277626, 40277897, 40277141, 40277834, 40277189]",120,1715015923,Patagonia's New Study Finds Fleece Jackets Are a Serious Pollutant (2016),story,https://www.outsideonline.com/outdoor-gear/gear-news/patagonias-new-study-finds-fleece-jackets-are-serious-pollutant/,
_wire_,1.0,40270095,[40276237],12,1714956925,Show HN: Ddrescue-helper.sh – A bash script for GNU ddrescue,story,https://github.com/c-o-pr/ddrescue-helper,"ddrescue-helper.sh is a bash script to make running GNU ddrescue easier.<p>Do you have a spinning drive with read errors that you can&#x27;t access?\
Do you need to rescue a drive, partition, or file from read errors?<p>ddrescue-helper.sh might be useful.<p>This is a pure bash script that hooks you up to the majesty that is GNU ddrescue, and makes it more useful.<p>For Linux and macOS.<p>Rescue...
- device-to-device
- device-to-file (image)
- file-to-file<p>Consistency checks help avoid user mistakes, such as trying to place the domain map on a target device, or targeting the boot drive.<p>Auto persistent un-mount via &#x2F;etc&#x2F;fstab ensures rescue integrity.<p>Ddrescue&#x27;s domain-map file and read-rate logs are placed in a directory named by the user.<p>Once you have a ddrescue domain map, a REPORT function lists files affected by read errors and slow-reads for supported filesystems...\
Linux: NTFS, ext2&#x2F;3&#x2F;4, HFS+\
macOS: HFS+.<p>Making a device or file copy is the best way to rescue. But if you need to work in situ with a filesystem or file that contains bad blocks, this helper offers a ZAP function that uses the domain map to write device blocks with read errors to attempt to make the blocks readable. This can regain access to an unreadable file, or make an un-mountable filesystem accessible, aiding further forensics (the data in the bad blocks are gone, but gaining device access may still be valuable).<p>An -K option allows ZAP of 4K blocks, for advanced format drives, instead of the default 512-byte block. This option may encourage the drive to re-allocate a bad sector.<p>(ZAP doesn&#x27;t rely on hdparm, it uses dd(1) to target single blocks.)<p>A PLOT function uses gnuplot to render the GNU ddrescue read-rate log as a simple graph at the terminal, helping you assess device health.<p>By rescuing (COPYING) to &#x2F;dev&#x2F;null instead of a proper destination, you can SCAN a source to create the domain-map and read-rate log without replicating to another device. This lets you REPORT, ZAP, and PLOT a source without need for a target device-- maybe you don&#x27;t have a spare.<p>If nothing else, a bit assistance running GNU ddrescue might be just the ticket.<p>DOCUMENTATION:<p>- The github README.md
- Built-in help. (-h)
- A LinkedIn article describing the helper&#x27;s use:<p><a href=""https:&#x2F;&#x2F;www.linkedin.com&#x2F;feed&#x2F;update&#x2F;urn:li:activity:7177497724383088640"" rel=""nofollow"">https:&#x2F;&#x2F;www.linkedin.com&#x2F;feed&#x2F;update&#x2F;urn:li:activity:7177497...</a><p>—<p>WARNING! This script has so far only been tested by me and mistakes due to maker myopia are likely. Plus bash is a can&#x27;o&#x27;worms!<p>While I believe this helper is not fundamentally dangerous, try it in a situation that&#x27;s low stakes to start. There&#x27;s a time for disaster later.<p>Also try to overlook that a huge bash script seems like an epic security hazard.<p>If something goes wrong, you should&#x27;ve voted for Kodos.<p>—<p>I would appreciate laments about the approach and code.<p>The github README.md contains thoughts about many concerns &amp; improvements.\
(see TODOs at the end.)<p>I think the most gross part of this script is the mainline option processing, so pointers to idioms for smarter option processing will be appreciated. But beat me over the head in any way you like.<p>I am a github noob so I have no idea how collaboration works over there, but I&#x27;m ready to learn.<p>—<p>I truly enjoy the nightmare that is the Unix shell. So I have no intention of rewriting this in a more palatable language. I just wanted to hack together a tool to help me work with failing drives and this script took on a life of its own.<p>Blame these guys:<p>AT&amp;T The UNIX System: Making Computers More Productive (1982)<p><a href=""https:&#x2F;&#x2F;www.youtube.com&#x2F;watch?v=tc4ROCJYbm0"" rel=""nofollow"">https:&#x2F;&#x2F;www.youtube.com&#x2F;watch?v=tc4ROCJYbm0</a><p>I like to think that old K &amp; R and KenT would have only dreamed of shell utility that is this byzantine.<p>With any luck this code will soon be polluting a LLM."
megapixel99,54.0,40261279,"[40275939, 40275801, 40276716, 40280503, 40276110, 40279653, 40276651, 40276672, 40276017, 40275853, 40277144, 40276106, 40277609, 40276020, 40277961, 40275771, 40277837, 40276922]",61,1714867007,Show HN: Kubernates in Node.js,story,https://github.com/Megapixel99/nodejs-k8s,"This project was&#x2F;is an attempt to recreate the core functionality of v1.29.1 Kubernetes in NodeJS, while being fully compatible with the kubectl CLI."
jimwang,2.0,40266682,[40267014],23,1714931137,What's bad about this habit (2009) [pdf],story,https://www.ehu.eus/aitor/irakas/mes/Reference/mermin.pdf,
classichasclass,1.0,40281538,[40281675],15,1715047428,Farm states push back on Biden's bird flu response,story,https://www.politico.com/news/2024/05/06/bird-flu-dairy-farms-cdc-00156119,
gz09,100.0,40259185,"[40261562, 40261546, 40260398, 40261037, 40260912, 40265629, 40260721, 40264358, 40260733, 40263021, 40260391, 40263018, 40260396, 40261844]",278,1714845053,Verified Rust for low-level systems code,story,https://github.com/verus-lang/verus,
get_flomped,0.0,40266057,,29,1714926486,Show HN: Wanderer – an open-source trail database,story,https://github.com/Flomp/wanderer,
mfiguiere,0.0,40278749,,5,1715024926,ECC DDR5-4800 vs. DDR5-5200 Memory Performance for AMD Ryzen Zen 4,story,https://www.phoronix.com/review/amd-ryzen-ecc-ddr5-5200,
