by,descendants,id,kids,score,time,title,type,url,text
ingve,5.0,40140919,"[40141371, 40143214, 40146989, 40142333, 40141535]",89,1713936492,QEMU Version 9.0.0 Released,story,https://www.qemu.org/2024/04/23/qemu-9-0-0/,
priyankanath,0.0,40140159,,5,1713929020,The true story of Japan's samurai city that chose art over war,story,https://www.bbc.com/travel/article/20240423-the-true-story-of-japans-samurai-city-that-chose-art-over-war,
priyankanath,0.0,40140141,,4,1713928908,"Cigarette prices motivating more quit attempts, study says",story,https://www.bbc.com/news/health-68875556,
todsacerdoti,81.0,40159988,"[40160890, 40163359, 40160633, 40160988, 40160573, 40161039, 40160272, 40162991]",50,1714064169,Go or Rust? Just Listen to the Bots,story,https://cybernetist.com/2024/04/25/go-or-rust-just-listen-to-the-bots/,
snehesht,2.0,40160148,"[40160535, 40160555, 40160775]",46,1714064753,Ubuntu 24.04 LTS,story,https://ubuntu.com/download/desktop,
Brajeshwar,1.0,40157559,"[40158352, 40158308, 40158402]",16,1714052918,Searing heat shuts schools for 33M children,story,https://www.bbc.com/news/articles/c1wxjj3g965o,
ta988,1.0,40152977,"[40153034, 40153318, 40153314, 40153260]",43,1714014861,McKinsey Is Under Criminal Investigation for Its Opioid Work,story,https://www.nytimes.com/2024/04/24/business/mckinsey-criminal-investigation.html,
gulced,30.0,40151181,"[40157276, 40152105, 40152119, 40152236, 40152187, 40152040, 40152005, 40152264, 40152091, 40151991, 40152140, 40152138, 40151995]",35,1714001072,"Decline in heart failure deaths has been undone, led by people under 45",story,https://www.statnews.com/2024/04/24/heart-failure-deaths-decline-undone/,
mikhael,2.0,40158500,"[40159568, 40159731]",15,1714057845,Garry's Mod Deleting 20 Years of Content After Nintendo Sends Takedown Notices,story,https://gizmodo.com/nintendo-garrys-mod-takedown-content-1851434683,
dulvui,1.0,40136793,[40167990],4,1713903614,Happy JavaScript Naked Day 2024,story,https://simondalvai.org/blog/js-naked-day-2024/,
lproven,144.0,40148795,"[40150250, 40150197, 40150258, 40150012, 40150092, 40150034, 40150225, 40150224, 40149946, 40150192, 40150137, 40150116]",71,1713988376,Why does Windows use backslash as path separator? (2019),story,https://www.os2museum.com/wp/why-does-windows-really-use-backslash-as-path-separator/,
coloneltcb,45.0,40157470,"[40157750, 40157541, 40157602, 40157813, 40157629, 40157706, 40162167, 40158469, 40157930, 40158474, 40157676, 40157573, 40157727, 40158573, 40157772]",71,1714052536,Florida inmates charged for prison cells long after incarceration,story,https://www.abcactionnews.com/news/local-news/i-team-investigates/pay-to-stay-florida-inmates-charged-for-prison-cells-long-after-incarceration,
kqnrnq17r,50.0,40140396,"[40140726, 40141137, 40140729, 40141066, 40142183, 40141244, 40141502, 40141259, 40140397, 40141450, 40141580]",118,1713931171,"Building a full Django project, starting with a single file",story,https://www.mostlypython.com/django-from-first-principles/,
jonathang6k,45.0,40151860,"[40154628, 40153199, 40152372, 40155352, 40152657, 40159972, 40158107, 40153967, 40154499, 40154022, 40155638, 40155366, 40160000, 40156781, 40154686, 40161448]",55,1714006069,Show HN: See your current Spotify song in the menu bar,story,https://github.com/jonathangarelick/SoundSeer,
rntn,12.0,40140237,"[40141088, 40140459, 40140286, 40140508]",26,1713929659,US Government reportedly ponders crimping China's use of RISC-V,story,https://www.theregister.com/2024/04/24/us_commerce_china_risc_v_investigation/,
NetBeck,17.0,40159776,"[40160223, 40160571, 40160156, 40160143, 40160128, 40159977, 40160125, 40160121]",52,1714063351,FCC votes to restore net neutrality,story,https://www.theverge.com/2024/4/25/24140157/fcc-vote-restore-net-neutrality-rosenworcel-biden,
xnx,2.0,40164312,"[40164669, 40164618, 40164597]",5,1714087736,Xiaomi EV Factory [video],story,https://www.youtube.com/watch?v=yezR-mH12xs,
PaulHoule,14.0,40138756,"[40139725, 40138996, 40141538, 40141544, 40138816]",22,1713916241,Loongson CPU that performs like 2020 Core i3 makes its way to Chinese mini PCs,story,https://www.theregister.com/2024/04/13/loongson_cpu_mini_pc/,
kieranmaine,45.0,40145162,"[40145895, 40147749, 40145635, 40145536, 40145659, 40145480, 40145493, 40145725, 40145517, 40146245]",58,1713970751,Electricity generated by fossil fuels in Great Britain drops to record low,story,https://www.theguardian.com/business/2024/apr/24/share-electricity-generated-by-fossil-fuels-great-britain-record-low,
LorenDB,1.0,40137908,[40141380],3,1713909892,The Brightest Monitor We've Ever Seen – Sun Vision Re RLCD Display [video],story,https://www.youtube.com/watch?v=c0TcGjzKbag,
asafela,1.0,40165528,[40165612],5,1714100081,Trump Allies Draw Up Plans to Blunt Fed's Independence,story,https://www.wsj.com/economy/central-banking/trump-allies-federal-reserve-independence-54423c2f,
doener,0.0,40153174,,5,1714016664,Biden Makes $11B Push to Beat China at Chip Research,story,https://www.bloomberg.com/news/articles/2024-04-24/biden-makes-11-billion-push-to-beat-china-at-chip-research,
rpgbr,86.0,40142598,"[40143464, 40143409, 40143227, 40143539, 40143167, 40143574, 40143098, 40143474, 40143199, 40143755, 40144221, 40144770, 40149142, 40143351, 40143770, 40143652, 40143561, 40143457, 40148361, 40159499, 40151753, 40145838]",62,1713953916,Framework won't be just a laptop company anymore,story,https://www.theverge.com/2024/4/23/24138475/framework-laptop-product-categories-new,
Jtsummers,1.0,40136982,[40143567],4,1713904725,IT Doesn't Matter,story,https://hbr.org/2003/05/it-doesnt-matter,
kryster,2.0,40150893,"[40152001, 40151070]",12,1713999406,Nginx 1.26 Released with Experimental HTTP/3 Support,story,https://www.phoronix.com/news/nginx-1.26-Released,
ziptron,0.0,40151486,[40152184],23,1714003269,Llama3 – 65k Context Window with great recall,story,https://twitter.com/winglian/status/1783122644579090600,
simenandre,4.0,40146575,"[40148681, 40147363]",39,1713976677,"Pulumi adds drift detection, time-to-live stacks, and scheduled deployments",story,https://www.pulumi.com/blog/infrastructure-lifecycle-management/,
georgecmu,0.0,40136934,[40137942],8,1713904484,The Bitsavers Main Page,story,http://www.bitsavers.org/,
Brajeshwar,0.0,40160412,[40160740],7,1714065689,"Earth got hammered by cosmic rays 41,000 years ago due to a weak magnetic field",story,https://www.space.com/earth-hammered-cosmic-rays-weak-magnetic-field,
peutetre,13.0,40151623,"[40151967, 40153236, 40166019, 40151813, 40152202, 40152220, 40151938, 40152298, 40152169]",20,1714004261,"Mercedes unveils 2025 electric G-Class, with 4 motors and tank turns",story,https://electrek.co/2024/04/23/mercedes-unveils-2025-electric-g-class-with-4-motors-and-tank-turns/,
dangle1,67.0,40162672,"[40163310, 40163252, 40164501, 40165160, 40165011, 40163832, 40163685, 40163548, 40165102, 40163807]",28,1714077326,'The bane of retail.' Many big chains now lock up all kinds of merchandise,story,https://www.latimes.com/business/story/2024-04-25/retail-theft-locked-up-merchandise,
PaulHoule,31.0,40138396,"[40140821, 40140934, 40139328, 40140555, 40140957, 40141501, 40141552]",70,1713913581,"Microplastics make their way from the gut to other organs, researchers find",story,https://medicalxpress.com/news/2024-04-microplastics-gut.html,
devonnull,1.0,40149036,[40149714],24,1713989785,Why IBM employees in Brazil are suing to be classified as tech workers,story,https://restofworld.org/2024/ibm-lawsuit-brazil/,
lairv,6.0,40158916,"[40160501, 40165969, 40160877, 40161642, 40160895]",34,1714059892,Ubuntu 24.04 LTS Noble Numbat release,story,https://ubuntu.com/blog/canonical-releases-ubuntu-24-04-noble-numbat,
gulced,47.0,40151485,"[40152010, 40151830, 40151777, 40151754, 40152016, 40152068, 40153568, 40152398, 40152205, 40152093, 40151767, 40151919, 40151869, 40152151]",67,1714003266,Windows 11 now comes with its own adware,story,https://www.engadget.com/windows-11-now-comes-with-its-own-adware-124531977.html,
zkoch,32.0,40137441,"[40137835, 40137788, 40137797, 40137807, 40137902, 40137861, 40138858, 40137805, 40137749, 40137738, 40137765, 40138368, 40137719, 40137796]",60,1713907314,Thefastest.ai,story,https://thefastest.ai,
spxneo,27.0,40150793,"[40153221, 40163612, 40164928, 40151761, 40151664, 40152349, 40162424, 40153648, 40162266, 40155554, 40153759, 40151738, 40151510, 40152781, 40151522, 40151611, 40151330, 40151580, 40152061, 40151686, 40157960, 40151295]",16,1713998757,Ask HN: Do you use ChatGPT to generate code? What were your experiences?,story,,"So I was experimenting with Swift without knowing any Swift code to see if I could generate an app.<p>To my surprise I see a repeating theme:<p>- ChatGPT generates ample amount of code that eventually runs after refinement through multiple prompts.<p>- Solution hits a hard edge case and we need to rework, refactor stuff, involving even more prompts to get it working (this is understandable as more tech debt is introduced)<p>- Solution hits an edge case and eventually ChatGPT4 starts hitting a loop saying it has a new solution or it fixed something but it really didn&#x27;t.<p>- Manual inspection of code and simple logic removes that edge case from that solution.<p>To me this was an interesting to see: ChatGPT4 seems quite apt at handling requirements but it is unable to see very obvious mistakes or one liners.<p>I&#x27;ve spent about a week developing an iOS app with ChatGPT4 and these are my findings. I&#x27;m wondering if anybody else has experimented with generating code they have no experience or knowledge of and what your experience was like."
belter,0.0,40148475,,7,1713986662,"China on track for crewed moon landing by 2030, space official says",story,https://spacenews.com/china-on-track-for-crewed-moon-landing-by-2030-space-official-says/,
mufty,32.0,40151180,"[40151503, 40151479, 40151618, 40151834, 40153854, 40152587, 40153363, 40159072, 40152668, 40157963, 40151781, 40151617, 40152014, 40153090, 40151792, 40151747, 40152211, 40152060, 40151454, 40151557, 40151473]",16,1714001065,Are Unpaid Take-Home Interview Assignments Ethical?,story,https://www.inhersight.com/blog/interview/are-unpaid-interview-assignments-ethical,
todsacerdoti,14.0,40143559,"[40143939, 40143817, 40143736, 40143801, 40144218]",43,1713961697,Learn OTP with Gleam,story,https://github.com/bcpeinhardt/learn_otp_with_gleam,
johntiger1,12.0,40149630,"[40150200, 40150139, 40150150, 40150234, 40150109, 40150391, 40150485]",19,1713992708,Meta stock has lost $137B in market cap on weak Q2 revenue guidance,story,https://finance.yahoo.com/video/meta-stock-falls-disappointing-q2-202013597.html,
iosystem,135.0,40158417,"[40158819, 40159069, 40158505, 40158811, 40158913, 40159482, 40159626, 40159661, 40158832, 40159044, 40159699, 40158992, 40159161, 40158905, 40159265, 40159327, 40159261, 40158997, 40158418, 40159727, 40158824, 40159060]",102,1714057351,Today Microsoft Banned My Country Iran from Minecraft,story,https://old.reddit.com/r/GirlGamers/comments/1cckj2q/today_microsoft_banned_my_country_iran_from/,
8organicbits,120.0,40156057,"[40156278, 40156525, 40156244, 40156712, 40156231, 40156487, 40156323, 40156315, 40156922, 40156470, 40157503, 40156293, 40156338, 40156755, 40156444, 40156346, 40156632, 40156560, 40156281, 40156491, 40156361, 40157614, 40156103]",88,1714043995,Leaving Substack,story,https://www.mostlypython.com/leaving-substack/,
hadrien01,0.0,40148667,[40148822],23,1713987640,Spotify is struggling to get Apple to approve its iOS updates in the EU,story,https://www.theverge.com/2024/4/24/24139335/spotify-apple-eu-ios-app-update-submission-antitrust-dma,
hn_acker,9.0,40136555,"[40136556, 40136998, 40137126, 40136970, 40136964, 40136944]",25,1713902301,No One Can Own the Law–So Why Is Congress Extending Copyright to It?,story,https://www.arl.org/blog/no-one-can-own-the-law-so-why-is-congress-advancing-a-bill-to-extend-copyright-to-it/,
okaleniuk,1.0,40142037,[40142699],11,1713948281,Ukrainian Coder's New Programming Language: One Big Data Structure,story,https://thenewstack.io/ukrainian-coders-new-programming-language-one-big-data-structure/,
LorenDB,10.0,40138830,"[40139075, 40140509, 40139150, 40139183]",35,1713916986,The spam came from inside the house: How a smart TV can choke a Windows PC,story,https://arstechnica.com/gadgets/2024/04/the-spam-came-from-inside-the-house-how-a-smart-tv-can-choke-a-windows-pc/,
LinuxBender,0.0,40144886,,7,1713969355,Tesla profits drop 55% as Elon Musk dodges cheap car questions,story,https://arstechnica.com/cars/2024/04/tesla-profits-drop-55-as-elon-musk-dodges-cheap-car-questions/,
voisin,0.0,40144728,,5,1713968546,"The Folly of China's Real-Estate Boom Was Easy to See, No One Wanted to Stop It",story,https://www.wsj.com/real-estate/china-real-estate-bubble-bust-35a2b7db,
samspenc,64.0,40151193,"[40151742, 40151741, 40151689, 40161532, 40153128, 40151748, 40157129, 40152166, 40151988]",67,1714001137,Argentina celebrates first quarterly budget surplus in 16 years,story,https://www.wionews.com/business-economy/argentina-celebrates-its-first-quarterly-budget-surplus-president-milei-promises-continued-fiscal-discipline-714060,
bdcravens,0.0,40148079,"[40148273, 40148184]",11,1713984516,El Salvador's Bitcoin Wallet Suffers Leak of Source Code and VPN Access,story,https://www.coinfeeds.io/daily/el-salvador-s-bitcoin-wallet-faces-security-breaches,
drak0n1c,0.0,40147411,,4,1713980414,Unreal Engine 5.4 is now available,story,https://www.unrealengine.com/en-US/blog/unreal-engine-5-4-is-now-available,
Anon84,5.0,40137429,"[40138038, 40137824, 40137761, 40137482, 40139309]",11,1713907238,Why You Can't Get a Restaurant Reservation,story,https://www.newyorker.com/news/our-local-correspondents/why-you-cant-get-a-restaurant-reservation,
noch,1.0,40137269,"[40138423, 40137327]",6,1713906463,The Virtual Civil War,story,https://www.gurwinder.blog/p/dramageddon-the-virtual-civil-war,
segasaturn,0.0,40150455,"[40150757, 40150923, 40150869]",22,1713996736,Delta takes flight: Apple-approved Nintendo emulator is a great iOS option,story,https://arstechnica.com/gaming/2024/04/a-touchscreen-of-nostalgia-delta-brings-classic-nintendo-consoles-to-ios/,
anigbrowl,96.0,40137952,"[40138607, 40138567, 40138491, 40138572, 40138993, 40139403, 40138574, 40138833, 40138774, 40138997, 40138749, 40138909, 40143288, 40139098, 40139163, 40138497, 40138936, 40138895, 40138971, 40138792, 40138554, 40138636, 40138532, 40138975, 40138685, 40139178, 40138620, 40138610]",124,1713910198,Chechnya bans music outside the range of 80-116 beats per minute,story,https://www.smithsonianmag.com/smart-news/music-is-now-illegal-in-chechnyaif-it-doesnt-meet-authorities-tempo-restrictions-180984159/,
tantalor,1.0,40145709,[40146769],4,1713973199,Lawmakers unveil sprawling plan to expand online privacy protections,story,https://www.washingtonpost.com/technology/2024/04/07/congress-privacy-deal-cantwell-rodgers/,
LorenDB,0.0,40148341,[40148826],15,1713986079,SpaceX has now landed more boosters than most other rockets ever launch,story,https://arstechnica.com/space/2024/04/spacex-has-now-landed-more-boosters-than-most-other-rockets-ever-launch/,
thunderbong,117.0,40141811,"[40142070, 40142921, 40142977, 40142004, 40142052, 40142092, 40142632, 40143069, 40142395, 40142226, 40142656, 40143027, 40143083, 40142753, 40144264]",99,1713945545,Android 15 may make it harder for sideloaded apps to get sensitive permissions,story,https://www.androidauthority.com/android-15-enhanced-confirmation-mode-3436697/,
feross,115.0,40155926,"[40156932, 40166195, 40157066, 40157738, 40160652, 40157525, 40157136, 40158433, 40163984, 40157405, 40158042, 40158011, 40156954, 40156920, 40158001, 40157178, 40156889, 40157766]",57,1714042922,Desperately Trying to Fathom the Coffeepocalypse Argument,story,https://www.astralcodexten.com/p/desperately-trying-to-fathom-the,
panqueca,12.0,40140675,"[40166740, 40166255, 40140728, 40141747, 40151793, 40140691, 40141550, 40141383]",74,1713933894,Apple/OpenELM: Efficient Open-Source Family Language Models,story,https://huggingface.co/apple/OpenELM,
LorenDB,2.0,40148360,"[40150195, 40148462, 40148614]",10,1713986161,Lenovo and Micron first to implement LPCAMM2 in laptop,story,https://www.theregister.com/2024/04/24/lenovo_micron_lpcamm2_thinkpad/,
rbanffy,2.0,40136306,"[40136752, 40136847]",26,1713901298,Python Big O: Time complexities of different data structures in Python,story,https://www.pythonmorsels.com/time-complexities/,
andsoitis,2.0,40139650,"[40140426, 40140689]",37,1713924393,US breaks ground on its first-ever high-speed rail,story,https://www.popsci.com/technology/high-speed-rail/,
peter_hansteen,5.0,40140708,"[40142610, 40141563, 40141346]",16,1713934237,OpenBSD – Game of Trees 0.98 released,story,https://www.undeadly.org/cgi?action=article;sid=20240424043509,
rbanffy,1.0,40148175,[40162912],9,1713985219,The specific process by which Google enshittified its search,story,https://pluralistic.net/2024/04/24/naming-names/#prabhakar-raghavan,
JumpCrisscross,2.0,40139512,"[40139751, 40150763]",6,1713923105,'It Is Desolate': China's Glut of Unused Car Factories,story,https://www.nytimes.com/2024/04/23/business/china-auto-factories-price-cuts.html,
sgiratch,1.0,40137067,"[40165561, 40137251]",29,1713905238,Internet Archive in Court: There's More to Copyright Than Financial Incentives,story,https://torrentfreak.com/there-is-more-to-copyright-than-financial-incentives-internet-archive-argues-in-court-240423/,
rwmj,3.0,40136863,"[40138042, 40137243]",27,1713904090,Why RISC-V is so important,story,https://www.xda-developers.com/heres-why-risc-v-is-important/,
josephcsible,50.0,40164975,"[40165301, 40165267, 40165124, 40165271, 40166767, 40165221, 40165138, 40166075, 40165114, 40165216, 40165230, 40165186, 40165313]",78,1714094749,Banned in the U.S.: Healthy Light Bulbs,story,https://www.psychologytoday.com/us/blog/the-light-doctor/202404/banned-in-the-us-healthy-light-bulbs,
temp0826,1.0,40137780,"[40138066, 40137935]",17,1713909153,Arizona Church Reaches Settlement with Federal Agencies to Use Ayahuasca,story,https://chacruna.net/the-church-of-the-eagle-and-the-condor-reaches-a-settlement-with-federal-agencies-affirming-the-religious-right-to-use-ayahuasca/,
iancmceachern,1.0,40140620,[40140637],4,1713933288,"Calif. carmaker Fisker, once worth $2.9B, warns of looming bankruptcy",story,https://www.sfgate.com/tech/article/fisker-warns-bankruptcy-california-car-19418654.php,
DrNosferatu,101.0,40161573,"[40162110, 40161649, 40161831, 40161748, 40162010, 40161749, 40161960, 40162593, 40161655, 40164331, 40161653, 40162357, 40161906, 40162151, 40162014]",68,1714071400,Portugal's democracy turns 50,story,https://www.reuters.com/world/europe/portugals-democracy-turns-50-thousands-commemorate-carnation-revolution-2024-04-25/,
itvision,86.0,40155336,"[40155553, 40155999, 40155640, 40155583, 40155994, 40155440, 40157375, 40155897, 40155738, 40156069, 40155558]",46,1714037724,Dedoimedo reviews Wayland in 2024 and comes to sad conclusions,story,https://www.dedoimedo.com/computers/wayland-2024.html,
nla,5.0,40148397,"[40148726, 40149158, 40148715, 40149363, 40148638]",13,1713986293,Apple Releases OpenELM,story,https://venturebeat.com/ai/apple-releases-openelm-small-open-source-ai-models-designed-to-run-on-device/,
jmsflknr,3.0,40144783,"[40145637, 40151959, 40147319]",28,1713968808,Qualcomm Is Cheating on Their Snapdragon X Elite/Pro Benchmarks,story,https://semiaccurate.com/2024/04/24/qualcomm-is-cheating-on-their-snapdragon-x-elite-pro-benchmarks/,
LaSombra,0.0,40144135,[40144316],7,1713965251,QEMU 9.0 Released,story,https://wiki.qemu.org/ChangeLog/9.0,
djha-skin,0.0,40139611,,4,1713923940,Change Healthcare Finally Admits It Paid Ransomware Hackers,story,https://www.wired.com/story/change-healthcare-admits-it-paid-ransomware-hackers/,
praisewhitey,66.0,40145078,"[40146050, 40145730, 40145398, 40145556, 40147053, 40146406, 40146957, 40145630, 40146920, 40147168, 40146901, 40146259]",40,1713970368,"A morning with the Rabbit R1: a fun, funky, unfinished AI gadget",story,https://www.theverge.com/24138746/rabbit-r1-hands-on-ai-gadget-chatgpt,
jyunwai,59.0,40143621,"[40153782, 40157224, 40156975, 40157663, 40157684, 40157641, 40157434, 40157613, 40157037, 40157189, 40154386, 40157322, 40157381, 40157199, 40158173]",20,1713962183,The AI Revolution Is Crushing Thousands of Languages,story,https://www.theatlantic.com/technology/archive/2024/04/generative-ai-low-resource-languages/678042/,
PaulHoule,3.0,40151048,"[40151370, 40152255, 40152256, 40151228]",8,1714000331,Why there are 861 roguelike deckbuilders on Steam all of a sudden,story,https://arstechnica.com/gaming/2024/04/why-there-are-861-roguelike-deckbuilders-on-steam-all-of-a-sudden/,
lleb97a,0.0,40144200,[40144293],5,1713965645,"Thermonator, the Flame-Throwing Robot Dog, Can Now Be Yours for $9,420",story,https://gizmodo.com/thermonator-the-flame-throwing-robot-dog-can-now-be-y-1851429292,
datadrivenangel,56.0,40157279,"[40159941, 40159769, 40159893, 40159799, 40159118, 40168485, 40158897, 40160237, 40160458, 40162712, 40160314, 40160117, 40159852, 40161381, 40159355, 40157570, 40157549, 40160296, 40159686, 40160160, 40157539, 40159808, 40160058, 40160182]",45,1714051608,Ask HN: How do I stop political SMS spam?,story,,"I&#x27;m getting like 10 sms texts a day for the previous owner of my phone number, who hasn&#x27;t had the number in a long time. Is there a way to stop this? I tried responding to opt out a few times but just kept getting new texts from new numbers."
moelf,91.0,40142667,"[40143570, 40148265, 40143624, 40143183, 40143107, 40143088, 40143033, 40142755, 40143117, 40143607, 40143220, 40143121, 40150831, 40145722, 40143116, 40143048, 40143941, 40144816, 40143082, 40151385, 40142835, 40143051]",68,1713954619,Windows 11 Start menu ads are now rolling out to everyone,story,https://www.theverge.com/2024/4/24/24138949/microsoft-windows-11-start-menu-ads-recommendations-setting-disable,
hnrc,5.0,40149136,"[40149412, 40150318, 40151358, 40151494, 40167661, 40150368]",360,1713990286,"IBM to Acquire HashiCorp, Inc for $6.4 billion",story,https://newsroom.ibm.com/2024-04-24-IBM-to-Acquire-HashiCorp-Inc-Creating-a-Comprehensive-End-to-End-Hybrid-Cloud-Platform,
mike-the-brain,1.0,40136979,"[40137322, 40137187, 40137264]",16,1713904712,Phi-3: Redefining what's possible with SLMs,story,https://azure.microsoft.com/en-us/blog/introducing-phi-3-redefining-whats-possible-with-slms/,
HieronymusBosch,106.0,40142570,"[40143402, 40143003, 40142596, 40143599, 40143155, 40143401, 40143317, 40145301, 40143557, 40143103, 40143494, 40143701, 40143451, 40143412, 40143370, 40143441, 40144489, 40145595, 40142713, 40143961, 40143838, 40143086, 40143471]",83,1713953596,'Expensive' Streaming Services Are a Key Reason for Americans to 'Pirate',story,https://torrentfreak.com/expensive-streaming-services-are-a-key-reason-for-americans-to-pirate-240424/,
isomorph,0.0,40137138,[40137336],8,1713905636,"Ex-Post Office boss sought 'non-emotive words' for Horizon bugs, inquiry hears",story,https://www.theguardian.com/uk-news/2024/apr/23/ex-post-office-boss-paula-vennells-searched-for-non-emotive-words-to-describe-horizon-bugs-inquiry-hears,
leonagano,1.0,40151022,"[40151051, 40151271]",5,1714000226,List of founders and companies rejected by YC,story,https://docs.google.com/spreadsheets/d/1D9f6tf8ZwVEEaWg3GXDy8aKH_gA--4IZG1JaMWGh8z0/edit?usp=sharing,
lionix,0.0,40148007,[40148150],20,1713984005,Node 22.0.0 Just Released,story,https://github.com/nodejs/node/releases/tag/v22.0.0,
sarimkx,5.0,40145213,"[40145498, 40145674]",16,1713971028,Fisker Plans More Layoffs and Bankruptcy Looms,story,https://techcrunch.com/2024/04/23/fisker-more-layoffs-bankruptcy-ocean-suv/,
speckx,0.0,40144580,[40145925],10,1713967683,We Built a Database of Prison Commissary Prices,story,https://theappeal.org/locked-in-priced-out-commissary-database-methodology/,
helloplanets,71.0,40141667,"[40142770, 40142305, 40142329, 40144812, 40142264, 40142397, 40141681, 40142391, 40142318, 40142480, 40142424, 40142579, 40142340]",46,1713943927,US Senate passes TikTok divestment-or-ban bill,story,https://www.reuters.com/world/us/senators-hope-tiktok-will-remain-business-us-under-new-owner-2024-04-23/,
nathan_phoenix,10.0,40137671,"[40139033, 40141101, 40138109, 40141750, 40138137]",18,1713908491,Framework won't be just a laptop company anymore,story,https://www.theverge.com/2024/4/23/24138475/framework-laptop-product-categories-new,
nanomonkey,0.0,40137493,[40137962],12,1713907544,Hoot: Scheme to WebAssembly,story,https://spritely.institute/hoot/,
rntn,0.0,40147943,[40148695],22,1713983492,New evidence refutes Pentagon account of attack as US withdrew from Afghanistan,story,https://www.cnn.com/2024/04/24/world/new-evidence-challenges-pentagon-account-kabul-airport-attack-intl/index.html,
jenthoven,0.0,40137172,[40137310],6,1713905866,Adobe Launches Firefly Image 3 Model,story,https://blog.adobe.com/en/publish/2024/04/23/adobe-advances-creative-ideation-with-new-firefly-image-3-model,
rntn,15.0,40142258,"[40142759, 40142368, 40142487, 40143058, 40143912, 40142695, 40143112, 40142309, 40142347]",48,1713950599,"If Britain is so bothered by China, why do .gov.uk sites use Chinese ad brokers?",story,https://www.theregister.com/2024/04/24/ads_on_gov_uk_websites/,
appplication,8.0,40136702,"[40137011, 40137029, 40137121, 40136948, 40137019]",63,1713903116,U.S. bans noncompete agreements for nearly all jobs,story,https://www.npr.org/2024/04/23/1246655366/ftc-bans-noncompete-agreements-lina-khan,
pvitz,1.0,40136645,"[40137591, 40136954]",8,1713902778,Trolling IBM's Quantum Processor Advantage with a Commodore 64,story,https://hackaday.com/2024/04/20/trolling-ibms-quantum-processor-advantage-with-a-commodore-64/,
