by,descendants,id,kids,score,time,title,type,url,text
fagnerbrack,117.0,40280490,"[40281373, 40282571, 40282731, 40280816, 40281131, 40281358, 40280697, 40280806, 40280888, 40281159, 40280854, 40280892, 40280808, 40280906, 40282484, 40282586, 40281226, 40280777, 40281858, 40281585, 40281731, 40280936, 40280800, 40280964, 40280722, 40280527]",305,1715036614,Caniemail.com – like caniuse but for email content,story,https://www.caniemail.com/,
dsr_,125.0,40279632,"[40281267, 40279798, 40279843, 40280070, 40280243, 40280348, 40280260, 40280314, 40282528, 40279746, 40281016, 40280284, 40282351, 40279995, 40279924, 40280359, 40279748, 40279804, 40282458, 40279907, 40280982, 40279841]",242,1715030395,Attackers can decloak routing-based VPNs,story,https://www.leviathansecurity.com/blog/tunnelvision,
BerislavLopac,13.0,40273534,"[40282727, 40282843, 40282508, 40282703, 40282617, 40282489]",40,1714996465,Design docs at Google,story,https://www.industrialempathy.com/posts/design-docs-at-google/,
SirLJ,9.0,40264091,"[40282681, 40282675, 40282763, 40282752, 40282587, 40282557]",31,1714909220,A book Stanley Kubrick didn’t want anyone to read is being published,story,https://www.theguardian.com/film/2024/apr/21/stanley-kubrick-director-book-block-flaws-films-published,
jpjacobpadilla,5.0,40281139,"[40282650, 40282472, 40282739, 40282453]",66,1715043011,How Python asyncio works: recreating it from scratch,story,https://jacobpadilla.com/articles/recreating-asyncio,
LeoPanthera,51.0,40279305,"[40280733, 40282340, 40280409, 40281911, 40281166, 40279809, 40281185, 40282640, 40282123, 40280956, 40280469, 40279734, 40280775, 40279929, 40280529, 40280792]",136,1715028357,TOTP Authenticator for PalmOS,story,https://www.nkorth.com/palm/apps/#totp-authenticator,
anandbaburajan,163.0,40277547,"[40279625, 40278846, 40278615, 40278633, 40278787, 40280076, 40279328, 40279818, 40278748, 40282770, 40279882, 40279241, 40278852, 40279299, 40281848, 40282673, 40280185, 40281088, 40279728, 40281856, 40281065, 40279695, 40281077, 40279853, 40279117, 40278725, 40278790, 40278528, 40278540, 40279721, 40279865, 40282442, 40281361, 40278650, 40278673, 40280646, 40281782, 40279694, 40278611, 40279941, 40280203, 40278491, 40279177, 40278738, 40280063, 40280611, 40278933, 40278602, 40278625, 40279604, 40280778, 40278845, 40281390, 40278496, 40279714, 40278494, 40278583, 40278740, 40279015]",355,1715018579,The best way to have complex discussions?,story,https://cq2.co/blog/the-best-way-to-have-complex-discussions,
rsc,1.0,40273968,"[40273986, 40273969]",23,1714999422,Secure Randomness in Go 1.22,story,https://go.dev/blog/chacha8rand?hn=1,
st_goliath,64.0,40277469,"[40278184, 40278016, 40278227, 40280475, 40277868, 40278888, 40278099, 40278113, 40281385, 40279626, 40278242, 40281258, 40280405, 40278519, 40278236, 40279264]",206,1715018259,Results of the Grand C++ Error Explosion Competition (2014),story,https://tgceec.tumblr.com/post/74534916370/results-of-the-grand-c-error-explosion,
PaulHoule,8.0,40280875,"[40281148, 40281754, 40282120, 40281190, 40281151, 40281692]",47,1715040104,Faster XML Stream Processing in Go (2019),story,https://eli.thegreenplace.net/2019/faster-xml-stream-processing-in-go/,
ingve,59.0,40263109,"[40281614, 40282005, 40281496, 40282219, 40281289, 40281501, 40281322, 40281979, 40282346]",155,1714896493,A 100x speedup with unsafe Python,story,https://yosefk.com/blog/a-100x-speedup-with-unsafe-python.html,
mooreds,4.0,40281314,"[40282592, 40282567]",26,1715045170,Utilities for refactoring and upgrading Ruby code based on ASTs,story,https://github.com/baweaver/refactor,
farslan,45.0,40265904,"[40277291, 40278857, 40280867, 40278660, 40276779, 40269963, 40278297, 40277504, 40281370, 40276805, 40279361, 40280427, 40280716, 40277867, 40280471]",181,1714925394,Visiting the annual Braun collectors fair,story,https://arslan.io/2024/05/05/braun-borse-2024/,
melvinroest,4.0,40269911,[40269916],7,1714955079,Array.shift Optimizations in Firefox's JavaScript Engine (2020),story,https://lannonbr.com/blog/2020-01-27-shift-optimizations/,
gulced,48.0,40281272,"[40281887, 40282622, 40282653, 40282818, 40281850, 40281500, 40281872, 40281578, 40281457]",87,1715044699,Boeing Starliner's first crewed mission scrubbed,story,https://techcrunch.com/2024/05/06/boeing-starliners-first-crewed-mission-scrubbed/,
taubek,4.0,40282290,"[40282811, 40282693]",24,1715055553,Google begins enforcement of site reputation abuse policy,story,https://searchengineland.com/google-begins-enforcement-of-site-reputation-abuse-policy-with-portions-of-sites-being-delisted-440294,
wrongbaud,35.0,40274777,"[40275365, 40275394]",186,1715003982,PiFex: JTAG Hacking with a Raspberry Pi,story,https://voidstarsec.com/blog/jtag-pifex,
dsego,43.0,40272577,"[40278841, 40282786, 40277453, 40279437, 40282473, 40276994, 40279884, 40279848, 40279602, 40280387, 40280384, 40279253, 40274670, 40281114, 40282009, 40281962, 40279033, 40277161, 40279146, 40279074, 40282308]",130,1714985428,World Food Atlas: Discover local dishes and ingredients,story,https://www.tasteatlas.com/map,
chuckhend,2.0,40281516,"[40282697, 40282760]",11,1715047218,Kan: Kolmogorov-Arnold Networks,story,https://arxiv.org/abs/2404.19756,
tydunn,,40279464,,1,1715029231,Continue (YC S23) is hiring a founding engineer in San Francisco,job,https://www.ycombinator.com/companies/continue/jobs/smcxRnM-founding-engineer,
pohl,0.0,40277753,,5,1715019443,Async Channels for Swift Concurrency,story,https://github.com/gh123man/Async-Channels,
geox,5.0,40280161,"[40282401, 40281889, 40282205, 40282064, 40281961]",25,1715033962,How do birds flock? Research reveals previously unknown aerodynamic phenomenon,story,https://www.nyu.edu/about/news-publications/news/2024/april/how-do-birds-flock--researchers-do-the-math-to-reveal-previously.html,
pst723,71.0,40279499,"[40280378, 40280585, 40279500, 40280335, 40282734, 40281295, 40281377, 40281891, 40280719, 40282456, 40281998, 40281209, 40281441, 40281817, 40280813, 40280954, 40282485, 40281130, 40280782, 40280700, 40280703, 40281036, 40280564, 40282319, 40281943]",113,1715029434,An infinite canvas for code exploration,story,https://territory.dev,
saisrirampur,33.0,40276768,"[40282531, 40279867, 40278248, 40282105, 40281835, 40279272, 40279001, 40280846, 40277854, 40276783]",136,1715014842,"Show HN: Peerdb Streams – Simple, native Postgres change data capture",story,,"Hello HN, I am Sai Srirampur, one of the Co-founders of PeerDB. (<a href=""https:&#x2F;&#x2F;github.com&#x2F;PeerDB-io&#x2F;peerdb"">https:&#x2F;&#x2F;github.com&#x2F;PeerDB-io&#x2F;peerdb</a>). We spent the past 7 months building a solid experience to replicate data from Postgres to data warehouses. Now we&#x27;re expanding to queues.<p>PeerDB Streams provides a simple and native way to replicate changes as they happen in Postgres to Queues (Kafka, Redpanda, Google PubSub, etc). We use Postgres logical decoding to enable Change Data Capture (CDC).<p>Blog post here: <a href=""https:&#x2F;&#x2F;blog.peerdb.io&#x2F;peerdb-streams-simple-native-postgres-change-data-capture"">https:&#x2F;&#x2F;blog.peerdb.io&#x2F;peerdb-streams-simple-native-postgres...</a>. 10-min quickstart here: <a href=""https:&#x2F;&#x2F;docs.peerdb.io&#x2F;quickstart&#x2F;streams-quickstart"">https:&#x2F;&#x2F;docs.peerdb.io&#x2F;quickstart&#x2F;streams-quickstart</a>.<p>We chose queues as many users found that existing tools are complex. Debezium is the most used tool for this use-case. It has large production usage. However, a common pain point among our users is that it has a significant learning curve taking months to productionize.<p>A few issues are: a) Interacting through a command line interface, understanding the various settings, and learning best practices for running it in production is not trivial. Debezium UI, released to address usability concerns [1], is still in an incubating state [2]. Additionally, reading Debezium resources to get started can be overwhelming [3]. 
b) Supporting data formats and transformations isn’t easy. It needs a Java project, building JAR packages and setting up a runtime path on the kafka connect plugin. c)Debezium is not as native as Kafka for other queues and doesn’t offer the same level of configurability. For example, with Event Hubs, it is difficult to stream to topics spread across namespaces and subscriptions.<p>TL;DR Debezium aims to provide a comprehensive experience for engineers to implement CDC rather than making it dead simple for them. So you can do a lot with Debezium but need to know a lot about it.<p>At PeerDB, we are building a simple yet comprehensive experience for Postgres CDC. The goal is to enable engineers to build prod-grade Postgres CDC with a minimal learning curve, within a few days.<p>PeerDB’s feature-set isn&#x27;t at Debezium&#x27;s level yet, and as we evolve, we might face similar challenges. However, we&#x27;re putting usability at the forefront and we believe that we can achieve the above goal.<p>First, PeerDB offers a simple UI to set up Postgres and Kafka by creating PEERs and initiating CDC by creating a MIRROR. Through the UI, users can monitor the progress of CDC, including throughput and latency; set up alerts to Slack&#x2F;Email based on replication slot growth; investigate Postgres-native metrics, including slot size, etc. Here is a demo showing of PeerDB UI in action:<p><a href=""https:&#x2F;&#x2F;www.loom.com&#x2F;share&#x2F;ebcfb7646a1e48738835853b760e5d04"" rel=""nofollow"">https:&#x2F;&#x2F;www.loom.com&#x2F;share&#x2F;ebcfb7646a1e48738835853b760e5d04</a><p>Second, for users who prefer a CLI, we provide a Postgres-compatible SQL layer to manage CDC. This offers the same level of features as the UI and is more intuitive compared to bash scripts.<p>Third, users can perform row-level transformations using Lua scripts executed at runtime. This enables features such as encrypting&#x2F;masking PII data, supporting various data formats (JSON, MsgPack, Protobuf, etc.), and more. We offer a script editor along with a bunch of useful templates [5].<p>Fourth, we provide native connectors to non-Kafka targets. We also provide native configurability options tailored to these platforms. For example, with Event Hubs, users can perform CDC to topics distributed across different namespaces and subscriptions [4].<p>Finally, We are laser focused on Postgres, enabling specific optimizations like native metrics for replication, wait-events, and # of connections. Features like faster initial loads through parallel snapshotting and decoding transactions in-flight are in private beta.<p>Our hope is to provide the best data-movement experience for Postgres. PeerDB Streams is another step in that direction. We would love to get your feedback on product experience, our thesis and anything else that comes to your mind. It would be super useful for us. Thank you!<p>References:<p>[1] <a href=""https:&#x2F;&#x2F;debezium.io&#x2F;blog&#x2F;2020&#x2F;10&#x2F;22&#x2F;towards-debezium-ui&#x2F;"" rel=""nofollow"">https:&#x2F;&#x2F;debezium.io&#x2F;blog&#x2F;2020&#x2F;10&#x2F;22&#x2F;towards-debezium-ui&#x2F;</a>
[2] <a href=""https:&#x2F;&#x2F;debezium.io&#x2F;documentation&#x2F;reference&#x2F;stable&#x2F;operations&#x2F;debezium-ui.html"" rel=""nofollow"">https:&#x2F;&#x2F;debezium.io&#x2F;documentation&#x2F;reference&#x2F;stable&#x2F;operation...</a>
[3] <a href=""https:&#x2F;&#x2F;medium.com&#x2F;@cooper.wolfe&#x2F;i-hated-debezium-so-much-i-did-it-myself-b43b0efc20a9"" rel=""nofollow"">https:&#x2F;&#x2F;medium.com&#x2F;@cooper.wolfe&#x2F;i-hated-debezium-so-much-i-...</a>
[4] <a href=""https:&#x2F;&#x2F;blog.peerdb.io&#x2F;enterprise-grade-replication-from-postgres-to-azure-event-hubs"">https:&#x2F;&#x2F;blog.peerdb.io&#x2F;enterprise-grade-replication-from-pos...</a>
[5] <a href=""https:&#x2F;&#x2F;github.com&#x2F;PeerDB-io&#x2F;examples"">https:&#x2F;&#x2F;github.com&#x2F;PeerDB-io&#x2F;examples</a>
[5] <a href=""https:&#x2F;&#x2F;app.peerdb.cloud"" rel=""nofollow"">https:&#x2F;&#x2F;app.peerdb.cloud</a>
[6] <a href=""https:&#x2F;&#x2F;github.com&#x2F;PeerDB-io&#x2F;PeerDB"">https:&#x2F;&#x2F;github.com&#x2F;PeerDB-io&#x2F;PeerDB</a>"
prismatic,3.0,40262289,"[40282589, 40282619, 40264875]",30,1714883984,Frank Stella has died,story,https://www.nytimes.com/2024/05/04/arts/frank-stella-dead.html,
dnetesn,8.0,40281340,"[40282540, 40282848, 40282370, 40282747, 40281918, 40282392, 40282091, 40282413]",65,1715045543,New black hole visualization takes viewers beyond the brink,story,https://phys.org/news/2024-05-black-hole-visualization-viewers-brink.html,
alex_young,1.0,40281936,[40281950],30,1715051117,"Spacecraft Takes Close Up Video of the Sun, Revealing Otherworldly Hellscape",story,https://futurism.com/the-byte/spacecraft-close-up-video-sun,
speckx,25.0,40276442,"[40277775, 40276833, 40280929, 40278067]",91,1715012869,Spending an afternoon in the Sizewell control-room simulator,story,https://www.bentasker.co.uk/posts/blog/general/an-afternoon-in-sizewell-b-control-room-simulator.html,
rglullis,155.0,40272186,"[40277284, 40282523, 40273817, 40280735, 40281363, 40277495, 40282767, 40277792, 40274435, 40273677, 40281195, 40275714, 40279158, 40282404, 40274455, 40273809, 40273781, 40280072, 40278702, 40274812, 40277231, 40279844, 40274799, 40274338, 40273852, 40279987, 40281495, 40278232, 40274615, 40275221, 40279052, 40276453, 40275311, 40279955, 40282606, 40278623, 40273757, 40274310, 40279276, 40273858, 40281686, 40279796, 40281109, 40274913, 40278007, 40274306, 40274195, 40274074, 40274242]",214,1714981192,A useful productivity measure?,story,https://www.jamesshore.com/v2/blog/2024/a-useful-productivity-measure,
refset,6.0,40275997,"[40278736, 40276030, 40282238, 40281039]",120,1715010489,Clojure: Managing throughput with virtual threads,story,https://andersmurphy.com/2024/05/06/clojure-managing-throughput-with-virtual-threads.html,
xk3,28.0,40275973,"[40278095, 40276970, 40280636, 40278750, 40279833, 40278036, 40279836, 40278047]",96,1715010350,Nukefix: Simulating your nuclear weapons program,story,http://www.nukefix.org/nukepix.html,
gulced,89.0,40280689,"[40281795, 40281474, 40281629, 40281453, 40281467, 40282834, 40281447, 40282254, 40281222, 40282128, 40281212, 40281452, 40282014, 40281917]",120,1715038498,Proton Mail discloses user data leading to arrest in Spain,story,https://restoreprivacy.com/protonmail-discloses-user-data-leading-to-arrest-in-spain/,
ryebread777,114.0,40273470,"[40279932, 40274854, 40276042, 40274625, 40280557, 40282475, 40274930, 40282326, 40278086, 40281381, 40281251, 40276261, 40275583, 40275868, 40274549, 40279704, 40280269, 40274753, 40278889, 40274603, 40278534, 40274787, 40281246, 40280109, 40274747, 40275404, 40281589, 40279140, 40278913, 40274701, 40278023, 40274547, 40274476, 40278526, 40278079, 40275280, 40280544, 40274573, 40274902, 40275202]",365,1714995761,Show HN: A free site to explore and discover 6k plants,story,https://www.getanyplant.com/plants,"I’ve loved keeping plants since I was a kid. But the online world of plants can be confusing - strange vocabulary, plants going by conflicting names, and hundreds of niche websites. I wanted to create a site that would organize all of this info and make it easier to explore and discover new plants. That’s why I created GetAnyPlant, which aggregates and matches plants from dozens of online stores. It includes huge amounts of data on these plants along with filters and categories to help you search. You can also save plants to your wishlist and add notes to them.<p>I’m a data scientist by profession, so probably 80% of the work was totally new to me. I built v1 using wordpress , v2 using django, and v3 I pivoted to using react and next js for frontend.<p>I would greatly appreciate any feedback on the site as well as any advice on how to grow it."
omgwtfusb,10.0,40273180,[40279483],71,1714992648,Color Concepts 101 (2001) [pdf],story,https://developers.hp.com/system/files/Color_Concepts_101_0.pdf,
bookofjoe,9.0,40276399,"[40279666, 40281756]",47,1715012649,Quantum gravity gets a new test,story,https://physics.aps.org/articles/v17/65,
ggeorgovassilis,40.0,40262626,"[40272958, 40276008, 40271934, 40272011, 40279014, 40273025, 40276988, 40273675, 40274215, 40276732, 40271453, 40272422, 40273597]",190,1714888922,A High-Level Technical Overview of Homomorphic Encryption,story,https://www.jeremykun.com/2024/05/04/fhe-overview/,
rntn,31.0,40275759,"[40277352, 40281097, 40280228]",69,1715009070,Evaluating bias and noise induced by the U.S. Census Bureau's privacy protection,story,https://www.science.org/doi/10.1126/sciadv.adl2524,
goldenskye,24.0,40262543,"[40276222, 40273256, 40275104, 40272834, 40276946]",102,1714887771,"With PowerPC, Windows CE and the WiiN-Pad Slate, Everyone's a WiiN-Er",story,http://oldvcr.blogspot.com/2024/05/with-powerpc-windows-ce-and-wiin-pad.html,
breck,15.0,40280967,"[40282829, 40282801, 40282806, 40281510, 40281524, 40280981]",29,1715041056,"Apple Is Developing AI Chips for Data Centers, Seeking Edge in Arms Race",story,https://www.wsj.com/tech/ai/apple-is-developing-ai-chips-for-data-centers-seeking-edge-in-arms-race-0bedd2b2,
pmzy,356.0,40274158,"[40279698, 40275049, 40282857, 40275455, 40275440, 40275230, 40275653, 40281172, 40280452, 40282246, 40280655, 40275366, 40281561, 40280637, 40280781, 40281257, 40277605, 40275712, 40278679, 40280659, 40280223, 40280012, 40275402, 40278488, 40277822, 40280993, 40275500, 40275112, 40275278, 40278273, 40280421, 40275533, 40280680, 40280069, 40276348, 40275683, 40280787, 40274919, 40277711]",186,1715000646,How I think about debt,story,https://collabfund.com/blog/how-i-think-about-debt/,
ramboldio,73.0,40276714,"[40277974, 40277143, 40278226, 40279636, 40279424, 40277531, 40278112, 40280104, 40277833, 40278827, 40279164, 40276896, 40278418]",189,1715014568,German public broadcasters open source their streaming platforms,story,https://www.heise.de/en/news/ARD-und-ZDF-wollen-ihren-Streaming-Code-als-Open-Source-anbieten-9709177.html,
breck,2.0,40280747,"[40282380, 40282154]",7,1715039096,QUAMELEON: QUAntum Materials Engineering using eLEctrOmagNetic fields,story,https://www.darpa.mil/ARC/QUAMELEON,
mp187,2.0,40266635,"[40281763, 40267372]",45,1714930836,Stereogram Tutorial (2020),story,https://www.ime.usp.br/~otuyama/stereogram/basic/index.html,
PaulHoule,41.0,40279823,"[40280398, 40281119, 40281536, 40280961, 40280383, 40280210, 40282574]",73,1715031762,More than 100 arrested in Spain in $900k WhatsApp scheme,story,https://therecord.media/spain-arrests-whatsapp-impersonation-scams,
jseliger,1.0,40280008,[40282737],5,1715032840,"Stock Buybacks, Demystified",story,https://www.md-a.co/p/stock-buybacks-demystified,
PaulHoule,1.0,40281315,[40282794],15,1715045177,PCI-Sig Completes CopprLink Cabling Standard: PCIe 5.0 and 6.0 Get Wired,story,https://www.anandtech.com/show/21379/pcisig-completes-copprlink-cabling-standard-pcie-50-60-get-wired,
grugagag,0.0,40281878,,10,1715050566,I'm Getting Renovicted [video],story,https://www.youtube.com/watch?v=0baWAsCu6uk,
belter,289.0,40273651,"[40277479, 40277426, 40277832, 40277882, 40278075, 40278635, 40278438, 40277116, 40277990, 40280754, 40278092, 40278585, 40277245, 40278194, 40277796, 40281303, 40278578, 40278162, 40278799, 40278048, 40278605, 40277676, 40278300, 40278522, 40279456, 40277781, 40277826, 40278256, 40277431, 40278167, 40278760]",246,1714997134,Alternative clouds are booming as companies seek cheaper access to GPUs,story,https://techcrunch.com/2024/05/05/coreweaves-1-1b-raise-shows-the-market-for-alternative-clouds-is-booming/,
zaldih,16.0,40264194,"[40277766, 40279754, 40276916]",52,1714910461,A bug that spoke Russian and crashed my app,story,https://imzaldih.com/en/post/bug-spoke-russian-crashed-app/,
jfil,0.0,40281807,,13,1715049858,Beyond Peace and Quiet – A Craving for the Hermit's Life,story,https://www.theguardian.com/lifeandstyle/2008/nov/08/sara-maitland-silence-addiction,
mucle6,80.0,40277933,"[40279273, 40279148, 40282780, 40279045, 40282842, 40281398, 40279466, 40279581, 40279034, 40281810, 40278733, 40280803, 40280820, 40278885, 40279382, 40278312, 40281718, 40279561, 40279505, 40280984, 40279279, 40282011, 40279566, 40278808, 40279360, 40279570, 40279303, 40280184, 40279392, 40280027, 40279494, 40280909, 40282222, 40279274, 40281633, 40279468, 40279255, 40278854, 40279130, 40278680, 40279268, 40282103, 40279359, 40279533, 40279535, 40279577, 40277942, 40280220, 40279007]",97,1715020413,Ask HN: What nonfiction books do you keep rereading?,story,,"I find myself rereading Antifragile, Black Swan, Lean Startup, and $100M Offers<p>All of them have significantly shaped my worldview, and I&#x27;d love to know HN&#x27;s favorite nonfiction books"
josh-sematic,13.0,40266922,"[40280779, 40281050, 40281024, 40280033, 40280913]",27,1714932777,Understanding UMAP (2019),story,https://pair-code.github.io/understanding-umap/,
cebert,32.0,40261267,"[40277405, 40277073, 40276403, 40278871, 40280613, 40278404, 40279556, 40276815, 40277865, 40280343, 40279719]",69,1714866837,Project AZORIAN,story,https://www.cia.gov/legacy/museum/exhibit/project-azorian/,
ezekg,203.0,40274662,"[40276096, 40274967, 40274911, 40275781, 40275115, 40275954, 40275006, 40274957, 40275972, 40276701, 40275754, 40277618, 40275492, 40275678, 40274893, 40277205, 40276446, 40279338, 40277905, 40275160, 40275387, 40275052, 40275323, 40280583, 40274920, 40276394, 40280928, 40279493, 40275333, 40275281, 40276004, 40276512, 40276523, 40276661, 40275735, 40276958, 40275622, 40275692, 40276504, 40275229, 40275165, 40276256, 40275631, 40276130, 40275693, 40275980]",336,1715003410,A fourteen-day free trial ain’t gonna cut it,story,https://keygen.sh/blog/your-14-day-free-trial-aint-gonna-cut-it/,
gulced,5.0,40281321,"[40282812, 40282713, 40282344, 40282211, 40281678]",13,1715045256,Fortran popularity rises with numerical and scientific computing,story,https://www.infoworld.com/article/3715346/fortran-popularity-rises-with-numerical-and-scientific-computing.html#tk.rss_all,
mathgenius,0.0,40278439,,13,1715023088,The Clowder Project: an online resource for category theory and mathematics,story,https://www.clowderproject.com/,
RodgerTheGreat,1.0,40279129,[40282026],8,1715027349,Lila: A Lil Interpreter in Posix Awk,story,https://beyondloom.com/blog/lila.html,
medo-bear,0.0,40279813,,7,1715031693,High Performance Array Programming in Lisp,story,https://zenodo.org/records/11062314,
_emacsomancer_,79.0,40270586,"[40271602, 40271786, 40271578, 40271529, 40272664, 40271422, 40271370, 40271801, 40272613, 40271177, 40272567, 40271939, 40271859, 40271103, 40275892, 40271800, 40272937, 40272384, 40272821, 40273929, 40272389, 40280091, 40279295]",395,1714962426,Remnants of a legendary typeface have been rescued from the Thames,story,https://news.artnet.com/art-world/doves-typeface-2454807,
gulced,3.0,40280320,"[40282660, 40282416, 40281592]",22,1715035183,Research finds e-cigarette content on Instagram is marketed to teens,story,https://medicalxpress.com/news/2024-05-cigarette-content-instagram-violates-policies.html,
ckcheng,112.0,40270219,"[40275255, 40276542, 40281072, 40273847, 40274595, 40273414, 40280528, 40272064, 40275556, 40274488, 40274788, 40275820, 40275733, 40279370, 40272996, 40273072, 40272720, 40276124, 40280531, 40276618, 40271504, 40274132, 40275106, 40274083, 40272963]",311,1714958186,BlackHole: macOS Audio Loopback Driver,story,https://github.com/ExistentialAudio/BlackHole,
ignored,40.0,40261014,"[40267122, 40267417, 40267065, 40268085, 40268705, 40267302, 40267494, 40267630, 40268323, 40274069, 40267616, 40282390, 40268880]",44,1714863899,What makes a translation great?,story,https://scroll.in/article/876969/what-makes-a-translation-great-ten-literary-translators-from-across-the-world-weigh-in,
contingencies,6.0,40280253,"[40282872, 40280294, 40280512, 40281101, 40281406]",46,1715034669,Teens who discovered new way to prove Pythagoras' theorem uncover more proofs,story,https://www.theguardian.com/us-news/article/2024/may/06/pythagoras-theorem-proof-new-orleans-teens,
belter,8.0,40278391,"[40280617, 40281576, 40280325]",44,1715022830,FAA opens probe into Boeing 787: 'Employees may have falsified aircraft records',story,https://www.seattletimes.com/business/boeing-aerospace/faa-opens-new-investigation-into-boeing-787-wing-to-body-join-work/,
_Microft,53.0,40266015,"[40267458, 40267233, 40267890, 40274529, 40273238, 40267484, 40266625, 40266876]",186,1714926093,ESP32-S3 has a few SIMD instructions,story,https://bitbanksoftware.blogspot.com/2024/01/surprise-esp32-s3-has-few-simd.html,
alex_young,1.0,40281913,[40282107],6,1715050934,The Transamerica Pyramid's renovation is underway. We got a peek from the top,story,https://sfstandard.com/2024/05/06/transamerica-pyramid-renovation-beacon/,
NegativeLatency,0.0,40277581,,10,1715018699,Volcanoes and Us (2015) [video],story,https://www.youtube.com/watch?v=GlNhaAV5NZ4,
ingve,10.0,40263042,"[40278719, 40277514]",68,1714895146,The VGA Attribute Controller Is Weird,story,http://www.os2museum.com/wp/learn-something-old-every-day-part-x-the-vga-attribute-controller-is-weird/,
mooreds,193.0,40281274,"[40281352, 40281378, 40281498, 40282149, 40281823, 40281626, 40281423, 40281366, 40281526, 40282126, 40282291, 40282247, 40282245, 40281710, 40281523, 40281514, 40281387, 40281389, 40281503, 40281703, 40282337, 40281853, 40281436, 40281621]",213,1715044714,"Vets fret as private equity snaps up clinics, pet care companies",story,https://stateline.org/2024/03/29/vets-fret-as-private-equity-snaps-up-clinics-pet-care-companies/,
leonardtang,5.0,40276550,"[40279757, 40276721, 40279240]",16,1715013630,Thorn in a HaizeStack test for evaluating long-context adversarial robustness,story,https://github.com/haizelabs/thorn-in-haizestack,
