by,descendants,id,kids,score,time,title,type,url,text
elijahbenizzy,10.0,40235944,"[40244558, 40237169, 40237525, 40244753, 40249414]",40,1714656159,"Show HN: Hamilton's UI – observability, lineage, and catalog for data pipelines",story,https://github.com/DAGWorks-Inc/hamilton/tree/main/ui,"Hey HN – Stefan and Elijah here from DAGWorks (<a href=""http:&#x2F;&#x2F;dagworks.io&#x2F;"">http:&#x2F;&#x2F;dagworks.io&#x2F;</a>, YC W23).<p>If you don’t remember us from our previous HN launch (<a href=""https:&#x2F;&#x2F;news.ycombinator.com&#x2F;item?id=35056903"">https:&#x2F;&#x2F;news.ycombinator.com&#x2F;item?id=35056903</a>), we’re the authors of Hamilton (<a href=""https:&#x2F;&#x2F;github.com&#x2F;dagworks-inc&#x2F;hamilton"">https:&#x2F;&#x2F;github.com&#x2F;dagworks-inc&#x2F;hamilton</a>), an open-source library for building self-documenting, modular dataflows in python that works for data, ML, LLM pipelines, &amp; even web-workflows.<p>We’ve been developing this UI for a while and we’re excited to say we open-sourced it! It comes out of the box with the following capabilities, and only requires a single line code change to get:<p>1. Execution + metadata capture, e.g. automatic code profiling<p>2. Data&#x2F;artifact observability, e.g. summary statistics over dataframes, pydantic objects, etc...<p>3. Lineage &amp; provenance of data, e.g. quickly see what is upstream &amp; downstream of code&#x2F;data.<p>4. Asset&#x2F;transform catalog, e.g. search &amp; find if feature transforms&#x2F;metrics&#x2F;datasets&#x2F;models exist and where they’re used.<p>While the UI currently only self-populates for Hamilton dataflows, we’re looking to expand to other frameworks (we’d love your feedback!).<p>Check out the following video for an overview: <a href=""https:&#x2F;&#x2F;www.youtube.com&#x2F;watch?v=0VIVSeN7Ij8"" rel=""nofollow"">https:&#x2F;&#x2F;www.youtube.com&#x2F;watch?v=0VIVSeN7Ij8</a>, as well as the documentation: <a href=""https:&#x2F;&#x2F;hamilton.dagworks.io&#x2F;en&#x2F;latest&#x2F;concepts&#x2F;ui&#x2F;"">https:&#x2F;&#x2F;hamilton.dagworks.io&#x2F;en&#x2F;latest&#x2F;concepts&#x2F;ui&#x2F;</a>.<p>We’re looking for feedback&#x2F;adopters – feel free to reach out if you have any questions!"
jseliger,20.0,40258187,"[40261659, 40262064, 40260537, 40260644, 40258582, 40261580, 40260856, 40260941, 40261042]",14,1714835028,You May Soon Be Drinking Synthetic Coffee,story,https://www.wsj.com/arts-culture/food-cooking/ynthetic-coffee-chocolate-climate-change-bfa9cce3,
thunderbong,1.0,40248795,[40249078],10,1714750097,The Internet Is Like a City (But Not in the Way You'd Think),story,https://novum.substack.com/p/the-internet-is-like-a-city,
dangle1,27.0,40260881,"[40261020, 40261243, 40261564, 40261100, 40261135, 40261242, 40261470, 40261572, 40260979, 40261277]",47,1714862364,"Multi-million dollar Cheyenne supercomputer auction ends with $480,085 bid",story,https://www.tomshardware.com/tech-industry/supercomputers/multi-million-dollar-cheyenne-supercomputer-auction-ends-with-480085-bid,
dvolkhonskiy,31.0,40237375,"[40240376, 40239348, 40237609, 40240165, 40239965, 40240294, 40241868, 40239782, 40240247, 40240528, 40243757]",49,1714663804,Show HN: I built a 100% free startup idea generator,story,https://supalaunch.com/tools/startup-idea-generator,
Tomte,56.0,40237745,"[40239098, 40238029, 40238257, 40238436, 40239823, 40239088, 40239391, 40239020, 40240615, 40240114, 40238891, 40243688, 40238221, 40239911, 40238873, 40239770, 40239884, 40240546, 40239564, 40240105, 40238245, 40240167, 40239876, 40239786, 40241770, 40238545, 40241971]",366,1714665643,Online Cryptography Course (2017),story,https://crypto.stanford.edu/~dabo/courses/OnlineCrypto/,
tankfeeder,1.0,40246818,[40252576],32,1714738686,Dte – Text Editor,story,https://craigbarnes.gitlab.io/dte/,
snats,0.0,40259005,,11,1714843152,Curse of Dimensionality,story,https://en.wikipedia.org/wiki/Curse_of_dimensionality,
altilunium,0.0,40244729,,6,1714717463,Map Machine,story,https://github.com/enzet/map-machine,
molli,15.0,40246445,"[40247850, 40248359, 40255602]",18,1714735805,Show HN: ScriX – Chrome extension summarizing speech into bullet points,story,https://chromewebstore.google.com/detail/scrix-audio-to-text-trans/aapbilffnkjhifbaejfmcjjcpdpadjfm,
e2e4,154.0,40241525,"[40242332, 40241878, 40243153, 40242137, 40243461, 40241838, 40242209, 40253761, 40242313, 40242803, 40246783, 40243746, 40242828, 40243196, 40243371, 40241973, 40243036, 40242671, 40243267, 40245646, 40242856, 40244233, 40243271, 40246835, 40243069, 40243059, 40243307, 40241765, 40246661, 40241747]",235,1714685082,They thought they were joining an accelerator – instead they lost their startups,story,https://techcrunch.com/2024/05/02/they-thought-they-were-joining-an-accelerator-instead-they-lost-their-startups/,
ethanholt1,41.0,40245363,"[40258685, 40250597, 40245551, 40262336, 40247677, 40247530, 40249710, 40261877, 40254482, 40255263, 40255800, 40247505, 40252814, 40247721, 40248608, 40252567, 40255359]",56,1714723870,Windows 10 share increases while Windows 11 share decreases,story,https://www.pcmag.com/news/yikes-windows-10-sees-uptick-as-windows-11-share-decreases,
zdw,59.0,40237984,"[40239553, 40240210, 40239666, 40240958, 40240326, 40241094, 40239492, 40239586, 40240219, 40240990, 40240406, 40241825, 40240619, 40239501, 40240694, 40241403, 40239503, 40239524]",74,1714666745,"Longevity of Recordable CDs, DVDs and Blu-Rays (2020)",story,https://www.canada.ca/en/conservation-institute/services/conservation-preservation-publications/canadian-conservation-institute-notes/longevity-recordable-cds-dvds.html,
abetusk,28.0,40241057,"[40242377, 40243830, 40242459, 40253016, 40243171, 40246977, 40250560, 40242635, 40248872]",75,1714681879,Hobby's algorithm for aesthetic Bézier splines,story,https://www.jakelow.com/blog/hobby-curves,
rntn,1.0,40249601,[40249665],37,1714754436,"Court Supports NY's Requiring $15 Broadband for Poor, to Big Telecom's Horror",story,https://www.techdirt.com/2024/05/03/court-supports-ny-states-quest-to-require-15-broadband-for-poor-people-much-to-big-telecoms-horror/,
chapulin,30.0,40238788,"[40243987, 40240368, 40245539, 40243732, 40241406, 40241190]",65,1714670503,Pleasure or pain? He maps the neural circuits that decide,story,https://www.quantamagazine.org/pleasure-or-pain-he-maps-the-neural-circuits-that-decide-20240416/,
ankitg12,56.0,40246398,"[40247274, 40248579, 40247099, 40247225, 40246843, 40246812, 40249175, 40248845, 40247229]",119,1714735422,How to Make More Money Renting a GPU Than Nvidia Makes Selling It,story,https://www.nextplatform.com/2024/05/02/how-to-make-more-money-renting-a-gpu-than-nvidia-makes-selling-it/,
PaulHoule,20.0,40241694,"[40242219, 40242304, 40246029]",183,1714686264,"TSMC Jumps into Silicon Photonics, Lays Out Roadmap for 12.8 Tbps Interconnect",story,https://www.anandtech.com/show/21373/tsmc-adds-silicon-photonics-coupe-roadmap-128tbps-on-package,
someotherperson,15.0,40254080,"[40255220, 40257472, 40254608, 40256738, 40255799, 40255823, 40255142, 40260880, 40259921, 40256470]",90,1714786232,My secret life as an 11-year-old BBS sysop (2022),story,https://arstechnica.com/information-technology/2022/12/my-secret-life-as-an-11-year-old-bbs-sysop/,
sohkamyung,37.0,40245348,"[40247273, 40246789, 40246954, 40256350, 40247014, 40247872, 40246702, 40246846]",98,1714723699,"I can fix this PC, boss, but I'll need to play games for hours to do it",story,https://www.theregister.com/2024/05/03/on_call/,
fagnerbrack,21.0,40248530,"[40252861, 40250337, 40252964, 40262948, 40250197, 40252647, 40250131, 40253145, 40253422, 40252351, 40253710]",124,1714748826,What You Need to Know about Modern CSS (Spring 2024 Edition),story,https://frontendmasters.com/blog/what-you-need-to-know-about-modern-css-spring-2024-edition/,
internetter,20.0,40253514,"[40254297, 40254292, 40254326, 40257803, 40255108, 40256162, 40257123]",63,1714779627,"Bountysource Stole at Least $17,000 from Open Source Developers",story,https://boehs.org/node/bountysource,
dshipper,72.0,40248514,"[40249388, 40249675, 40250133, 40249425, 40250002, 40249924, 40251140, 40249935, 40250937, 40256827, 40250300, 40249167, 40249408, 40250945, 40249616, 40249654, 40249421, 40255070, 40250159, 40250246, 40250265, 40254210, 40249353]",130,1714748759,I Spent 24 Hours with GitHub Copilot Workspaces,story,https://every.to/chain-of-thought/i-spent-24-hours-with-github-copilot-workspaces,
eldar_ciki,4.0,40241544,"[40251491, 40256181, 40249091]",46,1714685264,"Show HN: Panza: A personal email assistant, trained and running on-device",story,https://github.com/IST-DASLab/PanzaMail,"Tired of crafting well-polished emails and wish you had an assistant to take over the hard work while mimicking your writing style? Introducing Panza, a personalized LLM email assistant that runs entirely on your device! Choose between Llama-3 or Mistral, tailor it to your unique style, and let it write the emails for you. Take a look at our demo and give it a try on your emails at: <a href=""https:&#x2F;&#x2F;github.com&#x2F;IST-DASLab&#x2F;PanzaMail"">https:&#x2F;&#x2F;github.com&#x2F;IST-DASLab&#x2F;PanzaMail</a><p>Some technical details about Panza:<p>- Panza is an automated email assistant customized to your writing style and past email history.<p>- Panza produces a fine-tuned LLM that matches your writing style, pairing it with a Retrieval-Augmented Generation (RAG) component which helps it produce relevant emails.<p>- Panza *can be trained and run entirely locally*. Currently, it requires a single GPU with 16-24 GiB of memory, but we also plan to release a CPU-only version.<p>- Training and execution are also quick - for a dataset on the order of 1000 emails, training Panza takes well under an hour, and generating a new email takes a few seconds at most."
walterbell,23.0,40240948,"[40242646, 40241675, 40241411, 40245107, 40242595, 40241580, 40241635, 40250047]",57,1714681183,Desert greening is transforming dust and sand into farmable soil (2023),story,https://www.freethink.com/energy/desertification-desert-greening,
m_c,191.0,40240737,"[40241249, 40241402, 40241235, 40241141, 40241804, 40243759, 40241279, 40241060, 40243288, 40243435, 40245404, 40243054, 40241879, 40241297, 40244884, 40241191, 40241286, 40243848, 40241148, 40245220, 40241984, 40242122, 40245458, 40241478]",263,1714679759,"Got an old Raspberry Pi spare? Try RISC OS. It is, something else",story,https://www.theregister.com/2024/05/02/rool_530_is_here/,
MiguelX413,95.0,40252525,"[40253155, 40252840, 40253921, 40254801, 40252884, 40253282, 40253649, 40253035, 40254735, 40258089, 40252720, 40252570, 40253371, 40254267, 40254335, 40254400, 40255869, 40253248, 40254599, 40253608, 40252632, 40253119, 40252728, 40252630]",181,1714771257,Discord Applying Forced Arbitration - opt-out before it is too late!,story,https://bsky.app/profile/silverwuffamute.bsky.social/post/3kqbd476nvk2i,
thunderbong,51.0,40238170,"[40239620, 40239819, 40239939, 40239855, 40239400, 40242008, 40240292]",114,1714667675,Rust: Box Is a Unique Type,story,https://blog.nilstrieb.dev/posts/box-is-a-unique-type/,
coloneltcb,301.0,40250056,"[40252212, 40251683, 40252205, 40252463, 40254154, 40253669, 40251864, 40252138, 40252773, 40253318, 40251992, 40252341, 40251677, 40253636, 40252941, 40258845, 40253898, 40251778, 40252229, 40252166, 40253708, 40253953, 40251661, 40252365, 40252182, 40252489, 40251440, 40253878, 40251719, 40252083, 40253312]",431,1714757126,"As private equity dominates wheelchair market, users wait months for repairs",story,https://www.statnews.com/2024/05/01/wheelchair-repair-delay-numotion-national-seating-mobility/,
Deeg9rie9usi,9.0,40241002,"[40241794, 40243765, 40241819, 40241763]",51,1714681532,Pseudo Graceful Process Termination Through Code Injection,story,https://sigma-star.at/blog/2024/02/exit0-code-injection/,
zmccormick7,22.0,40237546,"[40241283, 40240860, 40240628, 40240983, 40240842, 40241766, 40240784, 40245210, 40251364]",69,1714664691,Show HN: SpRAG – Open-source RAG implementation for challenging real-world tasks,story,https://github.com/SuperpoweredAI/spRAG,"Hey HN, I’m Zach from Superpowered AI (YC S22). We’ve been working in the RAG space for a little over a year now, and we’ve recently decided to open-source all of our core retrieval tech.<p>spRAG is a retrieval system that’s designed to handle complex real-world queries over dense text, like legal documents and financial reports. As far as we know, it produces the most accurate and reliable results of any RAG system for these kinds of tasks. For example, on FinanceBench, which is an especially challenging open-book financial question answering benchmark, spRAG gets 83% of questions correct, compared to 19% for the vanilla RAG baseline (which uses Chroma + OpenAI Ada embeddings + LangChain).<p>You can find more info about how it works and how to use it in the project’s README. We’re also very open to contributions. We especially need contributions around integrations (i.e. adding support for more vector DBs, embedding models, etc.) and around evaluation."
signor_bosco,0.0,40260971,"[40262118, 40261011]",5,1714863369,Exploring the enigma of database vacuuming,story,https://dineshgowda.com/posts/exploring-the-enigma-of-database-vacuuming/,
CTOSian,56.0,40245463,"[40247510, 40249296, 40248978, 40250739, 40247439]",67,1714725057,Firefox Webserial Addon,story,https://github.com/kuba2k2/firefox-webserial,
victorstanciu,164.0,40255209,"[40255573, 40255665, 40256109, 40255457, 40256202, 40255729, 40255753, 40255780, 40256220, 40255368, 40255528, 40255467, 40256508, 40255811, 40256233, 40256376, 40256669, 40256655, 40256586, 40260104, 40255500, 40256117, 40256997, 40257019, 40255834, 40258618, 40255530, 40256368, 40255756, 40256936, 40256138, 40256196, 40256630, 40255538]",214,1714801816,A love letter to bicycle maintenance and repair,story,https://tegowerk.eu/posts/bicycle-repair/,
rolph,10.0,40243015,"[40246710, 40243558]",48,1714698632,Collapsing Sheets of Spacetime Could Explain Dark Matter and Why Universe 'Hums',story,https://www.scientificamerican.com/article/collapsing-sheets-of-spacetime-could-explain-dark-matter-and-why-the/,
pseudolus,2.0,40234342,[40243919],28,1714642915,Hacker free-for-all fights for control of home and office routers everywhere,story,https://arstechnica.com/security/2024/05/hacker-free-for-all-fights-for-control-of-home-and-office-routers-everywhere/,
zh2408,2.0,40248744,[40249297],9,1714749854,Show HN: An open-source tool that semantically profiles your data using LLMs,story,https://github.com/Cocoon-Data-Transformation/cocoon,"The problem we solve is profiling tables: this is the initial step where you need to understand the table and identify any anomalies.<p>During the process, many small decisions require semantic understanding. For example, missing values are normal for &#x27;deathdate&#x27; (still alive) but abnormal for &#x27;name.&#x27; For outliers, 100 for ages is fine, but some are -1, which is impossible! We use LLMs to semantically understand your tables and detect anomalies.<p>You can try it by uploading a CSV, and we will email back the profile: <a href=""https:&#x2F;&#x2F;cocoon-data-transformation.github.io&#x2F;page&#x2F;"" rel=""nofollow"">https:&#x2F;&#x2F;cocoon-data-transformation.github.io&#x2F;page&#x2F;</a><p>Let me know your feedback. Thanks!"
TMWNN,110.0,40253831,"[40254179, 40254227, 40254539, 40254386, 40254099, 40257364, 40254345, 40253893, 40255953, 40254411, 40254459, 40253833, 40253997, 40254119]",113,1714782765,"Value of one of S.F.'s biggest buildings plunges by 80% after Uber, Block leave",story,https://www.sfchronicle.com/sf/article/s-f-office-building-value-19438429.php,
agiacalone,28.0,40239336,"[40241036, 40241380, 40241653, 40240070, 40240478, 40249056, 40243578, 40242887, 40240098]",79,1714672830,Pet parrots prefer live video-calls,story,https://phys.org/news/2024-05-pet-parrots-video-pre-videos.html,
consultnyc,6.0,40253559,"[40259972, 40254424, 40261751]",8,1714780117,Ask HN: How to Set Consulting Rate?,story,,"I found a niche in New York and consult in the hospitality sector with a focus on the hospitality industry. I have a full-time job, but picked up two consulting gigs with a recurring income totaling about half my post-tax W2 income from my full-time job. I&#x27;m struggling to set my &quot;consulting&quot; rate. How do other consultants set their rate on here?"
andreareina,4.0,40243417,"[40243718, 40244904, 40245202]",44,1714703500,Found: The dial in the brain that controls the immune system,story,https://www.nature.com/articles/d41586-024-01259-2,
DeathArrow,9.0,40257420,"[40257965, 40258113, 40257645, 40257844]",38,1714828413,StarCoder2-Instruct: Transparent Self-Alignment for Code Generation,story,https://github.com/bigcode-project/starcoder2-self-align,
moigagoo,7.0,40239716,"[40262809, 40239851, 40248272, 40239832]",15,1714674205,Show HN: Anonymous chat service with no registration or installation required,story,https://cannon-chat.online,"Cannon is a chat service created to mimic physical conversions. Like in real life, there is no chat history or account setup.<p>If you want to test the service, feel free to message me: <a href=""https:&#x2F;&#x2F;app.cannon-chat.online&#x2F;#&#x2F;newcontact?deviceId=neatly-blackened-liassaurus-4367&amp;displayName=moigagoo"" rel=""nofollow"">https:&#x2F;&#x2F;app.cannon-chat.online&#x2F;#&#x2F;newcontact?deviceId=neatly-...</a>"
jnnnthnn,67.0,40238509,"[40238986, 40239439, 40241070, 40239867, 40242516, 40241048, 40262545, 40239040, 40239328, 40239298, 40239416, 40241470, 40240279, 40239894, 40238849, 40241477, 40242397, 40244152, 40238894, 40242319, 40241151, 40241638, 40244926, 40239752, 40252696]",227,1714669260,Show HN: Hacker Search – A semantic search engine for Hacker News,story,https://hackersearch.net,"Hi HN!<p>I&#x27;m Jonathan and I built Hacker Search (<a href=""https:&#x2F;&#x2F;hackersearch.net"" rel=""nofollow"">https:&#x2F;&#x2F;hackersearch.net</a>), a semantic search engine for Hacker News. Type a keyword or a description of what you&#x27;re interested in, and you&#x27;ll get top links from HN surfaced to you along with brief summaries.<p>Unlike HN&#x27;s otherwise very valuable search feature, Hacker Search doesn&#x27;t require you to get your keywords exactly right. That&#x27;s achieved by leveraging OpenAI&#x27;s latest embedding models alongside more traditional indexes extracted from the scraped and cleaned up contents of the links.<p>I think there are many more interesting things one could build atop the HN dataset in the age of LLMs (e.g. more explicitly searching for technical opinions, recommending stories to you based on your interests, and making the core search feature more useful). If any of those sound interesting to you, head over to <a href=""https:&#x2F;&#x2F;hackersearch.net&#x2F;signup"" rel=""nofollow"">https:&#x2F;&#x2F;hackersearch.net&#x2F;signup</a> to get notified when I launch them!<p>Note: at least one person has built something similar before (<a href=""https:&#x2F;&#x2F;news.ycombinator.com&#x2F;item?id=36391655"">https:&#x2F;&#x2F;news.ycombinator.com&#x2F;item?id=36391655</a>). Funnily enough, I only found out about this through my own implementation, and I based on my testing, I think Hacker Search generally performs better when doing keyword&#x2F;sentence searches (vs. whole document similarity lookup), thanks to the way the data is indexed."
mofosyne,3.0,40261359,"[40262161, 40262416, 40264144, 40261459]",18,1714867790,TIL: You can open man or info pages in Firefox by man:<page> or info:<page>,story,,"Turns out in firefox, they added a feature on their latest browser at least where you can open man or info pages in firefox simply by typing in  `man:&lt;page&gt;` or `info:&lt;page&gt;`<p>Try typing `man:ls` for instance. I tried it on chrome as well, but this seems to be a firefox only feature."
zdw,8.0,40253245,"[40256354, 40260905, 40255555, 40255662, 40256658]",51,1714776862,How the Kindness of Sega Saved Nvidia from Going Under,story,https://www.timeextension.com/features/flashback-how-the-kindness-of-sega-saved-nvidia-from-going-under,
toomuchtodo,162.0,40250226,"[40251655, 40252126, 40251962, 40251369, 40251117, 40251581, 40251357, 40253941, 40252902, 40253449, 40251595, 40251005, 40250965, 40251458, 40250913, 40251252]",245,1714757999,Evidence of price-fixing in the oil industry?,story,https://www.thebignewsletter.com/p/an-oil-price-fixing-conspiracy-caused,
delichon,0.0,40264737,[40265403],19,1714915652,"Hey Claude: ""Garlic Bread""",story,https://twitter.com/emollick/status/1786763802047816157,
thelastgallon,8.0,40253973,"[40254035, 40256805, 40259587, 40255305, 40257451, 40254933]",19,1714784778,Electric 10000 ton container ship has begun service with over 50MWh in batteries,story,https://electrek.co/2024/05/02/fully-electric-10000-ton-container-ship-begun-service50000-kwh-batteries/,
wjb3,521.0,40243238,"[40244730, 40244103, 40243543, 40243700, 40243497, 40244086, 40243949, 40243489, 40243875, 40243864, 40244340, 40249209, 40244013, 40244146, 40244094, 40245825, 40244695, 40252612, 40243911, 40243968, 40243585, 40254673, 40245796, 40244011, 40255038, 40243913, 40243772, 40247669, 40244008, 40246370, 40243486, 40243824, 40244046, 40243682, 40243916, 40249241, 40243675, 40243760, 40245269]",476,1714701501,"Cardio fitness is a strong, consistent predictor of morbidity and mortality",story,https://bjsm.bmj.com/content/58/10/556,
rntn,4.0,40246642,"[40247711, 40246674, 40249528]",27,1714737359,Is There Language in Section 230 That Could Enable Adversarial Interoperability?,story,https://www.techdirt.com/2024/05/02/was-there-a-trojan-horse-hidden-in-section-230-all-along-that-could-enable-adversarial-interoperability/,
sandebert,3.0,40239412,"[40239448, 40243006, 40241647]",44,1714673066,Orangutan seen treating wound with medicinal herb in first for wild animals,story,https://www.theguardian.com/science/article/2024/may/02/orangutan-seen-treating-wound-with-medicinal-herb-in-first-for-wild-animals-max-planck-institute-sumatra,
gnabgib,19.0,40239955,"[40241042, 40240750, 40240810, 40241430, 40245523, 40242651, 40250310, 40240391]",49,1714675458,Asteroid that broke up over Berlin was fastest-spinning one ever seen,story,https://www.newscientist.com/article/2428473-asteroid-that-broke-up-over-berlin-was-fastest-spinning-one-ever-seen/,
TangerineDream,93.0,40235968,"[40238231, 40236785, 40236946, 40239123, 40237483, 40242479, 40241329, 40238978, 40237482, 40237031, 40238680, 40243783, 40240352, 40243703, 40236963, 40245624, 40239646, 40240395]",243,1714656344,Backblaze Drive Stats for Q1 2024,story,https://www.backblaze.com/blog/backblaze-drive-stats-for-q1-2024/,
vitplister,3.0,40242450,"[40253273, 40244156, 40252874]",9,1714692251,Sudon't,story,https://dotat.at/@/2024-05-02-sudo.html,
gnabgib,65.0,40253868,"[40254734, 40254274, 40254315, 40254648, 40254323, 40256705, 40256415, 40254448, 40256753, 40254341]",85,1714783383,How much time should you spend sitting versus standing?,story,https://theconversation.com/how-much-time-should-you-spend-sitting-versus-standing-new-research-reveals-the-perfect-mix-for-optimal-health-228894,
microflash,0.0,40251477,,8,1714765157,Content Standards in Design Systems,story,https://www.nngroup.com/articles/content-design-systems/,
ilamont,0.0,40251745,,10,1714766477,"Huawei Secretly Backs US Research, Awarding Millions in Prizes",story,https://www.bloomberg.com/news/articles/2024-05-02/huawei-secretly-backs-us-based-research-with-millions-in-prizes-through-dc-group,
wofo,1.0,40244909,"[40261856, 40261760]",7,1714719158,Foray into Fourier,story,https://roughly-understood.com/posts/foray-into-fourier/,
sousmx,23.0,40241677,"[40244864, 40242669, 40245409]",43,1714686156,Psilocybin Effective as Antidepressant,story,https://neurosciencenews.com/psilocybin-antidepressant-26021/,
dnetesn,220.0,40254054,"[40255065, 40257932, 40255211, 40254965, 40255101, 40255217, 40255447, 40257813, 40256163, 40258871, 40255412, 40258019, 40255323, 40255077, 40255522, 40259102, 40257558, 40254918, 40254884, 40255960, 40257936, 40254957, 40255206, 40255749, 40259170, 40255168, 40255911, 40257685]",121,1714785915,Insects and other animals have consciousness,story,https://nautil.us/insects-and-other-animals-have-consciousness-571584/,
wenfengwang,12.0,40237305,"[40242178, 40263891, 40237434, 40242188]",47,1714663306,Show HN: An Open Source project for enhancing AI Agents in taking action,story,https://github.com/npi-ai/npi,
paulpauper,38.0,40242372,"[40245861, 40246878, 40249432, 40251307]",21,1714691558,Taxpayers need to know how heavy a toll they'll be paying for weight-loss drugs,story,https://chicago.suntimes.com/editorials/2024/05/01/taxpayers-weight-loss-drug-coverage-illinois-employees-pritzker-ozempic-editorial,
sujayk_33,0.0,40234228,,8,1714641419,Introduction to Vectorization,story,https://thepalindrome.org/p/an-introduction-to-vectorization,
Brajeshwar,81.0,40249876,"[40250156, 40252208, 40250329, 40251070, 40250694, 40251191, 40250823, 40252810, 40252305, 40250709, 40254672, 40252745, 40254159, 40252424, 40251239, 40250061]",76,1714755989,CO2 removal 'gap' shows countries 'lack progress' for 1.5C warming limit,story,https://www.carbonbrief.org/co2-removal-gap-shows-countries-lack-progress-for-1-5c-warming-limit/,
rntn,14.0,40249047,"[40254518, 40249132, 40254694, 40252350, 40252207, 40264633]",19,1714751438,Read Satya Nadella's Microsoft memo on putting security first,story,https://www.theverge.com/24148033/satya-nadella-microsoft-security-memo,
itunpredictable,24.0,40237826,"[40239861, 40243029, 40241082, 40239850, 40239977, 40242703, 40242614, 40245550, 40240988]",55,1714665994,Umbra: A Disk-Based System with In-Memory Performance [pdf],story,https://www.cidrdb.org/cidr2020/papers/p29-neumann-cidr20.pdf,
