by,descendants,id,kids,score,text,time,title,type,url
rntn,0.0,40043103,,30,,1713200780,"Ocean heat driving global coral bleaching event, possibly the worst on record",story,https://www.cnn.com/2024/04/15/climate/global-coral-reef-mass-bleaching-climate-hnk-intl/index.html
jiripospisil,3.0,40033335,"[40038618, 40040557, 40033482]",10,,1713120292,Pikatea – Long Boi – Extra Long Keyboard Kit,story,https://www.pikatea.com/products/long-boi
wawayanda,56.0,40036104,"[40039702, 40037181, 40038852, 40036960, 40036754, 40038215, 40042701, 40037195, 40038718, 40036889, 40037162, 40041393, 40040630]",71,,1713143749,RocketStar tests fusion-enhanced in-space propulsion process,story,https://www.aerospacetestinginternational.com/news/space/rocketstar-tests-fusion-enhanced-in-space-propulsion-process.html
turtleyacht,0.0,40033270,,11,,1713119803,Practical Unix Manuals: mdoc (2014),story,https://manpages.bsd.lv/
Petiver,34.0,40020775,"[40033238, 40033017, 40039584, 40035100, 40032027, 40032663, 40033373, 40032921, 40033881]",60,,1712986682,When Nostalgia Was Deadly,story,https://www.historytoday.com/archive/history-matters/when-nostalgia-was-deadly
nickthegreek,33.0,40044187,"[40045301, 40044950, 40045180]",46,,1713206694,Judge halts Texas probe into Media Matters' reporting on X,story,https://arstechnica.com/tech-policy/2024/04/judge-halts-texas-probe-into-media-matters-reporting-on-x/
Brajeshwar,197.0,40022651,"[40024277, 40030482, 40023875, 40028218, 40030723, 40029587, 40024421, 40024137, 40028315, 40023781, 40027320, 40023614, 40026389, 40023670, 40029250, 40027131, 40023669, 40023913, 40023584, 40023747, 40024413, 40030879, 40026374, 40023662, 40032024, 40033309, 40023677, 40026249, 40024016, 40024082, 40027068, 40028371, 40023622, 40027684, 40033821, 40029104, 40023589, 40023802, 40029344, 40023940, 40032981, 40040215]",167,,1713010645,Research into why some people have a better sense of direction,story,https://knowablemagazine.org/content/article/society/2024/why-do-some-people-always-get-lost-but-others-dont
redbell,39.0,40035084,"[40035746, 40035455, 40035686, 40035560, 40035530, 40041226, 40036346, 40036718, 40036089, 40037426, 40036717, 40036725, 40036096]",58,,1713133983,Swatch Internet Time,story,https://en.wikipedia.org/wiki/Swatch_Internet_Time
nsoonhui,16.0,40020702,"[40030233, 40032799, 40031721, 40029045, 40032331, 40029841]",97,,1712985478,How do machines ‘grok’ data?,story,https://www.quantamagazine.org/how-do-machines-grok-data-20240412/
mpweiher,43.0,40021545,"[40030654, 40030861, 40030805, 40030640, 40031590, 40030762, 40030718, 40030503, 40030493, 40030752]",64,,1712997876,Experience report: It will never work in theory,story,https://www.computer.org/csdl/magazine/so/5555/01/10424425/1Ulj1Qa8tJ6
nikolai_tarasov,7.0,40036784,"[40048353, 40044175, 40043706, 40036980]",4,"Hi there! I recently launched my iOS development agency with a subscription model, inspired by DesignJoy founder Brett Williams. My agency is among the first in the US (or in Texas, or in Dallas ;)) to offer iOS development services on a month-to-month basis. The subscription is flexible, allowing for pauses or cancellations at any time. With 10 years of experience in software development and success as a consultant for Fortune 500 companies, I aim to leverage my expertise to help startups and other companies elevate their iOS development.",1713151458,Show HN: Solo founder launched iOS Development Agency as a Subscription,story,https://www.swiftapplab.com/
drpixie,57.0,40030188,"[40035272, 40030189, 40035499, 40035575, 40035565, 40035568, 40035853, 40034269]",88,,1713091384,Linux fu: getting started with systemd,story,https://hackaday.com/2024/04/11/linux-fu-getting-started-with-systemd/
cmpit,33.0,40037583,"[40038478, 40040870, 40039365, 40044502, 40042980, 40039230, 40044591]",63,,1713162605,Challenging software projects some programmers should try,story,https://www.andreinc.net/2024/03/28/programming-projects-ideas
alexmolas,74.0,40022628,"[40023413, 40023903, 40023991, 40034436, 40024897, 40031077, 40028157, 40028426, 40024138]",130,,1713010344,Shape typing in Python,story,https://jameshfisher.com/2024/04/12/shape-typing-in-python/
creer,11.0,40037898,"[40043141, 40042543, 40038732, 40037937]",14,,1713167003,Builder's remedy was supposed to 'Manhattanize' the Bay Area,story,https://www.mercurynews.com/2024/04/14/builders-remedy-was-supposed-to-manhattanize-the-bay-area-so-where-are-all-the-houses/
ulrischa,29.0,40033039,"[40035213, 40035392, 40035762, 40033863, 40033946, 40036051, 40035537, 40036455, 40033666, 40036344, 40037392, 40034394, 40035571, 40034862]",137,,1713118003,Phanpy: A minimalistic opinionated Mastodon web client,story,https://phanpy.social
aragonite,0.0,40047330,,3,,1713229029,"Kansas couple sues MaxMind for turning their life into a ""digital hell"" (2016)",story,https://arstechnica.com/tech-policy/2016/08/kansas-couple-sues-ip-mapping-firm-for-turning-their-life-into-a-digital-hell/
bpierre,1.0,40043595,[40043798],4,,1713203473,From Vim to Zed,story,https://registerspill.thorstenball.com/p/from-vim-to-zed
ewild,38.0,40023657,"[40025490, 40023701, 40026673, 40025801, 40025604, 40028866, 40030959, 40025599, 40025164, 40032320]",135,"This is a small project i made years ago and updated to whisper last year, i still use it from time to time and thought it might be useful to others, or just put the idea out there for someone better than me to make a better implementation!",1713021474,Show HN: CTRL-F for YouTube Videos,story,https://github.com/Evan-Wildenhain/CTRL-F-VIDEO
stacktrust,18.0,40020398,"[40028917, 40030792, 40029085, 40029050, 40030027, 40020821, 40029019, 40029097, 40030144, 40029852]",48,,1712981147,Wall Mounted Can Organizer (2019),story,https://www.ana-white.com/woodworking-projects/wall-mounted-can-organizer
tosh,6.0,40045396,"[40046414, 40046399, 40046303, 40046298, 40046288]",46,,1713214275,Apple Did a Dry Run of APFS on Your Device Even Before iOS 10.3 (2017),story,https://www.macobserver.com/analysis/apple-dry-run-apfs-prior-ios-10-3/
thunderbong,1.0,40032649,[40037416],12,,1713115163,The argument against clearing the database between tests,story,https://calpaterson.com/against-database-teardown.html
goranmoomin,46.0,40043888,"[40044310, 40044757, 40044300, 40044381, 40044290, 40044648, 40044535, 40044691, 40044822, 40044773, 40044582, 40044701, 40044686, 40044516, 40044842]",85,,1713204991,Apple's APFS Migration: A Feat of Engineering,story,https://registerspill.thorstenball.com/p/a-feat-of-engineering
HaoZeke,10.0,40035584,"[40037591, 40035643, 40037784, 40039604]",92,,1713138690,x86 and x86_64 software optimization resources,story,https://agner.org/optimize/
moose44,33.0,40041784,"[40042421, 40042238, 40041972, 40042446, 40042382, 40042258, 40044298, 40042043, 40041988, 40042888]",115,,1713194588,US House approves FISA renewal – warrantless surveillance and all,story,https://www.theregister.com/2024/04/15/security_in_brief/
gone35,21.0,40025362,"[40025837, 40032561, 40029279, 40028513, 40028829, 40028914, 40025563, 40029908, 40029311]",102,,1713036549,The Stacks Project: A Wikipedia of algebraic geometry (2022),story,https://news.columbia.edu/news/stacks-project-johan-dejong
atomicnature,0.0,40032352,,6,,1713112662,The Wrath of Rickover,story,https://ussrickover.org/rcl-william-toti/
blending,40.0,40018630,"[40028298, 40025024, 40024712, 40018633, 40024231, 40024165, 40025457, 40024328, 40042795, 40024920, 40024676, 40043317]",50,,1712963954,The Reconstruction of Ulysses S Grant (2017),story,https://www.damninteresting.com/the-reconstruction-of-ulysses-s-grant/
redbell,97.0,40030721,"[40032944, 40031377, 40032518, 40031569, 40032001, 40031159, 40031645, 40034021, 40031044, 40041868, 40032558, 40035139, 40032096, 40034741, 40034517, 40033700, 40030985, 40034366, 40031613, 40030924, 40033893, 40033753, 40032623, 40031624, 40032490, 40031899]",148,,1713098718,The Guide to Stock Options Conversations,story,https://zaidesanton.substack.com/p/the-guide-to-stock-options-conversations
jbegley,8.0,40035842,"[40039980, 40037813, 40042358, 40042004, 40038399]",19,,1713141306,America's Next Soldiers Will Be Machines,story,https://foreignpolicy.com/2024/04/06/us-army-military-robots-soldiers-technology-testing-war/
popol12,0.0,40038738,,16,,1713177470,Albino Redwood,story,https://en.wikipedia.org/wiki/Albino_redwood
transpute,6.0,40036101,"[40039419, 40046717, 40038985]",14,,1713143720,APFS Migration: A Feat of Engineering,story,https://registerspill.thorstenball.com/p/a-feat-of-engineering
rntn,26.0,40031305,"[40032529, 40033724, 40032447, 40035433, 40032691]",105,,1713104950,Algae that can fix nitrogen – thanks to a tiny cell structure,story,https://www.nature.com/articles/d41586-024-01046-z
oleg_tarasov,27.0,40017176,"[40021421, 40037079, 40021266, 40024249, 40021986, 40023115, 40023163, 40021246, 40021059]",115,,1712952959,DIY Wi-Fi thermostat from scratch with ESPHome and Home Assistant,story,https://olegtarasov.me/opentherm-thermostat-esphome/
CharlesW,0.0,40033845,,32,,1713124173,How macOS opens a file in the correct app,story,https://eclecticlight.co/2024/04/10/how-macos-opens-a-file-in-the-correct-app/
impish9208,246.0,40031365,"[40031430, 40031625, 40032005, 40035540, 40031738, 40036127, 40031684, 40036692, 40040700, 40036481, 40031699, 40035136, 40031566, 40031504, 40031621, 40031593, 40031596, 40031703, 40036522]",146,,1713105325,A day in the life of a Walmart manager,story,https://www.wsj.com/business/retail/a-day-in-the-life-of-a-walmart-manager-who-makes-240-000-a-year-3248037f
m-ahmed,489.0,40025261,"[40025499, 40028760, 40025795, 40030473, 40025624, 40028958, 40025361, 40027215, 40025483, 40028401, 40025502, 40025429, 40028222, 40025424, 40025736, 40035712, 40026266, 40028860, 40029302, 40030364, 40025592, 40027004, 40025423, 40031379, 40026902, 40028220, 40036424, 40033306, 40027062, 40025455, 40026916, 40025603, 40026957, 40042627, 40025492, 40029109, 40032071, 40029824, 40025609, 40025687, 40028963, 40028993, 40026643, 40030894, 40027814, 40028216, 40025554, 40026135, 40025963, 40028972, 40026705, 40025476, 40026126, 40025608, 40025484, 40025411, 40026962, 40032399, 40031047, 40030390, 40029237, 40030536, 40030505, 40033370, 40030651, 40028110, 40027899, 40028293, 40026647, 40038990, 40030367, 40028322]",608,,1713035439,The darker side of being a doctor,story,https://drericlevi.substack.com/p/the-darker-side-of-being-a-doctor
Terretta,47.0,40034411,"[40034715, 40035951, 40034915, 40034561, 40034774, 40034760, 40035462]",83,,1713128298,Senate Commerce Committee chair Maria Cantwell upended privacy bills for years,story,https://www.washingtonpost.com/technology/2024/04/13/congress-maria-cantwell-online-privacy/
martyvis,26.0,40022586,"[40024064, 40023252, 40027158, 40023603, 40023166, 40029519, 40025662, 40024949, 40027047, 40023118, 40023983, 40024861, 40025271, 40023754, 40027219, 40026757, 40024666, 40023116]",92,,1713009831,15 Note Poly Tempo Pendulum [video],story,https://www.youtube.com/watch?v=lTwg4mFF32E
PaulHoule,14.0,40044940,"[40045062, 40045132, 40045079, 40045175, 40045151]",32,,1713211166,An old rail track in Northern California could become a 300-mile hiking trail,story,https://www.latimes.com/environment/story/2024-04-06/northern-california-rail-track-could-become-hiking-trail
skeptrune,87.0,40024393,"[40027959, 40026814, 40027128, 40037099, 40028479, 40028744, 40027132, 40026950, 40028415, 40028078, 40027618, 40034168, 40026756, 40026675, 40027505]",115,,1713027723,OpenBSD is a cozy operating system,story,https://btxx.org/posts/OpenBSD_is_a_Cozy_Operating_System/
feynman_quantum,43.0,40036429,"[40037041, 40036704, 40038910, 40043049, 40043226, 40042819, 40042404, 40036729, 40041913, 40037539, 40043097, 40037047, 40036430]",55,,1713146979,Thermoelectric Cooling,story,https://thermoelectricsolutions.com/how-thermoelectric-cooling-works/
marban,0.0,40041273,,3,,1713192446,All Bad Bosses at Amazon Are Now Named 'Wayne',story,https://www.404media.co/bad-amazon-bosses-wayne/
yaantc,1.0,40032963,[40046728],5,,1713117487,The tiny ultrabright laser that can melt steel,story,https://spectrum.ieee.org/pcsel
jason5ng32,0.0,40030095,[40040428],14,,1713090219,Show HN: I just made an All-In-One IP Toolbox form builder open-sourced,story,https://github.com/jason5ng32/MyIP
ushakov,10.0,40025272,"[40027622, 40025450]",59,,1713035608,Today's open source models beat closed source models from 1.5 years ago,story,https://old.reddit.com/r/LocalLLaMA/comments/1c33agw/todays_open_source_models_beat_closed_source/
purplesyringa,9.0,40032792,"[40036459, 40036743, 40035648]",24,"How often do you screw up the system so much you have to reformat the disk (without losing data) to fix it? Well, sometimes I do, and sometimes I can&#x27;t be bothered to burn a live ISO onto a USB stick. There&#x27;s initramfs, but it&#x27;s hardly a pleasant environment, with network configuration and all.<p>My go-to solution has typically been to create a chroot with busybox and a few utilities in &#x2F;tmp, chroot into it, and then kill services that use the solid drive so that I can unmount it. That&#x27;s an error-prone process, and sometimes systemd itself uses disk, so you can&#x27;t unmount the drive despite killing all the userland but PID 1.<p>This script improves the UX. It uses a Docker image as the chroot base, which is much easier to tailor to your needs, and automagically commits all the atrocities, such as tearing down all the userland processes, including PID 1, and re-spawning the host system from the container filesystem.<p>It also drives libostree and Nix users mad, because it can be used to try out a new DE or even a whole OS without polluting the host filesystem or spawning a virtual machine. The video in the README shows me trying out KDE + SDDM from a host running GNOME + GDM3.",1713116285,Show HN: Docker-boot – Run a system from RAM without LiveCD,story,https://github.com/purplesyringa/docker-boot
gukov,0.0,40037279,,10,,1713158152,Mercury: The Solar System's smallest planet may once have been as large as Earth,story,https://www.bbc.com/future/article/20240410-mercury-the-solar-systems-smallest-planet-may-once-have-been-as-large-as-earth
marban,5.0,40037177,"[40042415, 40038960, 40040459, 40037924]",16,,1713156704,Apple Removes Game Boy Emulator iGBA from App Store Due to Copyright Violations,story,https://www.macrumors.com/2024/04/15/apple-removes-igba-from-app-store/
alflervag,15.0,40025148,"[40027024, 40029158, 40025149, 40028627, 40030858, 40027009, 40027010, 40028819]",58,,1713034250,"Careful with That Lock, Eugene",story,https://kaveland.no/careful-with-that-lock-eugene.html
rntn,40.0,40033465,"[40034297, 40034444, 40036929, 40037439, 40033902, 40034243, 40037809, 40033503, 40034454]",45,,1713121231,"Turning off electrical grids to prevent wildfire− a complex, technical operation",story,https://theconversation.com/colorado-is-latest-state-to-try-turning-off-the-electrical-grid-to-prevent-wildfires-a-complex-technical-operation-pioneered-in-california-227639
susam,22.0,40021782,"[40040809, 40040641, 40040703, 40041470, 40042178, 40040535, 40042029, 40042068, 40041346]",92,,1713001008,Emacs Info Expressions,story,https://susam.net/emacs-info-expressions.html
6uJYSrt8M,4.0,40032002,"[40032404, 40032905, 40032003, 40032238]",8,,1713109925,Google FeedBurner Dead?,story,https://feedburner.google.com/
nalgeon,60.0,40030308,"[40039917, 40030431, 40039666, 40043658, 40039710, 40040144, 40039779]",49,,1713093165,Travelling with Tailscale,story,https://mrkaran.dev/posts/travel-tailscale/
Turukawa,80.0,40038395,"[40039377, 40038565, 40039088, 40038783, 40038820, 40040486, 40038602, 40039491, 40038903, 40038642, 40038829, 40038920, 40038956]",59,,1713173642,'We're the last bastion of rental': video stores resisting rise of streaming,story,https://www.theguardian.com/film/2024/apr/15/uk-video-rental-shops
robertn702,412.0,40025339,"[40025741, 40025922, 40026127, 40028607, 40029529, 40025622, 40029513, 40025859, 40025652, 40026359, 40026176, 40033455, 40025675, 40026241, 40029206, 40025805, 40028739, 40026049, 40027953, 40026161, 40032681, 40025696, 40026174, 40025583, 40028514, 40028259, 40027775, 40029053, 40028885, 40029330, 40029949, 40029114, 40026200, 40025606]",358,,1713036282,Summers: Inflation Reached 18% in 2022 Using the Government's Previous Formula,story,https://www.forbes.com/sites/theapothecary/2024/03/23/summers-inflation-reached-18-in-2022-using-the-governments-previous-formula/
sagischwarz,87.0,40039450,"[40043540, 40040191, 40041012, 40040324, 40041458, 40041951, 40044346, 40040422, 40040168, 40041052, 40040164, 40040734, 40041223, 40040579, 40044681, 40040352, 40040605, 40039872, 40040445]",79,,1713182834,"Framework's software and firmware have been a mess, but it's working on them",story,https://arstechnica.com/gadgets/2024/04/frameworks-software-and-firmware-have-been-a-mess-but-its-working-on-them/
b20000,17.0,40034672,"[40036437, 40045142, 40038605, 40044486, 40035535, 40035007]",15,Any C++ devs who got off the train and went C-only to focus their skill set and spend more time on picking up other archtectural type skills instead of keeping up with the new features and standards?,1713130313,Ask HN: C++ devs who went C only,story,
logicziller,11.0,40037645,"[40048793, 40048812, 40042368, 40040135, 40044430, 40037665]",4,"I need to display an item that a user can rotate (left&#x2F;right, up&#x2F;down). I can pre-render these in Blender from every angle. Maybe if the renders are done just 10° rotated on every axis, that will do what I need.<p>Rather than doing it from scratch, I was thinking maybe some library already exists for this but I&#x27;m not sure what this is called, so I&#x27;m not able to find anything relevant. I am not looking for a STL renderer or some WebGL thing but just some JavaScript trickery.",1713163429,Best way to display photorealistic 3D in the browser?,story,
hsnice16,0.0,40031009,,5,,1713102466,"Show HN: Tech Interview Experience from Google, Microsoft, and Atlassian",story,https://techinterviewexp.site/
3v1n0,59.0,40018925,"[40018926, 40024221, 40021947, 40021720]",117,,1712966394,Ubuntu 24.04 (and Debian) removed libsystemd from SSH server dependencies,story,https://fosstodon.org/@3v1n0/112260950753323500
Tomte,23.0,40021343,"[40032483, 40033248, 40033013]",30,,1712994958,No Experience Necessary (2003),story,https://journals.sagepub.com/doi/pdf/10.2968/059002013
hggh,0.0,40037997,,4,,1713168540,Arch Linux 2024 Leader Election Results,story,https://archlinux.org/news/arch-linux-2024-leader-election-results/
jfax,78.0,40022709,"[40022964, 40025919, 40024753, 40026514, 40023320, 40028604, 40023450, 40024444, 40029777, 40024307, 40030066, 40024456, 40027412, 40029783, 40030546, 40022846, 40022934, 40024474, 40023004, 40023141]",213,,1713011274,A disgruntled federal employee's 1980s desk calendar (2018),story,https://www.theparisreview.org/blog/2018/06/13/a-disgruntled-federal-employees-1980s-desk-calendar/
ingve,16.0,40025330,"[40029696, 40030249, 40028956]",56,,1713036183,Go performance from version 1.0 to 1.22,story,https://benhoyt.com/writings/go-version-performance-2024/
mariuz,0.0,40030567,,4,,1713096613,How a microprocessor works implemented with FPGA,story,https://twitter.com/BrunoLevy01/status/1643305642147340316
vira28,0.0,40025521,,11,,1713037843,Show HN: A simple demo of Postgres wire protocol and SQLite as storage engine,story,https://github.com/viggy28/pglite
diodorus,3.0,40020818,[40029847],19,,1712987431,The Archeologists of Athens (2023),story,https://www.newyorker.com/news/annals-of-inquiry/the-hidden-archeologists-of-athens
racked,10.0,40036678,"[40037952, 40037051, 40036879, 40037015]",37,,1713149937,Frank Zappa on Crossfire about censoring rock lyrics (1986) [video],story,https://www.youtube.com/watch?v=B9856_xv8gc
anigbrowl,10.0,40042763,"[40043113, 40047474, 40044111, 40043401, 40043205, 40043362, 40043800, 40043286, 40043086, 40043088, 40042891]",36,,1713198893,The truth is paywalled but the lies are free (2020),story,https://www.currentaffairs.org/2020/08/the-truth-is-paywalled-but-the-lies-are-free/
rsingel,311.0,40024062,"[40024226, 40024230, 40024233, 40024378, 40025019, 40025285, 40024905, 40025088, 40026080, 40031538, 40024284, 40024991, 40024886, 40025644, 40028149, 40024626, 40026133, 40024234, 40024227, 40024785, 40029313, 40024801, 40028893, 40024346, 40043691, 40024320, 40024729, 40024869, 40026636, 40024812, 40024257]",427,,1713024550,The FCC needs to stop 5G fast lanes,story,https://cyberlaw.stanford.edu/blog/2024/04/harmful-5g-fast-lanes-are-coming-fcc-needs-stop-them
luu,15.0,40035225,"[40035811, 40035898, 40036843, 40035768]",80,,1713135234,Saskatoon freezing deaths,story,https://en.wikipedia.org/wiki/Saskatoon_freezing_deaths
mnemonicsloth,7.0,40035201,"[40045251, 40038121, 40046735, 40035873, 40036351, 40035740]",11,"Unix famously comes with a lot of documentation, but it&#x27;s still famously hard to learn.  Why?<p>As a teacher and cognitive scientist, the reason is interesting: Unix
documentation, starting with its man pages, is presented in a format
that makes it easy for experts to look up details, not for beginners
to learn concepts or build skills.  O&#x27;Reilly, Sam&#x27;s, APress and others
have built large businesses selling second-best solutions to this
problem.<p>This is a teaching anti-pattern that emerges when domain experts --
<i>but teaching novices</i> -- try to write a curriculum from scratch.
They don&#x27;t realize that teaching is a separate skill from the material
to be taught, and that a great deal of effort is needed to break a
domain down into right-sized, self-sufficient chunks for the reader to
consume.  Instead, they produce big volumes of unorganized knowledge
(man pages) that reflects <i>their expert-level understanding</i>, that the
reader tries to sift through and, as often as not, gives up on in
frustration.  Even when you pay experts to write beginner-friendly
books, you get separate books on bash, awk, sed, grep, regexes, files,
processes, packages and so on.  These put the onus on the reader to
remember all the details and put them all together into something
useful.<p>Having dumped all this information on you, I always get the feeling
that the gurus are patting you on the head and saying, &quot;Well, learning
is hard.  You have to work at it.  Be sure you practice enough and
you&#x27;ll figure it all out eventually.&quot;  Learning is not supposed to be
easy, and you do have to practice, but too often that attitude serves
as an excuse to stop looking for better teaching methods.<p>So I&#x27;d like to propose one here.<p>The interactive piece takes place on the user&#x27;s machine.  They clone a
git repository that contains lots of text files that they can
manipulate with complex commands, according to lessons and exercises
delivered via a web app.  The web app helps the user remember using a
technique I call graduated spaced repetition, which extends the basic
SuperMemo algorithm to test <i>concepts</i>, not just facts, with
progressively more elaborate questions.<p>All of this should be relatively simple to write.  The main
differentiator will be good instructional design which -- sorry if I
sound like a jerk here -- I have not seen much in evidence in the 20
years I&#x27;ve spent learning this material.<p>Which brings me to my questions for you:<p>1. I know a lot of people have already tried to do this.  Can you point to any existing learning tools that have really knocked it out of the park?<p>2. What text processing tasks do you consider absolutely essential to  Unix command line proficiency?<p>3. What kinds of text files (Natural language text, CSV, logfiles, etc) would it be useful to practice on to get there?  Where can I find some?<p>If you want to talk about building the training set or the
extensions I&#x27;ve made to the SuperMemo protocol, or if you just want to
spitball ideas, you can email me at $MY_HN_USERNAME@gmail.com",1713134999,Ask HN: What do you need to know to be good at the Unix Command Line?,story,
adulau,0.0,40024238,,19,,1713026232,"CLA Free Initiative, Embracing Open Source with Developer Certificate of Origin",story,https://ossbase.org/initiatives/cla-free/
conanxin,2.0,40020833,"[40033474, 40033138]",14,,1712987555,Kevin Kelly: Daddy Issues,story,https://zine.zora.co/issue/intergenerational-dynamics/kevin-kelly
oblib,11.0,40043711,"[40045249, 40045493, 40045247, 40045715, 40045483, 40045775]",23,,1713204014,Ketogenic diet may play a role in treating schizophrenia: research (2019),story,https://www.psychologytoday.com/us/blog/advancing-psychiatry/201904/chronic-schizophrenia-put-remission-without-medication
metadat,197.0,40035002,"[40037276, 40035527, 40036788, 40035387, 40036598, 40036277, 40036653, 40036445, 40037119, 40035445, 40035519, 40045761, 40036579, 40044025, 40035604, 40035051, 40035503, 40035204, 40035913, 40035485, 40035615, 40035833, 40037270, 40035638, 40036590, 40037875, 40043829, 40035587, 40036886, 40035622, 40038606, 40035557, 40035579, 40035594, 40035670, 40035672, 40038521, 40035511, 40036946, 40035621, 40036565, 40035411, 40035879, 40036205, 40035483, 40043093, 40042778, 40035474, 40036715, 40036489, 40045698, 40036906, 40039261, 40048242, 40036140, 40037406, 40036545, 40038047, 40038503, 40035371, 40035692, 40035600, 40036759, 40036970, 40035313, 40035539, 40036675, 40035832, 40036938, 40039418, 40039213, 40036593, 40035665, 40035687, 40036787, 40035478, 40035438, 40035521, 40038143, 40043869, 40035585, 40035456, 40035454, 40035413, 40035382, 40035640, 40035626, 40035443, 40036106, 40035607, 40035533]",108,"What movie changed your perception of reality or life, and how?",1713133391,Ask HN: What movies changed your perception of reality or life?,story,
nimzoLarsen,11.0,40036284,"[40044679, 40036285, 40036871, 40037201]",14,,1713145560,Paradox of Plenty,story,https://en.wikipedia.org/wiki/Resource_curse
