by,descendants,id,kids,score,time,title,type,url,text
imichael,1.0,40269930,[40278350],6,1714955285,The Management Guru Who Knows Why Nothing Works,story,https://www.bloomberg.com/opinion/articles/2024-05-05/the-forgotten-management-guru-who-knows-why-nothing-works,
kiyanwang,1.0,40266837,[40267362],14,1714932272,Cognitive Load for Knowledge Work,story,https://mattwynne.net/cognitive-load-for-knowledge-work,
hovden,0.0,40269825,,6,1714954150,Breakthrough Achieved in Nanometer-Resolution Imaging of 3D Chemistry,story,https://science.slashdot.org/story/24/05/04/2350234/breakthrough-achieved-in-nanometer-resolution-imaging-of-3d-chemistry,
rokkitmensch,199.0,40259196,"[40259493, 40259538, 40260115, 40259534, 40260224, 40259717, 40259410, 40260044, 40260610, 40267382, 40259708, 40259331, 40261173, 40261219, 40264694, 40260397, 40260619, 40259983, 40259919, 40259495, 40259628]",215,1714845173,Does the American Diabetes Association work for patients or companies?,story,https://www.theguardian.com/global/commentisfree/2024/may/02/american-diabetes-association-lawsuit,
therein,2.0,40279203,"[40279334, 40279536]",3,1715027709,"Ask HN: Got logged out, login says ""Sorry.""",story,,"I am on a residential US IP that seems to have a good reputation when I checked. As of a few days ago I got logged out and login page wouldn&#x27;t load, saying &quot;Sorry.&quot;.<p>Today frontpage started to say the same. I figured I&#x27;ll test from a different IP and even login worked.<p>Seems like the some mistake might have led to some potentially incorrect ranges getting blocked.<p>@dang, for reference, it is the IP that ends with 109.205"
shash_2708,13.0,40265051,"[40265257, 40274693, 40266308, 40267433, 40279792, 40265448, 40265613, 40265457, 40265222]",10,1714918433,Every product that you try to build is already built,story,,"Hi Guys,
Recently I was talking to my friends and it seems like all the mass consumer ideas have already been built. 
It is very hard to identify whether or not an idea is good.
But I think that for most entrepreneurs, once they think that an idea is great, they instantly start working on it.<p>But it is more heartbreaking than your girl dumping you, that someone else has already built your idea&#x2F;product.<p>Or even worse is that the product you want to build cannot be a real business.<p>That is why I have made a portal where a user has to enter their product idea and then after web scraping, a list of their competition will be generated. 
They will get an in-depth competition analysis and also a blueprint of what tech stack to use to build this, what type of challenges they might face in the particular industry(through llm) and if building this feature even possible.<p>Kindly lay on your active criticism as they are very valuable for me.<p>I know that their are static report generators online, but I also know that founders don&#x27;t have enough money to pay for it.<p>So even I might not charge for the services. Will just collect their emails and hopefully build a newsletter."
hunglee2,0.0,40276869,,4,1715015464,China's Chang'e-6 is carrying a surprise rover to the moon,story,https://spacenews.com/chinas-change-6-is-carrying-a-surprise-rover-to-the-moon/,
rbanffy,1.0,40265864,[40265878],4,1714925158,"Killer Asteroid Hunters Spot 27,500 Overlooked Space Rocks",story,https://www.nytimes.com/2024/04/30/science/killer-asteroids-algorithm.html,
mvip,13.0,40266178,"[40267342, 40267075, 40266899, 40273037, 40267874, 40268396, 40267002]",28,1714927426,My Home Server Journey – From Raspberry Pi to Ryzen,story,https://blog.viktorpetersson.com/2024/05/04/home-server-journey.html,
hudsonetkin,22.0,40261935,"[40264350, 40280914, 40262664, 40270986, 40263078, 40263110, 40262747, 40263606, 40262683, 40261975, 40262959, 40262988, 40263083, 40262860, 40263216]",12,1714877672,is AI the future of learning?,story,,What do you think the personalized AI tutor everybody gets hyped about will actually look like or do? Do we have the capability already? is it even possible?
pndy,1.0,40265365,[40270012],6,1714921167,Economy Coffin,story,https://en.wikipedia.org/wiki/Economy_coffin,
frereubu,1.0,40268553,[40269036],5,1714944213,Yorkshire apostrophe fans demand road signs with nowt taken out,story,https://www.theguardian.com/uk-news/article/2024/may/05/north-yorkshires-dropped-apostrophe-for-street-signs-upsets-residents,
Brajeshwar,1.0,40265009,[40268231],5,1714918061,Advanced 'high-density waterless hydro' energy plant gets green light,story,https://newatlas.com/energy/waterless-hydro-energy-storage-devon/,
gulced,1.0,40279991,"[40281463, 40280545, 40280162]",20,1715032721,Boeing Admits That Its Employees Falsified Aircraft Records for 787 Dreamliner,story,https://gizmodo.com/boeing-admits-employees-falsified-aircraft-records-1851459132,
Wingy,2.0,40277058,"[40277996, 40279930, 40278796, 40277814]",17,1715016327,Ad Blocker for IRL Ads,story,https://old.reddit.com/r/VisionPro/comments/1clgzks/ad_blocker_for_irl_ads/,
tosh,38.0,40268463,"[40269080, 40269182, 40269429, 40269071, 40268929, 40269110, 40268804, 40272333, 40268876, 40268707, 40269201, 40269021, 40269531]",68,1714943692,Alan Kay on Donald Knuth,story,https://twitter.com/fermatslibrary/status/1787105220268380448/photo/1,
petethomas,0.0,40270478,,10,1714961213,Tech layoffs cross 70k in April 2024,story,https://timesofindia.indiatimes.com/technology/tech-news/tech-layoffs-cross-70000-in-april-2024-google-apple-intel-amazon-and-these-companies-cut-hundreds-of-jobs/articleshow/109750185.cms,
wslh,0.0,40272791,,4,1714987889,Gateway to Hell': Turkmenistan urged to plug gas leaks driving climate change,story,https://www.france24.com/en/asia-pacific/20230618-gateway-to-hell-turkmenistan-urged-to-plug-gas-leaks-driving-climate-change,
keepamovin,22.0,40257154,"[40281287, 40281298, 40277455, 40281659, 40261683, 40267812, 40267786, 40278101, 40258069, 40257596, 40257937, 40261941, 40263089, 40259778, 40257548, 40257780, 40261800, 40263165, 40258159]",18,1714825804,Ask HN: Can you recommend some poetry?,story,,"Random question, I know, sorry. I&#x27;m a fan of classics -- ( Blake, Tennyson, Coleridge, Kipling, Ginsberg, Shakespeare, Basho, Yeats, Eliot, Lorde, Khayyam, Frost, Whitman ) -- but I want to branch out and very curious as to the poetry interests of this venerable group of intellectuals here. Haha! :) So please share your likes, preferably with links, and I&#x27;ll definitely read them. Hopefully this can function as a useful spot for folks who enjoy poetry to share the (ideally modern and contemporary) poets they like. :)"
timschmidt,0.0,40261526,[40262903],32,1714870454,Unveiling secrets of the ESP32 part 2: reverse engineering RX,story,https://zeus.ugent.be/blog/23-24/esp32-reverse-engineering-continued/,
SirLJ,0.0,40279622,[40279745],5,1715030349,"More than 90% of stablecoin transactions aren't from real users, study finds",story,https://www.businesstimes.com.sg/companies-markets/banking-finance/more-90-stablecoin-transactions-arent-real-users-study-finds,
batmaniam,1.0,40269792,[40269807],10,1714953778,"Firefox user lose 7,470 tabs saved over 2 years after they can't restore session",story,https://www.tomshardware.com/software/mozilla-firefox/firefox-user-loses-7470-opened-tabs-saved-over-two-years-after-they-cant-restore-browsing-session,
larrysalibra,2.0,40278149,"[40278351, 40278371, 40278422]",5,1715021496,Apple Reportedly Building M2 Ultra and M4-Powered AI Servers,story,https://www.macrumors.com/2024/05/06/apple-building-m2-ultra-and-m4-servers/,
walterbell,0.0,40279398,[40279492],4,1715028845,Apple Third-Party SDK List for Privacy Manifests,story,https://mjtsai.com/blog/2024/05/06/apples-third-party-sdk-list-for-privacy-manifests/,
internetter,26.0,40253514,"[40254297, 40254292, 40254326, 40255108, 40257803, 40256162, 40257123]",66,1714779627,"Bountysource Stole at Least $17,000 from Open Source Developers",story,https://boehs.org/node/bountysource,
croes,4.0,40279108,"[40281818, 40279431, 40279124, 40279115, 40279367]",4,1715027236,OpenAI CEO Sam Altman promises that GPT-5 will be smarter than the GPT-4,story,https://www.windowscentral.com/software-apps/openai-ceo-sam-altman-promises-gpt-5-will-be-smarter-than-gpt-4,
someotherperson,15.0,40254080,"[40255220, 40257472, 40254608, 40256738, 40255799, 40255823, 40255142, 40260880, 40259921, 40256470]",91,1714786232,My secret life as an 11-year-old BBS sysop (2022),story,https://arstechnica.com/information-technology/2022/12/my-secret-life-as-an-11-year-old-bbs-sysop/,
mattficke,3.0,40274980,"[40275635, 40275199, 40275208, 40275132]",18,1715005048,Teens come up with trigonometry proof for Pythagorean Theorem,story,https://www.cbsnews.com/news/teens-come-up-with-trigonometry-proof-for-pythagorean-theorem-60-minutes-transcript/,
gulced,0.0,40273942,[40274036],9,1714999285,Millions were booted from Medicaid: The insurers gained Medicaid revenue anyway,story,https://medicalxpress.com/news/2024-05-millions-booted-medicaid-gained-revenue.html,
jseliger,23.0,40258187,"[40260644, 40261659, 40262064, 40260537, 40258582, 40261580, 40260856, 40260941, 40261042]",15,1714835028,You May Soon Be Drinking Synthetic Coffee,story,https://www.wsj.com/arts-culture/food-cooking/ynthetic-coffee-chocolate-climate-change-bfa9cce3,
gulced,54.0,40273469,"[40273636, 40273588, 40273663, 40273681, 40273843, 40273679, 40274051, 40273738, 40273565, 40273927, 40273900, 40273530]",84,1714995761,Sony overturns Helldivers 2 PSN requirement following backlash,story,https://www.eurogamer.net/sony-overturns-helldivers-2-psn-requirement-following-backlash,
benfreu,12.0,40263692,[40265245],28,1714904693,Denying Russia's Only Strategy for Success,story,https://www.understandingwar.org/backgrounder/denying-russia%E2%80%99s-only-strategy-success,
ek750,3.0,40265736,"[40266074, 40266498, 40266590, 40269069]",12,1714924154,Randy Travis's New Song Recreates His Voice with AI Technology,story,https://www.rollingstone.com/music/music-country/randy-travis-releases-ai-song-1235014871/,
georgecmu,39.0,40265678,"[40267957, 40267019, 40267020, 40278091, 40266996, 40266742, 40268538, 40266966, 40266834, 40266803, 40266645, 40266835]",25,1714923831,The Runners Who Went So Hard They Were Never the Same,story,https://www.outsideonline.com/podcast/overtraining-syndrome-science/,
thelastgallon,8.0,40253973,"[40254035, 40256805, 40257451, 40259587, 40255305, 40254933]",20,1714784778,Electric 10000 ton container ship has begun service with over 50MWh in batteries,story,https://electrek.co/2024/05/02/fully-electric-10000-ton-container-ship-begun-service50000-kwh-batteries/,
consultnyc,14.0,40253559,"[40259972, 40254424, 40275948, 40266319, 40266457, 40261751]",11,1714780117,Ask HN: How to Set Consulting Rate?,story,,"I found a niche in New York and consult in the hospitality sector with a focus on the hospitality industry. I have a full-time job, but picked up two consulting gigs with a recurring income totaling about half my post-tax W2 income from my full-time job. I&#x27;m struggling to set my &quot;consulting&quot; rate. How do other consultants set their rate on here?"
nradov,21.0,40269907,"[40270380, 40272535, 40271240, 40272250, 40270521]",25,1714955024,North Korean weapons are killing Ukrainians. The implications are far bigger,story,https://www.bbc.com/news/world-asia-68933778,
TMWNN,112.0,40253831,"[40254179, 40254227, 40254539, 40254386, 40254099, 40257364, 40254345, 40253893, 40253833, 40253997, 40255953, 40254411, 40254459, 40254119]",115,1714782765,"Value of one of S.F.'s biggest buildings plunges by 80% after Uber, Block leave",story,https://www.sfchronicle.com/sf/article/s-f-office-building-value-19438429.php,
zdw,8.0,40253245,"[40256354, 40260905, 40255555, 40255662, 40256658]",52,1714776862,How the Kindness of Sega Saved Nvidia from Going Under,story,https://www.timeextension.com/features/flashback-how-the-kindness-of-sega-saved-nvidia-from-going-under,
bill38,0.0,40263403,,5,1714901465,Mars Express animated movie review,story,https://www.theverge.com/24146379/mars-express-review-animated-sci-fi-gkids,
belter,0.0,40278316,"[40278735, 40278384]",8,1715022470,The day Google started to get worse: 'We are getting too close to money',story,https://english.elpais.com/technology/2024-05-05/the-day-google-started-to-get-worse-we-are-getting-too-close-to-money.html,
thunderbong,20.0,40262056,"[40265207, 40264478, 40263921, 40265440, 40265528, 40273766, 40263280, 40263507, 40265381]",42,1714879689,The Guide to Git I Never Had,story,https://glasskube.dev/guides/git/,
victorstanciu,168.0,40255209,"[40255573, 40255665, 40256109, 40255457, 40256202, 40255729, 40255753, 40255780, 40256220, 40255368, 40255528, 40255756, 40256368, 40255467, 40255811, 40256508, 40256233, 40256376, 40256669, 40256655, 40255500, 40256586, 40256117, 40256936, 40260104, 40256997, 40257019, 40255834, 40258618, 40255530, 40256138, 40256196, 40256630, 40255538]",218,1714801816,A love letter to bicycle maintenance and repair,story,https://tegowerk.eu/posts/bicycle-repair/,
alex_young,28.0,40260347,"[40260516, 40260722, 40260468, 40260538, 40262436, 40262445, 40260505]",37,1714857395,Rebel 'Star Wars' fans saved the original movies,story,https://www.nytimes.com/2024/05/03/arts/star-wars-films-george-lucas.html,
gnabgib,68.0,40253868,"[40254734, 40254323, 40254274, 40254315, 40254648, 40254448, 40256705, 40256415, 40256753, 40254341]",86,1714783383,How much time should you spend sitting versus standing?,story,https://theconversation.com/how-much-time-should-you-spend-sitting-versus-standing-new-research-reveals-the-perfect-mix-for-optimal-health-228894,
rntn,4.0,40273278,"[40275039, 40273313, 40274545, 40274684]",13,1714993691,The surprise is not that Boeing lost commercial crew but that it finished at all,story,https://arstechnica.com/space/2024/05/the-surprise-is-not-that-boeing-lost-commercial-crew-but-that-it-finished-at-all/,
otuutti,0.0,40259713,,6,1714850695,Discovery in Teleportation Research,story,https://www.utu.fi/en/news/press-release/significant-new-discovery-in-teleportation-research-noise-can-improve-the,
snats,0.0,40259005,,11,1714843152,Curse of Dimensionality,story,https://en.wikipedia.org/wiki/Curse_of_dimensionality,
marban,0.0,40262060,,7,1714879774,Nick Bostrom Made the World Fear AI. Now He Asks: What If It Fixes Everything?,story,https://www.wired.com/story/nick-bostrom-fear-ai-fix-everything/,
ndsipa_pomu,4.0,40273553,"[40273899, 40274040, 40276231, 40273806, 40273794]",7,1714996562,Yorkshire apostrophe fans demand road signs with nowt taken out,story,https://www.theguardian.com/uk-news/article/2024/may/05/north-yorkshires-dropped-apostrophe-for-street-signs-upsets-residents,
gulced,52.0,40273637,"[40273970, 40273923, 40273785, 40273902, 40273837, 40273753, 40274474, 40274635, 40280917, 40273842, 40273948, 40274080, 40273812, 40274196, 40274269, 40280202, 40274178, 40273898, 40275674, 40273861, 40274563, 40274105, 40273854, 40273839]",75,1714997042,Everyone Hates Workday,story,https://www.businessinsider.com/everyone-hates-workday-human-resources-customer-service-software-fortune-500-2024-5,
alephnerd,6.0,40280433,"[40280501, 40280654, 40280632]",6,1715036146,"Tesla Lays Off More Staff in Software, Service Team",story,https://www.reuters.com/business/autos-transportation/tesla-lays-off-more-staff-software-service-teams-electrek-reports-2024-05-06/,
dnetesn,227.0,40254054,"[40255065, 40255211, 40257932, 40254965, 40255101, 40255217, 40255447, 40257813, 40256163, 40255077, 40255522, 40258871, 40257558, 40254918, 40255412, 40258019, 40254884, 40259102, 40255323, 40255960, 40257936, 40254957, 40255206, 40255749, 40259170, 40255168, 40255911, 40257685]",126,1714785915,Insects and other animals have consciousness,story,https://nautil.us/insects-and-other-animals-have-consciousness-571584/,
DeathArrow,9.0,40257420,"[40258113, 40257965, 40257645, 40257844]",38,1714828413,StarCoder2-Instruct: Transparent Self-Alignment for Code Generation,story,https://github.com/bigcode-project/starcoder2-self-align,
accrual,20.0,40264182,"[40264866, 40265159, 40265267, 40264481, 40265513, 40264971, 40265662, 40264858, 40266072, 40265283, 40265289, 40265280]",45,1714910326,A Visual History of Windows Icons: From Windows 1 to 11 (2021),story,https://www.howtogeek.com/733912/a-visual-history-of-windows-icons-from-windows-1-to-11/,
dangle1,35.0,40260881,"[40261020, 40261242, 40261243, 40261564, 40261100, 40261135, 40261470, 40261572, 40260979, 40261277]",54,1714862364,"Multi-million dollar Cheyenne supercomputer auction ends with $480,085 bid",story,https://www.tomshardware.com/tech-industry/supercomputers/multi-million-dollar-cheyenne-supercomputer-auction-ends-with-480085-bid,
paulpauper,1.0,40260898,"[40265562, 40262647]",4,1714862526,What Did We Eat?,story,https://fireinabottle.net/what-did-we-eat/,
CharlesW,1.0,40276153,"[40276450, 40276236]",5,1715011335,Is AI about to kill what's left of journalism?,story,https://www.ft.com/content/aa191322-13b1-4468-ab7b-431dfee2cc07,
thesuperbigfrog,2.0,40254259,[40254272],37,1714788786,Rustc_codegen_GCC: Progress Report #32,story,https://blog.antoyo.xyz/rustc_codegen_gcc-progress-report-32,
mrcgnc,2.0,40253595,[40253943],11,1714780405,Bumblebees socially learn behaviour too complex to innovate alone,story,https://www.nature.com/articles/s41586-024-07126-4,
CHB0403085482,0.0,40256148,,5,1714814440,How the Lockheed SR-71 Blackbird Works,story,https://www.youtube.com/watch?v=gkyVZxtsubM,
seatac76,0.0,40278041,[40278436],11,1715021041,More Layoffs at Tesla,story,https://www.theverge.com/2024/5/6/24150274/tesla-layoffs-employee-fourth-week-elon-musk-ev-demand,
xnhbx,0.0,40254472,,27,1714791655,"Japan ministry asks Line, Yahoo operator to shed Naver influence",story,https://asia.nikkei.com/Business/Technology/Japan-ministry-asks-Line-Yahoo-operator-to-shed-Naver-influence,
wslh,8.0,40264164,"[40265580, 40264165]",8,1714910072,China Is Buying Gold Like There's No Tomorrow,story,https://www.nytimes.com/2024/05/05/business/china-gold-price.html,
gulced,61.0,40281588,"[40281880, 40282171, 40281951, 40281738, 40282191, 40281820, 40282251]",99,1715047880,"Google, Meta 'break' Apple's device fingerprinting rules",story,https://www.theregister.com/2024/05/07/apple_fingerprinting_rules/,
rntn,0.0,40269077,,8,1714947653,Tesla plans to charge some Model Y owners to unlock more range,story,https://www.theverge.com/2024/5/5/24149447/tesla-model-y-software-locked-battery-capacity,
thunderbong,67.0,40262906,"[40271229, 40271172, 40271160, 40271097, 40272199, 40271411, 40272203, 40271225, 40271086, 40272074, 40271402, 40271781, 40271606, 40271790]",61,1714893095,Why Choose ULIDs over Traditional UUIDs or IDs for Database Identification?,story,https://sotergreco.com/why-choose-ulids-over-traditional-uuids-or-ids-for-database-identification,
jarbus,105.0,40261647,"[40261699, 40262092, 40262180, 40266343, 40262326, 40262122, 40262374, 40262556, 40262454, 40262313]",76,1714872593,Why US renters are taking corporate landlords to court,story,https://www.cnbc.com/2024/02/03/realpage-antitrust-lawsuits-allege-collusion-among-corporate-landlords.html,
ilamont,26.0,40265703,"[40265932, 40265966, 40266100, 40266115, 40266228, 40265899, 40266549, 40266642, 40266365]",58,1714923963,Aberdeenshire memorial inscriptions records removed from Ancestry,story,http://scottishgenes.blogspot.com/2024/05/aberdeenshire-memorial-inscriptions.html,
marijnz,237.0,40263289,"[40263486, 40263373, 40263395, 40263406, 40263774, 40263671, 40264508, 40269904, 40264041, 40263520, 40263976, 40263427, 40263419, 40263493, 40264967, 40264101, 40263898, 40263496, 40264004, 40265161, 40265106, 40263426, 40264233, 40264562, 40264855, 40264466]",240,1714899753,Helldivers 2 Removed from Purchase on Steam in over 150 Countries,story,https://www.thegamer.com/helldivers-2-delisted-on-steam-100-plus-countries-without-psn-due-to-psn-sign-in-requirement-controversy/,
robin_reala,5.0,40255307,"[40255343, 40257637, 40257502, 40255516, 40257487, 40257520]",18,1714803049,ReCAPTCHA is broken for [some|most|all] Windows users,story,https://bugzilla.mozilla.org/show_bug.cgi?id=1894735,
simonsarris,57.0,40261535,"[40277503, 40277785, 40261731, 40277801, 40277707, 40277247, 40276956, 40276839, 40277555, 40278373, 40277519, 40277859, 40277152]",19,1714870583,The agony and ecstasy of Costco (2023),story,https://blog.benedictfritz.com/the-agony-and-ecstasy-of-costco/,
kiyanwang,13.0,40266492,"[40266976, 40267066, 40266774, 40267100, 40266865, 40266721, 40268186, 40266928, 40270209, 40267007, 40266675, 40267036]",31,1714929626,Good ideas in computer science,story,https://danielchasehooper.com/posts/good-ideas-in-cs/,
belter,0.0,40273703,[40273882],3,1714997547,3D Ukraine Experience,story,https://www.arcgis.com/apps/instant/3dviewer/index.html?appid=1602762dbcde419bb957dea358449580,
thunderbong,3.0,40254688,"[40257179, 40257641, 40266127]",26,1714795194,Microsoft plans to lock down Windows DNS like never before,story,https://arstechnica.com/security/2024/05/microsoft-plans-to-lock-down-windows-dns-like-never-before-heres-how/,
alanpham,58.0,40254384,"[40254455, 40255529, 40255741, 40254682, 40254838, 40254559, 40255498, 40257766, 40255025, 40255999, 40255748, 40261233, 40255594, 40254495, 40255867, 40255747, 40254567, 40254807, 40258402, 40254878, 40255143, 40256261, 40254621, 40255742, 40255639, 40254430]",73,1714790311,Show HN: I hate online Lorem Ipsum Generator so I made my own,story,,"As a designer, I use Lorem Ipsum a lot but none satisfied me. They are either too slow or too clunky.<p><a href=""https:&#x2F;&#x2F;loremcopy.com&#x2F;"" rel=""nofollow"">https:&#x2F;&#x2F;loremcopy.com&#x2F;</a><p>It&#x27;s a weekend project so why not (•‿•)<p>Also, I am new here. I didn&#x27;t know about Hacker News before. Glad to meet you all."
wjb3,0.0,40254421,[40257149],14,1714790935,How to explore your scientific values and develop a vision for your field,story,https://www.thetransmitter.org/craft-and-careers/how-to-explore-your-scientific-values-and-develop-a-vision-for-your-field/,
derbOac,48.0,40253041,"[40256174, 40253884, 40253835]",50,1714775050,"After 16 years, Ecobee is ceasing support for original smart thermostat",story,https://www.theverge.com/2024/5/2/24147154/ecobee-smart-thermostat-end-of-support,
wilted-iris,3.0,40267695,"[40268144, 40272428]",15,1714939042,What Elon Musk's favorite game tells us about him,story,https://davekarpf.substack.com/p/what-elon-musks-favorite-game-tells,
mpweiher,16.0,40258354,"[40258724, 40259297, 40260196, 40258506]",47,1714836421,Judge believes Apple is violating Epic Games' U.S. injunction,story,https://gamesfray.com/judge-believes-apple-is-violating-epic-games-u-s-injunction-schedules-evidentiary-hearing-before-final-decision/,
mofosyne,4.0,40261359,"[40262161, 40262416, 40264144, 40272992, 40261459]",21,1714867790,TIL: You can open man or info pages in Firefox by man:<page> or info:<page>,story,,"Turns out in firefox, they added a feature on their latest browser at least where you can open man or info pages in firefox simply by typing in  `man:&lt;page&gt;` or `info:&lt;page&gt;`<p>Try typing `man:ls` for instance. I tried it on chrome as well, but this seems to be a firefox only feature."
gulced,22.0,40259337,"[40260248, 40259962, 40259566, 40259881, 40259813, 40261910, 40259572, 40260802, 40259357]",58,1714846778,Counterfeit Cisco Devices Discovered in US Military Combat Zones,story,https://arstechnica.com/information-technology/2024/05/counterfeit-cisco-gear-ended-up-in-us-military-bases-used-in-combat-operations/,
signor_bosco,0.0,40260971,"[40262118, 40261011]",6,1714863369,Exploring the enigma of database vacuuming,story,https://dineshgowda.com/posts/exploring-the-enigma-of-database-vacuuming/,
leonardtang,0.0,40261442,[40261468],5,1714869276,Thorn in a HaizeStack Long-Context Jailbreak Test,story,https://github.com/haizelabs/thorn-in-haizestack,
cdme,0.0,40278015,[40278447],6,1715020897,The tech industry doesn't deserve optimism it has earned skepticism,story,https://coryd.dev/posts/2024/the-tech-industry-doesnt-deserve-optimism-it-has-earned-skepticism/,
toss1,1.0,40253851,[40253877],6,1714783021,Woman follows advice to not exit Tesla during update – takes longer reaches 115F,story,https://www.usatoday.com/story/tech/2024/05/03/trapped-in-tesla-during-software-update-tiktok/73559812007/,
cokernel_hacker,0.0,40253743,,5,1714781940,The Goodyear Massively Parallel Processor,story,https://en.wikipedia.org/wiki/Goodyear_MPP,
vinnyglennon,4.0,40265242,"[40265970, 40265367]",25,1714920120,Occupy Wall Street,story,https://en.wikipedia.org/wiki/Occupy_Wall_Street,
beardyw,5.0,40255566,"[40282161, 40257014, 40257566, 40256161, 40256197]",34,1714806257,"Video of sun's surface shows solar rain, eruptions and coronal moss",story,https://www.theguardian.com/science/article/2024/may/03/video-of-suns-surface-captures-solar-rain-eruptions-and-coronal-moss,
arromatic,7.0,40282477,"[40282607, 40282584, 40282577]",14,1715057780,Google SGE Says Drink Urine to Pass Kidney Stones Quickly,story,https://www.seroundtable.com/google-sge-drink-urine-to-pass-kidney-stones-37339.html,
belter,0.0,40259202,[40259308],4,1714845240,Fidelity: Pension Funds Exploring Bitcoin Investments on ETF Approval,story,https://www.nasdaq.com/articles/fidelity:-pension-funds-exploring-bitcoin-investments-on-etf-approval,
ingve,8.0,40256574,"[40257103, 40257148, 40259105, 40257226]",44,1714819761,"UEFI, BIOS, and other confusing x86 PC (firmware) terms",story,https://utcc.utoronto.ca/~cks/space/blog/tech/UEFIAndBIOSAndOtherPCTerms,
redbell,1.0,40264026,[40264307],4,1714908566,I Love Facebook. That's Why I'm Suing Meta,story,https://www.nytimes.com/2024/05/05/opinion/facebook-court-internet-meta.html,
