by,descendants,id,kids,score,time,title,type,url,text
markuta,29.0,40263975,"[40264763, 40264544, 40264685, 40265184, 40264926, 40264945, 40264877, 40264553, 40265024, 40265102, 40264545]",42,1714907779,Rabbit R1 can be run on a Android device,story,https://www.androidauthority.com/rabbit-r1-bespoke-android-3439760/,
gitinit,99.0,40242639,"[40248518, 40245096, 40243860, 40245090, 40248677, 40257670, 40244627, 40244802, 40244283, 40251549, 40260227, 40249772, 40245064, 40245036, 40245545, 40248252, 40250919, 40244366, 40245614, 40248339, 40244320, 40244977, 40244481, 40249631, 40257161, 40255460]",345,1714694168,"Stirling PDF: Self-hosted, web-based PDF manipulation tool",story,https://github.com/Stirling-Tools/Stirling-PDF,
siegers,167.0,40248217,"[40249897, 40254438, 40249455, 40248688, 40248991, 40248595, 40252770, 40260029, 40257402, 40249323, 40254722, 40251228, 40256253, 40248279, 40250060, 40258175, 40248901, 40253390, 40258863, 40248441, 40251715, 40251171, 40249967, 40257734, 40249658, 40250746, 40258558, 40248863]",217,1714747189,Lowercase – A simple way to take and share notes,story,https://www.lowercase.app/,
botanical,9.0,40243773,"[40259709, 40258550, 40260008, 40261326, 40262042]",48,1714707279,One South African community stopped Shell oil in its tracks,story,https://e360.yale.edu/features/nonhle-mbuthuma-interview,
sr-latch,92.0,40240724,"[40242230, 40241202, 40244145, 40241381, 40247309, 40245800, 40241758, 40251966, 40244557, 40247896, 40241656, 40260806, 40243940, 40241772]",350,1714679688,Building a rocket engine from scratch,story,https://blog.ablspacesystems.com/p/building-e2,
imaq,503.0,40245601,"[40246033, 40250390, 40245873, 40248814, 40248343, 40246938, 40246573, 40245860, 40246105, 40249503, 40246243, 40246729, 40247705, 40246041, 40248560, 40247048, 40247130, 40245808, 40246407, 40249544, 40247460, 40246283, 40258715, 40246421, 40250642, 40246439, 40245913, 40249044, 40249163, 40257767, 40245797, 40247227, 40248388, 40246850, 40246654, 40248705, 40246308, 40257525, 40246547, 40259391, 40247746, 40255436, 40250233, 40246680, 40248833, 40247864, 40251547, 40246622, 40247853, 40251676, 40248062, 40247948, 40245884, 40254163, 40254128, 40246771, 40251685, 40245995, 40247378, 40254532, 40254721, 40252198, 40248375, 40248626, 40257938, 40257896, 40257888, 40247945, 40254253, 40247041, 40245987, 40251206]",696,1714726851,Woodworking as an escape from the absurdity of software,story,https://alinpanaitiu.com/blog/woodworking-escape-from-software-absurdity/,
techedlaksh,68.0,40242410,"[40244095, 40242442, 40243984, 40244575, 40247847, 40248697, 40243821, 40243502, 40247906, 40243514, 40243505, 40245675, 40245177, 40243981, 40243507, 40247071, 40245616, 40244127, 40250303, 40246616]",419,1714691860,A Single Div,story,https://a.singlediv.com/,
pg5,217.0,40250557,"[40258522, 40252315, 40264552, 40259098, 40253757, 40251974, 40256130, 40250722, 40253082, 40255138, 40252985, 40251389, 40250964, 40250880, 40251124, 40251591, 40252283, 40253704, 40252288, 40254508, 40253546, 40252142, 40253323, 40253504, 40253149, 40252343, 40256603, 40252717, 40253572, 40251205, 40251757, 40252897, 40255764, 40251195, 40257012, 40253162, 40250911, 40253300, 40254102, 40252982, 40253800, 40253736, 40253745, 40254662, 40251331, 40256210, 40254931, 40254165, 40253277, 40253133, 40253477, 40251408, 40258288, 40257245, 40252347, 40253438, 40251874, 40250893, 40257585, 40258479, 40258539, 40259627, 40253389, 40250954, 40258980, 40258766]",442,1714759885,Show HN: BandMatch – “Tinder” but for finding musicians to create bands/collab,story,https://bandmatch.app,
coloneltcb,118.0,40247421,"[40249844, 40248717, 40248373, 40248223, 40248163, 40253618, 40249524, 40250764, 40248204, 40248423, 40254074, 40253144, 40250720, 40248167, 40249431, 40248959]",423,1714742798,Unique volumes of Brothers Grimm fairy tales discovered in Poland,story,https://english.nv.ua/life/27-unique-volumes-of-grimm-brothers-fairy-tales-were-found-in-poland-50415035.html,
bustylasercanon,19.0,40253774,"[40259093, 40257593, 40258930, 40256259, 40258126, 40255451, 40257394]",179,1714782204,Show HN: Bloom – A shadcn like UI library for Elixir and Phoenix,story,https://bloom-ui.fly.dev/,"I&#x27;ve been writing Elixir for 5 years and made plenty of sites with Phoenix and LiveView but my biggest gripe has always been with the lack of quality UI components available.<p>The JS ecosystem has so many, and it&#x27;s the one thing I miss from being primarily a React &amp; Node developer.<p>So this is my attempt at bringing some pretty and useful components most applications need to Phoenix projects to try and fill in the gaps between what makes LiveView such a productive joy to work with.<p>The library is very very raw and requires some initial clean up so PRs are very welcome to tidy up the DX as well as the general quality of the repo &amp; components.<p>Hope you like it."
yousuke86,14.0,40262152,"[40262452, 40264946, 40262179, 40264914, 40262657, 40262210, 40264267, 40262380]",8,1714881583,I realized I am a bad programmer,story,,"These days I realized I am a bad programmer.
I&#x27;m sure this is not imposter syndrome.<p>I graduated in CS at 26, working since age of 24 only in web development, mostly front-end, but more recently full stack.<p>I sort of coasted through various jobs in the last 13 years.<p>Managed to became tech lead 5 years ago, but went back to just development due to burnout.<p>I have never applied any algorithm or particular data structure and I have never worked really really hard, beyond &quot;just&quot; coding.<p>Now I feel I have wasted all my best years and left with some coding skills that will become obsolete in a few years (if I &#x27;m lucky).<p>I don&#x27;t have any satisfaction from my job and I did not develop other soft skills that might help me...<p>I&#x27;m not exactly sure on what to do now... Study DSA? Transition to management? Construction?"
ofrzeta,0.0,40260616,,13,1714859927,The process of making a Japanese road bike at the Panasonic Bicycle Factory [video],story,https://www.youtube.com/watch?v=STmZdGNVil0,
ohjeez,169.0,40243242,"[40247094, 40244082, 40244509, 40248538, 40244406, 40249906, 40244386, 40257869, 40247533, 40244226, 40249831, 40254580, 40247576, 40244104]",168,1714701513,"Georgia Tech, Meta create open dataset to advance solutions for carbon capture",story,https://news.gatech.edu/news/2024/05/02/georgia-tech-and-meta-create-massive-open-dataset-advance-ai-solutions-carbon,
dnetesn,41.0,40254047,"[40258215, 40255265, 40264472, 40258628, 40262286, 40258755, 40255081, 40255119]",140,1714785816,I never stopped learning from Daniel Dennett,story,https://nautil.us/i-never-stopped-learning-from-daniel-dennett-569904/,
soheilpro,241.0,40245686,"[40258098, 40255179, 40255280, 40255818, 40261500, 40258165, 40255556, 40259130, 40256842, 40256473, 40257392, 40256852, 40255804, 40256692, 40255426, 40257323, 40259603, 40256818]",254,1714727659,Figma’s Journey to TypeScript,story,https://www.figma.com/blog/figmas-journey-to-typescript-compiling-away-our-custom-programming-language/,
abi,130.0,40252569,"[40258866, 40257168, 40254601, 40258004, 40253752, 40261481, 40253844, 40254302, 40257590, 40257178, 40256774, 40254170, 40255925, 40253926, 40257102, 40253816, 40256285, 40253934, 40253756, 40254700, 40253432, 40261953, 40258374, 40256640, 40255802, 40255063, 40254636, 40256665, 40253749, 40257438, 40259362, 40257204, 40255260, 40255875, 40256841, 40254687, 40255187, 40259637, 40256839, 40256837]",510,1714771606,Show HN: I built a free in-browser Llama 3 chatbot powered by WebGPU,story,https://github.com/abi/secret-llama,"I spent the last few days building out a nicer ChatGPT-like interface to use Mistral 7B and Llama 3 fully within a browser (no deps and installs).<p>I’ve used the WebLLM project by MLC AI for a while to interact with LLMs in the browser when handling sensitive data but I found their UI quite lacking for serious use so I built a much better interface around WebLLM.<p>I’ve been using it as a therapist and coach. And it’s wonderful knowing that my personal information never leaves my local computer.<p>Should work on Desktop with Chrome or Edge. Other browsers are adding WebGPU support as well - see the Github for details on how you can get it to work on other browsers.<p>Note: after you send the first message, the model will be downloaded to your browser cache. That can take a while depending on the model and your internet connection. But on subsequent page loads, the model should be loaded from the IndexedDB cache so it should be much faster.<p>The project is open source (Apache 2.0) on Github. If you like it, I’d love contributions, particularly around making the first load faster.<p>Github: <a href=""https:&#x2F;&#x2F;github.com&#x2F;abi&#x2F;secret-llama"">https:&#x2F;&#x2F;github.com&#x2F;abi&#x2F;secret-llama</a>
Demo: <a href=""https:&#x2F;&#x2F;secretllama.com"" rel=""nofollow"">https:&#x2F;&#x2F;secretllama.com</a>"
rntn,1.0,40265021,"[40265438, 40265373]",5,1714918263,"E2EE may be the bane of cops, but they can't close that Pandora's Box",story,https://www.theregister.com/2024/05/05/e2ee_police/,
hudsonetkin,16.0,40261935,"[40264350, 40262664, 40263606, 40263078, 40263110, 40262747, 40262683, 40262959, 40262988, 40261975, 40263083, 40262860, 40263216]",8,1714877672,is AI the future of learning?,story,,What do you think the personalized AI tutor everybody gets hyped about will actually look like or do? Do we have the capability already? is it even possible?
tosh,8.0,40250693,"[40255067, 40259159, 40253658, 40261513, 40252464, 40254817, 40261400]",114,1714760664,"llm.c: multi-GPU, bfloat16, flash attention, ~7% faster than PyTorch",story,https://twitter.com/karpathy/status/1786461447654125625,
rokkitmensch,189.0,40259196,"[40259493, 40259538, 40260115, 40259534, 40260224, 40264694, 40259717, 40260610, 40259410, 40261173, 40259331, 40260044, 40260397, 40259708, 40261219, 40260619, 40259983, 40259919, 40259495, 40259628]",206,1714845173,Does the American Diabetes Association work for patients or companies?,story,https://www.theguardian.com/global/commentisfree/2024/may/02/american-diabetes-association-lawsuit,
PaulHoule,0.0,40251747,,76,1714766501,StructLM: Towards Building Generalist Models for Structured Knowledge Grounding,story,https://arxiv.org/abs/2402.16671,
0x00000000,40.0,40243014,"[40248002, 40244871, 40245336, 40244111, 40248059, 40245114, 40245961, 40247358]",173,1714698632,Dressmaking CAD,story,https://xn--6xw240d.net/,
jarbus,76.0,40261647,"[40261699, 40262092, 40262180, 40262326, 40262122, 40262556, 40262374, 40262454, 40262313]",67,1714872593,Why US renters are taking corporate landlords to court,story,https://www.cnbc.com/2024/02/03/realpage-antitrust-lawsuits-allege-collusion-among-corporate-landlords.html,
WithinReason,112.0,40237947,"[40241483, 40240695, 40240803, 40241217, 40241034, 40242274, 40240513, 40243495, 40244515, 40242768, 40241263, 40243556, 40241693, 40241450, 40250599, 40241086, 40240495, 40240332, 40240793, 40241610, 40245058]",217,1714666554,Gene banks aren’t enough to save the world’s food,story,https://longnow.org/ideas/to-save-it-eat-it/,
timschmidt,0.0,40261526,[40262903],27,1714870454,Unveiling secrets of the ESP32 part 2: reverse engineering RX,story,https://zeus.ugent.be/blog/23-24/esp32-reverse-engineering-continued/,
downboots,19.0,40244653,"[40258321, 40258136, 40260685, 40260957, 40256702, 40257405, 40256472, 40257363, 40256969, 40256481]",104,1714716721,Folding and One Straight Cut Suffice [pdf] (1999),story,https://www.imsc.res.in/~hbar/PDFs_2017/Paper_by_Demaine_Demaine_Lubiw.pdf,
benfreu,3.0,40263692,[40265245],8,1714904693,Denying Russia's Only Strategy for Success,story,https://www.understandingwar.org/backgrounder/denying-russia%E2%80%99s-only-strategy-success,
davidbarker,251.0,40244165,"[40247866, 40247609, 40249805, 40248671, 40248070, 40245394, 40254439, 40257635, 40257255, 40251795, 40244733, 40248093, 40252854, 40245136, 40248410, 40257828, 40244887, 40244861, 40244898, 40249410, 40245080, 40249685, 40248405, 40245265, 40248118, 40244878, 40245224, 40256278, 40247833]",252,1714711856,Ontario family doctor says new AI notetaking saved her job,story,https://globalnews.ca/news/10463535/ontario-family-doctor-artificial-intelligence-notes/,
vvoruganti,23.0,40239029,"[40244030, 40243131, 40240708, 40239817, 40245536, 40240677, 40239873, 40240759, 40242879]",264,1714671481,Piccolo – A Stackless Lua Interpreter,story,https://kyju.org/blog/piccolo-a-stackless-lua-interpreter/,
rbanffy,3.0,40245626,"[40259411, 40258503]",21,1714727137,Agricultural IoT System Sends Power Through the Soil,story,https://spectrum.ieee.org/smart-agriculture,
marijnz,189.0,40263289,"[40263486, 40263373, 40263395, 40263406, 40263671, 40264508, 40263774, 40263520, 40264041, 40263427, 40263419, 40264967, 40263976, 40263493, 40265161, 40263898, 40263496, 40264004, 40265106, 40263426, 40264101, 40264233, 40264562, 40264466, 40264855]",202,1714899753,Helldivers 2 Removed from Purchase on Steam in over 150 Countries,story,https://www.thegamer.com/helldivers-2-delisted-on-steam-100-plus-countries-without-psn-due-to-psn-sign-in-requirement-controversy/,
philocalyst,0.0,40249477,,13,1714753688,You May Not Know Where You're Going Until You've Got There(2014),story,https://sites.wpp.com/annualreports/2014/what-we-think/essay-by-jeremy-bullmore/,
anonzzzies,18.0,40246185,"[40250445, 40257030, 40252023, 40260592, 40253598, 40253246]",56,1714733030,A portable Common Lisp toolkit for building inspectors,story,https://github.com/aartaka/trivial-inspect,
Brajeshwar,4.0,40246603,"[40265209, 40259981, 40260486]",42,1714737142,Google will now show labels in Play Store to denote official government apps,story,https://techcrunch.com/2024/05/02/google-will-now-show-labels-in-play-store-to-denote-official-government-apps/,
Brajeshwar,13.0,40249858,"[40252346, 40252934, 40253053]",69,1714755847,Costa Rica restored its forests and switched to renewable energy,story,https://www.theverge.com/24146299/costa-rica-forest-restoration-renewable-energy-lessons,
bpierre,50.0,40247871,"[40248641, 40248459, 40248527, 40253437, 40249407, 40250027, 40260943, 40250551, 40252869, 40249339, 40249058, 40248853, 40249417, 40254340, 40250466]",218,1714745509,CSS Text Box Trim,story,https://github.com/jantimon/text-box-trim-examples,
PaulHoule,30.0,40247662,"[40248763, 40248228, 40250572, 40249708, 40251838, 40251516, 40254486, 40248754, 40252143]",142,1714744256,Mexico's Floating Gardens,story,https://reasonstobecheerful.world/mexico-chinampas-floating-gardens-sustainable-farming/,
Michelangelo11,19.0,40260787,"[40263012, 40264808, 40263407, 40263728, 40264147, 40264225]",44,1714861519,I went to Yale—and I think two-parent families are more important than college,story,https://nypost.com/2024/02/17/us-news/foster-kid-who-went-to-yale-says-family-trumps-college/,
simonpure,6.0,40245769,"[40254003, 40250520, 40251438, 40262483]",56,1714728598,A Minimal Model for Biological Evolution and Other Adaptive Processes,story,https://writings.stephenwolfram.com/2024/05/why-does-biological-evolution-work-a-minimal-model-for-biological-evolution-and-other-adaptive-processes/,
tosh,4.0,40255611,"[40260625, 40260365, 40262645]",19,1714806854,Plotille: Plot in the terminal using Braille dots,story,https://github.com/tammoippen/plotille,
sansjack,33.0,40245050,"[40249734, 40264666, 40245097, 40248468, 40249264, 40249713, 40247594, 40252864, 40257423, 40260833, 40250968, 40253007, 40248365, 40248158, 40247408, 40253304]",79,1714720615,Show HN: I built a site to share code boilerplates,story,https://boilermate.site/hot,While looking for some code boilerplates i realised there isn&#x27;t really an easy &#x2F; efficient place to browse. Boilermate.site was made for the community to share them and give a vote!
alexzeitler,49.0,40247528,"[40249228, 40250706, 40254787, 40258055, 40249954, 40251527, 40247737]",95,1714743450,"Blue-Recorder, a Simple Screen Recorder Written in Rust",story,https://github.com/xlmnxp/blue-recorder,
wallflower,5.0,40252933,"[40265288, 40260219, 40260344]",33,1714774054,Make your own stargazing binoculars,story,https://www.analogsky.co/magic,
noashavit,4.0,40248692,"[40258332, 40261724, 40259401]",43,1714749613,Open-Source Lucidchart Alternative,story,https://www.drawio.com/,
serial_dev,16.0,40255249,"[40260699, 40260373, 40260535, 40260845]",50,1714802265,How big is the Flutter team?,story,https://ln.hixie.ch/?start=1714717681,
Brajeshwar,476.0,40248619,"[40255488, 40250835, 40254012, 40250538, 40253998, 40257203, 40250728, 40257212, 40255956, 40255632, 40254873, 40254410, 40255308, 40254263, 40251050, 40259706, 40253343, 40258984, 40250582, 40258950, 40260297, 40251579, 40250904, 40255079, 40251853, 40251122, 40257415, 40257416, 40255277, 40251029, 40253435, 40259672, 40255029, 40254435, 40255681, 40254308, 40253891, 40259903, 40250552, 40257457, 40253354, 40258570, 40258314, 40258050, 40250980]",255,1714749217,AI copilots are changing how coding is taught,story,https://spectrum.ieee.org/ai-coding,
fmerian,130.0,40245637,"[40246209, 40247663, 40245811, 40251934, 40251203, 40261754, 40246397, 40247260, 40245757, 40246074, 40249134, 40253031, 40246457, 40247101, 40247741, 40246542, 40246503, 40252121, 40249539, 40249122, 40245862, 40250784]",248,1714727188,How to Use JSON Path,story,https://bump.sh/blog/how-to-use-json-path,
bms2297,49.0,40242335,"[40242336, 40242685, 40242519, 40243105, 40249641, 40242448, 40242744, 40242743]",114,1714691157,More info about synonyms at Google (2010),story,https://www.mattcutts.com/blog/google-synonyms/,
thunderbong,11.0,40262056,"[40265207, 40265440, 40264478, 40263921, 40263280, 40263507, 40265381]",32,1714879689,The Guide to Git I Never Had,story,https://glasskube.dev/guides/git/,
techedlaksh,83.0,40250519,"[40252687, 40252010, 40254238, 40253460, 40253462, 40252105, 40253841, 40254357, 40251995, 40254469, 40257545, 40255964, 40254205, 40255655, 40261217, 40256911, 40259662, 40253416, 40253373, 40254183, 40251987, 40251959, 40253824, 40253678]",257,1714759613,How hard can generating 1024-bit primes be?,story,https://glitchcomet.com/articles/1024-bit-primes/,
neversaydie,153.0,40237855,"[40243152, 40239355, 40243943, 40246066, 40242795, 40244974, 40238456, 40250703, 40239333, 40248957, 40239693, 40238405, 40238562, 40238955, 40241695, 40238558]",246,1714666145,Wild orangutan seen healing his wound with a plant,story,https://www.bbc.co.uk/news/science-environment-68942123,
veryluckyxyz,17.0,40242939,"[40248418, 40251554, 40249812, 40253092, 40248781, 40254915]",104,1714697726,Refusal in LLMs is mediated by a single direction,story,https://www.lesswrong.com/posts/jGuXSZgv6qfdhMCuJ/refusal-in-llms-is-mediated-by-a-single-direction,
jasondavies,13.0,40249696,"[40254862, 40250549, 40254077, 40251100, 40250928, 40250756]",57,1714754927,DrEureka: Language Model Guided SIM-to-Real Transfer,story,https://eureka-research.github.io/dr-eureka/,
dukeyukey,50.0,40234490,"[40252616, 40234838, 40252416, 40254325, 40253402, 40252614, 40254083, 40253493, 40253146]",49,1714644626,Visiting the most expensive nuclear station,story,https://www.samdumitriu.com/p/visiting-the-worlds-most-expensive,
ripe,65.0,40234682,"[40244566, 40246281, 40244081, 40244120, 40244349, 40260389, 40244076, 40249359, 40245528, 40244503, 40256334, 40245115, 40243787, 40251256]",87,1714646726,Silk Helped the Armies of Genghis Khan Conquer Asia,story,https://lithub.com/how-silk-helped-the-armies-of-genghis-khan-conquer-asia/,
jger15,12.0,40248732,"[40251065, 40250759, 40250817, 40250779, 40253084, 40251342]",44,1714749788,The Modern Curse of Overoptimization,story,https://freddiedeboer.substack.com/p/the-modern-curse-of-overoptimization,
jnord,28.0,40242224,"[40242527, 40245648, 40242584, 40245237, 40243945, 40243118, 40246757, 40250361, 40247581, 40247295, 40243264]",96,1714690025,The life and times of an Abstract Syntax Tree,story,https://blog.trailofbits.com/2024/05/02/the-life-and-times-of-an-abstract-syntax-tree/,
demegire,62.0,40236797,"[40239180, 40237595, 40237819, 40237610, 40237439, 40237620, 40238302, 40238459, 40239368, 40243600, 40237297, 40238075, 40238445, 40244567, 40238140, 40244785, 40237505, 40237427, 40240962, 40237700, 40237226, 40237670, 40237267, 40237207, 40237323, 40237783]",178,1714660578,Show HN: An extension to track your Wikipedia adventures,story,https://chromewebstore.google.com/detail/wiki-journey/lehenbcbjcnkhkikgopniimobmmdcfog,"Wiki Journey tracks your daily Wikipedia rabbit holes in a tree format.<p>Available on Firefox and Chrome:
<a href=""https:&#x2F;&#x2F;addons.mozilla.org&#x2F;en-US&#x2F;firefox&#x2F;addon&#x2F;wiki-journey&#x2F;"" rel=""nofollow"">https:&#x2F;&#x2F;addons.mozilla.org&#x2F;en-US&#x2F;firefox&#x2F;addon&#x2F;wiki-journey&#x2F;</a>
<a href=""https:&#x2F;&#x2F;chromewebstore.google.com&#x2F;detail&#x2F;wiki-journey&#x2F;lehenbcbjcnkhkikgopniimobmmdcfog"" rel=""nofollow"">https:&#x2F;&#x2F;chromewebstore.google.com&#x2F;detail&#x2F;wiki-journey&#x2F;lehenb...</a><p>It&#x27;s open source, feel free to contribute!
<a href=""https:&#x2F;&#x2F;github.com&#x2F;demegire&#x2F;wiki-journey"">https:&#x2F;&#x2F;github.com&#x2F;demegire&#x2F;wiki-journey</a>"
PaulHoule,104.0,40251317,"[40252171, 40252188, 40256335, 40255701, 40253005, 40252071, 40260065, 40255154, 40252805, 40252634, 40254150, 40252082, 40253971, 40252519, 40252007]",128,1714764322,The Physics of Karate (2021),story,https://daily.jstor.org/the-physics-of-karate/,
gnabgib,35.0,40249944,"[40256140, 40250399, 40261482, 40255066, 40256751, 40257640, 40253762, 40252939, 40251866, 40253269, 40256546, 40253917, 40256558]",58,1714756389,Google rolls back reCaptcha update to fix Firefox issues,story,https://www.bleepingcomputer.com/news/security/google-rolls-back-recaptcha-update-to-fix-firefox-issues/,
bx376,25.0,40244911,"[40251010, 40257999, 40254038, 40252560, 40252456, 40252577, 40251792, 40250899]",30,1714719175,Investors won't give you the real reason they are passing on your startup,story,https://techcrunch.com/2024/04/27/your-team-sucks/,
8organicbits,85.0,40246841,"[40248189, 40247499, 40247238, 40247814, 40247844, 40247426, 40249984, 40250802, 40247303, 40249794, 40247244, 40247277, 40250071, 40248883, 40247776, 40250442, 40248562, 40248442, 40247335, 40247475]",98,1714738837,Experimental blog that is only available to read through a feed reader,story,https://theunderground.blog/,
Sajarin,22.0,40250525,"[40255000, 40252709, 40255074, 40253365, 40250708, 40251808, 40253901, 40254378, 40253223]",111,1714759637,SATO: Stable Text-to-Motion Framework,story,https://sato-team.github.io/Stable-Text-to-Motion-Framework/,
Brajeshwar,6.0,40246601,[40248836],52,1714737133,The highest observatory in the world just opened in Chile,story,https://www.theverge.com/2024/5/2/24146743/university-of-tokyo-atacama-observatory-telescope-highest-altitude-infrared,
jshchnz,112.0,40242297,"[40243918, 40243034, 40242840, 40242925, 40242909, 40242770, 40243324, 40242928, 40243907, 40244064, 40243739, 40243815, 40242727, 40243400, 40242779, 40243733, 40243003]",111,1714690732,An analysis of the Rabbit R1  APK,story,https://www.emergetools.com/deep-dives/rabbit-r1,
otuutti,0.0,40259713,,5,1714850695,Discovery in Teleportation Research,story,https://www.utu.fi/en/news/press-release/significant-new-discovery-in-teleportation-research-noise-can-improve-the,
keepamovin,16.0,40257154,"[40261683, 40258069, 40257596, 40263089, 40257937, 40261941, 40263165, 40259778, 40257548, 40261800, 40257780, 40258159]",12,1714825804,Ask HN: Can you recommend some poetry?,story,,"Random question, I know, sorry. I&#x27;m a fan of classics -- ( Blake, Tennyson, Coleridge, Kipling, Ginsberg, Shakespeare, Basho, Yeats, Eliot, Lorde, Khayyam, Frost, Whitman ) -- but I want to branch out and very curious as to the poetry interests of this venerable group of intellectuals here. Haha! :) So please share your likes, preferably with links, and I&#x27;ll definitely read them. Hopefully this can function as a useful spot for folks who enjoy poetry to share the (ideally modern and contemporary) poets they like. :)"
thunderbong,14.0,40235193,"[40236221, 40258805, 40235875, 40235947, 40235945]",54,1714651622,Recovering the master key from RAM to break Android's file-based encryption (2021),story,https://www.sciencedirect.com/science/article/pii/S266628172100007X,
jchanimal,30.0,40236923,"[40240858, 40246837, 40241428, 40241068, 40241313, 40240785, 40242285, 40240905]",20,1714661237,Delimited Generators – A more natural API for JS generators,story,http://axisofeval.blogspot.com/2024/05/delimited-generators.html,
Brajeshwar,373.0,40248627,"[40249330, 40249934, 40248806, 40250492, 40249660, 40251306, 40252011, 40250504, 40251743, 40249147, 40249153, 40249113, 40258947, 40251023, 40250358, 40249038, 40251058, 40253996, 40250098, 40249838, 40248950, 40250433, 40254020, 40254143, 40251224, 40249181, 40251686, 40250955, 40249186, 40252361, 40251556, 40251333, 40252060, 40249620]",471,1714749256,Lithium-free sodium batteries exit the lab and enter US production,story,https://newatlas.com/energy/natron-sodium-ion-battery-production-startt/,
