by,descendants,id,kids,score,time,title,type,url,text
11001100,32.0,40040738,"[40041022, 40040946, 40041395, 40041570, 40041229, 40041324, 40041059]",54,1713190078,TwitchAdSolutions – Blocking Twitch Ads,story,https://github.com/pixeltris/TwitchAdSolutions,
refset,78.0,40040593,"[40041351, 40041657, 40041629, 40041640, 40041600, 40040976, 40040966, 40041279, 40041314, 40041129, 40040994, 40041110, 40041455, 40041305, 40041248, 40040978, 40040993, 40040998, 40041007, 40041354, 40041322, 40041095, 40041046, 40040950, 40041176, 40041055, 40041147, 40040949]",154,1713189353,Neon Is Generally Available: Serverless Postgres,story,https://neon.tech/blog/neon-ga,
susam,17.0,40021782,"[40040809, 40040703, 40040641, 40041470, 40040535, 40041346]",71,1713001008,Emacs Info Expressions,story,https://susam.net/emacs-info-expressions.html,
rbanffy,70.0,40038251,"[40039712, 40039533, 40040530, 40040649, 40040508, 40040867, 40040211, 40039608, 40040370, 40040366, 40040872, 40040448, 40039944]",143,1713171769,The Tiny Ultrabright Laser That Can Melt Steel,story,https://spectrum.ieee.org/pcsel,
jimmcslim,11.0,40039191,"[40039598, 40041456, 40041473, 40041374, 40041562]",61,1713181170,Supabase – General Availability Week,story,https://supabase.com/ga,
tosh,27.0,40037844,"[40038086, 40038335, 40039343, 40039996, 40038775, 40038719, 40041341]",121,1713166348,Beautifying Org Mode in Emacs (2018),story,https://zzamboni.org/post/beautifying-org-mode-in-emacs/,
ingve,41.0,40030125,"[40037711, 40041371, 40039511, 40039633, 40041047, 40038786, 40041227, 40038986, 40041334]",92,1713090493,Why good external SSDs are faster with Apple Silicon,story,https://eclecticlight.co/2024/04/14/last-week-on-my-mac-why-good-external-ssds-are-faster-with-apple-silicon/,
xlinux,48.0,40039591,"[40040673, 40040598, 40040789, 40041412, 40040583, 40040735, 40041053, 40041233]",74,1713183631,Open source versus Microsoft: The new rebellion begins,story,https://www.theregister.com/2024/04/15/opinion_microsoft_sovereignty/,
davidgu,,40039372,,1,1713182448,Recall.ai (YC W20) Is Hiring Engineer #4 (Rust and Large Scale Infra),job,https://www.workatastartup.com/jobs/63615,
Thevet,61.0,40037396,"[40037625, 40038027, 40038539, 40038622, 40039006, 40038089, 40038558, 40038851, 40037799, 40037973, 40038015, 40037961]",127,1713159902,A shrub in Nepal supplies the raw material for the bank notes used in Japan,story,https://www.nytimes.com/2024/04/15/world/asia/nepal-japan-yen-argeli.html,
adrianhon,36.0,40038922,"[40040832, 40040689, 40040555, 40040600, 40040423, 40041131, 40041038, 40040519, 40041092, 40041193, 40040634]",22,1713179127,Are Flying Cars Here?,story,https://www.newyorker.com/magazine/2024/04/22/are-flying-cars-finally-here,
bryanrasmussen,33.0,40030127,"[40041552, 40038571, 40038152, 40038111]",69,1713090559,Canoes Discovered Northwest of Rome Are Oldest Boats Ever Found in Mediterranean,story,https://www.smithsonianmag.com/smart-news/five-canoes-discovered-northwest-of-rome-are-oldest-boats-ever-found-in-the-mediterranean-180984014/,
thunderbong,31.0,40039020,"[40039763, 40040313, 40039585, 40041217, 40040028, 40040076, 40039559, 40040242, 40039486, 40041328]",97,1713179864,A proof-of-concept Python executable built on Cosmopolitan Libc (2022),story,https://ahgamut.github.io/2021/07/13/ape-python/,
matan-h,20.0,40037772,"[40040890, 40038962, 40040176, 40038403, 40040668, 40039125, 40039216, 40038336, 40038684, 40038519]",53,1713165373,Better Adb-Shell,story,https://github.com/matan-h/adb-shell,
dotcoma,5.0,40040959,"[40041534, 40041623, 40041577, 40041497, 40041502]",17,1713191226,20 years ago Gmail revolutionized email. It's time for a new revolution,story,https://tuta.com/blog/gmail-20-years-old,
rohitpaulk,124.0,40035514,"[40038352, 40037174, 40037545, 40039590, 40037081, 40035945, 40037203, 40036100, 40036223, 40039849, 40037558, 40036825, 40036244, 40038285, 40036639, 40037114, 40036302, 40035979, 40036858, 40036052, 40039097]",711,1713137881,"Visualizing Attention, a Transformer's Heart [video]",story,https://www.3blue1brown.com/lessons/attention,
bookofjoe,171.0,40040100,"[40040102, 40040578, 40041596, 40041540, 40040228, 40040905, 40040396, 40040210, 40040456, 40040884, 40041203, 40040124, 40041617, 40040493, 40040378, 40040756, 40040677, 40040574, 40041104, 40040665, 40041327, 40040347, 40040356, 40040453]",195,1713186648,Tesla Cybertruck Production Halted,story,https://www.barrons.com/articles/tesla-cybertruck-production-halted-ac750c17,
sprawl_,8.0,40007120,"[40024683, 40027573, 40026261, 40024267, 40025154, 40027141]",42,1712871732,Asymmetric Routing Around the Firewall,story,https://devnonsense.com/posts/asymmetric-routing-around-the-firewall/,
sohkamyung,49.0,40039752,"[40040194, 40040857, 40040172, 40040340, 40040554]",48,1713184454,Getting the Grid to Net Zero,story,https://spectrum.ieee.org/electric-inverter,
politelemon,3.0,40037619,"[40040828, 40037884, 40039413, 40039982]",32,1713163176,"Control Linux based distros using hand gestures using OpenCV, GTK, Mediapipe",story,https://github.com/flying-pizza-69/GestureX,
jbegley,31.0,40039581,"[40041621, 40040051, 40040716, 40041353, 40040031, 40040026]",53,1713183581,FBI Opens Criminal Investigation into Baltimore Bridge Collapse,story,https://apnews.com/article/baltimore-bridge-collapse-fbi-investiagation-58188d524035c756872603055f309c78,
Tomte,26.0,40020598,"[40040474, 40039650, 40039759, 40028185, 40039236, 40039380]",28,1712984098,Never redefine an inherited default parameter value (1997),story,http://www.cpptips.com/redef_dflt_parm,
ta988,9.0,40036237,"[40036682, 40036799, 40036932, 40036792, 40036945, 40036664]",99,1713145037,Computer-generated holography with ordinary display,story,https://opg.optica.org/ol/abstract.cfm?uri=ol-49-8-1876,
rntn,36.0,40040126,"[40040928, 40040882, 40041498, 40041021, 40040844, 40041039, 40041433, 40040874, 40041491, 40040910]",22,1713186781,Citizenship Privilege Harms Science,story,https://www.nature.com/articles/d41586-024-01080-x,
zaikunzhang,1.0,40040748,[40041370],10,1713190140,Fortran Standard Library: release v0.5.0,story,https://fortran-lang.discourse.group/t/fortran-standard-library-release-v0-5-0/7827,
jwarden,1.0,40041309,[40041310],7,1713192591,Deliberative Consensus Protocols,story,https://social-protocols.org/deliberative-consensus-protocols/,
keepamovin,0.0,40041288,,3,1713192511,Yagi–Uda Antenna,story,https://en.wikipedia.org/wiki/Yagi%E2%80%93Uda_antenna,
wawayanda,33.0,40036104,"[40039702, 40036960, 40037181, 40038852, 40038215, 40041393, 40036754, 40037195, 40037162, 40036889, 40038718, 40040630]",61,1713143749,RocketStar tests fusion-enhanced in-space propulsion process,story,https://www.aerospacetestinginternational.com/news/space/rocketstar-tests-fusion-enhanced-in-space-propulsion-process.html,
lonk,6.0,40029849,"[40030356, 40030593, 40041220, 40035706, 40041148, 40030460]",50,1713086302,I ported thousands apps to Windows 95 [video],story,https://www.youtube.com/watch?v=CTUMNtKQLl8,
impish9208,1.0,40040694,[40041413],7,1713189868,FBI IC3: Smishing Scam Regarding Debt for Road Toll Services,story,https://www.ic3.gov/Media/Y2024/PSA240412,
fargle,11.0,40036138,"[40040307, 40038070, 40036146, 40040559, 40038380, 40037810]",46,1713144017,1800-2023 – IEEE Standard for SystemVerilog,story,https://ieeexplore.ieee.org/document/10458102,
mooreds,33.0,40031054,"[40041634, 40039354, 40039701, 40037540, 40037792, 40038436, 40037481, 40038433, 40038170, 40038320]",42,1713102919,The unwritten laws of engineering at Stedi,story,https://www.stedi.com/blog/the-unwritten-laws-of-engineering-at-stedi,
BigBalli,0.0,40040919,,3,1713191084,Ionos prices go up after Broadcom acquires VMware,story,https://twitter.com/BigBalli/status/1779878305812152367,
feynman_quantum,27.0,40036429,"[40037041, 40036704, 40038910, 40036729, 40037539, 40037047, 40036430]",46,1713146979,Thermoelectric Cooling,story,https://thermoelectricsolutions.com/how-thermoelectric-cooling-works/,
luu,38.0,40035414,"[40039425, 40037459, 40039948, 40038703, 40036817, 40037125, 40040308, 40037548, 40038402, 40038655, 40040290, 40038122, 40039538, 40037399, 40037637]",198,1713136963,WireViz: Easily document cables and wiring harnesses,story,https://github.com/wireviz/WireViz,
earslap,29.0,40035552,"[40037713, 40037008, 40038476, 40040877, 40037306, 40036999, 40037945, 40039144, 40037301, 40036730, 40037375, 40038007, 40036790, 40037421, 40037377]",198,1713138328,Spectral Ray Tracing,story,https://larswander.com/writing/spectral-ray-tracing/,
conanxin,269.0,40028643,"[40029387, 40029188, 40029242, 40029515, 40032894, 40032127, 40029176, 40029225, 40038870, 40029286, 40029075, 40029159, 40029239, 40029102, 40032051, 40029118, 40033427, 40030015, 40029830, 40030824, 40032762, 40029235, 40034477, 40032744, 40031480, 40029288, 40035170, 40036231, 40030553, 40037397, 40031032, 40033312, 40032866, 40031027, 40029185, 40032128, 40029688, 40032895, 40036533]",1301,1713068678,Obituary for a quiet life (2023),story,https://bittersoutherner.com/feature/2023/obituary-for-a-quiet-life,
tscherno,5.0,40040825,"[40040955, 40041468, 40041545, 40041528, 40041515]",6,1713190576,Democracy Dies Behind Paywalls,story,https://www.theatlantic.com/ideas/archive/2024/04/paywall-problems-media-trust-democracy/678032/,
hbarka,24.0,40036431,"[40036538, 40037028, 40039142, 40036432, 40038065, 40036842, 40037640, 40036994]",62,1713147001,The Wallis Annenberg Wildlife Crossing,story,https://101wildlifecrossing.org/,
gone35,8.0,40017539,"[40024872, 40025802, 40025368, 40039964]",65,1712955222,Common pitfalls of digital health startups and how to avoid them (2023),story,https://bettychang.xyz/advice-for-digital-health-founders/,
vitplister,11.0,40035636,"[40036870, 40036925]",35,1713139077,Dumping Parallel NAND with Glasgow,story,https://colinoflynn.com/2024/04/dumping-parallel-nand-with-glasgow/,
tosh,114.0,40030746,"[40034384, 40033558, 40040740, 40040972, 40033324, 40035546, 40033784, 40033993, 40035249, 40035077, 40035344, 40033834, 40035045, 40033704, 40033573, 40037414, 40035468, 40036971, 40036504, 40033426, 40035450, 40034189, 40035069]",417,1713099111,Redis re-implemented with SQLite,story,https://github.com/nalgeon/redka,
walterbell,22.0,40038330,"[40039961, 40041541, 40039781, 40041121]",24,1713172961,"Apple Readies M4 Chip Mac Line, Including New MacBook Air and Mac Pro",story,https://www.bloomberg.com/news/articles/2024-04-11/apple-aapl-readies-m4-chip-mac-line-including-new-macbook-air-and-mac-pro,
sagischwarz,43.0,40039450,"[40040191, 40041458, 40041052, 40040324, 40041012, 40040422, 40040734, 40040168, 40040164, 40041223, 40040579, 40040352, 40040605, 40039872, 40040445]",55,1713182834,"Framework's software and firmware have been a mess, but it's working on them",story,https://arstechnica.com/gadgets/2024/04/frameworks-software-and-firmware-have-been-a-mess-but-its-working-on-them/,
cmpit,15.0,40037583,"[40038478, 40040870, 40039365, 40039230]",30,1713162605,My list of challenging software projects some programmers should try,story,https://www.andreinc.net/2024/03/28/programming-projects-ideas,
thunderbong,40.0,40040030,"[40040516, 40040415, 40040833, 40040251, 40040695, 40040455]",37,1713186218,Medium bans AI-generated content from its paid Partner Program,story,https://www.bleepingcomputer.com/news/technology/medium-bans-ai-generated-content-from-its-paid-partner-program/,
mehulashah,18.0,40028984,"[40037866, 40037280, 40039000, 40037958, 40028985]",33,1713074040,Proving Heron’s formula by complex number (2013),story,https://mathgarage.wordpress.com/2013/01/20/proving-herons-formula-by-complex-number/,
jseliger,46.0,40033268,"[40038223, 40039517, 40035795, 40035955, 40035524, 40035785, 40038213, 40036677, 40038151, 40036568, 40037296, 40036246]",151,1713119791,Good news against dengue,story,https://www.science.org/content/blog-post/good-news-against-dengue,
peutetre,127.0,40037046,"[40037216, 40037707, 40037525, 40037360, 40040281, 40037257, 40038909, 40040912, 40037442, 40038044, 40038101, 40037446, 40037317, 40037148, 40037510, 40040970, 40038084, 40037527, 40037804, 40037425, 40037529, 40037601, 40037454, 40037334, 40038125, 40038034]",173,1713154855,"Sleep apnea: Mouthguards less invasive, just as effective as CPAP",story,https://newatlas.com/medical/sleep-apnea-mouthguard-cpap-blood-pressure/,
ksec,54.0,40020984,"[40038848, 40036628, 40037057, 40036403, 40037793, 40037761, 40039995, 40036780, 40036811, 40036622, 40039864, 40038762]",128,1712989672,"Swift for C++ Practitioners, Part 1: Intro and Value Types",story,https://www.douggregor.net/posts/swift-for-cxx-practitioners-value-types/,
DeathArrow,10.0,40037781,"[40038563, 40037822, 40041291, 40039285, 40038261]",25,1713165460,WD launches 4TB SD card,story,https://www.techradar.com/pro/wd-launches-enormous-4tb-sd-card-for-creative-pros-smashes-world-record-for-largest-removable-memory-card-to-smithereens-at-twice-the-capacity-of-biggest-microsd-cards,
doener,3.0,40039505,"[40040904, 40041164]",8,1713183116,Proton: Inactive Accounts,story,https://proton.me/support/inactive-accounts,
mooreds,50.0,40030786,"[40039907, 40039090, 40039703, 40039002, 40039895, 40039332, 40039428, 40039623]",43,1713099670,Trying to Understand Copilot's Type Spaghetti,story,https://rtpg.co/2024/03/07/parsing-copilots-type-spaghetti/,
tambourine_man,15.0,40037330,"[40038322, 40037636, 40037943, 40037620]",46,1713158859,From L3 to seL4 what have we learnt in 20 years of L4 microkernels? [video],story,https://www.youtube.com/watch?v=RdoaFc5-1Rk,
rbanffy,77.0,40034140,"[40037651, 40037018, 40035492, 40038154, 40035453, 40037189, 40036290, 40035655, 40035810, 40036191, 40035606, 40037947, 40036243, 40038550, 40036844, 40035818, 40035844, 40036271, 40037942, 40035733]",123,1713126247,The Airship to Orbit Project,story,https://www.jpaerospace.com/ATO/ATO.html,
bookofjoe,201.0,40033646,"[40033987, 40034801, 40034660, 40038472, 40034183, 40034118, 40034093, 40038292, 40040779, 40035721, 40034538, 40035681, 40037029, 40035753, 40034127, 40035027, 40033960, 40035802, 40038115, 40036698, 40036177, 40038535, 40039026, 40036907, 40035685, 40038586, 40035396, 40035024, 40034635, 40034552, 40034194, 40034032, 40033977, 40035054, 40035581, 40034092]",141,1713122742,AI made these movies sharper – critics say it ruined them,story,https://www.nytimes.com/2024/04/13/movies/ai-blu-ray-true-lies.html,
fanf2,85.0,40033497,"[40040193, 40033903, 40034293, 40035888, 40035158, 40034920, 40034347, 40037983, 40037830, 40037130, 40038482, 40036214, 40034799, 40034070, 40035357, 40035062, 40036395, 40034842]",147,1713121459,Sandboxing all the things with Flatpak and BubbleBox,story,https://www.ralfj.de/blog/2024/04/14/bubblebox.html,
neom,0.0,40034563,,15,1713129454,PicoGK is a compact and robust geometry kernel for Computational Engineering,story,https://github.com/leap71/PicoGK,
beckthompson,19.0,40034869,"[40036801, 40038252, 40037284, 40040854]",78,1713132188,Integral Calculator,story,https://www.integral-calculator.com/,
goranmoomin,23.0,40029036,"[40037211, 40036800, 40036875, 40036837, 40036998, 40036691, 40036950, 40036981, 40037323, 40037137]",88,1713074725,How Shazam Works (2003) [pdf],story,https://ismir2003.ismir.net/presentations/Wang.pdf,
mihaich,3.0,40035919,"[40038832, 40037612]",21,1713142090,Show HN: Semantic Search React Component,story,https://github.com/Mihaiii/semantic-autocomplete,"If you&#x27;ve ever used CTRL+F on websites or documentation, you&#x27;ll love this functionality."
kiwicopple,91.0,40028111,"[40028894, 40031524, 40028694, 40029226, 40031713, 40029971, 40029409, 40029335, 40029004, 40029276, 40028821, 40030302, 40028879, 40029209, 40031943, 40031774, 40031306, 40029083, 40032061, 40028112, 40030132]",382,1713060876,Show HN: PostgreSQL index advisor,story,https://github.com/supabase/index_advisor,"This is a Postgres extension that can determine if a query should have an index. For example, for this table:<p><pre><code>    create table book(
      id int primary key,
      title text not null
    );
</code></pre>
You can run `index_advisor()` to see if there should be an index on a select statement:<p><pre><code>    select *
    from index_advisor(&#x27;select book.id from book where title = $1&#x27;);
</code></pre>
And it will return (summarized):<p><pre><code>    {&quot;CREATE INDEX ON public.book USING btree (title)&quot;}
</code></pre>
It works particularly well with pg_stat_statements[0] which tracks execution statistics of all SQL statements executed on your Postgres database.<p>It leans heavily on HypoPG[1], an excellent extension to determine if PostgreSQL will use a given index without spending resources to create them.<p>[0] pg_stat_statements: <a href=""https:&#x2F;&#x2F;www.postgresql.org&#x2F;docs&#x2F;current&#x2F;pgstatstatements.html"" rel=""nofollow"">https:&#x2F;&#x2F;www.postgresql.org&#x2F;docs&#x2F;current&#x2F;pgstatstatements.htm...</a><p>[1] <a href=""https:&#x2F;&#x2F;github.com&#x2F;HypoPG&#x2F;hypopg"">https:&#x2F;&#x2F;github.com&#x2F;HypoPG&#x2F;hypopg</a>"
Gooblebrai,74.0,40034972,"[40041538, 40041153, 40035400, 40035348, 40040836, 40038898, 40041259, 40035273, 40035574, 40035161, 40035550, 40035425, 40035165, 40038233, 40035301, 40035183, 40035764, 40037691, 40036173, 40036256, 40035502, 40035134, 40038730, 40035341, 40035554, 40035215, 40035148, 40035488, 40035345, 40035682, 40036415, 40036322, 40035619]",91,1713133143,Ask HN: Is RAG the Future of LLMs?,story,,It seems to be in vogue that RAG is one of the best solutions to reduce the problem of hallucinations in LLMs.<p>What do you think? Are there any other alternatives or solutions on sight?
peutetre,1.0,40039391,[40040699],4,1713182573,The hero tax: Why 'selfless' workers are professionally exploited,story,https://www.bbc.com/worklife/article/20240409-heroic-jobs-earn-less-money,
Turukawa,65.0,40038395,"[40039377, 40038565, 40039088, 40038820, 40038783, 40039491, 40038602, 40040486, 40038903, 40038642, 40038920, 40038829, 40038956]",54,1713173642,'We're the last bastion of rental': video stores resisting rise of streaming,story,https://www.theguardian.com/film/2024/apr/15/uk-video-rental-shops,
keepamovin,71.0,40004349,"[40036778, 40037244, 40040876, 40037267, 40037696, 40037966, 40036405, 40036649, 40036973, 40037685, 40036599, 40037176, 40036714, 40036519, 40036855, 40037497]",127,1712854776,"One man's artistic wonderland, created in rental, gets protected status",story,https://www.cnn.com/2024/04/07/style/rental-apartment-artwork-listed-gbr-scli-intl-gbr/index.html,
n2d4,64.0,40031090,"[40033615, 40033493, 40038587, 40033260, 40034912, 40033252, 40034722, 40031213, 40033251, 40033006, 40036418, 40033002, 40033337, 40034931, 40033402, 40035211, 40033449, 40036024, 40033273, 40039670, 40033478, 40036992, 40033693, 40034785, 40033513, 40035777, 40033186, 40031463, 40033059]",128,1713103211,"Show HN: Stack, an open-source Clerk/Firebase Auth alternative",story,https://stack-auth.com/blog/introducing-stack,"Hey HN! Happy to finally launch Stack. We made it because we like to put apps into production quickly, and authentication &amp; user management was taking up way too much time.<p>We have components like &lt;SignIn &#x2F;&gt; and &lt;AccountSettings &#x2F;&gt; that automatically adapt to whatever theme &amp; design system you&#x27;re using. Check the blog post to see the example with Radix UI and Joy UI.<p>Also, there&#x27;s an admin dashboard for monitoring and editing accounts. Stack is 100% AGPL&#x2F;MIT-licensed, so you can self-host it.<p>Cheers!"
Alex3917,72.0,40033261,"[40041448, 40035193, 40035342, 40034813, 40035008, 40036654, 40034348, 40036422, 40036510, 40037451, 40035803, 40035612, 40034995, 40036287]",67,1713119749,The Battle to Define Mental Illness (2010),story,https://www.wired.com/2010/12/ff-dsmv/,
popol12,0.0,40038738,,5,1713177470,Albino Redwood,story,https://en.wikipedia.org/wiki/Albino_redwood,
wglb,3.0,40008409,[40024423],22,1712883306,"Beautiful nebula, violent history: Clash of stars solves stellar mystery",story,https://phys.org/news/2024-04-beautiful-nebula-violent-history-clash.html,
tspeterkim,68.0,40014711,"[40030840, 40031743, 40030182, 40025145, 40033581, 40024542, 40030674, 40031964, 40024026, 40023996, 40031952, 40030081, 40030091, 40039904]",230,1712939271,The One Billion Row Challenge in CUDA,story,https://tspeterkim.github.io/posts/cuda-1brc,
cullmann,112.0,40032869,"[40034742, 40033399, 40033591, 40034964, 40034603, 40037271, 40035676, 40033408, 40033453, 40033679, 40034691, 40033443, 40034069, 40033764, 40034946, 40034765, 40034737, 40033586, 40034579, 40037764, 40033877, 40036989, 40035486, 40037234, 40036818, 40033978, 40037623, 40032870, 40034956]",274,1713116820,Kate editor on all platforms,story,https://cullmann.io/posts/kate-on-all-platforms-2024/,
TheFreim,0.0,40039143,,3,1713180825,Zooming User Interface (ZUI),story,https://en.wikipedia.org/wiki/Zooming_user_interface,
owulveryck,10.0,40014708,"[40036378, 40025252, 40024933]",83,1712939254,Data-as-a-Product and Data-Contract: An evolutionary approach to data maturity,story,https://blog.owulveryck.info/2024/04/09/data-as-a-product-and-data-contract-an-evolutionary-approach-to-data-maturity.html,
jbegley,24.0,40035630,"[40040292, 40035796, 40040408, 40037675, 40038760, 40039167, 40040603, 40039309, 40037258, 40038715, 40037909, 40036923]",50,1713139052,The Intercept Is Running Out of Cash,story,https://www.semafor.com/article/04/14/2024/the-intercept-is-running-out-of-cash,
asadalt,88.0,40033490,"[40035347, 40035144, 40034771, 40037027, 40034908, 40035654, 40033654, 40034344, 40037269, 40034921, 40033706, 40034020, 40035111, 40036878, 40034472, 40036587, 40034094, 40033720, 40035014, 40034327, 40034176, 40035123, 40037011, 40037354, 40034963, 40034413, 40034102, 40035110, 40033894, 40038526, 40038269, 40038225, 40033872, 40034151, 40036524, 40033514, 40035254, 40034397]",387,1713121438,Show HN: I made a tool to clean and convert any webpage to Markdown,story,https://markdowndown.vercel.app/,"My partner usually writes substack posts which I then mirror to our website’s blog section.<p>To automate this, I made a simple tool to scrape the post and clean it so that I can drop it to our blog easily. This might be useful to others as well.<p>Oh and ofcourse you can instruct GPT to make any final edits :D"
nalgeon,52.0,40030308,"[40039917, 40039666, 40030431, 40039710, 40040144, 40039779]",39,1713093165,Travelling with Tailscale,story,https://mrkaran.dev/posts/travel-tailscale/,
manibaur,16.0,40036536,"[40037383, 40039358, 40037107, 40037705, 40039186, 40037363, 40037903, 40037161, 40037332, 40038310, 40037073, 40037142, 40037126, 40037218]",34,1713148163,Ask HN: What tool(s) do you use to code review and deploy SQL scripts?,story,,"Say you&#x27;re an engineer that needs to deploy a SQL script to a production database; you need it peer-reviewed and (hopefully) approved by a chain of approvers who gate-keep production databases; what tool do you currently use?<p>I&#x27;m assuming you&#x27;ll also need this script&#x2F;change to go through QA and staging before it reaches Prod. The only tool I found, short of daisy chaining a bunch of GitHub actions, that does this is RedGate Deploy.<p>Curious to learn how y&#x27;all are achieving this today."
Stratoscope,22.0,40037959,"[40041561, 40041278, 40039301, 40038331, 40039066, 40040335]",35,1713168001,Mid-level Nvidia employee gets $62M in stock options; another lost it all,story,https://www.tomshardware.com/pc-components/gpus/nvidia-employees-make-fortunes-and-foul-ups-with-their-stock-options-a-story-of-millionaire-winners-and-losers,
kamikaz1k,39.0,40033659,"[40034455, 40034317, 40034248, 40034453, 40036756, 40035815, 40034096]",101,1713122821,A primer on x86 by Casey Muratori and The Primeagen [video],story,https://www.youtube.com/watch?v=xCBrtopAG80,
panabee,0.0,40035185,,9,1713134856,Patchscopes: A framework for viewing hidden representations of language models,story,https://research.google/blog/patchscopes-a-unifying-framework-for-inspecting-hidden-representations-of-language-models/,
mihirchronicles,40.0,40014540,"[40024992, 40024365, 40024288, 40027120, 40028492, 40037950, 40024690, 40038443, 40026290, 40024641, 40024620, 40014541]",55,1712938475,Monkey Management,story,https://mihirchronicles.com/monkey-management/,
catatsuy,28.0,40020779,"[40037814, 40034698, 40038981, 40038255, 40034651, 40037688, 40036556, 40036300, 40034821, 40036959, 40020780, 40034807]",62,1712986749,Show HN: Purl – A Simple Tool for Text Processing,story,https://github.com/catatsuy/purl,"Hello HN community,<p>I&#x27;m excited to share a new command-line tool I developed called purl, inspired by the simplicity of Perl one-liners for efficient text processing. Purl features include Perl-like regex that simplifies text manipulation, it&#x27;s cross-platform so works equally well on macOS, Linux, etc., and it&#x27;s quick and easy to install. The tool also supports simple commands such as -replace, -filter, and -exclude, and offers optional color output to enhance readability.<p>Purl is a practical alternative to traditional tools like sed and grep, designed to address some of their common limitations.<p>For more information and to try purl yourself, visit: <a href=""https:&#x2F;&#x2F;github.com&#x2F;catatsuy&#x2F;purl"">https:&#x2F;&#x2F;github.com&#x2F;catatsuy&#x2F;purl</a><p>I appreciate any feedback!"
creer,1.0,40037898,"[40038732, 40037937]",6,1713167003,Builder's remedy was supposed to 'Manhattanize' the Bay Area,story,https://www.mercurynews.com/2024/04/14/builders-remedy-was-supposed-to-manhattanize-the-bay-area-so-where-are-all-the-houses/,
