by,descendants,id,kids,score,time,title,type,url,text
tosh,13.0,40269606,"[40279880, 40271545, 40281309, 40273767, 40275898, 40271729, 40274471, 40272335, 40272291]",15,1714952052,Unicode 16: Symbols for Legacy Computing Supplement [pdf],story,https://www.unicode.org/charts/PDF/Unicode-16.0/U160-1CC00.pdf,
JumpCrisscross,0.0,40279323,,4,1715028440,"Wozniak's space firm, Privateer, buys Orbital Insight, raises $56.5M",story,https://www.reuters.com/markets/deals/wozniaks-space-firm-privateer-buys-orbital-insight-raises-565-million-2024-05-06/,
spenrose,94.0,40258037,"[40259830, 40265067, 40263062, 40259928, 40261804, 40261635, 40260408, 40264005, 40261178, 40259904, 40263244, 40260429, 40262471, 40263401, 40259899, 40260544]",342,1714833764,How to build a $20B semiconductor fab,story,https://www.construction-physics.com/p/how-to-build-a-20-billion-semiconductor,
benjbrooks,80.0,40276687,"[40277190, 40277194, 40277733, 40277008, 40276909, 40278337, 40281099, 40276735, 40277017, 40276856, 40277103, 40278201, 40276757, 40276771, 40276851, 40277125, 40277685, 40277489, 40280315, 40276908, 40277277, 40278475, 40278243, 40277295, 40279173, 40276748, 40277950, 40276806, 40276794, 40276982, 40276999, 40276841, 40277458, 40276770, 40278855, 40276895, 40277965, 40277099, 40277563, 40278836, 40278744, 40277525, 40277212, 40276928, 40276741, 40276744]",95,1715014441,Ask HN: How to do simple heartbeat monitoring?,story,,"Hey there!<p>My team is hosting an API that sends open telemetry data to Signoz &amp; manages on-call via PagerDuty. We&#x27;ve configured Signoz to hit Pagerduty when there&#x27;s a series of 500 errors.<p>However, our server went down last night and NO opentel data was sent to Signoz. We weren&#x27;t notified that the server went down as there weren&#x27;t 500 responses to report. What&#x27;s the easiest way to have a cron-like query hit our API and integrate with our existing stack? Is this feasible with our existing vendors? Should I have a serverless function running on a timer that uses Pagerduty&#x27;s API? Should I be migrating to another monitoring service?<p>Any advice would be appreciated!"
anarbadalov,80.0,40273780,"[40276295, 40276376, 40278616, 40278430, 40277279, 40281547, 40278476, 40278398, 40278106, 40278490, 40277239, 40276424]",91,1714998067,Daniel Dennett: 'Where Am I?',story,https://thereader.mitpress.mit.edu/daniel-dennett-where-am-i/,
bookofjoe,5.0,40266382,"[40267115, 40267097, 40267089, 40268860, 40274099]",60,1714928847,"Dick Rutan, co-pilot of historic round-the-world flight, has died",story,https://www.theguardian.com/world/article/2024/may/04/dick-rutan-pilot-dies-aged-85,
joeig,2.0,40276465,"[40282871, 40276860]",19,1715013065,Largest model railway launches inductive Formula 1 circuit [video],story,https://www.youtube.com/watch?v=1fikd9NfsSA,
the_decider,7.0,40275639,"[40277218, 40280952, 40276871]",16,1715008506,Large language models are poor medical coders,story,https://ai.nejm.org/doi/full/10.1056/AIdbp2300040,
speckx,15.0,40260210,"[40260872, 40261251, 40261878, 40266685, 40263600, 40263951, 40264226, 40264268, 40265045, 40263646]",234,1714856162,Atari's Mike Jang,story,https://arcadeblogger.com/2024/02/13/ataris-mike-jang/,
gnabgib,0.0,40280225,,4,1715034442,Sex-Specific Brain Responses to Alcohol Craving,story,https://neurosciencenews.com/alcohol-brain-sex-differences-26043/,
coloneltcb,13.0,40279133,"[40280336, 40279463, 40280428, 40281826, 40280457, 40280508]",13,1715027370,The AI Music Era Is Here. Not Everyone Is a Fan,story,https://www.bloomberg.com/news/articles/2024-05-06/suno-udio-and-more-the-ai-music-era-is-here-not-everyone-is-a-fan,
PaulHoule,1.0,40280177,[40280193],3,1715034059,"10 years in the making, retro game emulator Delta is now #1 on the iOS charts",story,https://techcrunch.com/2024/05/03/retro-game-emulator-delta-app-store-ios/,
Brajeshwar,121.0,40258273,"[40259154, 40261676, 40258669, 40262658, 40259689, 40259478, 40261675, 40258902, 40269637, 40264148, 40259123, 40259223, 40261719]",84,1714835748,Was the Stone Age the Wood Age?,story,https://www.nytimes.com/2024/05/04/science/archaeology-neanderthals-wood.html,
paulpauper,297.0,40268204,"[40269243, 40269742, 40268602, 40269288, 40270796, 40270263, 40273976, 40270567, 40270496, 40269884, 40272295, 40272737, 40270552, 40270787, 40269763, 40271071, 40271239, 40269651, 40269248, 40269002, 40275978, 40270405, 40270303, 40269553, 40268967, 40269375, 40270649, 40270308, 40269061]",300,1714942117,“Meta spent almost as much as the Manhattan Project on GPUs in today's dollars”,story,https://twitter.com/emollick/status/1786213463456448900,
Wavum,83.0,40269945,"[40276099, 40270888, 40271560, 40270522, 40270275, 40273239, 40272145, 40277076, 40270900, 40272129, 40271933, 40270311, 40279121, 40279936, 40276374, 40272496, 40273194, 40270697, 40271042, 40272802, 40271279, 40275920, 40271433, 40271156, 40271931, 40271927, 40270436, 40279942, 40280520]",108,1714955397,Ask HN: What's the most life-changing blog post you've ever read?,story,,"... any blog post that had a major impact on your life, workflow, career, understanding, etc. qualifies."
MilnerRoute,33.0,40268523,"[40269244, 40275327, 40269309, 40273880, 40271710, 40269230, 40270741, 40270954, 40272182, 40272280]",83,1714944051,"Amazon CEO Andy Jassy violated labor law with union comments, NLRB rules",story,https://www.seattletimes.com/business/amazon/amazon-ceo-andy-jassy-violated-labor-law-with-union-comments-nlrb-rules/,
jseliger,0.0,40280080,,3,1715033331,Chip Shot: China will conquer semiconductors,story,https://newsletter.doomberg.com/p/chip-shot,
andsoitis,101.0,40265456,"[40266031, 40266397, 40265695, 40266341, 40266330, 40266306, 40265897, 40265821, 40265853, 40266564, 40266251, 40266356, 40269112, 40267830, 40269473, 40268755, 40265939, 40267130, 40269411, 40270579, 40265751]",77,1714921825,Let insects eat your plants,story,https://www.bbc.com/future/article/20240503-why-you-should-let-insects-eat-your-plants,
r4um,0.0,40272980,[40273196],3,1714990338,Symmetry,story,http://theprogrammersparadox.blogspot.com/2024/05/symmetry.html,
gulced,2.0,40279984,"[40281081, 40281742]",25,1715032693,"Apple Illegally Interrogated NYC Retail Staff, US Labor Board Rules",story,https://www.bloomberg.com/news/articles/2024-05-06/apple-illegally-interrogated-nyc-retail-staff-us-labor-board-rules,
botanical,228.0,40262190,"[40263203, 40262327, 40262250, 40262309, 40262330, 40262379, 40263362, 40264023, 40262350, 40262518, 40264950, 40262406, 40263936, 40262304, 40271325, 40265921, 40262307, 40264183, 40263114, 40262428, 40264531]",222,1714882436,Judge mulls sanctions over Google's destruction of internal chats,story,https://arstechnica.com/tech-policy/2024/05/judge-mulls-sanctions-over-googles-shocking-destruction-of-internal-chats/,
thunderbong,13.0,40262643,"[40263526, 40265542, 40265482, 40264715, 40266303, 40265496, 40264187]",70,1714889155,New scanning electron microscope tech sees magnetic field with 100nm resolution,story,https://papers.ssrn.com/sol3/papers.cfm?abstract_id=4812984,
jicea,2.0,40276451,"[40277844, 40277452]",9,1715012943,Artifact Attestations–now in public beta,story,https://github.blog/2024-05-02-introducing-artifact-attestations-now-in-public-beta/,
bikenaga,55.0,40261001,"[40265837, 40261827, 40261414, 40261741, 40261700, 40261507, 40261409, 40261852, 40264494, 40266559, 40266739, 40262441, 40262887, 40261805]",155,1714863750,Vera Rubin's primary mirror gets its first reflective coating,story,https://www.universetoday.com/166842/vera-rubins-primary-mirror-gets-its-first-reflective-coating/,
osm3000,127.0,40263168,"[40276570, 40263614, 40263855, 40263630, 40263804, 40267047, 40263845, 40263662, 40263531, 40264317]",96,1714897884,US prepares to exempt AUKUS nations from ITAR,story,https://www.naval-technology.com/news/us-prepares-to-scrap-itar-for-aukus-nations/,
tosh,11.0,40255611,"[40260625, 40262645, 40260365, 40270810]",40,1714806854,Plotille: Plot in the terminal using Braille dots,story,https://github.com/tammoippen/plotille,
Virock,0.0,40272677,,4,1714986267,Show HN: Gets words that best describe the given description,story,https://reverse-dictionary.virock.org,Ever been in a situation where you can’t remember a word? You know what the word means but not the word itself? Give Reverse Dictionary the description and it will return the words you are looking for.
okl,70.0,40263479,"[40266505, 40265544, 40264149, 40266841, 40264826, 40264246, 40264613, 40266541, 40264032]",151,1714902268,Debian 64-bit-time transition,story,https://wiki.debian.org/ReleaseGoals/64bit-time,
gulced,0.0,40281789,,5,1715049687,Google sues CRTC to have YouTube ad revenue exempted from regulatory fees,story,https://financialpost.com/technology/google-sues-crtc-youtube-ad-revenue,
pjmlp,0.0,40272514,,3,1714984802,How to Use the Foreign Function API in Java 22 to Call C Libraries,story,https://ifesunmola.com/how-to-use-the-foreign-function-api-in-java-22-to-call-c-libraries/,
rendaw,13.0,40271548,"[40273544, 40275604, 40274508, 40274212, 40274448, 40274445, 40274291]",22,1714974906,Testing a new version of Stack Overflow Jobs,story,https://meta.stackexchange.com/questions/399440/testing-a-new-version-of-stack-overflow-jobs,
vwoolf,9.0,40270360,"[40273249, 40271342, 40270958]",33,1714959782,TSMC says Arizona fab is now ahead of schedule,story,https://www.datacenterdynamics.com/en/news/tsmc-updates-arizona-fab-production-timeline-signs-semiconductor-talent-agreement-with-kyushu-university/,
nicowaltz,181.0,40260259,"[40263157, 40260788, 40266491, 40261194, 40265511, 40261289, 40260832, 40263065, 40260968, 40260690, 40262957, 40266567, 40263636, 40260789, 40261308, 40264155, 40261069, 40262871, 40261129, 40262557, 40261492, 40264371, 40260805, 40260785, 40261281, 40265910, 40261258, 40261125, 40264211, 40265337, 40260916, 40262340, 40261790, 40262046, 40261998, 40261603, 40261391, 40263710, 40261394, 40261658, 40261227, 40261064, 40261966, 40266369, 40262453, 40260851, 40261343, 40261349]",254,1714856635,"Show HN: gpudeploy.com – ""Airbnb"" for GPUs",story,https://www.gpudeploy.com,"Hi HN,<p>YC w24 company here. We just pivoted from drone delivery to build gpudeploy.com, a website that routes on-demand traffic for GPU instances to idle compute resources.<p>The experience is similar to lambda labs, which we’ve really enjoyed for training our robotics models, but their GPUs are never available for on-demand. We are also trying to make it more no-nonsense (no hidden fees, no H100 behind “contact sales”, etc.).<p>The tech to make this work is actually kind of nifty, we may do an in-depth HN post on that soon.<p>Right now, we have H100s, a few RTX 4090s and a GTX 1080 Ti online. Feel free to try it out!<p>Also, if you’ve got compute sitting around (a GPU cluster, a crypto mining operation or just a GPU) or if you’re an AI company with idle compute (hopefully not in a Stability AI way) and want to see some ROI, it’s very simple and flexible to hook it up to our site and you’ll maybe get a few researchers using your compute.<p>Nice rest of the week!"
jtwaleson,3.0,40268011,[40272471],17,1714940923,The long long tail of AI applications,story,https://blog.waleson.com/2024/05/the-long-long-tail-of-ai-applications.html,
crazythursday,4.0,40272506,"[40272523, 40275182, 40272539, 40279345]",12,1714984703,Is Google Analytics Broken?,story,,I&#x27;ve found it not responding on my browser.
tosh,1.0,40255649,"[40262912, 40261743]",42,1714807366,CookingSense: A Culinary Knowledgebase with Multidisciplinary Assertions,story,https://arxiv.org/abs/2405.00523,
throwoutway,1.0,40281679,[40281708],3,1715048614,Planned crewed launch of Boeing's Starliner spacecraft scrubbed,story,https://www.cbsnews.com/news/boeing-starliner-launch-space-station-crew/,
mstats,6.0,40259505,"[40266972, 40269424, 40270668]",12,1714848507,YC’s founder-matching service helped medical records AI startup Hona,story,https://techcrunch.com/2024/05/03/y-combinator-founder-matching-tool-hona-medical-ai-startup/,
tosh,1.0,40269020,[40271105],11,1714947324,Livegrep: Interactively Grep Source Code,story,https://github.com/livegrep/livegrep,
ldenoue,5.0,40267006,"[40273646, 40270920]",15,1714933418,Show HN: Free web app to read YouTube transcripts and highlight them,story,https://www.appblit.com/scribe,
racional,2.0,40280902,"[40281953, 40281803]",9,1715040344,Russia to Hold Drills on Tactical Nuclear Weapons in New Tensions with West,story,https://www.nytimes.com/2024/05/06/world/europe/russia-tactical-nuclear-weapons-drills.html,
nsoonhui,691.0,40262921,"[40267353, 40267547, 40270369, 40267615, 40268044, 40269294, 40263252, 40267516, 40270046, 40269431, 40269647, 40269154, 40268956, 40269380, 40269724, 40271140, 40263304, 40263232, 40267840, 40269844, 40271309, 40267462, 40267530, 40269625, 40269084, 40271715, 40270798, 40270250, 40269507, 40269333, 40272679, 40269437, 40268404, 40267761, 40269253, 40271552, 40269277, 40267468, 40267887, 40263282, 40267321, 40269698, 40267574, 40268346, 40270859, 40268581, 40269910, 40269302, 40267499, 40264064, 40267354, 40267726, 40268604, 40268518, 40263228, 40268824, 40269703, 40267444, 40263446, 40270550, 40268979, 40270519, 40268745, 40263284, 40269494]",905,1714893266,MIT abandons requirement of DEI statements for hiring and promotions,story,https://whyevolutionistrue.com/2024/05/04/mit-abandons-use-of-dei-statements/,
orcul,24.0,40267723,"[40272997, 40268428, 40281242, 40270777, 40278498, 40271055, 40270806, 40269569]",52,1714939277,Ten years ago Microsoft bought Nokia's phone unit – then killed it,story,https://www.theregister.com/2024/05/05/microsoft_nokia_anniversary/,
jdmark,0.0,40270309,,9,1714959359,An Overview of Defensive Tactics from the Modern History of Urban Warfare,story,https://mwi.westpoint.edu/defending-the-city-an-overview-of-defensive-tactics-from-the-modern-history-of-urban-warfare/,
nrabulinski,0.0,40271797,,4,1714977304,Pair Your Compilers at the ABI Café,story,https://faultlore.com/blah/abi-puns/,
croes,0.0,40279028,,3,1715026760,Image shows atoms transforming into quantum waves as Schrödinger predicted,story,https://www.livescience.com/physics-mathematics/quantum-physics/stunning-image-shows-atoms-transforming-into-quantum-waves-just-as-schrodinger-predicted,
stoniejohnson,10.0,40256173,"[40256840, 40260450, 40261299, 40256833, 40256824, 40257007, 40260502]",138,1714814865,The Matrix: A Bayesian learning model for LLMs,story,https://arxiv.org/abs/2402.03175,
YeGoblynQueenne,117.0,40257064,"[40258571, 40257243, 40258054, 40258093, 40258416, 40258396, 40263943, 40259125, 40263873, 40259973, 40261684, 40258936, 40258588, 40258712, 40260243, 40258051]",193,1714824799,Vulture shortage threatens Zoroastrian burial rites,story,https://www.theguardian.com/world/article/2024/may/04/vulture-shortage-threatens-zoroastrian-burial-rites-india-iran-pakistan,
iruoy,4.0,40274863,"[40276101, 40276412]",10,1715004448,"Fedora Cleared to Build Python Package with ""-O3"" Optimizations",story,https://www.phoronix.com/news/FESCo-Approves-Fedora-Python-O3,
thunderbong,0.0,40266062,,11,1714926533,Advance in light-based computing shows capabilities for future smart cameras,story,https://newsroom.ucla.edu/releases/light-based-computing-advance-capabilities-future-smart-cameras,
jjgreen,1190.0,40267639,"[40267756, 40268301, 40267806, 40267932, 40268167, 40267999, 40267920, 40275067, 40267846, 40267843, 40267902, 40271764, 40267844, 40268421, 40267866, 40268589, 40268004, 40267804, 40269801, 40274173, 40274139, 40269445, 40269121, 40267966, 40269191, 40267835, 40280710, 40270984, 40269782, 40267894, 40268938, 40271904, 40268597, 40271994, 40267905, 40270793, 40272674, 40269013, 40272686, 40270000, 40272196, 40267962, 40273264, 40271124, 40268086, 40267749, 40269802, 40273208, 40268370, 40267963, 40269541, 40271558, 40271347, 40268005, 40270319, 40273846, 40267813, 40268592, 40268513, 40268016, 40267733, 40268371, 40268021, 40271885, 40267798, 40267809, 40273216, 40271259]",741,1714938659,Israel shuts down local Al Jazeera offices,story,https://www.theguardian.com/world/article/2024/may/05/israel-shuts-down-local-al-jazeera-offices-in-dark-day-for-the-media,
TotalCrackpot,107.0,40257677,"[40259831, 40260266, 40259509, 40259815, 40260198, 40260108, 40260461, 40260822, 40259724, 40259518, 40259968, 40260582, 40260180, 40261084, 40265655, 40261777, 40260089, 40259546, 40260184, 40269577, 40261143, 40261701, 40261221, 40261163, 40261772, 40260279, 40259510]",265,1714830718,In Praise of Idleness (1932),story,https://harpers.org/archive/1932/10/in-praise-of-idleness/,
soopurman,43.0,40266784,"[40267264, 40267214, 40273539, 40267867, 40267987, 40267540, 40267751, 40267884, 40268040, 40267685, 40267288, 40267402]",50,1714931815,Ansible is a Lisp?,story,https://astrid.tech/2024/05/01/0/ansible-is-a-lisp/,
not_a_boat,77.0,40257843,"[40258156, 40259351, 40257939, 40258726, 40258733, 40259630, 40258169, 40257942, 40258789, 40258484, 40258912, 40259091, 40258626, 40257960, 40257902, 40258933]",120,1714832221,The Mirror Fusion Test Facility (2023),story,https://www.beautifulpublicdata.com/the-mirror-fusion-test-facility/,
commspam,9.0,40261023,"[40263117, 40262465, 40261039, 40262749]",32,1714863984,Hymn for Walpurgisnacht,story,https://themillions.com/2024/04/hymn-for-walpurgisnacht.html,
gulced,7.0,40268576,"[40270364, 40268577]",38,1714944373,Shell sold 'phantom' carbon credits,story,https://www.ft.com/content/93938a1b-dc36-4ea6-9308-170189be0cb0,
helix278,3.0,40267120,[40270204],47,1714934244,Monaspace font 1.1 released,story,https://github.com/githubnext/monaspace/releases/tag/v1.100,
petethomas,22.0,40269754,"[40272706, 40271484, 40275514, 40275232, 40274203, 40273422]",26,1714953452,Book People Think They Know Why 9-Year-Olds Stop Reading for Fun,story,https://slate.com/culture/2024/05/kids-reading-fun-books-decline-by-nine-crisis.html,
ganzuul,0.0,40278172,,3,1715021627,Snail-Inspired Robotic Swarms,story,https://www.youtube.com/watch?v=aNw92VlH3rA,
rodarima,104.0,40260035,"[40260597, 40263313, 40260167, 40260193, 40260188, 40260520, 40260157, 40260513, 40262631, 40260634, 40261861, 40261791, 40260621, 40260329, 40261614, 40260829, 40269657, 40261606, 40260604, 40260770, 40260163, 40260174, 40261625, 40260215, 40260909, 40260265, 40260668, 40260781]",421,1714854174,Show HN: Dillo 3.1.0 released after 9 years,story,https://dillo-browser.github.io/latest.html,"As commented before[1], I&#x27;ve been working on the past months to get the Dillo
back to life and today I&#x27;m happy to release the 3.1.0 version, after almost 9
years since the last one.<p>[1]: <a href=""https:&#x2F;&#x2F;news.ycombinator.com&#x2F;item?id=38847613"">https:&#x2F;&#x2F;news.ycombinator.com&#x2F;item?id=38847613</a><p>During this time:<p>- A new mailing list was created[2] which is beginning to get
some messages and patches. It is available in gmane via NNTP at
gmane.comp.web.dillo.devel.<p>[2]: <a href=""https:&#x2F;&#x2F;lists.mailman3.com&#x2F;hyperkitty&#x2F;list&#x2F;dillo-dev@mailman3.com&#x2F;"" rel=""nofollow"">https:&#x2F;&#x2F;lists.mailman3.com&#x2F;hyperkitty&#x2F;list&#x2F;dillo-dev@mailman...</a><p>- A LiberaPay page[3] which received the first donations (thanks!).<p>[3]: <a href=""https:&#x2F;&#x2F;liberapay.com&#x2F;dillo&#x2F;"" rel=""nofollow"">https:&#x2F;&#x2F;liberapay.com&#x2F;dillo&#x2F;</a><p>- Some more bugs where fixed and new features where added (details in the
release page and&#x2F;or changelog).<p>Thanks to all the people that contributed with patches and tests. Now let&#x27;s see
if we can make it land in some distros!"
andsoitis,1.0,40269931,[40269956],27,1714955287,Bluesky confirms Jack Dorsey is no longer on its board,story,https://www.theverge.com/2024/5/5/24149543/jack-dorsey-gone-bluesky-board,
chapulin,115.0,40267072,"[40265635, 40266688, 40267539, 40266143, 40266889, 40266851, 40265789, 40267606, 40265731, 40267332, 40267294, 40269145, 40266431, 40265787, 40274137, 40268192, 40265721, 40272609, 40266629, 40265664, 40267141, 40266943, 40266138, 40265739]",46,1714933929,Recruiters are going analog to fight the AI application overload,story,https://www.wired.com/story/recruiters-ai-application-overload/,
calebjosue,12.0,40260862,"[40260977, 40263947, 40263420, 40266947, 40266954, 40277907]",112,1714862272,Tell HN: A note of gratitude to the people providing answers over here,story,,A couple of days ago I explained my current job situation and asked for a job.<p>Here&#x27;s a note of gratitude to the people answering questions all over the world.<p>Thanks!<p>https:&#x2F;&#x2F;calebjosue.gigalixirapp.com&#x2F;blog.html#gratitude
gaws,1.0,40280750,"[40281748, 40280811]",5,1715039131,The 2024 Pulitzer Prize Winners and Finalists,story,https://www.pulitzer.org/prize-winners-by-year/2024,
fanf2,31.0,40257601,"[40260372, 40260048, 40258500, 40258738, 40259450, 40259120]",105,1714830122,CBMC: C bounded model checker (2021),story,http://www.cprover.org/cbmc/,
arcanus,27.0,40258804,"[40260079, 40259545, 40262886, 40260324]",94,1714841237,Porting HPC Applications to AMD Instinct MI300A Using Unified Memory and OpenMP,story,https://arxiv.org/abs/2405.00436,
gulced,34.0,40268811,"[40269432, 40274742, 40274965, 40271864, 40271685, 40269440, 40269280, 40269485, 40269504, 40270027, 40272743, 40270368, 40270042]",31,1714945864,How coffee became a joke,story,https://www.honest-broker.com/p/how-coffee-became-a-joke,
Kye,1.0,40267891,"[40268077, 40268931]",38,1714940345,Jack Dorsey is no longer on Bluesky's board,story,https://bsky.app/profile/bsky.app/post/3krrebumv3k2h,
kdamica,88.0,40271457,"[40272994, 40272801, 40273045, 40272541, 40273347, 40273056, 40276785, 40273427, 40273775, 40272852]",203,1714974002,"How LLMs Work, Explained Without Math",story,https://blog.miguelgrinberg.com/post/how-llms-work-explained-without-math,
lermontov,2.0,40253494,[40255350],21,1714779479,Art and Memory,story,https://www.lrb.co.uk/the-paper/v46/n09/julian-barnes/diary,
Netherland4TW,2.0,40276996,"[40281421, 40280995]",5,1715016096,Schools May Be Too Focused on Mental Health,story,https://www.nytimes.com/2024/05/06/health/mental-health-schools.html,
robertvc,52.0,40261319,"[40261955, 40270628, 40270726, 40272385, 40270825, 40272468, 40269929]",68,1714867428,A mostly complete guide to React rendering behavior (2020),story,https://blog.isquaredsoftware.com/2020/05/blogged-answers-a-mostly-complete-guide-to-react-rendering-behavior/,
conelion,5.0,40272571,"[40282837, 40280893, 40274439, 40273724, 40275093]",13,1714985334,Ask HN: Looking for good industrial design news/resources/discussions/books,story,,"Hey all, I&#x27;ve recently developed an interest in industrial design, particularly inspired by the works of figures like Max Bill. I want to explore more about this field and would like an easy in. I&#x27;m not necessarily looking for academic or career-oriented insights. I&#x27;d like to find resources&#x2F;discussions from people who have similar interests, like the discussions on HN. Thanks in advance!"
PaulHoule,0.0,40266268,,4,1714928081,Towards a Holistic Evaluation of LLMs on Factual Knowledge Recall,story,https://arxiv.org/abs/2404.16164,
adif_sgaid,2.0,40272875,"[40275155, 40275204]",39,1714988724,Pure-PyTorch Implementation of Kolmogorov-Arnold Network (Kan),story,https://github.com/Blealtan/efficient-kan,
jksk61,0.0,40262728,,10,1714890844,The Promise of SGLT2 Inhibitors,story,https://worksinprogress.co/issue/the-future-of-kidney-treatment/,
siddharthgoel88,8.0,40277791,"[40278484, 40278531, 40278549, 40278547, 40278533]",24,1715019600,OpenAI API Partnership with Stack Overflow,story,https://openai.com/index/api-partnership-with-stack-overflow,
ranit,6.0,40271978,[40272598],10,1714979270,The rise of Sweden's super rich,story,https://www.bbc.com/news/business-68927238,
edward,191.0,40263194,"[40263432, 40265829, 40263416, 40263654, 40263807, 40263786, 40263716, 40263656, 40263752, 40263723, 40263521, 40278794, 40265406, 40263458, 40263616, 40266870, 40263422, 40267317, 40265600, 40266647, 40265873, 40263701, 40271573, 40263736, 40263445]",107,1714898369,Flags Are Not Languages,story,https://www.flagsarenotlanguages.com/blog/,
onatm,173.0,40274371,"[40275650, 40275671, 40274952, 40275528, 40275090, 40275050, 40275481, 40275570, 40275611, 40274836, 40275243, 40275078, 40275575, 40276009, 40280113, 40274933, 40280693, 40274715, 40275133, 40274880, 40275239, 40275288, 40275252, 40274724, 40276059, 40275642, 40276790, 40277274, 40274897, 40274809, 40276228, 40275125, 40276521, 40274590, 40274822]",180,1715001934,Stack Overflow and OpenAI are partnering,story,https://stackoverflow.co/company/press/archive/openai-partnership/,
jeeybee,1.0,40263615,[40277533],11,1714903798,Show HN: PgQueuer – Over 5k Jobs/SEC with PostgreSQL,story,https://github.com/janbjorge/PgQueuer,
ingigauti,2.0,40269096,[40270699],5,1714947777,Flexibility of Plang Programming Language,story,https://ingig.substack.com/p/flexibility-of-plang-programming,
bdcravens,57.0,40275235,"[40276657, 40279399, 40278875, 40276681, 40276677, 40276581]",52,1715006381,Robinhood Crypto Gets Wells Notice from US SEC,story,https://www.reuters.com/business/finance/robinhood-crypto-gets-wells-notice-us-sec-2024-05-06/,
coreyp_1,3.0,40254729,"[40261932, 40260600, 40268344]",107,1714795742,Websites Every Aspiring Programmer Should Visit at Least Once,story,https://cscrunch.com/content/websites-every-aspiring-programmer-should-visit-least-once,
petrusnonius,0.0,40264897,"[40264898, 40278052]",11,1714917051,European Accelerationism – EU/Acc,story,https://www.santiago-martins.com/european-accelerationism-eu-acc.html,
malfist,31.0,40277811,"[40278804, 40278176, 40278215, 40279308]",18,1715019733,Tesla cuts even more workers as unsold inventory stacks up,story,https://arstechnica.com/cars/2024/05/tesla-announces-fourth-round-of-layoffs-in-four-weeks/,
