by,descendants,id,kids,score,text,time,title,type,url
kevin42,53.0,40048177,"[40048219, 40048753, 40048685, 40048714, 40048400, 40048284, 40048381, 40048428, 40048440, 40048268, 40048432, 40048424, 40048254, 40048782, 40048299, 40048689, 40048426, 40048631, 40048315, 40048576, 40048251, 40048672, 40048346, 40048453, 40048178]",297,Someone recently asked if the source code from Descent 3 will be released. I reached out to my old boss (Matt Toschlog) at Outrage Entertainment and he gave me the go ahead. I&#x27;m going to work on getting this running again and I&#x27;m looking for some co-maintainers.,1713239346,Descent 3 Source Code,story,https://github.com/kevinbentley/Descent3
MBCook,39.0,40047806,"[40048229, 40048544, 40048262, 40048638, 40048524, 40048670, 40048217, 40048322, 40047969, 40048444, 40048596, 40048564, 40048407, 40048112, 40048225, 40048118, 40048203, 40048039, 40048570, 40048326]",139,,1713234443,A curious phenomenon called 'Etak',story,https://maphappenings.com/2024/04/11/story-of-etak/
pyinstallwoes,41.0,40047041,"[40048084, 40047042, 40048731, 40047469, 40048222, 40048138, 40047984, 40048116, 40047481, 40047906, 40047538, 40047448]",144,,1713226126,BTFS: BitTorrent Filesystem,story,https://github.com/johang/btfs
aardvark179,131.0,40044665,"[40045377, 40046382, 40048145, 40045090, 40045170, 40045403, 40044961, 40048579, 40046381, 40044946, 40046420, 40047328, 40045233, 40045167, 40047880, 40048186, 40048193, 40048187, 40048190, 40044947, 40045082, 40047114, 40048175, 40045176, 40045239, 40045231, 40045753]",373,,1713209092,PuTTY vulnerability vuln-p521-bias,story,https://www.chiark.greenend.org.uk/~sgtatham/putty/wishlist/vuln-p521-bias.html
nateb2022,8.0,40047212,"[40048478, 40048791, 40048502, 40048705, 40047938, 40048697]",64,,1713228093,"HonoJS: Small, simple, and ultrafast web framework for the Edges",story,https://github.com/honojs/hono
benbreen,44.0,40044901,"[40045345, 40045494, 40045256, 40045329, 40045476, 40046071]",182,,1713210854,Ramanujan's lost notebook,story,https://en.wikipedia.org/wiki/Ramanujan%27s_lost_notebook
aylmao,19.0,40046774,"[40047007, 40047917, 40048314, 40046901, 40047163, 40047902, 40047613, 40047117, 40046863]",77,"Hey HN. I built this quick and dirty component to render audio waveforms using WebGPU. I just published it to NPM.<p>It&#x27;s the first time I use WebGPU and it&#x27;s been a while since I write shaders. Feedback is very welcome!<p>GitHub: https:&#x2F;&#x2F;github.com&#x2F;mrkev&#x2F;webgpu-waveform
Examples: https:&#x2F;&#x2F;aykev.dev&#x2F;webgpu-waveform",1713223408,Show HN: Render audio waveforms to HTML canvas using WebGPU,story,
jdmark,124.0,40044863,"[40046305, 40047691, 40046802, 40046360, 40048825, 40046671, 40046936, 40047728, 40048125, 40048321, 40048622, 40047860, 40047795, 40046502]",215,,1713210582,Phone conversations with law enforcement can be recorded without their consent,story,https://www.orlandoweekly.com/news/phone-conversations-with-law-enforcement-can-be-recorded-without-their-consent-court-says-36640808
milliondreams,28.0,40047152,"[40047654, 40047975, 40047865, 40048550, 40048728, 40047349]",53,,1713227380,ResearchAgent: Iterative Research Idea Generation Using LLMs,story,https://arxiv.org/abs/2404.07738
gnabgib,15.0,40048541,"[40048720, 40048724, 40048659, 40048756, 40048748]",35,,1713243979,Psychiatric risks for worsened mental health after psychedelic use,story,https://journals.sagepub.com/doi/10.1177/02698811241232548
g0xA52A2A,15.0,40029469,"[40047259, 40048805, 40048713, 40048629, 40030830, 40048188, 40048387, 40048008]",79,,1713081322,Knuth–Morris–Pratt illustrated,story,https://www.cambridge.org/core/journals/journal-of-functional-programming/article/knuthmorrispratt-illustrated/8EFA77D663D585B68630E372BCE1EBA4
VHRanger,263.0,40042616,"[40042922, 40042926, 40043306, 40043724, 40044529, 40043560, 40043255, 40044951, 40048073, 40042843, 40045224, 40043188, 40043419, 40044847, 40043329, 40044474, 40043006, 40046390, 40046236, 40042963, 40043147, 40043151, 40048000, 40043308, 40044369, 40043415, 40042972, 40043019, 40042904, 40042764, 40045086, 40043159, 40045055, 40042938, 40043307, 40043206, 40042923, 40043285, 40043168, 40047165, 40046551, 40043851, 40043333, 40042948]",407,,1713198291,Embezzlers Are Nice People (2017),story,https://www.stimmel-law.com/en/articles/story-1-embezzlers-are-nice-people
fanf2,11.0,40038759,"[40048593, 40048214, 40046886, 40047207, 40048195, 40047840, 40047144]",77,,1713177724,Weird monitor bugs people sent me in the last 5 years (2022),story,https://notes.alinpanaitiu.com/Weird-monitor-bugs
wglb,21.0,40047580,"[40048763, 40048241, 40048369, 40048293, 40048394, 40048349, 40048447]",44,,1713231683,Seismologists suspect earthquake on San Andreas Fault is imminent,story,https://phys.org/news/2024-04-seismologists-earthquake-san-andreas-fault.html
andsoitis,14.0,40042497,"[40044986, 40045271, 40044400, 40048627, 40046888, 40044413, 40044230]",127,,1713197739,Web-based Turbo Pascal compiler,story,https://github.com/lkesteloot/turbopascal
tintinnabula,6.0,40026866,"[40048332, 40048117, 40048614, 40048587, 40048128]",12,,1713048260,The Heart of Low,story,https://www.newyorker.com/culture/persons-of-interest/alan-sparhawk-the-heart-of-low
privatdozent,129.0,40038773,"[40045342, 40047110, 40045628, 40045447, 40047044, 40045289, 40045308, 40038894, 40045310]",96,,1713177822,The purge of German science in 1933,story,https://www.privatdozent.co/p/the-great-purge-of-1933-9f0
defrost,8.0,40037466,"[40046993, 40046782, 40048209, 40046916]",67,,1713160813,Mini rope bridges built in Forest of Dean to help dormice,story,https://www.bbc.com/news/uk-england-gloucestershire-68788690
codyd51,93.0,40041198,"[40043323, 40042064, 40043343, 40041347, 40046016, 40043334, 40042713, 40047743, 40048535, 40048007, 40042134, 40042541, 40042615, 40044802, 40044099, 40047028, 40044096, 40043034, 40041993, 40043991, 40042416, 40042597, 40042491, 40041199, 40044104, 40042507]",380,"Hi everyone!<p>Shortly after publishing my iOS 4 jailbreak last October[1], I got to work on my next hobby project: a from-scratch homebrew GPS receiver, which can solve the user’s location solely from billions of radio antenna samples.<p>I took a commodity SDR (alongside the Python standard library and numpy) and built a signal processing pipeline that can detect and track GPS satellites over many minutes, drop and pick up satellites as they come in and out of view, and precisely determine the user’s position and clock inaccuracy.<p>All told, gypsum can go from a cold start to a fix on the user’s position, and the precise time, in less than a minute of listening to the antenna. I went on a journey of learning how to detect and track satellite signals that are literally too quiet to hear, and I hope that some of the magic comes through in the posts!<p>After implementing this myself and walking the long road of getting it working, I’m left completely stunned by the brilliance of GPS, across so many axes. I hope you enjoy the read!<p>On a more personal note, I’ll be starting a new job next week which isn’t as amenable to publishing side projects, and therefore this will be my last publicly-published project for some time. I’ve had great experiences making and sharing projects on here, and I’m really grateful for the positive feedback that’s been shared!<p>[1]: <a href=""https:&#x2F;&#x2F;news.ycombinator.com&#x2F;item?id=37736318"">https:&#x2F;&#x2F;news.ycombinator.com&#x2F;item?id=37736318</a>",1713192130,Show HN: Building a GPS receiver,story,https://axleos.com/building-a-gps-receiver-part-1-hearing-whispers/
goranmoomin,6.0,40038729,"[40048011, 40047535, 40045281, 40048086]",42,,1713177409,How much memory does a graph take?,story,https://jazco.dev/2024/04/15/in-memory-graphs/
anigbrowl,54.0,40047193,"[40048857, 40047528, 40047634, 40047730, 40048595, 40047592, 40047895, 40048328, 40047540, 40047688, 40047537, 40048273]",79,,1713227927,"Object that slammed into Florida home was space junk for ISS, NASA confirms",story,https://www.space.com/object-crash-florida-home-iss-space-junk-nasa-confirms
dpola,5.0,40037486,"[40048464, 40037487, 40048232, 40048278, 40047954]",19,,1713161093,Reproducing the printer hack of Windows 95,story,https://dpolakovic.space/blogs/windows-95-printer-hack
indiantinker,7.0,40037891,"[40048743, 40048827, 40048801, 40038110]",5,,1713166929,One Knuckle Rice Rule,story,https://indiantinker.bearblog.dev/proposed-amendments-to-one-knuckle-rice-rule/
kennandavison,,40045532,,1,,1713214883,"Skio (YC S20) – Subscriptions for Shopify, ReCharge Migrations Is Hiring",job,https://skio.com/careers/
susam,1.0,40046692,[40048828],13,,1713222490,Google Common Lisp Style Guide,story,https://google.github.io/styleguide/lispguide.xml
bschne,16.0,40044464,"[40048721, 40047815, 40048142, 40047833, 40048076, 40047582, 40044738, 40048119, 40044707, 40044723]",43,,1713207936,Histomap: Visualizing the 4000 year history of global power (2021),story,https://www.visualcapitalist.com/histomap/
mooreds,70.0,40030786,"[40048859, 40048526, 40039703, 40039090, 40042190, 40039895, 40044274, 40039332, 40039907, 40039002, 40039428, 40039623]",61,,1713099670,Trying to Understand Copilot's Type Spaghetti,story,https://rtpg.co/2024/03/07/parsing-copilots-type-spaghetti/
piotrkaminski,2.0,40045319,"[40048835, 40048132]",35,,1713213833,Geometers Engineer New Tools to Wrangle Spacecraft Orbits,story,https://www.quantamagazine.org/geometers-engineer-new-tools-to-wrangle-spacecraft-orbits-20240415/
0xdade,15.0,40028494,"[40036326, 40035922, 40037382, 40028495, 40036832, 40048080]",55,,1713066546,Can You Grok It – Hacking together my own dev tunnel service,story,https://0xda.de/blog/2024/04/can-you-grok-it/
Gamemaster1379,6.0,40044881,"[40048159, 40048473, 40048404, 40047797]",46,,1713210718,"If you put server code in your live-service game client, expect private servers",story,https://1379.tech/the-making-of-side-7-gundam-evolution-private-server-project/
udev4096,21.0,40037324,"[40039094, 40047138, 40048182, 40048759, 40037602, 40047790, 40047355, 40045633, 40048584, 40048259, 40047107, 40047763, 40048033]",64,,1713158807,Learning about distributed systems: where to start?,story,http://muratbuffalo.blogspot.com/2020/06/learning-about-distributed-systems.html
wglb,2.0,40031732,[40045188],33,,1713107972,New Titanosaur Species Identified in Argentina,story,https://www.sci.news/paleontology/titanomachya-gimenezi-12853.html
miles,356.0,40045093,"[40045538, 40045543, 40045540, 40046689, 40046102, 40045511, 40045426, 40046253, 40045619, 40045714, 40045684, 40046157, 40048002, 40045897, 40045631, 40045366, 40046532, 40045405, 40047397, 40045759, 40045910, 40046206, 40045481, 40045774, 40045601, 40047006, 40046240, 40046426, 40046398, 40045313, 40046367, 40046705, 40045568, 40047237, 40046331, 40045555, 40045359, 40045885, 40045441, 40045460, 40045375, 40046446, 40045844, 40046156]",401,,1713212357,T-Mobile employees across the country receive cash offers to illegally swap SIMs,story,https://tmo.report/2024/04/t-mobile-employees-across-the-country-receive-cash-offers-to-illegally-swap-sims/
pionar,4.0,40043997,"[40048305, 40047892]",19,,1713205534,Self-hosting on a Raspberry Pi cluster,story,https://savannahostrowski.com/posts/raspberry-pi-cluster/
masterofsome,20.0,40045357,"[40047944, 40046171, 40046966, 40046822, 40045968, 40047191]",82,,1713214051,Nathan Tolbert pushes the limitations of new games on old consoles,story,https://www.smilepolitely.com/culture/nathan-tolbert-pushes-the-limitations-of-new-games-on-old-consoles/
rohitpaulk,160.0,40035514,"[40038352, 40037174, 40037545, 40037081, 40035945, 40036223, 40039590, 40037203, 40036100, 40036825, 40037558, 40036244, 40044993, 40038285, 40043919, 40039849, 40036858, 40036639, 40037114, 40047169, 40036302, 40035979, 40036052, 40039097]",868,,1713137881,"Visualizing Attention, a Transformer's Heart [video]",story,https://www.3blue1brown.com/lessons/attention
mgh2,0.0,40048549,,3,,1713244018,America's Big Chipmaking Blunder [video],story,https://www.youtube.com/watch?v=NFLjeyd2M0k
null_point,7.0,40048307,"[40048308, 40048396, 40048398, 40048571]",16,,1713241160,MSFT's WizardLM2 models have been taken down,story,https://huggingface.co/WizardLM/WizardLM-13B-V1.2
donutpepperoni,0.0,40047338,,7,"I am neurodivergent and noticed the Youtube Shorts format was hacking my brain to engage longer than I wanted. I wrote this quick extension to gain my time back. If you have suggestions for improvement, I&#x27;m all ears. Thank you :)",1713229169,Show HN: YouTube Shorts Redirector,story,https://github.com/adamenger/youtube-shorts-redirector
tripdout,1.0,40048014,[40048505],15,,1713237090,The project to migrate Android to Bazel is cancelled,story,https://twitter.com/MishaalRahman/status/1779985959926288407
visviva,3.0,40030761,"[40036690, 40032247, 40032216]",24,,1713099376,The Space Force is planning what could be the first military exercise in orbit,story,https://arstechnica.com/space/2024/04/the-space-force-is-planning-what-could-be-the-first-military-exercise-in-orbit/
tosh,17.0,40041976,"[40045655, 40045716, 40043750, 40043487, 40043119, 40044661, 40042996, 40043020, 40043547]",138,,1713195414,An open-source implementation of Apple code signing and notarization (2022),story,https://gregoryszorc.com/blog/2022/08/08/achieving-a-completely-open-source-implementation-of-apple-code-signing-and-notarization/
rbanffy,184.0,40038251,"[40039533, 40040508, 40040649, 40046204, 40040530, 40047101, 40040867, 40042873, 40046251, 40044921, 40039608, 40039712, 40048323, 40040211, 40040370, 40042181, 40046534, 40043107, 40040366, 40042095, 40040448, 40040872, 40039944]",294,,1713171769,A tiny ultrabright laser that can melt steel,story,https://spectrum.ieee.org/pcsel
kruuuder,0.0,40045069,,9,,1713212149,The demise of email forwarding is getting closer,story,https://talk.tidbits.com/t/the-demise-of-email-forwarding-is-getting-closer/27315
luu,13.0,40021458,"[40044305, 40044910, 40045072, 40044915, 40046352, 40046622, 40044747, 40044495]",72,,1712996581,ScanAllFish,story,https://www.adamsummers.org/scanallfish
todsacerdoti,0.0,40043399,,8,,1713202419,Testing Practical Common Lisp Code on Medley Interlisp,story,https://journal.paoloamoroso.com/testing-the-practical-common-lisp-code-on-medley
mklein123,59.0,40041406,"[40043537, 40048521, 40042533, 40048094, 40042052, 40041991, 40042399, 40043074, 40041990, 40043380, 40042013, 40041958, 40042962, 40042129, 40042065, 40042069]",88,,1713193043,Do we need to store all that telemetry?,story,https://mattklein123.dev/2024/04/10/do-you-need-to-store-that-telemetry/
tosh,57.0,40037844,"[40043253, 40038086, 40038335, 40039343, 40039996, 40045190, 40046592, 40038775, 40038719, 40047067, 40041341]",208,,1713166348,Beautifying Org Mode in Emacs (2018),story,https://zzamboni.org/post/beautifying-org-mode-in-emacs/
Zobat,44.0,40042007,"[40044970, 40046436, 40045268, 40044612, 40044118, 40043202, 40043834, 40044022, 40042610, 40043649]",97,,1713195514,Cycloidal marine propellers: Efficient thrust in any direction,story,https://newatlas.com/marine/abb-dynafin-marine-propulsion/
beatthatflight,12.0,40046670,"[40047099, 40047363, 40048767, 40047189, 40048049, 40047217, 40047155, 40047190, 40047160, 40047956]",17,"Have a client with multiple departments making copy changes&#x2F;edits on email templates and websites.  However, it either comes in forwarded emails with strikethroughs and red&#x2F;black text, or in a word document with two columns showing old and new, and you have to eyeball each character.  Is there a tool or better way to do it?",1713222288,Ask HN: How do you track copy changes on websites/emails?,story,
earslap,38.0,40035552,"[40037008, 40037713, 40038476, 40037306, 40037945, 40044832, 40036999, 40040877, 40039144, 40036730, 40037301, 40043562, 40036790, 40037375, 40037421, 40038007, 40037377]",262,,1713138328,Spectral Ray Tracing,story,https://larswander.com/writing/spectral-ray-tracing/
mhb,13.0,40046552,"[40047885, 40047118, 40047482, 40047380, 40047839]",23,,1713221172,"To Build Muscle, It's the Sets That Count",story,https://www.outsideonline.com/health/training-performance/strength-training-non-responders/
tosh,115.0,40030746,"[40034384, 40033558, 40033324, 40035546, 40040740, 40033784, 40033993, 40035249, 40040972, 40035077, 40033834, 40035344, 40035045, 40033704, 40033573, 40037414, 40035468, 40036971, 40036504, 40033426, 40035450, 40034189, 40035069]",461,,1713099111,Redis re-implemented with SQLite,story,https://github.com/nalgeon/redka
squircle,2.0,40047204,"[40048416, 40047231]",9,,1713228041,'Chinampas': The Ancient Aztec Floating Gardens That Hold Promise for Future,story,https://www.thearchaeologist.org/blog/chinampas-the-ancient-aztec-floating-gardens-that-hold-promise-for-future-urban-agriculture
Thevet,81.0,40037396,"[40037625, 40038027, 40038622, 40038539, 40039006, 40038089, 40038558, 40038851, 40037799, 40037973, 40042210, 40038015, 40037961]",200,,1713159902,A shrub in Nepal supplies the raw material for the bank notes used in Japan,story,https://www.nytimes.com/2024/04/15/world/asia/nepal-japan-yen-argeli.html
luu,44.0,40035414,"[40039425, 40037459, 40038703, 40036817, 40037125, 40039948, 40038655, 40037548, 40042430, 40038122, 40040308, 40038402, 40039538, 40040290, 40037399, 40037637]",229,,1713136963,WireViz: Easily document cables and wiring harnesses,story,https://github.com/wireviz/WireViz
peutetre,5.0,40047989,[40048231],6,,1713236759,Laser Rocket Anti-Drone Systems Being Rushed to U.S. Forces in the Middle East,story,https://www.twz.com/land/laser-rocket-anti-drone-systems-being-rushed-to-u-s-forces-in-the-middle-east
neom,9.0,40034563,"[40042847, 40048329, 40047641, 40044639, 40045682, 40046121]",54,,1713129454,PicoGK is a compact and robust geometry kernel for computational engineering,story,https://github.com/leap71/PicoGK
ganeshdole,129.0,40041954,"[40043364, 40042601, 40043357, 40042522, 40043149, 40042537, 40042814, 40044621, 40042911, 40043332, 40048386, 40042887, 40043959, 40045147, 40043820, 40043292, 40044036, 40044653, 40044313, 40046984, 40043143, 40045119, 40047167, 40046499, 40045406, 40044216, 40046510, 40046691, 40044149, 40044005, 40044585, 40044828, 40042853, 40043723, 40048654, 40043842, 40044161, 40046529, 40043767, 40045050, 40042881, 40045248, 40044696, 40044821, 40045139, 40043840, 40043545, 40043041, 40043680, 40042373, 40044064, 40042997, 40045444, 40043883, 40043806, 40042765, 40043570, 40043620, 40043478, 40047354, 40043413, 40043368, 40046850, 40045216, 40046500, 40042897, 40043189, 40043403, 40042912, 40046563, 40044635, 40042862, 40042569, 40043611, 40047704, 40046400, 40042561]",205,"I am interested in developing a web application that bears resemblance to IMDb but for open-source projects. The primary goal of this application will be to serve as a directory for discovering open-source projects.<p>While GitHub is an exceptional platform, it does not provide all the functionality I need. Therefore, I plan to add a search function that enables users to filter projects.<p>1. What do you think about this idea?
2. However, I am uncertain about how to plan the product. Can you assist me with this?",1713195330,Ask HN: I want to create IMDB for open source projects,story,
andsoitis,159.0,40041430,"[40043965, 40043134, 40042603, 40042403, 40047015, 40048053, 40044027, 40044126, 40042330, 40047524, 40045284, 40042248, 40046477, 40043164, 40042989, 40042239, 40042607, 40043690, 40042599, 40044109, 40045962, 40044883, 40045272, 40046897, 40047297, 40043062, 40042447, 40044674, 40047131, 40043053, 40042575, 40044046, 40042605, 40044086, 40042222, 40045054, 40048184]",270,,1713193121,An FDA approved device offers a new treatment for tinnitus,story,https://www.npr.org/sections/health-shots/2024/04/15/1244501055/tinnitus-hearing-loss-ringing-ear-noise
wrineha2,0.0,40047807,,21,,1713234443,Ex-TikTok employees say the company worked closely with its China-based parent,story,https://fortune.com/2024/04/15/tiktok-china-data-sharing-bytedance-project-texas/
kmdupree,0.0,40043828,,7,,1713204670,Manufacturing Bliss–Asterisk,story,https://asteriskmag.com/issues/06/manufacturing-bliss
mgh2,1.0,40047967,[40048102],11,,1713236417,Tesla lays off more than 10% of its workforce,story,https://www.bbc.com/news/technology-68818113
tosh,45.0,40042225,"[40048749, 40043715, 40042958, 40048017, 40043210, 40047913, 40043866, 40043221, 40045232, 40042869, 40042919, 40046730, 40043621]",146,,1713196473,WizardLM 2,story,https://wizardlm.github.io/WizardLM2/
bryanrasmussen,58.0,40030127,"[40041552, 40042628, 40038571, 40038152, 40038111]",112,,1713090559,Canoes discovered northwest of Rome are oldest boats ever found in Mediterranean,story,https://www.smithsonianmag.com/smart-news/five-canoes-discovered-northwest-of-rome-are-oldest-boats-ever-found-in-the-mediterranean-180984014/
matan-h,41.0,40037772,"[40040890, 40040176, 40045620, 40038403, 40039125, 40038684, 40038336, 40039216, 40040668, 40038519, 40038962]",93,,1713165373,Better adb shell,story,https://github.com/matan-h/adb-shell
jimmcslim,92.0,40039191,"[40041960, 40039598, 40045330, 40042127, 40041374, 40042992, 40041877, 40046663, 40042443, 40046568, 40043127, 40041473, 40044334, 40041456, 40041882, 40042498, 40046581, 40043386, 40041871, 40047344, 40043346, 40041562]",242,,1713181170,We are moving to General Availability,story,https://supabase.com/ga
coatta,5.0,40048061,"[40048180, 40048294, 40048092, 40048091]",13,,1713237527,"Happy 20th Anniversary, Gmail. I'm Sorry I'm Leaving You",story,https://www.nytimes.com/2024/04/07/opinion/gmail-email-digital-shame.html
DreamGen,3.0,40044742,"[40045011, 40045752]",54,,1713209690,Open-source passive radar taken down for regulatory reasons (2022),story,https://hackaday.com/2022/11/19/open-source-passive-radar-taken-down-for-regulatory-reasons/
politelemon,18.0,40037619,"[40042371, 40040828, 40042779, 40037884, 40044484, 40045053, 40039413, 40039982]",68,,1713163176,"Control Linux based distros using hand gestures using OpenCV, GTK, Mediapipe",story,https://github.com/flying-pizza-69/GestureX
EndXA,32.0,40041667,"[40043675, 40043259, 40048402, 40043624, 40045189, 40044053, 40047548, 40043068, 40042959, 40046174, 40044684, 40042851]",108,,1713194085,Procrastination can be caused by anxiety,story,https://solvingprocrastination.com/anxiety/
Hooke,0.0,40026817,,23,,1713047852,Learning from snapshots of lost fossils,story,https://www.sapiens.org/archaeology/human-teeth-ksar-akil/
perihelions,6.0,40046152,"[40047386, 40048318]",10,,1713218240,State tax officials are using AI to go after wealthy payers,story,https://www.cnbc.com/2024/04/15/state-tax-officials-use-ai-to-go-after-wealthy-payers.html
bane,3.0,40047647,"[40048339, 40048107, 40048264]",10,,1713232352,Japanese minimalist and his designs for a minimalist lifestyle,story,https://www.youtube.com/watch?v=XBQBKseozuY
jackweirdy,0.0,40043949,,6,,1713205280,Lawyer divorces wrong couple through dropdown selection error,story,https://www.lawgazette.co.uk/news/firm-pledges-full-support-to-lawyer-over-online-divorce-mistake/5119365.article
jseliger,54.0,40033268,"[40038223, 40039517, 40035795, 40035955, 40035785, 40035524, 40038213, 40036677, 40038151, 40036568, 40037296, 40036246]",162,,1713119791,Good news against dengue,story,https://www.science.org/content/blog-post/good-news-against-dengue
mehulashah,20.0,40028984,"[40037866, 40037280, 40039000, 40037958, 40028985]",42,,1713074040,Proving Heron’s formula by complex number (2013),story,https://mathgarage.wordpress.com/2013/01/20/proving-herons-formula-by-complex-number/
paulpauper,1.0,40047611,[40047950],7,,1713231907,St. Louis office tower lost 98% of its value,story,https://www.morningbrew.com/daily/stories/2024/04/14/undefined
paulpauper,7.0,40047603,"[40048632, 40047629, 40048012]",8,,1713231867,America's Bonds Are Getting Harder to Sell,story,https://www.wsj.com/finance/americas-bonds-are-getting-harder-to-sell-c3fde4de
ta988,9.0,40036237,"[40036682, 40036799, 40036932, 40036792, 40042166, 40036945, 40036664]",115,,1713145037,Computer-generated holography with ordinary display,story,https://opg.optica.org/ol/abstract.cfm?uri=ol-49-8-1876
todsacerdoti,4.0,40047256,"[40047519, 40048618, 40047555]",24,,1713228463,"No I don't want 2, Emacs",story,https://www.emoses.org/posts/dont-write-2/
conanxin,41.0,40029032,"[40046785, 40046662, 40031521, 40048141, 40029173, 40046203, 40046560, 40046862, 40045877, 40046604, 40046164]",40,,1713074685,A City Is Not a Computer (2017),story,https://placesjournal.org/article/a-city-is-not-a-computer/
nier,2.0,40047040,"[40048470, 40047080]",5,,1713226103,Apple: No notes taken at executive meetings,story,https://www.afr.com/technology/apple-s-secret-to-success-don-t-take-notes-and-worry-about-the-numbers-20240415-p5fjuz
TheFreim,47.0,40039143,"[40048649, 40046709, 40043693, 40046701, 40045217, 40046935, 40044866, 40045739, 40045360, 40045365, 40046583, 40045389, 40046405, 40046637, 40047317, 40045246]",60,,1713180825,Zooming User Interface (ZUI),story,https://en.wikipedia.org/wiki/Zooming_user_interface
pachico,34.0,40037811,"[40045384, 40046402, 40046963, 40046891, 40047272, 40046478, 40045398, 40046674, 40046648, 40046595, 40047000, 40046899, 40047218, 40047522, 40046498, 40045025]",73,,1713165983,Simplified Technical English,story,https://www.asd-ste100.org/
