by,descendants,id,kids,score,time,title,type,url,text
speckx,374.0,40001971,"[40002532, 40002504, 40006929, 40006770, 40002981, 40002378, 40006761, 40002503, 40002973, 40003178, 40002445, 40002715, 40002741, 40007124, 40006791, 40007401, 40028252, 40010830, 40007928, 40006490, 40003591, 40002512, 40005375, 40004474, 40003161, 40007189, 40007409, 40008976, 40003074, 40006035, 40006362, 40002255, 40002318, 40002458, 40003130, 40002321, 40002829, 40002832, 40001987, 40038381, 40002293, 40003001, 40002112, 40002287, 40006208]",741,1712842465,Anyone got a contact at OpenAI. They have a spider problem,story,https://mailman.nanog.org/pipermail/nanog/2024-April/225407.html,
todsacerdoti,52.0,40006722,"[40008404, 40008251, 40007534, 40008892, 40008354, 40009104, 40008190, 40007938, 40009642, 40007961]",106,1712868942,Why CISA Is Warning CISOs About a Breach at Sisense,story,https://krebsonsecurity.com/2024/04/why-cisa-is-warning-cisos-about-a-breach-at-sisense/,
faeyanpiraat,1.0,40022272,[40022285],6,1713006999,Body Design and Gait Generation of Chair-Type Robot,story,https://shin0805.github.io/chair-type-tripedal-robot/,
vira28,0.0,40025521,,7,1713037843,Show HN: A simple demo of Postgres wire protocol and SQLite as storage engine,story,https://github.com/viggy28/pglite,
andrea76,33.0,39999159,"[40022892, 40022003, 40022830, 40022636, 40023408, 40023390, 40025976, 40024805, 40022040, 39999160]",72,1712819070,Running DOS Apps on Windows from 1.0 to 95 (2020),story,https://gekk.info/articles/dosapps.html,
SirLJ,18.0,40024921,"[40026203, 40026308, 40027960, 40027468, 40029157]",24,1713032141,$850 Millennium Falcons and $680 Titanics: Grown-Ups Are Now a Gold Mine,story,https://www.wsj.com/business/retail/850-millennium-falcons-and-680-titanics-grown-ups-are-now-a-gold-mine-for-lego-73f265cf,
metadat,1.0,40007971,[40023488],21,1712878766,ble.sh: Revolutionize the BASH user experience,story,https://github.com/akinomyoga/ble.sh,
beefman,0.0,40018785,,42,1712965328,OpenEQA: Embodied Question Answering in the Era of Foundation Models,story,https://open-eqa.github.io/,
mnk47,1.0,40021906,[40021907],7,1713002771,Wu's Method Can Boost AlphaGeometry to Outperform Gold Medalists at IMO Geometry,story,https://arxiv.org/abs/2404.06405,
tosh,16.0,39999713,"[40024216, 40024601, 40026004, 40024472, 40000206]",42,1712823792,On Self-Respect (1961),story,https://www.vogue.com/article/joan-didion-self-respect-essay-1961,
blending,33.0,40018630,"[40025024, 40028298, 40024712, 40018633, 40024231, 40025457, 40024165, 40024328, 40024920, 40024676]",39,1712963954,The Reconstruction of Ulysses S Grant (2017),story,https://www.damninteresting.com/the-reconstruction-of-ulysses-s-grant/,
bryanrasmussen,17.0,39999530,"[40012891, 40016097, 40023236, 40011170, 40016493, 40011671, 40012235]",49,1712822423,An unusual prehistoric monument made up of three interlocking circles,story,https://www.labrujulaverde.com/en/2024/04/an-unusual-prehistoric-monument-made-up-of-three-interlocking-circles-a-typology-never-seen-before-discovered-in-france/,
sgorawski,14.0,40000022,"[40018394, 40018945, 40000368, 40031754, 40021543, 40020805, 40020321, 40018230, 40021071, 40020463, 40024782, 40022603]",49,1712826284,Show HN: ClassroomIO – an in-browser programming environment for education,story,https://www.classroomio.site/,"Hey Hacker News,<p>I’m excited to introduce ClassroomIO – a project that I’ve been working on for the past few months. It’s an educational platform that provides an in-browser code editor and execution environment. The idea is to make teaching programming easier by eliminating the technical barriers that educators and students often face.<p>Feature highlights:
* In-Browser coding: Write, run, and debug code directly in your browser. No more downloading software, configuring environments, and resolving compatibility issues.
* Course management: Manage classes, assignments, and student interactions in one place.
* Many languages supported: Python, Java, JavaScript, C&#x2F;C++, C#, Go, PHP – more incoming.<p>Open beta access: I’d love it if interested people could join my open beta, explore the platform&#x27;s capabilities, and provide some feedback to help me make it a better tool.<p>Thank you for your time!<p>Contact: support@classroomio.app"
draugadrotten,205.0,40038549,"[40038840, 40038742, 40038728, 40038604, 40040280, 40039098, 40039049, 40039513, 40038667, 40039862, 40038763, 40038791]",136,1713175593,Tesla to lay off more than 10% of its staff,story,https://www.reuters.com/business/autos-transportation/tesla-lay-off-more-than-10-its-staff-electrek-reports-2024-04-15/,
alexzeitler,147.0,40015612,"[40041517, 40021696, 40021044, 40019910, 40022198, 40020425, 40023620, 40021356, 40021770, 40021599, 40023449, 40034777, 40019972, 40025897, 40021441, 40020679, 40021741, 40021325, 40027281, 40023461, 40021832, 40022944, 40022607, 40021930, 40021967, 40022617, 40021811, 40021565, 40021553, 40021412, 40021867, 40021724, 40024184]",177,1712944064,Htmx and the Rule of Least Power,story,https://blog.gypsydave5.com/posts/2024/4/12/htmx-and-the-rule-of-least-power/,
mkosmul,51.0,40010606,"[40024323, 40024557, 40025397, 40024295, 40025390, 40025577, 40024155]",92,1712911921,Ten Years and Counting: My Affair with Microservices,story,https://blog.allegro.tech/2024/04/ten-years-microservices.html,
luu,0.0,40021458,,5,1712996581,ScanAllFish,story,https://www.adamsummers.org/scanallfish,
pjmlp,3.0,40029542,"[40032845, 40029859]",18,1713082288,Rust Nation UK 2024: Renault wants to sell cars with Rust!,story,https://www.youtube.com/watch?v=Z1xMvm3eS4k,
visviva,3.0,40030761,"[40036690, 40032247, 40032216]",21,1713099376,The Space Force is planning what could be the first military exercise in orbit,story,https://arstechnica.com/space/2024/04/the-space-force-is-planning-what-could-be-the-first-military-exercise-in-orbit/,
zaptrem,234.0,39992817,"[39994616, 39995018, 39994724, 39997372, 39994899, 39994807, 39994639, 39995059, 39993620, 39997501, 39993674, 39993643, 39995078, 39994241, 39994019, 39993885, 39995565, 39997420, 39993682, 39994481, 39996706, 39995619, 39994331, 39997885, 39995266, 39994295, 39998102, 39995583, 39993648, 39996405, 40002277, 40000029, 40003804, 39998310, 39994920, 39994086, 39996702, 39996463, 39996390, 39997875, 39993890, 39996123, 39996227, 39996282, 39996561, 40001611, 40001239, 39993998, 39998240, 39999470, 39995278, 40012427, 39997632, 39995548, 39995054, 39996137, 39998970, 39997173, 39996712, 39993667, 39997382, 40002309, 40002586, 39997390, 39997381, 39993850, 39993717, 39998380, 39997162, 39993715, 39996439, 39997992, 40001472, 39996101, 39996098, 40026492, 40026490, 39999024]",451,1712767681,Show HN: Sonauto – A more controllable AI music creator,story,https://sonauto.ai/,"Hey HN,<p>My cofounder and I trained an AI music generation model and after a month of testing we&#x27;re launching 1.0 today. Ours is interesting because it&#x27;s a latent diffusion model instead of a language model, which makes it more controllable: <a href=""https:&#x2F;&#x2F;sonauto.ai&#x2F;"">https:&#x2F;&#x2F;sonauto.ai&#x2F;</a><p>Others do music generation by training a Vector Quantized Variational Autoencoder like Descript Audio Codec (<a href=""https:&#x2F;&#x2F;github.com&#x2F;descriptinc&#x2F;descript-audio-codec"">https:&#x2F;&#x2F;github.com&#x2F;descriptinc&#x2F;descript-audio-codec</a>) to turn music into tokens, then training an LLM on those tokens. Instead, we ripped the tokenization part off and replaced it with a normal variational autoencoder bottleneck (along with some other important changes to enable insane compression ratios). This gave us a nice, normally distributed latent space on which to train a diffusion transformer (like Sora). Our diffusion model is also particularly interesting because it is the first audio diffusion model to generate coherent lyrics!<p>We like diffusion models for music generation because they have some interesting properties that make controlling them easier (so you can make <i>your own</i> music instead of just taking what the machine gives you). For example, we have a rhythm control mode where you can upload your own percussion line or set a BPM. Very soon you&#x27;ll also be able to generate proper variations of an uploaded or previously generated song (e.g., you could even sing into Voice Memos for a minute and upload that!). @Musicians of HN, try uploading your songs and using Rhythm Control&#x2F;let us know what you think! Our goal is to enable more of you, not replace you.<p>For example, we turned this drum line (<a href=""https:&#x2F;&#x2F;sonauto.ai&#x2F;songs&#x2F;uoTKycBghUBv7wA2YfNz"">https:&#x2F;&#x2F;sonauto.ai&#x2F;songs&#x2F;uoTKycBghUBv7wA2YfNz</a>) into this full song (<a href=""https:&#x2F;&#x2F;sonauto.ai&#x2F;songs&#x2F;KSK7WM1PJuz1euhq6lS7"">https:&#x2F;&#x2F;sonauto.ai&#x2F;songs&#x2F;KSK7WM1PJuz1euhq6lS7</a> skip to 1:05 if impatient) or this other song I like better (<a href=""https:&#x2F;&#x2F;sonauto.ai&#x2F;songs&#x2F;qkn3KYv0ICT9kjWTmins"">https:&#x2F;&#x2F;sonauto.ai&#x2F;songs&#x2F;qkn3KYv0ICT9kjWTmins</a> - we accidentally compressed it with AAC instead of Opus which hurt quality, though)<p>We also like diffusion models because while they&#x27;re expensive to train, they&#x27;re cheap to serve. We built our own efficient inference infrastructure instead of using those expensive inference as a service startups that are all the rage. That&#x27;s why we&#x27;re making generations on our site free and unlimited for as long as possible.<p>We&#x27;d love to answer your questions. Let us know what you think of our first model! <a href=""https:&#x2F;&#x2F;sonauto.ai&#x2F;"">https:&#x2F;&#x2F;sonauto.ai&#x2F;</a>"
Lockal,143.0,40038372,"[40038807, 40039618, 40039268, 40038694, 40038756, 40038801, 40039271, 40039127, 40039023, 40039436, 40038761, 40038904, 40039363, 40038710, 40038631, 40039199, 40038650, 40038643, 40038780, 40038794, 40039415, 40038995, 40038831, 40038672, 40039070, 40038695, 40038645, 40038656, 40039663]",151,1713173425,"RFC: Banning ""AI""-backed (LLM/GPT/whatever) contributions to Gentoo",story,https://www.mail-archive.com/gentoo-dev@lists.gentoo.org/msg99042.html,
peutetre,1.0,40035696,[40038275],8,1713139722,$45K EV smuggles a 620-mile solid-state battery out of the lab,story,https://newatlas.com/automotive/im-ls-lightyear-solid-state/,
ingve,30.0,40011762,"[40020329, 40028226, 40025068, 40016310, 40014350, 40014573, 40014500, 40020451, 40014613, 40034939, 40023966, 40014216]",48,1712924610,Wiring Your House for Networking,story,https://saagarjha.com/blog/2024/04/12/wiring-your-house-for-networking/,
protontypes,338.0,40010615,"[40016246, 40011195, 40012401, 40011009, 40011216, 40018334, 40012128, 40014943, 40011302, 40010907, 40014681, 40011688, 40013819, 40015311, 40010823, 40011026, 40011379, 40014292, 40012772, 40013232, 40010914, 40011148, 40014049, 40011457, 40013428, 40020971, 40015353, 40011264, 40013108, 40014601, 40014489, 40013784, 40015542, 40012703, 40011347, 40011092, 40024325]",702,1712911996,An open source initiative to share and compare heat pump performance data,story,https://heatpumpmonitor.org/,
ilikecinnamon,1.0,40033307,[40034049],6,1713120149,Government spyware is another reason to use an ad blocker,story,https://techcrunch.com/2024/04/13/government-spyware-use-ad-blocker/,
birriel,1.0,40033221,[40033299],4,1713119412,Cancer patients can now be 'matched' to best treatment with DNA,story,https://theconversation.com/personalized-cancer-treatments-based-on-testing-drugs-quickly-leads-to-faster-treatment-better-outcomes-221469,
sorokod,8.0,40033166,"[40033889, 40033442, 40033536]",7,1713118881,Why America Fell for Guns,story,https://aeon.co/essays/america-fell-for-guns-recently-and-for-reasons-you-will-not-guess,
WithinReason,18.0,40011438,"[40012762, 40014763, 40013516, 40012788]",98,1712922052,Researchers find a new organelle evolving,story,https://arstechnica.com/science/2024/04/researchers-find-a-new-organelle-evolving/,
mfiguiere,46.0,40035739,"[40037642, 40037468, 40037118, 40040282, 40035985, 40036977, 40038142, 40037179, 40037214]",37,1713140154,Apple's iPhone Shipments Plunge 10% as Android Rivals Rise,story,https://www.bloomberg.com/news/articles/2024-04-15/apple-s-iphone-shipments-plunge-10-as-android-rivals-rise,
deathtrader666,4.0,40034839,"[40035267, 40037664]",15,1713131915,TCS sued for discriminating against Americans for H1Bs,story,https://economictimes.indiatimes.com/nri/work/us-techie-sues-tcs-for-discrimination-against-americans-and-favouring-indians-on-h-1b-visas/articleshow/109237855.cms?from=mdr,
andy99,11.0,40035743,"[40036419, 40036625, 40036618, 40036514, 40036933, 40039231, 40036619]",37,1713140171,Why is Montreal a stolen car export hub?,story,https://nationalpost.com/news/canada/why-is-montreal-a-stolen-car-export-hub-jurisdiction-limits-and-size-officials-say,
forgingahead,9.0,39998149,"[40002669, 40004196, 40004615, 40010195, 40003462]",69,1712806253,Parler-TTS: Natural language guidance of high-fidelity TTS,story,https://github.com/huggingface/parler-tts,
nikodunk,219.0,40025195,"[40025943, 40026926, 40026461, 40026292, 40025734, 40025955, 40026011, 40026314, 40028135, 40026303, 40025934, 40025755, 40026923, 40025925, 40026310, 40026376, 40026689, 40026393, 40026318, 40027118, 40026561, 40026062, 40026029, 40026692, 40027832, 40026815, 40029101, 40026701, 40025852, 40026326]",219,1713034744,"Show HN: My $1k self-install, off-grid solar backup build for renters",story,https://sunboxlabs.com,
napoleongl,17.0,40016932,"[40020396, 40018778, 40018741, 40018237, 40021601, 40018607, 40020858, 40018167, 40016933, 40021456, 40018629, 40018545]",64,1712951455,Shiakaku of the Day,story,https://shikakuofthe.day/,
gk1,119.0,39993930,"[39994282, 39995764, 39994198, 39994373, 39995787, 39996863, 39994585, 39994458, 39994314, 39994326, 39995358, 39995780, 39998193, 39998937, 39994786, 40003693, 39998413, 39999111, 39997328, 39996748, 39998417, 40017537, 40017562, 39994968, 39998081, 39995976, 39994398, 40015189, 40000994, 39998273, 39997706, 39998139, 40011629, 40020760, 40021965]",231,1712772631,Udio: Generate music in your favorite styles with a text prompt,story,https://twitter.com/udiomusic/status/1778045322654003448,
mwfogleman,14.0,39998359,"[40010556, 40011296, 40010645, 40013111, 40015271, 40012935, 40014324, 40011834, 40015753, 40010706, 40014866]",69,1712809513,Rooster King: A multimedia zine website collage album memoir thing,story,https://roosterking.drewschorno.com/,
hafthor,68.0,40025531,"[40027111, 40027665, 40026484, 40028952, 40026482, 40026841, 40026074, 40026792, 40026871, 40026583, 40026758, 40026889]",85,1713037935,Show HN: ZSV (Zip Separated Values) columnar data format,story,https://github.com/Hafthor/zsvutil,"A columnar data format built using simple, mature technologies."
ygoldfeld,49.0,40028118,"[40029054, 40032445, 40024280, 40005504, 40036852, 39987737, 40010197, 40005544, 40024248, 40030960, 40032189]",87,1713060915,Show HN: Comprehensive inter-process communication (IPC) toolkit in modern C++,story,https://github.com/Flow-IPC,"If you work in C++, and you would like 2+ programs to share data structures (and&#x2F;or native I&#x2F;O handles a.k.a. FDs) among each other, there is a good chance Flow-IPC<p>- will make it considerably less annoying to code than typical approaches; and<p>- may massively reduce the latency involved.<p>Those sharing Cap&#x27;n Proto-encoded data may have particular interest. Cap&#x27;n Proto (<a href=""https:&#x2F;&#x2F;capnproto.org"" rel=""nofollow"">https:&#x2F;&#x2F;capnproto.org</a>) is fantastic at its core task - in-place serialization with zero-copy - and we wanted to make the IPC (inter-process communication) involving capnp-serialized messages be <i>zero-copy, end-to-end</i>.<p>That said, we paid equal attention to other varieties of payload; it&#x27;s not limited to capnp-encoded messages. For example there is painless (&lt;-- I hope!) zero-copy transmission of arbitrary combinations of STL-compliant native C++ data structures.<p>To help determine whether Flow-IPC is relevant to you we wrote an intro blog post. It works through an example, summarizes the available features, and has some performance results. <a href=""https:&#x2F;&#x2F;www.linode.com&#x2F;blog&#x2F;open-source&#x2F;flow-ipc-introduction-low-latency-cpp-toolkit"" rel=""nofollow"">https:&#x2F;&#x2F;www.linode.com&#x2F;blog&#x2F;open-source&#x2F;flow-ipc-introductio...</a><p>Of course there&#x27;s nothing wrong with going straight to the GitHub link and getting into the README and docs.<p>Currently Flow-IPC is for Linux. (macOS&#x2F;ARM64 and Windows support could follow soon, depending on demand&#x2F;contributions.)"
jyunwai,188.0,40032233,"[40032889, 40032828, 40032766, 40033005, 40032872, 40032593, 40033760, 40032975, 40034139, 40032817, 40033192, 40032900, 40032622, 40032923, 40032686, 40032597, 40032572, 40036824, 40032712, 40032606, 40036531, 40032677, 40032655]",248,1713111810,Hospitals that make profits should pay taxes,story,https://www.statnews.com/2024/04/14/nonprofit-hospitals-turn-profit-charity-care-tax-exempt-status/,
sogen,124.0,40015961,"[40018290, 40017822, 40040713, 40017734, 40017584, 40018459, 40017521, 40030241, 40030248, 40019587, 40027459, 40018153, 40032930, 40017564, 40019088, 40016612, 40018421, 40017059, 40019991, 40019615, 40023678, 40016918, 40018887, 40016876, 40017503, 40018198, 40017611, 40019048, 40020427, 40020599, 40017572, 40017129]",334,1712945662,Tell HN: Bypass Paywalls repository is gone,story,,"Repository seems to be gone:<p><a href=""https:&#x2F;&#x2F;gitlab.com&#x2F;magnolia1234&#x2F;bypass-paywalls-chrome-clean&#x2F;"" rel=""nofollow"">https:&#x2F;&#x2F;gitlab.com&#x2F;magnolia1234&#x2F;bypass-paywalls-chrome-clean...</a><p>Visiting the user profile says it has been blocked:<p><a href=""https:&#x2F;&#x2F;gitlab.com&#x2F;magnolia1234&#x2F;"" rel=""nofollow"">https:&#x2F;&#x2F;gitlab.com&#x2F;magnolia1234&#x2F;</a>"
Tomte,0.0,40024732,,12,1713030572,Of the Just Shaping of Letters by Albrecht Dürer,story,https://www.gutenberg.org/ebooks/37103,
paulpauper,2.0,40032494,"[40035816, 40036161]",7,1713113721,California Is Losing Tech Jobs,story,https://www.apricitas.io/p/california-is-losing-tech-jobs,
1970-01-01,9.0,40014156,"[40035787, 40019503]",33,1712936440,V-2 No. 13,story,https://en.wikipedia.org/wiki/V-2_No._13,
xenophonf,9.0,40007684,"[40010999, 40014619, 40011480]",46,1712876189,Steam Controller reverse engineering and customization project,story,https://github.com/greggersaurus/OpenSteamController,
cartesius13,0.0,40026698,,13,1713046980,4chan's /biz/ board now requires email verification,story,https://boards.4chan.org/biz/thread/58388587/email-verification-required,
arcile,49.0,39998335,"[40015036, 40016424, 40018042, 40017003, 40015073, 40015321, 40016825, 40016700, 40016607, 40016924, 40016545, 40017758, 40017477, 40015691, 40016973, 40015737, 40017445, 40017472, 40017280, 40016199, 39998816, 40019138, 40016523, 40017670, 40016798, 40028419, 40016675, 40020166, 40015943, 40018649, 39999036, 40019445, 40015198]",70,1712809100,Ask HN: What resources to learn tech and software in manufacturing?,story,,"A lot of us have a history and experience in software and often online solutions where information and knowledge is often online and accessible.<p>I&#x27;ve recently joined a company that do manufacturing, involving supply chain, shop floor management, material handling, inventory, production planning, quality control, tracability etc.<p>I&#x27;m trying to learn as much as possible around today&#x27;s innovation in these areas, what are the best technologies, best processes, what companies are in the forefront, which are up and coming, but find it a lot more difficult than for pure online software solutions.<p>What approaches would you take to this, and is there any sources of information that you can recommend? Ways of extracting this knowledge?<p>Obviously ChatGPT, perplexity and others have been asked."
Tomte,3.0,40014764,"[40024130, 40020615, 40015061, 40024640, 40014808]",10,1712939513,The Future of NetBSD (2006),story,https://mail-index.netbsd.org/netbsd-users/2006/08/30/0016.html,
nth_order,5.0,40025335,"[40029347, 40029014]",20,1713036269,Von Neumann's Elephant,story,https://en.wikipedia.org/wiki/Von_Neumann%27s_elephant,
alwillis,284.0,40002987,"[40003631, 40003651, 40003398, 40006783, 40004945, 40004262, 40003673, 40004302, 40004612, 40003612, 40003687, 40003658, 40003655, 40005583, 40004500, 40003698, 40003971]",469,1712847986,Apple alerts users in 92 nations to mercenary spyware attacks,story,https://techcrunch.com/2024/04/10/apple-warning-mercenary-spyware-attacks/,
thunderbong,66.0,40032750,"[40032957, 40032964, 40032983, 40033127, 40033031, 40033204, 40033057, 40033158, 40033007, 40033179, 40033397, 40033107]",111,1713115982,Hidden dependencies in Linux binaries,story,http://thelittleengineerthatcould.blogspot.com/2024/04/hidden-dependencies-in-linux-binaries.html,
pseudolus,6.0,40015744,"[40022644, 40018455]",57,1712944640,The Silver or the Lead: How White Collar Crime Prosecutors Get Punished,story,https://www.thebignewsletter.com/p/the-silver-or-the-lead-how-white,
nithinbekal,25.0,40008934,"[40009427, 40010670, 40010254, 40011929, 40010188, 40015450, 40009955]",52,1712889898,Abstract Methods and NotImplementedError in Ruby,story,https://nithinbekal.com/posts/abstract-methods-notimplementederror-ruby/,
thunderbong,8.0,40019775,"[40021409, 40028395, 40022002, 40025096, 40021083, 40022963]",30,1712973665,Hügelkultur,story,https://en.wikipedia.org/wiki/H%C3%BCgelkultur,
rntn,135.0,40015851,"[40016775, 40016593, 40016480, 40016986, 40017607, 40017106, 40016418, 40016503, 40017091, 40016214, 40016862, 40017784, 40016196, 40018312, 40016887, 40017612, 40017904]",157,1712945174,"""Strong focus on aesthetics"" contributed to collapse of Norway timber bridge",story,https://www.dezeen.com/2024/04/11/tretten-bridge-collapse-norway-timber/,
goranmoomin,35.0,40029628,"[40029880, 40030074, 40030083, 40030171, 40030769, 40031824, 40031804, 40030230, 40029920]",109,1713083409,Godot as an Embeddable Game Engine,story,https://tirania.org/blog/archive/2024/Apr-23.html,
FiloSottile,295.0,39996314,"[39998156, 39998372, 39997660, 40000146, 39997671, 39998010, 39997968, 39997547, 39998844, 39997549, 40001468, 39998891, 40000120, 40003753, 40003949, 39999702, 39997735, 39998398, 39998039, 40002786]",278,1712787708,Why can't my mom email me?,story,https://matduggan.com/why-cant-my-mom-email-me/,
georgehill,0.0,40023531,,11,1713020042,Mechanics of Next Token Prediction with Self-Attention,story,https://arxiv.org/abs/2403.08081,
Stratoscope,202.0,40008170,"[40008719, 40008600, 40009792, 40013014, 40010347, 40009815, 40009295, 40010020, 40008500, 40009646, 40010250, 40009605, 40011221, 40015615, 40008793, 40012879, 40009035, 40009835, 40009692, 40010348, 40015702, 40009339, 40010172, 40013088, 40009987, 40009420, 40010432, 40008851]",172,1712881163,Amazon virtually kills efforts to develop Alexa Skills,story,https://arstechnica.com/gadgets/2024/04/amazon-virtually-kills-efforts-to-develop-alexa-skills-disappointing-dozens/,
mooreds,6.0,40002508,[40011140],11,1712845497,Postman Has Acquired Orbit,story,https://blog.postman.com/announcing-postman-has-acquired-orbit/,
pyinstallwoes,82.0,40008383,"[40009319, 40009461, 40009917, 40009843, 40010075, 40009580, 40009711, 40009201, 40009410, 40009450, 40013012, 40009456, 40013237, 40011285, 40010217, 40008498, 40009426, 40010361, 40009612, 40009648]",285,1712883130,DNS over Wikipedia,story,https://github.com/aaronjanse/dns-over-wikipedia,
Tomte,107.0,40023892,"[40029373, 40028210, 40029030, 40028003, 40028503, 40028174, 40027975, 40028155, 40030265, 40029315, 40028456, 40028998, 40031861, 40029769, 40029359, 40028883, 40029380, 40029148, 40030772, 40029864, 40030889]",193,1713023286,"Old CSS, new CSS (2020)",story,https://eev.ee/blog/2020/02/01/old-css-new-css/,
todsacerdoti,0.0,40021299,,3,1712994357,Identifying and Correcting Programming Language Behavior Misconceptions,story,https://cs.brown.edu/~sk/Publications/Papers/Published/lk-smol-tutor/,
alexahn,0.0,40021204,,5,1712992897,Searching for new asymmetry between matter and antimatter,story,https://phys.org/news/2024-04-asymmetry-antimatter.html,
dralley,8.0,40033499,"[40033860, 40033616, 40033604, 40033725]",42,1713121469,Linux 6.10 to Merge Driver for Emulating Windows NT Synchronization Primitives,story,https://www.phoronix.com/news/Linux-6.10-Merging-NTSYNC,
Michelangelo11,106.0,40016243,"[40016518, 40016999, 40016866, 40017261, 40017125, 40016534, 40016783, 40016755, 40016974, 40022741, 40017311, 40017816, 40016954, 40017095, 40017371, 40016629]",144,1712947120,"Ford's battery flagship socked by mold sickness, workers say",story,https://labornotes.org/2024/02/fords-battery-flagship-socked-mold-sickness-workers-say,
marvinborner,0.0,40021916,,33,1713002962,Coding Adventure: Rendering Text [video],story,https://www.youtube.com/watch?v=SO83KQuuZvg,
sky_nox,59.0,40016985,"[40017208, 40014127, 40013747, 40018337, 40013560, 40021658, 40018711, 40018606, 40019862, 40013550, 40013404, 40017009, 40013435]",93,1712951732,Palo Alto Networks PAN-OS Zero-Day Exploitation,story,https://www.volexity.com/blog/2024/04/12/zero-day-exploitation-of-unauthenticated-remote-code-execution-vulnerability-in-globalprotect-cve-2024-3400/,
tosh,0.0,40031088,,5,1713103197,Monomyth,story,https://en.wikipedia.org/wiki/Hero%27s_journey,
victormustar,51.0,40001193,"[40001755, 40003797, 40001653, 40002234, 40001547, 40004547, 40001595, 40004674, 40002500, 40003312, 40002726]",238,1712836666,Transformers.js –  Run Transformers directly in the browser,story,https://github.com/xenova/transformers.js,
