by,descendants,id,kids,score,time,title,type,url,text
pyinstallwoes,79.0,40008755,"[40009443, 40010115, 40009217, 40011543, 40009086, 40009975, 40010248, 40027167, 40014874, 40011005, 40012911, 40010984, 40011234, 40009031, 40014054, 40015708, 40009818, 40010169, 40015306, 40012282, 40009533, 40009558, 40010736, 40013413, 40010661, 40014799]",209,1712887494,DwarFS – Deduplicating Warp-Speed Advanced Read-Only File System,story,https://github.com/mhx/dwarfs,
skeptrune,87.0,40024393,"[40027959, 40026814, 40037099, 40027128, 40028479, 40028744, 40027132, 40034168, 40028078, 40027618, 40028415, 40026950, 40026756, 40026675, 40027505]",114,1713027723,OpenBSD is a cozy operating system,story,https://btxx.org/posts/OpenBSD_is_a_Cozy_Operating_System/,
oleg_tarasov,27.0,40017176,"[40021421, 40037079, 40021266, 40024249, 40021986, 40023115, 40023163, 40021246, 40021059]",113,1712952959,DIY Wi-Fi thermostat from scratch with ESPHome and Home Assistant,story,https://olegtarasov.me/opentherm-thermostat-esphome/,
1fishe2fishe,33.0,40010050,"[40015676, 40011229, 40022669, 40013498, 40013896]",226,1712905070,Show HN: Running TempleOS in user space without virtualization,story,https://github.com/1fishe2fishe/EXODUS,"TempleOS is an experimental OS designed to be simple and self-hosted with a JIT compiler. I was mesmerized by it but didn&#x27;t like the hassle of using virtual machines to boot it up and move files around from the virtual drive.<p>My project lets you run TempleOS as an app of some sort instead of using a virtual machine to run it - this brings a lot of benefits like speed, seamless filesystem integration (virtual machine development with stock TempleOS is really a pain.), command-line mode where you can code in HolyC on the command line instead of TempleOS&#x27; GUI.<p>Its user-space nature lets it do networking quite easily with the FFI - it even features an IRC server, client and a wiki server!<p>I&#x27;ve also added a bunch of third-party games and software written for TempleOS on the Community folder, I hope you people take a look and enjoy!"
ushakov,9.0,40025272,"[40027622, 40025450]",58,1713035608,Today's open source models beat closed source models from 1.5 years ago,story,https://old.reddit.com/r/LocalLLaMA/comments/1c33agw/todays_open_source_models_beat_closed_source/,
mariuz,0.0,40030567,,3,1713096613,How a microprocessor works implemented with FPGA,story,https://twitter.com/BrunoLevy01/status/1643305642147340316,
ementally,186.0,40033522,"[40033927, 40034376, 40033919, 40033931, 40034015, 40034228, 40034018, 40033875, 40033928, 40034478, 40033959, 40034948, 40034082, 40034005, 40034858, 40035617, 40037165, 40034051, 40035422, 40034606, 40035038, 40035669, 40035404, 40036026, 40035331, 40034153, 40034735, 40035646, 40035096, 40035516, 40034064, 40034156, 40034016, 40035436, 40035005, 40033967, 40038398, 40034097, 40034035, 40034119, 40034089, 40033897, 40034299, 40034155, 40034012, 40034052, 40033934, 40040807, 40033973, 40036479]",134,1713121690,Personal VPN services are snake oil,story,https://httpscolonforwardslashforwardslashwwwdotzoltanbalazsdotcom.com/2024/03/01/VPN-Snakeoil.html,
Tomte,23.0,40021343,"[40032483, 40033248, 40033013]",28,1712994958,No Experience Necessary (2003),story,https://journals.sagepub.com/doi/pdf/10.2968/059002013,
alflervag,15.0,40025148,"[40027024, 40029158, 40025149, 40028627, 40030858, 40027009, 40027010, 40028819]",57,1713034250,"Careful with That Lock, Eugene",story,https://kaveland.no/careful-with-that-lock-eugene.html,
andrewcourtice,35.0,40009143,"[40016929, 40038854, 40016372, 40028895, 40018031, 40016013, 40028728, 40023420, 40022875, 40022249, 40016957, 40015343, 40018397, 40014393]",158,1712892689,Show HN: A JavaScript library for data visualization in both SVG and Canvas,story,https://github.com/andrewcourtice/ripl,"Here&#x27;s a project I&#x27;ve been working on for a little while now. Ripl is a JS library that provides a unified API for rendering shapes on both canvas and SVG interchangeably. Over the years I&#x27;ve used D3 extensively to create data visualisations so I figured I&#x27;d have a go at making my own version with a slightly more modern API and stricter TypeScript support.<p>I am aware there are already libraries that can draw to multiple contexts interchangeably, but I&#x27;ve added a few little niceties to Ripl that (as far as I know) some other libraries don&#x27;t have such as CSS-like query selectors, DOM-like event bubbling, and keyframe animation support.<p>The project is far from done and not published to NPM yet, but there are a few demos and source that you can look at in the repo.<p>I&#x27;m happy with how it has come along and the things I&#x27;ve learnt along the way, especially the math. My dream would be to one day work on this full-time and build out a full data-viz library."
harperlee,366.0,39999019,"[40006209, 39999570, 40005107, 39999650, 39999731, 40002616, 40014128, 40032549, 39999522, 39999422, 39999286, 40006149, 40009570, 39999589, 39999481, 40005699, 40005833, 40033287, 39999318, 39999308, 40000060, 40007125, 39999773, 40010789, 40005453, 40008076, 39999496, 39999299, 40000484, 39999608, 40006464, 40005743, 40020204, 39999355, 39999462, 40005921, 39999488, 39999360, 40008390, 39999755, 39999569, 40012533, 39999577, 39999588, 39999764, 39999350, 40006854, 40021142, 40011141, 40006935, 40008062, 39999323, 39999301, 40009424, 40005394, 40007153, 39999424, 40005911, 40009294, 40005117, 39999395, 39999526, 40006197, 40005488, 39999524, 39999466, 40005258, 40005830]",194,1712817315,"If Inheritance is so bad, why does everyone use it?",story,https://buttondown.email/hillelwayne/archive/if-inheritance-is-so-bad-why-does-everyone-use-it/,
fluentbyfire,13.0,40022333,"[40027406, 40036412, 40038577, 40035864, 40036150, 40037751]",43,1713007470,"I ""Blitzed"" 50 Books in 50 Days – My Experiment in Language Learning",story,https://buttondown.email/bimodalblitz/archive/i-blitzed-50-books-in-50-days-my-experiment-in/,
8bitsrule,0.0,40035748,,9,1713140202,Pulsed charging enhances the service time of batteries,story,https://www.sciencedaily.com/releases/2024/04/240409123909.htm,
cmpit,425.0,40001150,"[40008034, 40005913, 40001730, 40001513, 40001825, 40005159, 40001689, 40001959, 40001587, 40001640, 40001601, 40008587, 40001900, 40001550, 40002808, 40005447, 40008417, 40006958, 40001602, 40008871, 40001596, 40002174, 40007890, 40010324, 40001573, 40007667, 40007132, 40011059, 40002890, 40012142, 40006724, 40014980, 40011086, 40001581, 40001680, 40005827, 40005186, 40011958, 40007693, 40008742, 40012106, 40002121, 40008516, 40003018, 40001540, 40029115, 40001471, 40016008, 40006876, 40002339, 40001242, 40003180, 40009786]",373,1712836257,Mental health in software engineering,story,https://vadimkravcenko.com/shorts/mental-health-in-software-engineering/,
safaa1993,98.0,40033033,"[40033154, 40034833, 40034363, 40035375, 40037694, 40034364, 40035217, 40035415, 40037088, 40034559, 40033816, 40034237, 40034668]",176,1713117986,Discovering my roommate's death on Facebook,story,https://medium.com/the-wind-phone/discovering-my-roommates-death-on-facebook-3a060fc477ec,
robertn702,397.0,40025339,"[40025741, 40025922, 40026127, 40028607, 40029529, 40025622, 40029513, 40025859, 40025652, 40033455, 40026359, 40026176, 40025675, 40026241, 40029206, 40025805, 40027953, 40032681, 40025696, 40026174, 40028259, 40027775, 40029053, 40028885, 40029330, 40029949, 40028739, 40028514, 40026161, 40026049, 40025583, 40029114, 40026200, 40025606]",348,1713036282,Summers: Inflation Reached 18% in 2022 Using the Government's Previous Formula,story,https://www.forbes.com/sites/theapothecary/2024/03/23/summers-inflation-reached-18-in-2022-using-the-governments-previous-formula/,
maltalex,14.0,40008030,"[40011609, 40024857, 40014386, 40009215, 40010225, 40009314, 40016693, 40017387, 40014877]",58,1712879483,VNC Resolver,story,https://computernewb.com/vncresolver/,
todsacerdoti,12.0,40016468,"[40018142, 40017768, 40017806]",47,1712948528,Cipherleaks is the first demonstrated attack against AMD SEV-SNP (2021),story,https://cipherleaks.com/,
croes,0.0,40035532,,7,1713138064,Top cosmologists convene to question conventional view of the universe,story,https://www.theguardian.com/science/2024/apr/14/worlds-top-cosmologists-convene-to-question-conventional-view-of-the-universe,
MaximilianEmel,6.0,40036408,"[40037881, 40036596]",17,1713146703,Humane AI Pin: The Worst Product I've Ever Reviewed for Now [video],story,https://www.youtube.com/watch?v=TitZV6k8zfA,
hasheddan,51.0,40003868,"[40006982, 40004914, 40004351, 40005027, 40004601, 40005270]",159,1712852360,Vortex: OpenCL compatible RISC-V GPGPU,story,https://vortex.cc.gatech.edu/,
ingve,11.0,40025330,"[40029696, 40030249, 40028956]",56,1713036183,Go performance from version 1.0 to 1.22,story,https://benhoyt.com/writings/go-version-performance-2024/,
diodorus,3.0,40020818,[40029847],18,1712987431,The Archeologists of Athens (2023),story,https://www.newyorker.com/news/annals-of-inquiry/the-hidden-archeologists-of-athens,
dnetesn,15.0,39998903,"[40022425, 40023160, 40022630, 40022481, 40023499]",68,1712815866,Backyard Birding (2023),story,https://worldsensorium.com/backyard-birding/,
Tomte,42.0,39999855,"[40020939, 40028254, 40021980, 40023707, 40025137]",91,1712824972,Metaprogramming in Ruby: It's All About the Self (2009),story,https://yehudakatz.com/2009/11/15/metaprogramming-in-ruby-its-all-about-the-self/,
bookofjoe,0.0,40035003,,5,1713133396,Visual processing speed and its association w future dementia: prospective study,story,https://pubmed.ncbi.nlm.nih.gov/38424122/,
gnabgib,106.0,39998740,"[40003066, 40002014, 40003717, 40001120, 40001474, 40001834, 40006512, 40001972, 40003682, 40001740, 40000847]",151,1712814076,Roll-to-roll fabricated perovskite solar cells under ambient room conditions,story,https://www.nature.com/articles/s41467-024-46016-1,
conanxin,2.0,40020833,"[40033474, 40033138]",14,1712987555,Kevin Kelly: Daddy Issues,story,https://zine.zora.co/issue/intergenerational-dynamics/kevin-kelly,
3v1n0,58.0,40018925,"[40018926, 40024221, 40021947, 40021720]",116,1712966394,Ubuntu 24.04 (and Debian) removed libsystemd from SSH server dependencies,story,https://fosstodon.org/@3v1n0/112260950753323500,
geox,8.0,39999273,"[40035500, 40028453, 40029577]",24,1712820283,Scientists use biodegradable straws to protect lab-grown coral from hungry fish,story,https://apnews.com/article/coral-restoration-biodegradable-straws-ae23b903da2f91becd489d40e8cd9e17,
jfax,75.0,40022709,"[40022964, 40025919, 40024753, 40028604, 40023320, 40023450, 40029777, 40024444, 40030066, 40024307, 40024456, 40027412, 40029783, 40026514, 40030546, 40022846, 40022934, 40024474, 40023004, 40023141]",211,1713011274,A disgruntled federal employee's 1980s desk calendar (2018),story,https://www.theparisreview.org/blog/2018/06/13/a-disgruntled-federal-employees-1980s-desk-calendar/,
PaulHoule,6.0,40012738,"[40023916, 40024452]",37,1712929229,When an antibiotic fails: Scientists are using AI to target 'sleeper' bacteria,story,https://phys.org/news/2024-04-antibiotic-scientists-ai-sleeper-bacteria.html,
ingve,72.0,40011111,"[40012864, 40012992, 40012587, 40014065, 40018552, 40024432, 40015261, 40015501, 40013651, 40013133, 40014502, 40012360, 40012502, 40018940, 40013047]",183,1712918148,Why I recommend Renovate over any other dependency update tools,story,https://www.jvt.me/posts/2024/04/12/use-renovate/,
adityaathalye,1.0,40029048,[40029049],3,1713075012,How to Be a Natural Conference Speaker? (2022),story,https://www.evalapply.org/posts/how-to-give-a-conference-talk/index.html,
rsingel,308.0,40024062,"[40024226, 40024230, 40024233, 40024378, 40025019, 40025285, 40025088, 40031538, 40024284, 40024991, 40028149, 40025644, 40024626, 40026133, 40024234, 40024785, 40029313, 40026080, 40024905, 40024886, 40024801, 40028893, 40024346, 40024227, 40024320, 40024729, 40024869, 40024812, 40026636, 40024257]",421,1713024550,The FCC needs to stop 5G fast lanes,story,https://cyberlaw.stanford.edu/blog/2024/04/harmful-5g-fast-lanes-are-coming-fcc-needs-stop-them,
olooney,60.0,40001597,"[40002446, 40002341, 40004122, 40002236, 40002705, 40003553, 40002395, 40031167, 40006865, 40003094, 40009109, 40003139, 40002403, 40003901, 40002658, 40002412, 40005765, 40005147]",193,1712840238,Stacking triangles for fun and profit,story,https://www.oranlooney.com/post/angle-addition/,
wyndham,94.0,40005005,"[40005561, 40005842, 40006648, 40009933, 40009697, 40007198, 40007379, 40005353, 40005455, 40008789, 40008137, 40007906, 40005444]",234,1712858572,Using ClickHouse to scale an events engine,story,https://github.com/getlago/lago/wiki/Using-Clickhouse-to-scale-an-events-engine,
marban,154.0,40000861,"[40008546, 40016314, 40012084, 40003563, 40011955, 40034380, 40015911, 40016871, 40037528, 40023479, 40012297, 40027203, 40012053, 40011622, 40012039, 40016868, 40021151, 40011458, 40023683, 40011704, 40011540]",142,1712833559,Adobe is buying videos for $3 per minute to build AI model,story,https://www.bloomberg.com/news/articles/2024-04-10/adobe-is-buying-video-clips-for-3-per-minute-to-build-ai-model,
adulau,0.0,40024238,,19,1713026232,"CLA Free Initiative, Embracing Open Source with Developer Certificate of Origin",story,https://ossbase.org/initiatives/cla-free/,
belter,1.0,40033015,[40037196],8,1713117869,Israeli Hetz 3 or US Navy SM-3 caught Iranian exoatmospheric threat,story,https://bulgarianmilitary.com/2024/04/14/israeli-hetz-3-or-us-navy-sm-3-caught-iranian-exoatmospheric-threat/,
self,159.0,40010066,"[40014637, 40011198, 40010733, 40010229, 40017762, 40017052, 40014035, 40010067, 40013066, 40010384, 40018569, 40011934, 40028706, 40011367, 40013779, 40013832, 40012650, 40015334, 40012310, 40011479, 40015002, 40013557, 40010070, 40016914, 40010326, 40011002, 40010654, 40016296, 40012151]",169,1712905175,Here's a puzzle game. I call it Reverse the List of Integers,story,https://mathstodon.xyz/@two_star/112242224494626411,
rbanffy,54.0,40000443,"[40001087, 40000822, 40001382, 40004087, 40002947, 40004320, 40005126, 40003572, 40001269]",155,1712829955,ESA satellites to test razor-sharp formation flying,story,https://spectrum.ieee.org/satellite-constellation-formation-flying-esa,
fortran77,73.0,40031256,"[40033000, 40032022, 40031473, 40032077, 40031562, 40031874, 40035738, 40033062, 40032049, 40031448, 40033746, 40031357, 40032528, 40031359, 40031506]",127,1713104605,Roku says hackers gained access to 576k accounts in latest data-breach incident,story,https://www.wsj.com/tech/roku-says-hackers-gained-access-to-576-000-accounts-in-latest-data-breach-incident-8f73ab15,
back7co,79.0,40014937,"[40018453, 40015485, 40020690, 40015481, 40017368, 40025751, 40015521, 40018166, 40015264, 40017127, 40017671, 40018732, 40016265, 40015570, 40016505, 40015620, 40023280, 40020666, 40019484, 40017100, 40015338]",397,1712940309,"Show HN: 5 Years Ago I made the Recovery Kit, I just made the RK2",story,https://www.doscher.com/recovery-kit-version-2/,"The Recovery Kit 2 is another cyberdeck that for me is part computer, part backup device, and part functional movie prop.  It&#x27;s been fun to build, and the HN community has been great with ideas- especially around hosting and getting me off Squarespace.  I hope you all enjoy!"
todsacerdoti,54.0,40000349,"[40021896, 40021198, 40023123, 40000886, 40021294, 40021560, 40021657, 40025204, 40022857, 40021408]",98,1712829018,Browser Security Bugs That Aren't: JavaScript in PDF,story,https://textslashplain.com/2024/04/10/browser-security-bugs-that-arent-javascript-in-pdf/,
paulpauper,0.0,40032974,,21,1713117626,"White House, Senate Democrats unveil bill to battle pandemic aid fraud",story,https://www.washingtonpost.com/business/2024/04/09/covid-aid-fraud-congress/,
nen-nomad,35.0,40024273,"[40025084, 40025292, 40024964, 40027479, 40025031, 40025562, 40025764, 40025910, 40025536, 40025077]",63,1713026576,AI-Startup Launches Ever-Expanding Library of Free Stock Photos and Music,story,https://torrentfreak.com/ai-startup-launches-ever-expanding-library-of-free-stock-photos-and-music-240413/,
howsilly,24.0,40004319,"[40040155, 40019787, 40022428, 40005207, 40022308, 40019700, 40017436, 40005864, 40004412, 40005271]",46,1712854633,The Camorra Never Sleeps (2012),story,https://www.vanityfair.com/culture/2012/05/naples-mob-paolo-di-lauro-italy,
bookofjoe,0.0,40035523,,3,1713137998,Replicable functional brain signatures of 22q11.2 deletion syndrome andpsychosis,story,https://www.nature.com/articles/s41380-024-02495-8,
luu,367.0,40026732,"[40027121, 40027829, 40026996, 40027008, 40026987, 40026976, 40026960, 40028502, 40027367, 40027050, 40031481, 40029831, 40027883, 40027348, 40027785, 40028619, 40027130, 40027627, 40027169, 40027623, 40029405, 40028482, 40027915, 40031330, 40029397, 40029401, 40027179]",151,1713047201,Ford Mustang Mach-E using BlueCruise at time of crash: NTSB,story,https://fordauthority.com/2024/04/ford-mustang-mach-e-using-bluecruise-at-time-of-crash-ntsb/,
tosh,0.0,40034806,,15,1713131600,Mad MAX was released 45 years ago this week,story,https://twitter.com/ATRightMovies/status/1779443434790522982,
stanleydrew,16.0,40026789,"[40028593, 40028738, 40031434, 40027188, 40027154, 40027346, 40030614]",35,1713047611,We ensure Cloudflare customers aren't affected by LE's certificate chain change,story,https://blog.cloudflare.com/shortening-lets-encrypt-change-of-trust-no-impact-to-cloudflare-customers,
edward,228.0,40009856,"[40015017, 40010227, 40011807, 40010480, 40010102, 40011469, 40013197, 40010376, 40010276, 40010260, 40010099, 40010298, 40013473, 40011408, 40010383, 40014884, 40010203, 40010398, 40011068, 40010263, 40010289, 40015160, 40010338, 40022860, 40018679, 40010460, 40010451, 40015371, 40010351, 40010214, 40014781, 40020535, 40010365, 40016026, 40017541, 40010850, 40011985, 40019552, 40010243, 40010158, 40010140, 40022186]",418,1712902495,There’s a 30-year old dead Rabbit in Seven Sisters tube station,story,https://www.ianvisits.co.uk/articles/theres-a-dead-rabbit-in-seven-sisters-tube-station-71502/,
adius,44.0,40011250,"[40017010, 40013648, 40016393, 40013457, 40013264, 40015933, 40019638, 40011510, 40017703, 40026434, 40013391, 40013062, 40015236]",81,1712919844,Show HN: tu – Convert natural language date/time to UTC,story,https://github.com/ad-si/tu,
sebg,2.0,40008520,"[40021922, 40010029]",77,1712884377,How I got into deep learning,story,https://www.vikas.sh/post/how-i-got-into-deep-learning,
tosh,1.0,40033444,[40035937],8,1713121123,"Naval Ravikant's Airchat is a social app built around talk, not text",story,https://techcrunch.com/2024/04/13/airchat-launch/,
X-Cubed,150.0,39998346,"[39998753, 40004487, 39999215, 39999329, 39999066, 40000750, 39999330, 40000319, 40003923, 40001807, 40005319, 40002457, 39999799, 40001783, 39999224, 39999525, 40001684, 39998864, 39999685, 40004257, 40004709, 40002662, 40001409, 39998997, 40006266, 40001367, 39998750, 39998919]",229,1712809324,Going in circles without a real-time clock,story,https://rachelbythebay.com/w/2024/04/10/rtc/,
spxneo,330.0,40002851,"[40008452, 40007448, 40009405, 40013316, 40008547, 40009261, 40027541, 40003339, 40008180, 40003195, 40007049, 40003504, 40003163, 40003561, 40003199, 40003216, 40003228, 40008053, 40007244, 40007411]",267,1712847233,Vietnamese property tycoon sentenced to death in $27B fraud case,story,https://www.theguardian.com/world/2024/apr/11/vietnamese-property-tycoon-sentenced-to-death-in-27bn-case,
tosh,4.0,40001626,"[40037878, 40020560, 40007257, 40009943]",37,1712840462,Leave No Context Behind: Efficient Infinite Context Transformers,story,https://arxiv.org/abs/2404.07143,
janosdebugs,150.0,40017180,"[40019324, 40018353, 40018218, 40018157, 40018176, 40018254, 40021747, 40018410, 40018486, 40018718, 40019303, 40020875, 40018440, 40018062, 40022110, 40020829, 40029654, 40022541, 40018480, 40021946, 40018765, 40021633, 40022096, 40018255, 40018638, 40018248, 40021022, 40033081, 40021334, 40019396, 40018462, 40020306, 40020551, 40021624, 40020302, 40019739, 40021030, 40018790, 40019572, 40022746]",497,1712952988,Show HN: Mazelit - My wife and I released our first game,story,,"Hey folks,<p>About a year ago my wife and I, both closing in on 40, quit our jobs at Red Hat to start a games company and learn game development. Many things happened along the road, and about a week ago we released our first (small) game on Steam.<p><a href=""https:&#x2F;&#x2F;store.steampowered.com&#x2F;app&#x2F;2816120&#x2F;Mazelit&#x2F;"" rel=""nofollow"">https:&#x2F;&#x2F;store.steampowered.com&#x2F;app&#x2F;2816120&#x2F;Mazelit&#x2F;</a><p>The demo is free to play up to level 8 (the final game plays up to level 80) and we&#x27;d appreciate any feedback you have, whether it&#x27;s for the store page or the game itself.<p>We made the game in Godot 4.2 in roughly 3 months and I was working full time next to it. Since we ran into a bunch of roadblocks, we decided to also offer the entire source code up as a DLC in case someone wants to go look how we implemented the game, mod the game, or compile it for a different platform. The only thing we can&#x27;t redistribute with the game code is the Steamworks SDK, which is available for download from Steam. (The game minus integration is fully runnable without the SDK, though.)<p>Cheers and happy weekend!"
joaovcoliveira,158.0,40014730,"[40021079, 40017026, 40020119, 40020444, 40016261, 40017055, 40039307, 40038182, 40017689, 40018917, 40017294, 40016983, 40016795, 40021042, 40016717, 40020060, 40020208, 40016127, 40017317, 40017331, 40038050, 40019808, 40016131, 40017327, 40023358, 40018744, 40018531, 40021230, 40017727, 40016158, 40022832, 40017172, 40018067, 40019314, 40024965, 40018466, 40020346, 40019960, 40020042, 40021281, 40017313, 40020272, 40019290, 40022493, 40019937, 40023404, 40017020, 40017287, 40017494, 40016449, 40022030, 40021966, 40018136, 40018071, 40016574, 40020237, 40017297, 40016330, 40016992, 40016280, 40022808, 40020030, 40019242, 40020816, 40014731, 40016787]",349,1712939341,Show HN: Using Google Sheets as the back end/APIs of your app,story,https://www.zerosheets.com/,"Hello everyone!<p>At a company I worked for, we needed to develop an MVP (basically a web page) and apply certain business logic to a Google Drive spreadsheet that was frequently updated by the Sales team.<p>In this case, we had two options:<p>Develop a backend to replace the current spreadsheet and have the sales team use it as a new &quot;backoffice&quot; - This would take a very long time, and if the hypothesis we were testing was wrong, it would be time wasted.<p>Create the web page and use Google&#x27;s SDK to extract data from the spreadsheet.<p>We chose to go with the second option because it was quicker. Indeed, it was much faster than creating a new backoffice. But not as quick as we imagined. Integrating with Google&#x27;s SDK requires some effort, especially to handle the OAuth logic, configure it in the console, and understand the documentation (which is quite shallow, by the way).<p>Anyway! We did the project and I realized that maybe other devs might have encountered similar issues. Therefore, I developed a tool that transforms Google spreadsheets into &quot;realtime APIs&quot; with PATCH, GET, POST, and DELETE methods.<p>Since it&#x27;s a product for devs, I think it would be cool to hear your opinions. It&#x27;s still quite primitive, but the basic features already work.<p><a href=""https:&#x2F;&#x2F;zerosheets.com"" rel=""nofollow"">https:&#x2F;&#x2F;zerosheets.com</a>"
westurner,28.0,40026619,"[40031340, 40030550, 40027617, 40027919, 40028632, 40028832]",24,1713046302,Jim Keller suggests Nvidia should have used Ethernet to link Blackwell GPUs,story,https://www.tomshardware.com/tech-industry/artificial-intelligence/jim-keller-suggests-nvidia-should-have-used-ethernet-to-stitch-together-blackwell-gpus,
janandonly,73.0,40010221,"[40013769, 40016041, 40010506, 40010527, 40010787, 40010650, 40010820, 40011897, 40015286, 40014064, 40010664, 40010534, 40011056, 40010994, 40010887, 40010492, 40011353]",363,1712906957,What is Webb observing now?,story,https://spacetelescopelive.org/webb?obsId=01HTJT20C0STKNZ01KQYGEKBQ1,
TaurenHunter,32.0,40019217,"[40019861, 40020010, 40023219, 40028567, 40020358, 40033395, 40022826, 40024500, 40021029, 40021772, 40023137, 40023378, 40020368]",118,1712968740,Your LLM Is a Capable Regressor When Given In-Context Examples,story,https://arxiv.org/abs/2404.07544,
sebg,2.0,40003133,"[40016963, 40010144]",28,1712848747,What makes a great technical blog,story,https://notes.eatonphil.com/2024-04-10-what-makes-a-great-tech-blog.html,
gumby,37.0,39998483,"[40021422, 40021538, 40024219, 40021870, 40024384, 40024627, 40022090, 40021735, 40024299, 40023867, 40025228, 40023724]",40,1712810904,Commercial wing in ground effect plane (2018),story,https://www.nextbigfuture.com/2018/09/commercial-wing-in-ground-effect-plane.html,
todsacerdoti,73.0,40033870,"[40034222, 40034513, 40034306, 40034619, 40035296, 40034170, 40035019, 40034732, 40034231, 40034531, 40034372, 40035279, 40034593, 40034685, 40034256, 40037800, 40034402, 40034994, 40034686]",58,1713124322,Emacs 2011-2023,story,https://bastibe.de/2024-03-24-rip-emacs-2011-2023.html,
walterbell,32.0,40000553,"[40020462, 40020563, 40019257, 40022637, 40021211, 40021917, 40000626, 40020348, 40022862, 40020761, 40018959, 40021220, 40021321, 40022643, 40020002]",58,1712830886,HP 200LX and Related Palmtops,story,https://dfarq.homeip.net/hp-200lx-and-related-palmtops/,
hn1986,41.0,40009148,"[40010343, 40009688, 40010160, 40011301, 40010641, 40009753, 40010014, 40013862, 40010008, 40011466, 40014604, 40009624, 40009984]",136,1712892766,Threads on Mastodon and the bright future of the Fediverse,story,https://www.augment.ink/threads-on-mastodon/,
