by,descendants,id,kids,score,time,title,type,url,text
Slayertgc500,13.0,40237510,"[40237569, 40259494, 40260961, 40237640, 40260705, 40239095, 40238535, 40255218]",6,1714664490,Any way to get around 2FA on GitHub?,story,,This is really annoying and it won&#x27;t let me skip it anymore. Is there a way to get rid of it without enabling or logging out of my account?
gulced,4.0,40245633,"[40263691, 40248417]",18,1714727154,Russia leaves planes without GPS in northern Europe,story,https://english.elpais.com/international/2024-05-03/russia-leaves-thousands-of-planes-without-gps-in-northern-europe.html,
paulpauper,3.0,40254109,"[40255581, 40255146]",11,1714786477,Even the Most-Envied Retirement Plan Is Falling Short,story,https://www.bloomberg.com/news/features/2024-05-02/blackrock-uk-envy-australia-s-pensions-but-retirees-still-worry,
harporoeder,119.0,40242114,"[40243229, 40243065, 40242381, 40242275, 40242764, 40243205, 40242307, 40242393, 40242301, 40242432, 40242428, 40242344, 40242416, 40242401]",159,1714689196,YouTube's Legal Team sent me a letter [video],story,https://www.youtube.com/watch?v=dqTYg6vnQvw,
Brajeshwar,20.0,40257689,"[40258245, 40258172, 40258176, 40258329]",44,1714830829,Cancer vaccines are having a renaissance,story,https://www.technologyreview.com/2024/05/03/1092026/cancer-vaccines-are-having-a-renaissance/,
doener,1.0,40234212,[40234335],9,1714641229,GPS jamming: no more flights to the airport in Estonia for the time being,story,https://www.heise.de/en/news/GPS-jamming-no-more-flights-to-the-airport-in-Estonia-for-the-time-being-9703197.html,
microflash,1.0,40239880,[40245863],6,1714675085,Flood of AI-Generated Submissions 'Final Straw' for Small 22-Year-Old Publisher,story,https://www.404media.co/bards-and-sages-closing-ai-generated-writing/,
blegr,1.0,40260251,"[40260368, 40260652]",21,1714856518,Personalized mRNA vaccine boosts melanoma immunotherapy,story,https://www.nature.com/articles/d41591-024-00006-4,
sbt567,12.0,40253899,"[40253940, 40253980, 40254053, 40254073, 40254090]",45,1714783865,Rust to .NET compiler – Progress update,story,https://fractalfir.github.io/generated_html/rustc_codegen_clr_v0_1_2.html,
gulced,0.0,40261411,[40261449],5,1714868786,Unraveling life's origin: Five key breakthroughs from the past five years,story,https://phys.org/news/2024-05-unraveling-life-key-breakthroughs-years.html,
amichail,0.0,40260394,[40260932],17,1714857817,New mRNA cancer vaccine triggers fierce immune response to fight brain tumor,story,https://medicalxpress.com/news/2024-05-mrna-cancer-vaccine-triggers-fierce.html,
nukemandan,1.0,40243925,[40243948],6,1714709141,Maximum-severity Gitlab CVE allowing account hijacking under active exploitation,story,https://arstechnica.com/security/2024/05/0-click-gitlab-hijacking-flaw-under-active-exploit-with-thousands-still-unpatched/,
hn1986,0.0,40241595,,6,1714685651,Encrypted DMs Are Coming to ActivityPub,story,https://wedistribute.org/2024/05/encrypted-dms-activitypub/,
alt-glitch,4.0,40259225,"[40259402, 40260168, 40259319, 40259300]",24,1714845562,Rabbit R1 reverse engineered to run on Android,story,https://twitter.com/thel3l/status/1786717001265590576,
rntn,79.0,40235874,"[40238305, 40236431, 40237833, 40238394, 40238210, 40238838, 40238575, 40238892, 40238400, 40238373, 40239070, 40238857, 40238657, 40238934, 40241010, 40238882, 40238336, 40238344, 40238468, 40238229, 40238883, 40238994, 40236648, 40238748]",110,1714655810,Nurses Say Hospital Adoption of Half-Cooked 'AI' Is Reckless,story,https://www.techdirt.com/2024/05/02/nurses-say-hospital-adoption-of-half-cooked-ai-is-reckless/,
hbcondo714,68.0,40253637,"[40255086, 40254763, 40255838, 40254654, 40254710, 40258435, 40256281, 40255231, 40256120, 40255208, 40254692, 40255962, 40255671, 40253644, 40254825]",38,1714780881,People with gas and propane stoves breathe more unhealthy nitrogen dioxide,story,https://news.stanford.edu/2024/05/03/people-gas-propane-stoves-breathe-unhealthy-nitrogen-dioxide/,
perihelions,7.0,40260213,"[40260602, 40260691, 40260923, 40260929]",39,1714856196,Highly Pathogenic Avian Influenza A(H5N1) Virus Infection in a Dairy Farm Worker,story,https://www.nejm.org/doi/full/10.1056/NEJMc2405371,
paulpauper,0.0,40242396,,7,1714691759,"US job openings fall to 8.5M in March, the lowest level in more 3 years",story,https://finance.yahoo.com/news/us-job-openings-fall-8-141732496.html,
Tomte,12.0,40259666,"[40261105, 40260001, 40263088, 40263067, 40259698, 40259819]",25,1714850013,How Do I Prepare My Phone for a Protest?,story,https://themarkup.org/the-breakdown/2024/05/04/how-do-i-prepare-my-phone-for-a-protest-updated-2024,
kungfudoi,31.0,40254746,"[40254929, 40254913, 40254854, 40257057, 40254956, 40258144, 40254847, 40254903, 40255327, 40255031, 40254980, 40255041]",23,1714795940,"Bay Area restaurants react to new Calif. law with anger, shock",story,https://www.sfgate.com/food/article/sf-restaurants-junk-fees-law-19436419.php,
craigkerstiens,0.0,40240414,[40240771],12,1714677845,Simple Postgres to ClickHouse replication featuring MinIO,story,https://blog.peerdb.io/simple-postgres-to-clickhouse-replication-featuring-minio,
doener,5.0,40258472,"[40259126, 40259270, 40260086, 40258549, 40258490]",10,1714837492,"Firefox Power User Keeps 7,400 Browser Tabs Open for 2 Years",story,https://uk.pcmag.com/browsers/152140/firefox-power-user-keeps-7400-browser-tabs-open-for-2-years,
Tomte,2.0,40258395,"[40260465, 40260062, 40260003, 40258498]",13,1714836792,We Sent Ralph Nader Some of Our Favorite Pens. He Dismissed Them All,story,https://www.nytimes.com/wirecutter/reviews/ralph-nader-favorite-pens/,
wslh,2.0,40253337,"[40257211, 40263439]",6,1714777861,The Phantom Menace: still terrible after all these years?,story,https://www.theguardian.com/film/article/2024/may/03/star-wars-the-phantom-menace-still-terrible-after-all-these-years,
jonbeebe,16.0,40256600,"[40257710, 40257669, 40257793, 40257401, 40256601, 40257354, 40257959, 40256979]",23,1714820113,"At some point, JavaScript got good",story,https://jonbeebe.net/2024/05/javascript-got-good/,
lproven,0.0,40253170,,5,1714776204,RHEL stays fresh with 9.4 while CentOS 7 gets a Rocky retirement plan,story,https://www.theregister.com/2024/05/03/rhel_94_centos_7/,
belter,0.0,40259253,[40259294],4,1714845881,U.S. tech dominates generative AI boom–and cost of model training explains why,story,https://fortune.com/2024/04/18/google-gemini-cost-191-million-to-train-stanford-university-report-estimates/,
ajdude,69.0,40238118,"[40242074, 40241532, 40242004, 40242077, 40244780, 40241226, 40242627, 40242076, 40241698, 40242485, 40242777]",49,1714667387,Oh Frick Go Back: GUI Tool to Removes Ads from Various Places Around Windows 11,story,https://github.com/xM4ddy/OFGB,
gfourfour,12.0,40260581,"[40264283, 40260773, 40261527, 40262116, 40260757, 40260701, 40260735, 40261455, 40260951, 40260695]",18,1714859440,Ask HN: How do you develop and maintain a good note-taking habit?,story,,"I see a lot of people here talking about the importance of their respective note-taking systems for their life and productivity. I would like to gain the benefits of such a system but I run into a couple issues.<p>The first is that when I do take notes, I over-write them. I’ll find myself nearly word-for-word copying the information I need. This is a habit from my years in education where I would basically transcribe lectures as a way to maintain attention as a strategy for ADHD. Therefore, my notes end up a muddled version of the source material and I’ll just use the source material for reference, making the initial note take a big waste of time from the standpoint of having an easy reference available.<p>Another problem I run into is that when I’m very attentive to a task or piece of information and want to take some note on it or reference notes from elsewhere, switching contexts to my notes is disruptive.<p>Are there any resources you recommend for effective note-taking?"
crazydoggers,1.0,40240336,[40240358],6,1714677425,Gitlab flaw allowing account hijacking under active exploitation,story,https://arstechnica.com/security/2024/05/0-click-gitlab-hijacking-flaw-under-active-exploit-with-thousands-still-unpatched/,
peutetre,2.0,40259128,"[40259227, 40259326, 40259157]",5,1714844549,It's been two years since the UK's poop-engulfed beaches became a scandal,story,https://www.cnn.com/england-uk-sewage-poop-beach/index.html,
devonnull,0.0,40252018,,14,1714768131,Taiwan experiences cyberattacks each day. We should pay attention,story,https://theconversation.com/taiwan-is-experiencing-millions-of-cyberattacks-every-day-the-world-should-be-paying-attention-225677,
gulced,0.0,40257711,[40257831],9,1714831013,Modern SQLite #1: STRICT tables,story,https://antonz.org/sqlite-strict-tables/,
latchkey,0.0,40258873,[40258879],4,1714841840,Huy Fong Foods halts production. Is another sriracha shortage coming?,story,https://www.usatoday.com/story/money/2024/05/03/sriracha-hot-sauce-shortage-huy-fong-foods/73547924007/,
rntn,0.0,40258811,[40258824],4,1714841294,"School Convinced to Ditch Spyware, but Only Agrees to Not Spy on Its Journalists",story,https://www.techdirt.com/2024/05/03/student-journalists-convince-school-to-ditch-its-spyware-but-school-only-agrees-to-not-spy-on-its-journalists/,
jrflowers,8.0,40244246,"[40244294, 40245423, 40244708]",10,1714712682,"The Post Millennial hacked, subscriber database leaked",story,https://twitter.com/WilliamTurton/status/1786238180141695076,
conanxin,3.0,40257470,"[40258739, 40258218, 40257914]",11,1714828936,Rising Tide Rents and Robber Baron Rents,story,https://www.oreilly.com/radar/rising-tide-rents-and-robber-baron-rents/,
lproven,0.0,40251613,,9,1714765780,"For BASIC's 60th, three modern BASICs release new versions",story,https://www.theregister.com/2024/05/03/basic_60th_birthday/,
neustradamus,5.0,40252481,"[40253541, 40253523, 40253698]",18,1714771021,"Wine 9.8 (Dev) – Run Windows Applications on Linux, BSD, Solaris and macOS",story,https://gitlab.winehq.org/wine/wine/-/releases/wine-9.8,
ZuckMusk,27.0,40246690,"[40247027, 40248906, 40246895, 40248203, 40251999, 40247532, 40246840, 40247949, 40248329, 40247074]",42,1714737651,"Elon Musk is throwing his weight around Tesla, comes in like a wrecking ball",story,https://electrek.co/2024/05/01/elon-musk-throwing-weight-tesla-wrecking-ball/,
dev_by_day,36.0,40238911,"[40242631, 40239779, 40240019, 40239374, 40239331, 40239946, 40240926, 40242755, 40239727, 40239294]",58,1714671009,Ask HN: Are there any open source forks of nomad and consul?,story,,"Considering hashicorp has moved away from open source, does anyone know if there are any community forks of nomad and consul like there is now OpenTofu for terraform?"
parkertomatoes,5.0,40241290,"[40246598, 40241562, 40245656, 40241311]",14,1714683461,"Show HN: 2,629 Tiny Demos from Pouet, Running in the Browser",story,https://parkertomatoes.github.io/demo-parade/,
belter,0.0,40258547,[40260071],6,1714838357,Armies need their own drone Air Force flown by specialist soldiers,story,https://www.businessinsider.com/armies-need-their-own-drone-air-force-flown-by-specialists-study-says-2024-5,
salynchnew,4.0,40250780,"[40250992, 40253930, 40250781, 40252451]",14,1714761228,A Billionaire Wanted to Save 1T Trees by 2030. It's Not Going Great,story,https://www.bloomberg.com/graphics/2024-benioff-save-trillion-trees/,
taco-hands,28.0,40256017,"[40256949, 40261280, 40257753, 40258572, 40257008, 40257051, 40256989, 40257452, 40257029, 40257033, 40256990, 40256984, 40256994, 40257035, 40256069, 40256352]",23,1714812560,Are recruiters better than a coin flip at judging resumes? Here's the data,story,https://interviewing.io/blog/are-recruiters-better-than-a-coin-flip-at-judging-resumes,
dbreunig,70.0,40236637,"[40237070, 40236810, 40237009, 40238191, 40237448, 40237390, 40237110, 40236965, 40236812, 40236792, 40236924, 40237925, 40237391, 40236883, 40237261, 40237032, 40237109, 40236731, 40237055, 40248452, 40252978, 40237156, 40237188, 40237698, 40237079, 40237107, 40237102, 40241560, 40249907, 40237251, 40238672, 40238282, 40236952, 40236829, 40237718]",117,1714659719,Show HN: I built a tool for repeatable checklists,story,https://steplist.app/,"For a long time (after devouring Atul Gawande’s The Checklist Manifesto), I&#x27;ve noticed a gap in the productivity tool market—most tools don&#x27;t cater well to repeatable checklists. Task managers handle one-off tasks effectively, but falter with routines. On the other hand, project management software often feels overly complex. What I wanted was in the Goldilocks Zone between Todoist and Jira.<p>For my own personal use, I created StepList. I&#x27;ve used it to assist and track workouts, my daily workday, software deployment and setup, household management, and more. Over the last year I&#x27;ve prepared StepList for sharing with others, and it&#x27;s finally ready. It&#x27;s designed to be unobtrusive and straightforward, allowing you to focus seamlessly on your tasks.<p>Key features include:<p>Easy List Creation: Quickly make lists with basic formatting options.<p>Search and Access: Find your lists and those shared by others.<p>Efficient Execution: Perform tasks swiftly, whether on a computer or mobile browser.<p>Flexible Scheduling: Set up lists to be done once or on a recurring basis, with email reminders.<p>Simple Delegation: Assign lists via email, no StepList account needed for collaborators.<p>StepList is fairly vanilla Rails 7 app. I&#x27;ve found Hotwire to be a powerful tool for building apps that work well on mobile and desktop (though in a few key places, I eschew it to keep things fast).<p>StepList is free to use, with a $5&#x2F;month premium plan for unlimited scheduled, delegated, and private lists.<p>- Drew"
luu,83.0,40242692,"[40243422, 40243418, 40243712, 40243681, 40243345, 40243706, 40243713, 40245184, 40243424, 40243490, 40243572, 40243620, 40243546]",47,1714694881,Vanguard just went live and LoL players are claiming it's bricking their PCs,story,https://dotesports.com/league-of-legends/news/vanguard-just-went-live-and-lol-players-are-already-claiming-its-bricking-their-pcs,
bookofjoe,1.0,40258146,"[40258179, 40258531]",8,1714834642,ChatGPT search engine rumored to be coming next week,story,https://mashable.com/article/chatgpt-search-announcement-what-we-know,
blueridge,0.0,40258043,[40258076],5,1714833818,Why am I still doing this?,story,https://world.hey.com/jason/why-am-i-still-doing-this-b931cdf8,
traviskuhl,6.0,40257997,"[40258168, 40258934, 40258085, 40258449]",13,1714833409,What's happening at Tesla? Here's what experts think,story,https://arstechnica.com/cars/2024/05/chaos-at-tesla-what-analysts-think-about-elon-musks-cuts-and-layoffs/,
colinprince,1.0,40248301,[40252161],9,1714747643,"Russian troops enter base housing US Military in Niger, US official says",story,https://www.reuters.com/world/africa/russian-troops-enter-base-housing-us-military-niger-us-official-says-2024-05-02/,
elorant,8.0,40260179,"[40260715, 40262741, 40260918, 40260574, 40260681]",22,1714855778,Microsoft plans to lock down Windows DNS like never before,story,https://arstechnica.com/security/2024/05/microsoft-plans-to-lock-down-windows-dns-like-never-before-heres-how/,
kickofline,1.0,40259304,"[40259310, 40259371]",5,1714846423,Fogbank,story,https://en.wikipedia.org/wiki/Fogbank,
belter,1.0,40259246,"[40260152, 40259293]",9,1714845839,Berkshire Hathaway's cash pile hits new record as Buffett dumps stocks,story,https://www.ft.com/content/a3e25396-972a-4989-931e-7369fdd8d55b,
belter,28.0,40247218,"[40247954, 40247927, 40247827, 40247979, 40248107, 40248153, 40248084, 40247326, 40248676, 40247952, 40248030]",32,1714741287,"AI engineers report burnout, rushed rollouts as 'rat race' to stay competitive",story,https://www.cnbc.com/2024/05/03/ai-engineers-face-burnout-as-rat-race-to-stay-competitive-hits-tech.html,
rntn,0.0,40250326,,5,1714758559,Who's making chips for AI? Chinese manufacturers lag behind US tech giants,story,https://www.nature.com/articles/d41586-024-01292-1,
paulpauper,0.0,40259000,[40259101],3,1714843105,Americans are still worried about inflation,story,https://reason.com/2024/05/03/americans-are-still-really-worried-about-inflation/,
daolf,117.0,40235138,"[40235440, 40235234, 40235428, 40235200, 40237878, 40235392, 40235740, 40235971, 40235437, 40235552, 40235693, 40235376, 40235201, 40235385, 40235411, 40235369, 40235282, 40235178, 40235625, 40235426, 40235668, 40235220, 40241318, 40235170]",127,1714651221,Search.chatgpt.com domain and SSL cert have been created,story,https://search.chatgpt.com,
lxm,0.0,40254354,[40254368],13,1714789952,SVB agrees to sell venture capital arm for $340M,story,https://www.axios.com/2024/05/03/svb-venture-capital-arm,
NegativeLatency,8.0,40260165,"[40260636, 40260736, 40260679]",22,1714855710,Climate scientists say South Asia's heat wave (120F) is a sign of what's to come,story,https://text.npr.org/1096085028,
asix66,2.0,40261259,"[40262038, 40261269]",9,1714866648,Ukraine Is Using a Dungeons and Dragons Weapon to Wreak Havoc on Russian Trucks,story,https://www.popularmechanics.com/military/weapons/a60661761/ukraine-dungeons-and-dragons-weapon/,
belter,47.0,40235928,"[40241469, 40238855, 40241206, 40247204, 40239658, 40241359]",35,1714656091,Dutch Students Delay Graduation Due to Housing Shortages,story,https://nltimes.nl/2024/05/02/graduates-stuck-staying-student-housing-cant-find-affordable-home,
adamcarson,10.0,40239811,"[40239941, 40239916, 40240508, 40240223, 40239989, 40239980, 40240004, 40241309, 40239975]",40,1714674697,Independent publishers are being demoted to give way to big sites on Google,story,https://housefresh.com/how-google-decimated-housefresh/,
paulpauper,5.0,40251463,"[40252005, 40251849, 40251902, 40251847]",19,1714765082,"""We live and we die. We control nothing beyond that.""",story,https://americandreaming.substack.com/p/we-live-and-we-die-we-control-nothing,
kmdupree,1.0,40241310,"[40241583, 40241333]",8,1714683568,An Examination of Large Language Model Performance on Grade School Arithmetic,story,https://arxiv.org/abs/2405.00332,
belter,0.0,40257812,[40257816],15,1714831926,EU plan to force apps to scan for CSAM risks millions of false positives,story,https://techcrunch.com/2024/05/02/eu-csam-scanning-council-proposal-flaws/,
gulced,0.0,40257738,[40257870],6,1714831162,HSBC banking app crashes leaving thousands unable to access their accounts,story,https://metro.co.uk/2024/05/04/major-banking-app-crashes-leaving-thousands-unable-access-accounts-20774756/,
thunderbong,34.0,40236699,"[40237764, 40237084, 40237262, 40238956, 40237122, 40237298, 40255175, 40237020, 40245768, 40237014, 40237010]",48,1714660107,GitHub: Nintendo Submit DMCA Notices to Yuzu Forks,story,https://github.com/github/dmca/blob/master/2024/04/2024-04-29-nintendo.md,
robblack,4.0,40243976,"[40244037, 40246932]",8,1714709761,"Economist Slams Elon Musk for Making Tesla a ""Tech-Bubble"" Meme Stock",story,https://futurism.com/the-byte/economist-slams-elon-musk-meme-stock,
belter,85.0,40245509,"[40246666, 40246764, 40247520, 40246699, 40246653, 40246864, 40246646, 40247248, 40248013, 40247059, 40246607]",54,1714725658,Apple announces $110B share buyback after quarterly profit and revenue drop,story,https://www.thenationalnews.com/business/markets/2024/05/02/apple-announces-110bn-share-buyback-after-quarterly-profit-and-revenue-drop/,
wslh,1.0,40253641,[40256051],10,1714780925,Sony and Apollo send letter expressing interest in $26B Paramount buyout,story,https://www.cnbc.com/2024/05/02/sony-apollo-express-interest-in-paramount-buyout-amid-skydance-bid.html,
vasco,37.0,40235206,"[40236029, 40236555, 40236213, 40236198, 40236779, 40236633, 40236554, 40236898, 40236452, 40243738, 40236006, 40236167, 40236635, 40236407, 40236033]",40,1714651718,OpenAI working on web search product,story,https://searchengineland.com/open-ai-search-product-437563,
hiatus,1.0,40238871,"[40238996, 40239282]",34,1714670859,Orangutan was seen treating his wound with a medicinal plant,story,https://www.nbcnews.com/science/science-news/orangutan-treated-own-wound-medicinal-plant-rcna150230,
MilnerRoute,65.0,40254733,"[40255715, 40255382, 40255521, 40255663, 40258792, 40258770, 40255507, 40255656, 40255574, 40255464, 40255453, 40254737, 40254752]",37,1714795811,Tesla retreat from EV charging leaves growth of U.S. network in doubt,story,https://www.washingtonpost.com/business/2024/05/03/tesla-charging-us-network/,
dez_blanchfield,7.0,40237254,"[40237644, 40238407, 40237884, 40238056, 40237860]",8,1714662954,"World Password Day. Join the Fight Against Cybercrime, One Password at a Time",story,https://elnion.com/2024/05/02/world-password-day-2024-join-the-fight-against-cybercrime-one-strong-password-at-a-time/,
LopRabbit,1.0,40243193,[40243240],6,1714701024,Cascadia Code 2404.23,story,https://devblogs.microsoft.com/commandline/cascadia-code-2404-23/,
indrora,230.0,40254573,"[40254788, 40254753, 40255411, 40254745, 40254755, 40254711, 40254940, 40254739, 40258904, 40257595, 40254771, 40255062, 40255938, 40254858, 40255094, 40254609]",161,1714793411,I joined landlord groups to persuade them to be better people to their tenants,story,https://www.thisisalot.com/unhinged-opinions/i-joined-a-bunch-of-landlord-groups-to-subtly-manipulate-them-into-being-better-people/118/,
sousmx,7.0,40242157,"[40242436, 40242555, 40255049, 40249735, 40242462, 40242728]",22,1714689558,Warrantless FBI searches of American communications drop 50 percent,story,https://www.theverge.com/2024/5/2/24147263/fbi-fisa-section-702-searches-transparency-report,
gulced,72.0,40246021,"[40247411, 40246727, 40247963, 40247936, 40252304, 40247607, 40248231, 40247481]",49,1714731218,Starlink geofence appears to have some gaping holes,story,https://www.theregister.com/2024/05/03/spacex_roaming_lockdown/,
sandebert,0.0,40262383,[40262831],5,1714885450,The internet is in decline – it needs rewilding,story,https://www.theguardian.com/commentisfree/article/2024/may/04/the-internet-is-in-decline-it-needs-rewilding,
JumpCrisscross,2.0,40248509,[40248909],6,1714748747,China Launches Spacecraft to the Far Side of the Moon,story,https://www.nytimes.com/2024/05/03/science/china-moon-launch-watch.html,
jihadjihad,0.0,40240835,,7,1714680424,Chinampa,story,https://en.wikipedia.org/wiki/Chinampa,
thunderbong,0.0,40256505,[40256808],5,1714818835,Microsoft bans US police departments from using AI tool for facial recognition,story,https://techcrunch.com/2024/05/02/microsoft-bans-u-s-police-departments-azure-openai-facial-recognition/,
dxs,66.0,40247877,"[40248706, 40248460, 40248262, 40248234, 40248449, 40248456, 40250257, 40249801, 40248197, 40248649]",41,1714745534,"The Airbus A340 was built to rule long-haul travel, but now it’s vanishing",story,https://www.cnn.com/travel/the-a340-vanishing/index.html,
robblack,14.0,40237409,"[40237589, 40240916, 40239189, 40237903, 40241696, 40241710, 40237686, 40237687, 40237834]",43,1714663993,Google paid Apple $20B in 2022 alone for default status,story,https://nypost.com/2024/05/02/business/google-paid-apple-20b-in-2022-alone-for-default-status-docs/,
LaSombra,3.0,40234075,"[40237709, 40237755, 40236294]",9,1714639903,Bitwarden just launched a new authenticator app,story,https://bitwarden.com/blog/bitwarden-just-launched-a-new-authenticator-app-heres-what-it-means-to-users/,
jseliger,2.0,40243519,[40243522],9,1714704670,The Exodus of China's Wealthy to Japan,story,https://www.wsj.com/world/china/chinese-residents-move-japan-311d8557,
gslin,0.0,40241424,[40241513],5,1714684404,Tor Migrates from Gitolite/GitWeb to Gitlab,story,https://blog.torproject.org/gitolite-gitlab-migration/,
belter,18.0,40257238,"[40257239, 40259842, 40257277, 40257556]",12,1714826659,It's Time to Tax the Billionaires,story,https://www.nytimes.com/interactive/2024/05/03/opinion/global-billionaires-tax.html,
roschdal,17.0,40259289,"[40259373, 40260455, 40259355, 40259523, 40259798, 40260572, 40259612, 40259324, 40259298]",12,1714846251,Ask HN: When will the AI bubble burst?,story,,"When will the AI bubble burst?
What will trigger it?
What do we really need LLMs for that humans can&#x27;t?"
geox,0.0,40244642,,5,1714716634,Bumblebee nests are overheating due to climate change,story,https://www.eurekalert.org/news-releases/1043007,
coloneltcb,81.0,40238269,"[40239571, 40239831, 40239829, 40239940, 40239145, 40242529, 40239698, 40240137, 40238296, 40240119]",55,1714668098,Spotify moves lyrics behind a paywall,story,https://techcrunch.com/2024/05/02/spotify-is-quietly-moves-lyrics-behind-a-paywall/,
pseudolus,11.0,40247249,"[40247634, 40248156, 40248035]",11,1714741539,Some scientists can't stop using AI to write research papers,story,https://www.theregister.com/2024/05/03/ai_scientific_articles/,
marban,10.0,40238949,"[40239209, 40240312, 40240250, 40239218, 40239162, 40239192]",24,1714671137,Stealing your Telegram account in 10 seconds flat,story,https://lyra.horse/blog/2024/05/stealing-your-telegram-account-in-10-seconds-flat/,
cebert,58.0,40258867,"[40260160, 40260413, 40260330, 40260298, 40260472, 40260772, 40260430, 40260514, 40260356]",32,1714841793,State Farm announces major change affecting tens of thousands households in CA,story,https://finance.yahoo.com/news/state-farm-announces-major-insurance-150000813.html,
fragmede,1.0,40234111,"[40234114, 40236277]",5,1714640243,Show HN: SSH Funky.nondeterministic.computer,story,https://funky.nondeterministic.computer/,
keepamovin,17.0,40256591,"[40256809, 40256777, 40256820, 40257385, 40256959, 40256798]",24,1714819979,Georgia rocked by protests as government pushes Putin-style 'foreign agent' bill,story,https://www.cnn.com/2024/05/03/europe/georgia-russia-foreign-agent-europe-intl/index.html,
