by,descendants,id,kids,score,time,title,type,url,text
josephcsible,83.0,40023471,"[40025938, 40024076, 40023811, 40027770, 40023725, 40028273, 40023782, 40023889, 40026185, 40028587, 40026968, 40028154, 40028898, 40025200, 40028862, 40025451, 40023780, 40023661, 40031989]",99,1713019474,Florence museum won suit against publisher that used Michelangelo's David image,story,https://news.artnet.com/art-world/florence-gallerie-dellaccademia-wins-david-lawsuit-2313262,
the_panopticon,8.0,40035258,"[40035543, 40035726, 40035754]",16,1713135611,"From boom to burst, the AI bubble is only heading in one direction",story,https://www.theguardian.com/commentisfree/2024/apr/13/from-boom-to-burst-the-ai-bubble-is-only-heading-in-one-direction,
geox,7.0,40004935,"[40005401, 40005296, 40015398]",55,1712858228,Holodeck: Language Guided Generation of 3D Embodied AI Environments,story,https://yueyang1996.github.io/holodeck/,
cwwc,1.0,40036315,[40036381],6,1713145822,China's Crumbling Metro(s),story,https://www.bloomberg.com/news/articles/2024-04-12/addis-ababa-ethiopia-metro-s-decline-shows-china-s-step-back-from-africa,
bookstore-romeo,75.0,40015267,"[40016686, 40015629, 40015692, 40016177, 40016508, 40015900, 40016203, 40015805, 40017498, 40016585, 40016706, 40015697, 40016966, 40016385, 40015937, 40016114]",71,1712942117,Haunting photos of the bison extermination in 19th century America,story,https://rarehistoricalphotos.com/american-bison-extinction-photos/,
dagmx,6.0,40002784,"[40009361, 40009695]",15,1712846803,Apple to expand repair options with support for used genuine parts,story,https://www.apple.com/newsroom/2024/04/apple-to-expand-repair-options-with-support-for-used-genuine-parts/,
tosh,155.0,39995725,"[39996120, 39998892, 39996290, 39996619, 39996522, 39996205, 39995915, 39996171, 40001147, 39998124, 39997322, 39996320, 39996447, 40001176, 39999528, 40003982, 39996710, 40003506, 39998726, 39997914, 40021137, 39997301, 39996343, 39999050, 39997965, 40000977, 39997222, 40003160, 39996431, 39998407, 39996145, 39998806, 39997831, 40007668, 39996440, 39997359, 39995927, 39997972, 39996184]",430,1712783202,Aider: AI pair programming in your terminal,story,https://github.com/paul-gauthier/aider,
kmdupree,81.0,40002306,"[40004024, 40003485, 40009092, 40003473, 40006374, 40003952, 40006601, 40008733, 40005373, 40003096, 40006186, 40004274, 40003091]",81,1712844434,NYC Rat Sightings (Daily),story,https://realtime.org/data/nyc-rat-sightings,
CanaryLayout,2.0,40025281,[40025282],43,1713035677,"For Go programmers, a cheap CGo pattern to give Jia Tan a headache",story,https://gist.github.com/christoofar/880b4bcf3018f4681bb71bfdf1c16a6a,
josephcsible,233.0,40019124,"[40019470, 40020037, 40019610, 40019772, 40019334, 40019317, 40019690, 40019293, 40019351, 40019407, 40019525, 40019516, 40019758, 40023490, 40019885, 40020217, 40019487, 40019912, 40020279, 40019588]",199,1712968032,Japanese police arrest man for tampering with Pokémon Violet save data,story,https://www.ign.com/articles/japanese-police-arrest-36-year-old-man-on-suspicion-of-tampering-with-pokemon-violet-save-data,
aduffy,30.0,39995112,"[39999340, 39995409, 39995732, 39997294, 39995281, 39996789, 39996908, 39998128, 39997052, 39995832, 39995672]",120,1712779221,Nimble: A new columnar file format by Meta [video],story,https://www.youtube.com/watch?v=bISBNVtXZ6M,
chippy,3.0,40017514,"[40023330, 40022695, 40025369]",30,1712955071,Invisibility Cloak,story,https://www.cs.umd.edu/~tomg/projects/invisible/,
sebg,10.0,40008458,"[40015781, 40008708, 40008910]",72,1712883846,An Introduction to Flow Matching,story,https://mlg.eng.cam.ac.uk/blog/2024/01/20/flow-matching.html,
aleph_minus_one,0.0,40026250,,37,1713043132,Kerodon – an online resource for homotopy-coherent mathematics,story,https://kerodon.net/,
dmvdoug,5.0,40023216,"[40026748, 40025640, 40023935]",18,1713016966,Ask HN: Learning about build systems generally,story,,"The question: what resources exist to help explore build systems, specifically anything that isn’t extremely tool-specific? Or is compile&#x2F;build so tool-specific that that’s all there is?<p>Here’s what I mean by tool-specific: resources about autotools require you to go into the guts of autotools. Resources about  Cmake require you to go into the guts of Cmake. Resources about Meson require you to go into the guts of Meson. Compare that with, for example, learning about memory management. You can get quite in depth introductions and overviews of memory management without necessarily needing to get into the guts of x86-64 mm. Now, you often do. But usually as an exemplar towards the end, in order to illustrate the general principles that have been established. When I have tried to approach learning about build systems, it feels like you are immediately thrown into the weeds of how specific tools work. But my interest is not necessarily in learning one specific tool in order to use it right now.<p>From the beggars <i>can</i> be choosers front: reading material preferred, podcasts ok, videos I’m meh-ish about but if that’s what exists, hit me with them."
jerlam,416.0,40004889,"[40010672, 40009592, 40009895, 40009746, 40008268, 40012600, 40014930, 40010746, 40008475, 40008426, 40020367, 40012300, 40009615, 40008275, 40009964, 40019708, 40012865, 40009947, 40008333, 40010233, 40008235, 40008222, 40005023, 40010525, 40008439, 40010016, 40024830, 40010027, 40015788, 40008466, 40012895, 40010918, 40008272, 40011992, 40024619, 40010311, 40011228, 40009585, 40008344, 40010909, 40008300, 40004944, 40009515, 40008450, 40008461]",208,1712858027,"Man creatively sneaks onto Delta flight, but gets caught",story,https://onemileatatime.com/news/man-creatively-sneaks-onto-delta-flight/,
emegeve83,65.0,40001019,"[40021337, 40021518, 40021951, 40021160, 40022299, 40021445, 40023836, 40021583, 40021616, 40023731, 40021644, 40022827]",94,1712835099,It's far from clear how grub package updates work on Ubuntu,story,https://utcc.utoronto.ca/~cks/space/blog/linux/UbuntuGrubUpdateConfusion,
kryster,247.0,40017310,"[40024823, 40023425, 40019640, 40021894, 40021226, 40021287, 40021461, 40021471, 40020048, 40020164, 40022072, 40023757, 40020801, 40021990, 40021061, 40020330, 40030585, 40022908, 40019967, 40019383, 40021093, 40021146, 40020976, 40020885]",394,1712953716,XZ backdoor story – Initial analysis,story,https://securelist.com/xz-backdoor-story-part-1/112354/,
nalgeon,81.0,39996521,"[39998746, 39997263, 39997564, 39997116, 39999803, 39999149, 39997625, 39999511, 39999959, 39997143]",149,1712789507,ETag and HTTP Caching,story,https://rednafi.com/misc/etag_and_http_caching/,
signa11,54.0,40009743,"[40041155, 40010585, 40010466, 40011817, 40010732, 40010436]",83,1712901126,Fivefold Slower Compared to Go? Optimizing Rust's Protobuf Decoding Performance,story,https://www.greptime.com/blogs/2024-04-09-rust-protobuf-performance,
Anon84,18.0,40030354,"[40032149, 40032237, 40032295, 40032265, 40032139, 40032285]",71,1713093904,Is the Atlantic Overturning Circulation Approaching a Tipping Point?,story,https://tos.org/oceanography/article/is-the-atlantic-overturning-circulation-approaching-a-tipping-point,
geox,135.0,40022801,"[40023998, 40023972, 40024239, 40023653, 40024357, 40023477, 40024846, 40024741, 40023491, 40024603, 40023926, 40023421, 40024075, 40023700, 40023509, 40024494, 40023872, 40023774, 40024014, 40023503, 40027517, 40024979]",125,1713012347,350 tons of of chocolate and wine arrive on world’s largest cargo sailboat,story,https://untappedcities.com/2024/04/12/grain-de-sail-ll/,
redbell,114.0,39996475,"[39998615, 39997938, 39998841, 39997854, 39997919, 39998101, 39997996, 39998365, 39998269, 39998998, 39998258, 39998093, 39997964, 39997727, 39998032, 39997784, 40006297, 39999772, 39998180, 39998195, 39997826, 39998349, 40004821, 39998887, 39998646, 39997881, 39998406, 39998312, 40002538, 39998166, 39998154, 40000537, 40002931, 39998332, 39998169, 39998685, 40014301, 39998667, 39998231, 39998439, 39997827, 39998095]",101,1712789133,"When teaching computer architecture, why are universities using obscure CPUs?",story,https://academia.stackexchange.com/questions/209300/when-teaching-computer-architecture-why-are-universities-using-obscure-or-even,
lxm,12.0,40024063,"[40026604, 40027564, 40026929, 40026488, 40027190]",11,1713024577,Cheap Stuff on Temu Opens a New Generational Divide,story,https://www.wsj.com/lifestyle/temu-victims-parents-kids-bargain-shopping-ca25ef93,
todsacerdoti,0.0,40022092,,14,1713005286,Go performance from version 1.0 to 1.22,story,https://benhoyt.com/writings/go-version-performance-2024/,
tosh,2.0,40003003,[40007943],12,1712848076,Orbit Is Joining Postman,story,https://orbit.love/blog/orbit-is-joining-postman,
pyinstallwoes,20.0,39994301,"[39999114, 39994730, 39997616, 39997768, 39997098]",123,1712774824,"Lens sort, a masked pixel sort glitch effect",story,https://github.com/BernardZhao/lenssort,
pabs3,58.0,40036940,"[40037116, 40037076, 40037253, 40037318, 40037102, 40037456, 40037067, 40037526, 40037101, 40038355, 40037422, 40037050, 40037078, 40037542]",54,1713153411,DMCA Notice Targeting 'Bypass Paywalls Clean' Isn't the Thing to Get Angry About,story,https://torrentfreak.com/dmca-targetting-bypass-paywalls-clean-isnt-what-people-should-be-angry-about-240414/,
ericcholis,30.0,39994723,"[39999249, 39997141, 39997923, 40003200, 39998481, 40001030, 40001948, 39997874, 40002266]",122,1712776918,Slay the Spire 2 Announced – Using Godot,story,https://www.ign.com/articles/slay-the-spire-2-officially-announced-first-gameplay-screens-revealed,
billybuckwheat,0.0,40027156,,10,1713050894,Schools Blocked Homework and Censored Suicide Prevention Sites,story,https://themarkup.org/digital-book-banning/2024/04/13/schools-were-just-supposed-to-block-porn-instead-they-sabotaged-homework-and-censored-suicide-prevention-sites,
consumer451,6.0,40027113,"[40027114, 40027607, 40031272]",17,1713050421,IC3PEAK – Marching [video],story,https://www.youtube.com/watch?v=xqohApD6Ng8,
msolujic,1.0,40020540,"[40027088, 40027086]",27,1712983243,OpenTofu Project Denies HashiCorp's Allegations of Code Theft,story,https://thenewstack.io/opentofu-project-denies-hashicorps-allegations-of-code-theft/,
Brajeshwar,0.0,40023402,,10,1713018850,Texas' skyscrapers are going dark to keep billions of birds safe,story,https://www.bbc.com/future/article/20240410-how-switching-off-lights-stops-migrating-birds-collisions-with-buildings,
kiyanwang,24.0,40015380,"[40020242, 40024212, 40017496, 40016453, 40017174, 40016809, 40016959, 40018476, 40016420, 40018449, 40020793]",69,1712942817,We need more calm companies,story,https://justinjackson.ca/calm-company/,
andyjohnson0,1.0,40029998,[40038681],7,1713088507,Friedrich Glasl's model of conflict escalation,story,https://en.wikipedia.org/wiki/Friedrich_Glasl%27s_model_of_conflict_escalation,
janpot,71.0,40003138,"[40004333, 40004689, 40006313, 40003716, 40005929, 40004839, 40003499, 40004742, 40004965, 40004264]",178,1712848775,New paintings found at Pompeii,story,https://www.bbc.com/news/science-environment-68777741,
sherilm,7.0,40016456,"[40019411, 40018207, 40021110, 40023713, 40019534, 40016550, 40018407, 40017160, 40020488]",31,1712948468,Secretary Problem,story,https://en.wikipedia.org/wiki/Secretary_problem,
stevekrouse,157.0,39993976,"[39994894, 39994538, 39998435, 39994908, 39999168, 39995462, 39995611, 39994563, 39998217, 40005678, 39996203, 39994582, 39995217, 39995819, 39997044, 40003586, 39994661, 39998971, 39998366, 40001674, 39995722, 39994502, 39996339, 40010657, 39996553, 39996636, 39997597, 39994469, 39994487, 39998083, 40000629, 39994103, 39995702, 39997477, 39999348, 39996684, 39995374, 39994496, 39999277, 39995717, 39994584, 39997434]",301,1712772908,Code search is hard,story,https://blog.val.town/blog/search-notes/,
lifefeed,76.0,40001889,"[40004299, 40002635, 40004211, 40004352, 40004063, 40004197, 40002063, 40004275, 40005052, 40004515, 40004650, 40007837, 40002732, 40004668, 40008233, 40002525, 40002010]",74,1712842016,"Stack Overflow is documentation, not Q&A",story,https://landedstar.com/blog/posts/stack-overflow-is-documentation/,
Bostonian,1.0,40006245,[40006286],28,1712865849,Open-sourced central bank macroeconomic models,story,https://papers.ssrn.com/sol3/papers.cfm?abstract_id=4755247,
klelatti,9.0,40001833,"[40005114, 40003778, 40002131, 40009070, 40002081]",34,1712841668,Herman Goldstine and the IAS Machine: Unveiling the Modern Computer (2023),story,https://thechipletter.substack.com/p/unveiling-the-modern-computer,
gorky1,71.0,39994339,"[39994575, 40003115, 39996348, 39994890, 39994690, 39994764, 40004100, 39996168, 39995046, 39994805]",219,1712774987,Libgourou: A Free Implementation of Adobe's Adept DRM on ePub/PDF Files,story,https://forge.soutade.fr/soutade/libgourou,
bguberfain,5.0,40004741,"[40004970, 40005556, 40004911, 40005754]",45,1712857112,Rerank 3: A new foundation model for efficient enterprise search and retrieval,story,https://txt.cohere.com/rerank-3/,
awfulsystems,28.0,40007539,"[40008150, 40007645, 40008844, 40007817]",47,1712875091,Pivot to AI: Hallucinations worsen as the money runs out,story,https://davidgerard.co.uk/blockchain/2024/04/11/pivot-to-ai-hallucinations-worsen-as-the-money-runs-out/,
Brajeshwar,0.0,40024052,,9,1713024509,Mass die-off half a billion years ago caused by shifting tectonic plates,story,https://www.livescience.com/archaeology/mass-die-off-half-a-billion-years-ago-caused-by-shifting-tectonic-plates-ancient-rocks-reveal,
tip_of_the_hat,3.0,40004367,[40004514],12,1712854906,Show HN: Annotate: Create walkthrough guides in the style of the Stripe docs,story,https://annotate.dev,"Hi HN!<p>Founder of Annotate here. Annotate lets you create step-by-step code walkthroughs, inspired by Stripe’s documentation (e.g., <a href=""https:&#x2F;&#x2F;docs.stripe.com&#x2F;checkout&#x2F;quickstart"" rel=""nofollow"">https:&#x2F;&#x2F;docs.stripe.com&#x2F;checkout&#x2F;quickstart</a>) for your technical product. It comes with a React SDK that lets you  embed walkthroughs directly in your docs or marketing materials. Check out an example walkthrough on the home page.<p>Why build Annotate? I’ve been in the dev tooling space for the last 5 years and have two main learnings:<p>1. Developers first look for a quick start guide when exploring a technical product. A great quick start increase developer adoption.<p>2. Developers typically prefer code snippets that closely resemble real-world applications over traditional longer-form docs.<p>Annotate helps you solve both above points.<p>Let me know if you have any questions or feedback!"
Orochikaku,9.0,40018246,"[40018876, 40020774, 40018682, 40020828, 40019551]",37,1712960241,I Optimised My Game Engine Up to 12000 FPS [video],story,https://www.youtube.com/watch?v=40JzyaOYJeY,
thunderbong,0.0,40016046,,3,1712946125,Ten Years and Counting: My Affair with Microservices,story,https://blog.allegro.tech/2024/04/ten-years-microservices.html,
justinclift,10.0,40008005,"[40008336, 40008123, 40009340, 40010947]",32,1712879192,"Intel's ""Gaudi 3"" AI accelerator chip may give Nvidia's H100 a run for its money",story,https://arstechnica.com/information-technology/2024/04/intels-gaudi-3-ai-accelerator-chip-may-give-nvidias-h100-a-run-for-the-money/,
belter,6.0,40025722,"[40030623, 40034395, 40026697]",14,1713039641,Google goes all in on generative AI at Google Cloud Next,story,https://techcrunch.com/2024/04/13/google-goes-all-in-on-generative-ai-at-google-cloud-next/,
badcc,1.0,40003691,[40004448],11,1712851451,Suno Explore – roll the dice for random genres,story,https://suno.com/explore/,
shivensinha4,0.0,40015493,,6,1712943401,"Show HN: Symbolic AI at Silver Medal, Boosts AlphaGeometry to Beat IMO Geo Gold",story,https://arxiv.org/abs/2404.06405,
sashk,208.0,39997556,"[39999590, 39997949, 39998279, 39997863, 40003646, 40001036, 39998745, 39998945, 39999016, 39998008, 39998489, 40004385, 39997917, 40004033, 39999177, 39998761, 39997894, 40000130, 40000508, 40000926]",236,1712799202,"Amazon owes $525M in cloud-storage patent fight, US jury says",story,https://www.reuters.com/legal/amazon-owes-525-mln-cloud-storage-patent-fight-us-jury-says-2024-04-11/,
Foxboron,117.0,40039154,"[40039329, 40039673, 40039826, 40039426, 40039187, 40039342, 40039490, 40039382, 40039439, 40040071, 40039443, 40039514, 40039319, 40039347, 40039454, 40039385, 40039706, 40039455, 40039432, 40039464, 40039369, 40039417, 40040913, 40040749, 40039474, 40039438, 40039386]",53,1713180906,Why No IPv6?,story,https://whynoipv6.com/,
jseliger,2.0,40023562,"[40040777, 40027925]",16,1713020455,What Ramadan is like in Xinjiang,story,https://www.economist.com/china/2024/04/11/what-ramadan-is-like-in-xinjiang,
raizer88,29.0,40010047,"[40010109, 40015811, 40016216, 40011108, 40011957, 40011194, 40016221, 40015438, 40015932, 40018505, 40012086, 40010048, 40012049, 40010629]",48,1712905039,Google One VPN will be discontinued,story,https://9to5google.com/2024/04/11/google-one-vpn-discontinued/,
milliondreams,38.0,39993626,"[39994628, 39998813, 39994640, 39995604]",217,1712771231,Implementation of Google's Griffin Architecture – RNN LLM,story,https://github.com/google-deepmind/recurrentgemma,
janandonly,1.0,40006508,[40007362],44,1712867511,Apple's collection of user data hard to stop says report,story,https://appleinsider.com/articles/24/04/10/apple-makes-it-really-hard-for-users-to-completely-stop-it-from-collecting-data,
GavCo,96.0,40004887,"[40005591, 40005585, 40005540, 40007078, 40005365, 40005721, 40007423, 40005274, 40013486, 40007046, 40005629, 40005183, 40005782, 40008171, 40005410, 40009343, 40005755, 40004994, 40005302, 40009983]",120,1712858018,Storm: LLM system that researches a topic and generates full-length wiki article,story,https://github.com/stanford-oval/storm,
klooney,89.0,40014724,"[40014801, 40015116, 40015949, 40015604, 40016033, 40017101, 40016758, 40016435, 40019298, 40021587, 40015207, 40015422]",112,1712939310,Systemd replacing ELF dependencies with dlopen,story,https://mastodon.social/@pid_eins/112256363180973672,
walterbell,5.0,40020735,"[40029499, 40030135]",19,1712985896,Review: Levitouch Dual Arm Monitor Mount by Gabor (2023),story,https://larryjordan.com/articles/review-levitouch-dual-arm-monitor-mount-by-gabor/,
bx376,4.0,40033533,"[40033793, 40034226, 40033830, 40033948, 40033812, 40033781]",27,1713121775,Journalism in the Digital Age,story,https://cs.stanford.edu/people/eroberts/cs181/projects/2010-11/Journalism/index.html,
hwayne,47.0,40004909,"[40005461, 40005085, 40005028, 40005731, 40011003, 40005260, 40006675, 40005568, 40007752, 40006217, 40005054, 40005464, 40005840, 40007846]",102,1712858104,Why birds survived and dinosaurs went extinct after an asteroid hit earth (2020),story,https://www.smithsonianmag.com/science-nature/why-birds-survived-and-dinosaurs-went-extinct-after-asteroid-hit-earth-180975801/,
carride,3.0,40016767,"[40020580, 40023132, 40021544, 40021748]",17,1712950297,Tech giant with 30k employees has no return-to-office policy,story,https://www.bnnbloomberg.ca/tech-giant-with-30-000-employees-has-no-return-to-office-policy-1.2058477#,
impish9208,4.0,40012105,[40021191],19,1712926814,She Won the Boston Marathon 10 Years Ago. She's Still Waiting for Her $100k,story,https://www.wsj.com/sports/boston-marathon-buzunesh-deba-rita-jeptoo-7dc69230,
div3rs3,22.0,40016592,"[40031289, 40016685, 40023667, 40040507, 40020189, 40020312, 40020227, 40039833, 40028161, 40021452, 40028434, 40020283, 40025338, 40019562, 40018541, 40026918]",20,1712949233,Ask HN: What programming jobs are least likely to be disrupted by AI?,story,,There are now prominent people in tech suggesting our next generation shouldn&#x27;t learn coding because that&#x27;ll be done by AI. What programming jobs do you expect will be less affected?
joshcsimmons,88.0,40003743,"[40004556, 40004204, 40004272, 40004102, 40004382, 40004053, 40004625, 40004202, 40004007, 40004232, 40004952, 40003993, 40004381, 40004104, 40004578, 40004995, 40004543, 40004370, 40004270, 40010123, 40003976, 40004014, 40004282, 40005093, 40004184, 40004918, 40004726, 40005869, 40004177, 40007974, 40003943, 40004254]",139,1712851694,Readme.txt vs. README.txt (2015),story,https://softwareengineering.stackexchange.com/questions/301691/readme-txt-vs-readme-txt,
thelastgallon,68.0,39997189,"[39997592, 39997864, 39999119, 39998436, 40010023, 40000940, 39997647, 39997799, 40002659, 40002110, 39997473, 39999178, 39999081]",99,1712795256,Replacing Wires Could Double How Much Electricity the US Grid Can Handle,story,https://cleantechnica.com/2024/04/10/replacing-wires-could-double-how-much-electricity-the-us-grid-can-handle/,
todsacerdoti,2.0,40016256,"[40018323, 40018402, 40023015]",20,1712947196,Sigbovik 2024,story,https://sigbovik.org/2024/,
b20000,72.0,40034662,"[40035812, 40035843, 40036056, 40035962, 40036083, 40035941, 40040539, 40036016, 40035923, 40035087, 40040122, 40036947, 40036032, 40036671, 40035974, 40036512, 40034725, 40036057, 40035867, 40036210, 40037180, 40035734, 40035877, 40035975]",60,1713130194,Ask HN: Does it still matter to be in the Bay Area?,story,,A while ago lots of people moved out. Due to the current AI fad people came back (?). Does it still matter to be there and in what circumstances?
mfiguiere,13.0,40018146,"[40019791, 40019272, 40020849, 40024720, 40019636, 40019611]",24,1712959369,Tesla drops FSD price to $99 per month in US,story,https://techcrunch.com/2024/04/12/tesla-drops-fsd-price-to-99-per-month-in-us/,
keyvank,53.0,40001222,"[40020386, 40011456, 40002587, 40020202, 40007171, 40020714, 40020532, 40020962, 40020800, 40003415, 40020558, 40002016, 40020757, 40020102, 40020825, 40020914, 40020165, 40020826, 40019961, 40020269, 40019938, 40020796, 40002560, 40020079, 40020866, 40020059, 40021025]",65,1712836948,Ask HN: How can I learn about manufacturing?,story,,I&#x27;m a software engineer but am very curious to learn about the process of designing and manufacturing a &quot;physical&quot; thing. What would be a good roadmap for someone who dreams about building a factory?
SiempreViernes,0.0,40010997,,3,1712916584,A Living Review of Machine Learning for Particle Physics,story,https://iml-wg.github.io/HEPML-LivingReview/,
Lammy,107.0,40006697,"[40008927, 40008134, 40008187, 40008612, 40008368, 40008593, 40010358, 40008164, 40010414, 40010308, 40006825, 40010839, 40008377, 40008120, 40006827, 40008481, 40008207, 40008127, 40010503, 40011856, 40008676, 40010934, 40008585, 40008261, 40008350, 40008568, 40009053, 40010953, 40009996, 40008911, 40010955, 40009958, 40023911, 40009591, 40008759, 40008145, 40008016, 40010957, 40008586, 40009857, 40008556, 40008484, 40008303, 40009924, 40008660, 40010949]",144,1712868777,Descent: A classic 3-D first-person shooter (2012),story,http://insectoid.budwin.net/dos/descent/descent.html,
jamez,31.0,40011937,"[40016422, 40018173, 40016527, 40015910, 40016412, 40019099, 40016771, 40015722, 40024974, 40018776, 40023438, 40018351]",74,1712925801,Show HN: Stream of Consciousness – watch an artificial persona making art,story,https://www.streamofconsciousness.net/,"Hi HN,<p>moved by curiosity about how to build an autonomous agent, and to explore the boundaries of machine creativity, I built a fictional entity (dubbed Livia) powered by LLMs, Multimodal models and text-to-image models to find some answers.<p>What happened instead is that more questions have cropped up. An important hypothesis of this project is that, by observing the train of thought and witnessing the simulated state of mind and emotional emulation surrounding it, humans could empathize with a machine. What happens when that&#x27;s the case? Would people enjoy companionship from a synthetic person? Would the Art establishment ever consider a non-human author (capable of making art and interacting with other humans) an Artist?<p>Whatever the answers, I can&#x27;t shake away the feeling that human uniqueness is being eroded and that we risk facing a crisis of meaning. Perhaps projects such as this help us demonize those fears, similarly to how sci-fi does, even though the boundary between fiction and reality is blurring.<p>This was a collaboration with Tibor (hn user: <a href=""https:&#x2F;&#x2F;news.ycombinator.com&#x2F;user?id=tiborsaas"">https:&#x2F;&#x2F;news.ycombinator.com&#x2F;user?id=tiborsaas</a>). Read our release posts on:
<a href=""https:&#x2F;&#x2F;jamez.it&#x2F;blog&#x2F;b&#x2F;14f"" rel=""nofollow"">https:&#x2F;&#x2F;jamez.it&#x2F;blog&#x2F;b&#x2F;14f</a>
and
<a href=""https:&#x2F;&#x2F;tibor.szasz.hu&#x2F;post&#x2F;stream-of-consciousness"" rel=""nofollow"">https:&#x2F;&#x2F;tibor.szasz.hu&#x2F;post&#x2F;stream-of-consciousness</a><p>Hope you enjoy it as much as we had fun building it."
jseliger,24.0,40025151,"[40025649, 40025880, 40026532, 40025529, 40025787, 40025712, 40030562, 40030705, 40026458, 40030617, 40026335, 40027725]",35,1713034269,"BYD Got €3.4B Chinese Aid to Dominate EVs, Study Says",story,https://www.bloomberg.com/news/articles/2024-04-10/byd-got-3-4-billion-chinese-aid-to-dominate-evs-study-says,
slicktux,3.0,40026132,[40026350],20,1713042375,Mathematical Handbook: Higher Mathematics,story,https://archive.org/details/vygodsky-mathematical-handbook-higher-mathematics-mir,
leotravis10,35.0,39994900,"[39997774, 39999801, 39996794, 39997138, 39997546, 39995586, 39999858, 39997648, 39997939, 40001360, 40004077, 39996395, 39999068, 39994948, 39997752, 40000229, 39997745, 40001181, 40001430]",68,1712777864,Movie industry demands US law requiring ISPs to block piracy websites,story,https://arstechnica.com/tech-policy/2024/04/movie-industry-demands-us-law-requiring-isps-to-block-piracy-websites/,
LinuxBender,0.0,40023448,,12,1713019276,Physicists Know How the Strong Force Gets Its Strength,story,https://www.scientificamerican.com/article/physicists-finally-know-how-the-strong-force-gets-its-strength/,
