by,descendants,id,kids,score,time,title,type,url,text
_Microft,6.0,40141713,"[40167814, 40166549, 40167779, 40165689, 40166318]",36,1713944319,"Same species, different sizes: Rare evolution in action spotted in island bats",story,https://phys.org/news/2024-04-species-sizes-rare-evolution-action.html,
BerislavLopac,7.0,40143285,"[40164052, 40163158, 40162809, 40163672]",59,1713959754,Notes on Structured Programming (1970) [pdf],story,https://www.cs.utexas.edu/users/EWD/ewd02xx/EWD249.PDF,
NeilSmith2048,70.0,40147883,"[40149062, 40153005, 40151254, 40148740, 40151150, 40148921, 40155337, 40153014, 40148766, 40149891, 40155323, 40149015, 40160421, 40149943, 40150420, 40155952, 40152820, 40149591, 40154036, 40155752, 40161669, 40156900, 40153826, 40151669, 40153650, 40149667]",350,1713983127,A feature-rich front-end drag-and-drop component library,story,https://github.com/atlassian/pragmatic-drag-and-drop,
phantomathkg,1.0,40168925,[40168946],5,1714136488,Floorp Twitter Account Suspended,story,https://twitter.com/floorp_browser,
rocauc,127.0,40139398,"[40139842, 40140318, 40139931, 40139688, 40140379, 40139846, 40142057, 40139757, 40145477, 40140114, 40142077, 40139669, 40140124, 40139893, 40144793, 40139412, 40139639, 40145136, 40142425]",491,1713922008,CoreNet: A library for training deep neural networks,story,https://github.com/apple/corenet,
MBCook,42.0,40163882,"[40168097, 40166419, 40167520, 40166257, 40165636, 40166722, 40168367, 40164073, 40169145, 40166754]",151,1714084251,Apple releases eight small AI language models aimed at on-device use,story,https://arstechnica.com/information-technology/2024/04/apple-releases-eight-small-ai-language-models-aimed-at-on-device-use/,
mpmisko,0.0,40162210,,12,1714074821,Show HN: I put PubMed in a vector DB,story,https://www.pubmedisearch.com/,"Hi HN,<p>As a researcher, I often found myself struggling with the limitations of keyword-based search when exploring PubMed papers. To address this, I created PubMed Search (<a href=""https:&#x2F;&#x2F;www.pubmedisearch.com&#x2F;"" rel=""nofollow"">https:&#x2F;&#x2F;www.pubmedisearch.com&#x2F;</a>), a tool that leverages a vector database to enable semantic search across medical research literature.<p>Some key features:<p>* Daily updates to ensure access to the latest articles
* Semantic search using latest &amp; greatest embedding models
* Some additional useful info about the papers (tldr, journal, publication date, etc.)<p>Hope you find it useful!"
DustinBrett,4.0,40166116,[40168632],20,1714108113,React 19 Beta,story,https://react.dev/blog/2024/04/25/react-19,
asymmetric,2.0,40163521,"[40167768, 40169216]",39,1714081887,"Facebook must ""minimize"" personal data for ads in EU",story,https://noyb.eu/en/ag-cjeu-facebook-must-minimize-personal-data-ads-eu,
json_bourne_,6.0,40166516,"[40169528, 40169280, 40168799]",6,1714113630,A website dedicated for sharing Movie scenes with Timestamps - scenestamps.com,story,,"Hello hackers,<p>I&#x27;ve launched a website specifically for sharing scenes, complete with descriptions and timestamps from various films and TV shows. I&#x27;m reaching out to gather your perspectives and recommendations in these domains to improve the site and extend my outreach.<p>Link : https:&#x2F;&#x2F;scenestamps.com<p>You are not required to register&#x2F;login to browse the site.<p>Scenestamps Features:<p>1. Search : You can directly search for a scene or a source.<p>2. Upload Posts : 
 You can register with your google account, login and start posting right away. Unlike other sites in this specific domain, users are allowed to upload posts.<p>There are two types of posts
  - scene
  - source<p>Source is  a movie,tv show, documentary, etc...
 One source can have multiple scenes<p>While creating a scene post, source can be selected there.<p>Scene post will have the timestamp fields. 
 There are two types of it:
 - single - one input field of timestamp in which the scene happens.
 - from-to - two input fields, from and to within which the scene takes place.<p>3. Share posts : Share feature is available on both source and scene posts, with which you can share the post to your favorite social media platforms<p>4. Tagging system : You can add tag to the scene posts. You can also get all  the scenes that has that tag name by clicking on it.<p>I think people wanting to create scenes is quite a small audience, but I want to make this the best it can possibly be so please post any problems or suggestions in the replies or at reddit.com&#x2F;scenestamps.com or message me x.com&#x2F;gjpx_ if you prefer."
bookofjoe,11.0,40151424,"[40163257, 40164406, 40166991, 40166015, 40165983, 40167908, 40164581, 40165786]",56,1714002773,Don’t bleed on the artwork,story,https://oxfordamerican.org/magazine/issue-124-spring-2024/don-t-bleed-on-the-artwork-notes-from-the-afterlife,
andsoitis,68.0,40141777,"[40142032, 40141960, 40145331, 40142176, 40142486, 40154166, 40144458, 40142520, 40144541, 40142317, 40146060, 40142326, 40142634, 40152969, 40145701, 40143759, 40144889, 40142741, 40147451, 40142108, 40143007]",443,1713945178,Piet: Programming language in which programs look like abstract paintings (2002),story,https://www.dangermouse.net/esoteric/piet.html,
commons-tragedy,548.0,40147534,"[40158359, 40154287, 40150070, 40151017, 40149242, 40152421, 40150198, 40150025, 40150647, 40148282, 40148581, 40148302, 40151371, 40148314, 40148482, 40150027, 40158442, 40148342, 40147904, 40155043, 40148470, 40148168, 40151367, 40148247, 40152922, 40151506, 40153085, 40164502, 40167339, 40154260, 40153497, 40148130, 40161055, 40151267, 40148191, 40148952, 40150705, 40149317, 40157702, 40158218, 40150489, 40151520, 40161881, 40159601, 40150914, 40148180, 40153742, 40152904, 40155503, 40166628, 40149831, 40152935, 40148328, 40166425, 40148284, 40148486, 40148293, 40150552, 40148862, 40156749, 40153093, 40148376, 40155376, 40154690, 40155044, 40152868, 40149084, 40148421, 40149186, 40158148, 40148564, 40148258, 40153009, 40156072, 40152485, 40152966, 40148193, 40149467, 40153232, 40150446, 40153201, 40148288, 40160825, 40151445, 40154114, 40151695, 40148454, 40148194, 40148401, 40151235, 40161580, 40151644, 40149025, 40149875, 40152139, 40149481, 40153313, 40155255, 40154033, 40153943, 40148411, 40148300, 40151635, 40153255, 40151081, 40148134, 40153537, 40148157, 40148333, 40155058, 40155778, 40158553, 40150614, 40151303, 40148221, 40150538, 40149200, 40150314, 40154263, 40153161, 40152695, 40155893, 40155799, 40154101, 40153001, 40152840, 40152644, 40151472, 40150962, 40149992, 40149650, 40149280, 40151361, 40148322, 40148279, 40148151, 40149140, 40152072]",385,1713981018,When do we stop finding new music?,story,https://www.statsignificant.com/p/when-do-we-stop-finding-new-music,
rntn,19.0,40159759,"[40162244, 40162513]",66,1714063262,Honda to spend $11B on four EV factories in North America,story,https://arstechnica.com/cars/2024/04/honda-to-spend-11-billion-on-four-ev-factories-in-north-america/,
wglb,1.0,40165335,[40169927],5,1714098208,Conservation actions are effective at reversing biodiversity loss,story,https://phys.org/news/2024-04-kind-actions-effective-halting-reversing.html,
cachecrab,11.0,40148755,"[40159720, 40162046, 40157082, 40148813, 40154891, 40154890, 40154025, 40161428]",53,1713988164,Emulsifiers linked to increased diabetes risk,story,https://www.thelancet.com/journals/landia/article/PIIS2213-8587(24)00086-X/fulltext,
rbanffy,110.0,40156527,"[40157063, 40157123, 40156937, 40158021, 40157263, 40158479, 40165330, 40157493, 40160570, 40157658, 40160479, 40159443, 40164041, 40156943, 40157289, 40165028, 40158599, 40158325, 40158133, 40157421, 40156984, 40157425]",182,1714047193,David Frankel is a man on a mission against robocalls,story,https://spectrum.ieee.org/how-to-stop-robocalls,
elorant,189.0,40156275,"[40157515, 40156788, 40156784, 40156725, 40161487, 40157384, 40164365, 40156756, 40161880, 40164964, 40164908, 40158517, 40158646, 40157007]",368,1714045656,TSMC unveils 1.6nm process technology with backside power delivery,story,https://www.tomshardware.com/tech-industry/tsmc-unveils-16nm-process-technology-with-backside-power-delivery-rivals-intels-competing-design,
lermontov,20.0,40153691,"[40157975, 40169282, 40167207, 40166163, 40161016, 40161590]",47,1714021942,How Penelope Fitzgerald became a late blooming novelist,story,https://www.commonreader.co.uk/p/how-penelope-fitzgerald-became-a,
teleforce,39.0,40153162,"[40160092, 40154078, 40154135]",95,1714016541,Quaternion Knowledge Graph Embeddings (2019),story,https://arxiv.org/abs/1904.10281,
samclemens,35.0,40161712,"[40166076, 40163255, 40163603, 40164064, 40163893, 40166902, 40166898, 40165691, 40166184, 40164560, 40165109, 40163274, 40165587, 40166553, 40163250]",32,1714072102,Rhyme as Reason,story,https://bigthink.com/neuropsych/rhyme-as-reason/,
kaycebasques,162.0,40138228,"[40141607, 40140474, 40142953, 40140749, 40144176, 40144001, 40140743, 40144855, 40140401, 40141262, 40148187, 40149862, 40148238, 40145074, 40141721, 40162466, 40140740, 40141261, 40141760, 40143747, 40142660, 40141255, 40141968, 40140502, 40141743]",543,1713912404,ESPHome,story,https://esphome.io/index.html,
vyrotek,333.0,40150639,"[40151034, 40154126, 40151768, 40151284, 40151484, 40154889, 40151080, 40156179, 40151052, 40151154, 40154408, 40155018, 40152225, 40159120, 40151207, 40155881, 40154397, 40153988, 40152494, 40151368, 40157386, 40153746, 40155226, 40157310, 40152814, 40156723, 40151237, 40153579, 40153571, 40151233, 40152425, 40155134, 40151311, 40151728, 40154912, 40156378, 40154945, 40152143, 40152551, 40152541, 40152828, 40157688, 40155933, 40155267, 40155014, 40151444, 40153520, 40151153, 40153667, 40151570, 40153949, 40151716, 40152557, 40152177, 40151041, 40151243]",689,1713997763,"Airlines required to refund passengers for canceled, delayed flights",story,https://abcnews.go.com/Politics/airlines-give-automatic-refunds-canceled-flights-delayed-3/story?id=109573733,
panabee,4.0,40160728,"[40161948, 40163393, 40162204]",43,1714067164,CatLIP: Clip Vision Accuracy with 2.7x Faster Pre-Training on Web-Scale Data,story,https://arxiv.org/abs/2404.15653,
robaato,2.0,40166166,[40168173],11,1714108723,Personalised melanoma mRNA cancer trial in stage 3,story,https://www.theguardian.com/society/2024/apr/26/cancer-mrna-vaccine-melanoma-trial,
herbertl,416.0,40151952,"[40153026, 40152810, 40170074, 40152798, 40154745, 40154192, 40168842, 40153614, 40153078, 40158770, 40156442, 40153166, 40152837, 40154441, 40157998, 40152737, 40153549, 40154806, 40159983, 40156988, 40154571, 40153509, 40158043, 40154619, 40158699, 40155711, 40152803, 40157325, 40158083, 40156288, 40152675, 40154616, 40155451, 40153725, 40154013, 40155244, 40153287, 40153148, 40167064, 40152905, 40155053, 40155016, 40154543, 40154857, 40158631, 40153394, 40158938, 40154792, 40160276, 40152724, 40154564, 40153773, 40153750, 40152740, 40154893, 40152777, 40153852, 40154867, 40156224, 40154999, 40154967, 40155615, 40155171, 40153371, 40155076, 40160618, 40155161, 40153960, 40156373, 40157891, 40153853, 40154180, 40153577, 40153325, 40153238, 40153140]",805,1714006717,"You are what you read, even if you don't always remember it",story,https://blog.jim-nielsen.com/2024/you-are-what-you-read/,
todsacerdoti,68.0,40146615,"[40151223, 40152602, 40151735, 40152058, 40154146, 40151840, 40155677, 40158381, 40152934, 40155265, 40153962, 40161535, 40148920, 40153931, 40157925, 40153968, 40150120, 40151841, 40150991, 40150863]",175,1713976788,"Borrow Checking, RC, GC, and the Eleven () Other Memory Safety Approaches",story,https://verdagon.dev/grimoire/grimoire,
daremocooon,7.0,40143460,"[40162389, 40167515, 40161776]",60,1713960926,Swan – A Lightweight Language Model Execution Environment Using FPGA,story,https://github.com/turingmotors/swan,
yawpitch,13.0,40156205,"[40166207, 40157211, 40162565, 40166085, 40158293, 40165300]",16,1714045128,Any fun ways to learn Emacs?,story,,"I’ve been using vim for years, but after a traumatic brain injury my muscle memory for typing got a bit scrambled at the same time my need for something that was <i>always</i> installed everywhere dwindled. I’d kind of like to finally see what the deal is with emacs, but as holding down multiple keys simultaneously is now more than a bit hard (and so is memorizing all the chords) I’m looking for a game or typing tutor or similar sort of experience that can help me pick up emacs gradually and help me build a new muscle memory without having to actually work on anything important.<p>Over the years I’ve seen a bunch of games aimed at getting used to vim-style navigation, but not come across anything emacs-centric.<p>Alternatively I suppose I could just got evil, but as I’ve not used emacs practically I’m a bit confused how you don’t end up with a hybrid of home row touch typing plus having to wander about for whatever chords remain, which seems more like the worst of both worlds rather than the best."
jmcphers,117.0,40149071,"[40150292, 40153220, 40150542, 40152359, 40152959, 40150918, 40150011, 40156240, 40152057, 40149086, 40150482, 40153447, 40153393, 40154471, 40151456, 40150546, 40156238, 40153708, 40150110, 40152754, 40151780, 40161094, 40150540, 40151672, 40152873]",149,1713989986,"Augment, a GitHub Copilot rival, launches out of stealth",story,https://techcrunch.com/2024/04/24/eric-schmidt-backed-augment-a-github-copilot-rival-launches-out-of-stealth-with-252m/,
todsacerdoti,89.0,40141967,"[40148851, 40145416, 40145683, 40145237, 40146555, 40147979, 40146290, 40147564, 40147172, 40152708, 40145997, 40146134, 40146121, 40148724, 40144990, 40145297, 40148752, 40145144, 40149527, 40146502, 40145097]",258,1713947556,Sysadmin friendly high speed Ethernet switching,story,https://blog.benjojo.co.uk/post/sn2010-linux-hacking-switchdev,
thunderbong,6.0,40141545,"[40160803, 40160643, 40159850, 40141584]",20,1713942773,Test Sizes (2010),story,https://testing.googleblog.com/2010/12/test-sizes.html,
bookofjoe,11.0,40144955,"[40168281, 40166317, 40152489, 40161011, 40160999, 40158318, 40154583, 40161820, 40158741]",66,1713969673,Music for Programming,story,https://musicforprogramming.net/latest/,
imadr,37.0,40139434,"[40141773, 40144650, 40140451, 40145087, 40140722, 40141378, 40140125, 40141572, 40143282, 40144953, 40153753, 40141406]",358,1713922359,Simulating Jupiter,story,https://emildziewanowski.com/flowfields/,
todsacerdoti,61.0,40149446,"[40152785, 40151757, 40154575, 40164555, 40152411, 40152533, 40150654, 40162216, 40152282, 40152729, 40155068, 40150467, 40151996]",167,1713991803,Magic Numbers,story,https://exple.tive.org/blarg/2024/04/24/magic-numbers/,
vyrotek,1638.0,40145963,"[40146306, 40153847, 40146375, 40152802, 40151169, 40146246, 40151662, 40149631, 40146665, 40153527, 40146301, 40146450, 40149719, 40146374, 40151736, 40155421, 40150508, 40146156, 40146173, 40151126, 40146504, 40151535, 40146215, 40147560, 40150161, 40146706, 40146332, 40146141, 40153660, 40150115, 40146948, 40149560, 40152396, 40158595, 40146314, 40146391, 40160828, 40153926, 40150169, 40150864, 40150737, 40150102, 40153134, 40154908, 40152493, 40147646, 40149648, 40151116, 40153473, 40149252, 40149966, 40146412, 40165936, 40148087, 40151545, 40151184, 40151731, 40146471, 40151856, 40146889, 40146478, 40153485, 40147342, 40146054, 40146308, 40146305, 40153669, 40166452, 40146143, 40153037, 40150501, 40146433, 40154711, 40154722, 40153419, 40146569, 40146442, 40151218, 40146247, 40149669, 40146525, 40146427, 40146321, 40149455, 40151939, 40163126, 40146459, 40151822, 40146931, 40150618, 40146455, 40149224, 40147192, 40149997, 40146922, 40146378, 40146329, 40146468, 40156395, 40147941, 40152078, 40151399, 40146890, 40146192, 40152413, 40146309, 40150921, 40150479, 40146349, 40146401, 40149249, 40146338, 40146591, 40151643, 40146745, 40147714, 40149496, 40150873, 40146393, 40152626, 40150658, 40150128, 40146413, 40152303, 40146484, 40153786, 40146358, 40146278, 40146279, 40146302, 40146650, 40146645, 40149338, 40151212, 40152232, 40151463]",781,1713974395,"Biden signs TikTok bill into law, starting clock for ByteDance to divest",story,https://www.theverge.com/2024/4/24/24139036/biden-signs-tiktok-ban-bill-divest-foreign-aid-package,
nelu,0.0,40156268,[40156269],9,1714045630,"We were wrong, we need a database",story,https://simonedutto.github.io/2024-04-09/no-ret-no-party,
JNRowe,1.0,40141060,[40166645],21,1713937836,A Note about Coercions,story,https://oleg.fi/gists/posts/2024-04-21-a-note-about-coercions.html,
vmatsiiako,35.0,40149608,"[40154825, 40154028, 40154191, 40154534, 40155960, 40162775, 40154234, 40153506]",108,1713992578,Show HN: Open-source alternative to HashiCorp/IBM Vault,story,https://github.com/Infisical/infisical/blob/main/README.md,
jonmarkgo,2.0,40162523,[40165744],35,1714076551,Twilio cofounder Jeff Lawson appears to have just bought The Onion,story,https://www.businessinsider.com/twilio-founder-jeff-lawson-bought-the-onion-2024-4,
benbreen,8.0,40153825,"[40157967, 40158091, 40160799, 40163346, 40160302]",36,1714023447,The Analytical Language of John Wilkins,story,https://en.wikipedia.org/wiki/The_Analytical_Language_of_John_Wilkins,
arbol,193.0,40146751,"[40147691, 40149808, 40151269, 40150845, 40147547, 40168087, 40147682, 40148424, 40149575, 40148110, 40147868, 40151189, 40150786, 40148256, 40151356, 40149316, 40147771, 40154557, 40150155, 40154507, 40154996, 40149180, 40149603, 40150017, 40148225, 40158873, 40148137, 40152074, 40148163, 40147513]",184,1713977301,TypeScript: Branded Types,story,https://prosopo.io/articles/typescript-branding/,
minimaxir,29.0,40164393,"[40166032, 40165938, 40164394, 40165734, 40166366, 40167108]",90,1714088540,In Response to Google,story,https://www.wheresyoured.at/in-response-to-google/,
mariuz,51.0,40158794,"[40159013, 40159538, 40165712, 40161000, 40159073, 40161178, 40161505, 40159005, 40159181, 40161231]",135,1714059299,MemoryDB: A fast and durable memory-first cloud database,story,https://www.amazon.science/publications/amazon-memorydb-a-fast-and-durable-memory-first-cloud-database,
zerojames,67.0,40138579,"[40140993, 40139998, 40144026, 40138982, 40138782, 40149274, 40139287, 40144617, 40148569, 40139136, 40140624, 40141335, 40141855, 40138819, 40139173, 40138963, 40139054]",253,1713914818,American flag sort,story,https://xlinux.nist.gov/dads/HTML/americanFlagSort.html,
thunderbong,0.0,40155294,,12,1714037346,A brief history of web development. And why your framework doesn't matter,story,https://gebna.gg/blog/brief-history-of-web-development,
bifftastic,4.0,40161163,"[40164400, 40168829, 40161725]",31,1714069267,Deciphered Herculaneum papyrus reveals precise burial place of Plato,story,https://arstechnica.com/science/2024/04/deciphered-herculaneum-papyrus-reveals-precise-burial-place-of-plato/,
pabs3,9.0,40163950,"[40169365, 40166028, 40164068]",30,1714084702,The Future of MySQL is PostgreSQL: an extension for the MySQL wire protocol,story,https://hachyderm.io/@tobyhede/112329476255728961,
Brajeshwar,96.0,40156569,"[40157890, 40158845, 40157101, 40160437, 40158224, 40156863, 40161568, 40158044, 40157887, 40159098, 40158655, 40158789, 40157110, 40158121, 40157583, 40157764, 40161696, 40158360, 40157398, 40165677, 40160992, 40157307, 40160213, 40157265, 40159899, 40161829, 40158026, 40159011, 40157336, 40164066, 40157009, 40162227]",144,1714047418,Palm OS and the devices that ran it,story,https://arstechnica.com/gadgets/2024/04/palm-os-and-the-devices-that-ran-it-an-ars-retrospective/,
pbrowne011,7.0,40139130,"[40162488, 40161279, 40165742, 40161992, 40163575, 40162689, 40161084]",43,1713919302,Retro-tech HP-25 Calculator,story,https://github.com/eshazen/retro-25,
cameron_b,6.0,40158756,[40162729],89,1714059101,Ubuntu 24.04 Noble Numbat,story,https://canonical.com/blog/canonical-releases-ubuntu-24-04-noble-numbat,
Dagulf795,33.0,40152944,"[40157065, 40155411, 40162057, 40160663, 40156831, 40158312, 40155061, 40156382, 40155469]",72,1714014567,Enron tried to trade memory chip futures; why didn't it work?,story,https://www.felixstocker.com/blog/chips,
pmzy,145.0,40141463,"[40144947, 40144428, 40144446, 40144752, 40144136, 40145271, 40150872, 40145094, 40144995, 40148738, 40149721, 40145995, 40152002, 40145457, 40153115, 40148806, 40148063, 40146663, 40145905, 40145298, 40147337, 40147394, 40144844, 40153955, 40144601, 40146626, 40145546, 40144849, 40145125, 40151202, 40152030, 40151806, 40150997, 40145561, 40144182]",189,1713941844,Other People’s Problems,story,https://seths.blog/2024/04/other-peoples-problems/,
13years,132.0,40139501,"[40139747, 40139710, 40160105, 40139899, 40139838, 40149209, 40147999, 40147020, 40140731, 40139740, 40139924, 40148106, 40149222, 40149390, 40139856, 40139777, 40140115, 40139733, 40139878, 40139778, 40141473, 40139823, 40139713, 40140374, 40139809, 40150411, 40139684, 40152007, 40153490, 40148442, 40141084, 40139888, 40139865, 40139753, 40139829, 40140766, 40139989, 40147152]",94,1713923026,The question that no LLM can answer and why it is important,story,https://www.mindprison.cc/p/the-question-that-no-llm-can-answer,
marsinn,4.0,40163365,"[40166464, 40165570, 40163680]",13,1714081091,Ford just reported a loss on every electric vehicle it sold,story,https://www.cnn.com/2024/04/24/business/ford-earnings-ev-losses/index.html,
LkpPo,98.0,40139510,"[40139511, 40141477, 40141441, 40141637, 40141278, 40142606, 40146299, 40141500, 40141628, 40163431, 40150080, 40140971, 40141997, 40152577, 40141410]",234,1713923087,"BeeBase, a programmable relational database with graphical user interface",story,https://beebase.sourceforge.io,
Jun8,168.0,40148563,"[40148598, 40150841, 40152472, 40160780, 40152822, 40148995, 40155317, 40150643, 40155158, 40149160, 40151537, 40155748, 40149609, 40150293, 40151730, 40153866, 40150261, 40150193, 40150735, 40154823, 40151320, 40150579, 40150577, 40148845, 40151831, 40149523]",366,1713987140,I now lack the juice to fuel the bluster to conceal that I am a simpleton,story,https://lithub.com/i-now-lack-the-juice-to-fuel-the-bluster-to-conceal-that-i-am-a-simpleton-padgett-powell-legend/,
thunderbong,0.0,40155346,,9,1714037778,Software Design Principles I Learned the Hard Way,story,https://read.engineerscodex.com/p/4-software-design-principles-i-learned,
impish9208,145.0,40148729,"[40152309, 40151587, 40150787, 40152023, 40151798, 40148892, 40148751, 40154170, 40154010, 40151816, 40152992, 40155627, 40155698, 40155311, 40153224, 40153436, 40155474, 40154354, 40153195, 40152632, 40152761, 40153716, 40151024, 40153235]",389,1713988045,McKinsey Under Criminal Investigation over Opioid-Related Consulting,story,https://www.wsj.com/articles/mckinsey-faces-criminal-probe-over-opioid-related-consulting-a3f816d4,
mehulashah,24.0,40152486,"[40152843, 40153600, 40153639]",138,1714010609,"Fine tune LLAMA3 on million scale dataset in consumer GPU using QLora, DeepSpeed",story,https://medium.com/@sumandas0/fine-tune-llama3-on-million-scale-dataset-in-consumer-gpu-using-qlora-deepspeed-3ae8ad75299a,
chadsix,363.0,40158752,"[40158959, 40158909, 40158957, 40158764, 40159606, 40158981, 40162943, 40159213, 40159832, 40159042, 40159226, 40161840, 40160198, 40158805, 40160804, 40158877, 40159423, 40159698, 40160557, 40159030, 40160098, 40159405, 40159793, 40165460, 40160284, 40160976, 40162221, 40160490, 40161886, 40159140, 40159025, 40161305, 40158958, 40166003, 40159551, 40159058, 40160587, 40159818, 40161034, 40159634, 40159104, 40158812, 40159607, 40159218]",484,1714059076,We have 4 days to contest KYC being required by internet services,story,https://www.federalregister.gov/documents/2024/01/29/2024-01580/taking-additional-steps-to-address-the-national-emergency-with-respect-to-significant-malicious,
Halan,17.0,40160577,"[40161310, 40161399, 40161212, 40161144, 40166429, 40161010, 40160707, 40161345, 40164322, 40161668, 40161133, 40161155, 40161290]",15,1714066382,Ask HN: What's Rabbit R1 business model?,story,,No subscription sounds too good to be true long term considering API calls costs and their rabbit hole storage.
chr15m,50.0,40141350,"[40157167, 40155471, 40159909, 40155856, 40160580, 40141918, 40155119, 40157673, 40160151, 40164206, 40159519, 40155718, 40158635]",72,1713940614,Progress Quest: The original idle game,story,http://progressquest.com/play/,
geox,27.0,40160271,"[40161188, 40162334, 40161613, 40163437]",33,1714065203,Venice tests a 5-euro fee for day-trippers as the city grapples with overtourism,story,https://www.npr.org/2024/04/25/1247162570/venice-entry-fee-day-trippers-tourists,
zagap,45.0,40141980,"[40144347, 40165917, 40147765, 40143967, 40146129, 40143738, 40145070, 40147901, 40149930, 40145625, 40150855, 40148006, 40143776]",137,1713947730,Show HN: Podlite - a lightweight markup language for organizing knowledge,story,https://podlite.org/2024/4/23/1/podlite-specification-v1-0-released,"Unbound by any specific domain, programming language, or concept, Podlite stands out as a universal markup language<p>In addition, the support for Markdown markup as a standard block adds convenience and allows for the use of familiar syntax for text formatting<p>It&#x27;s perfect for documentation, educational materials, blogging, and much more for organizing knowledge.<p>One of the key features of Podlite is its extensibility. This allows for defining unique and domain-specific blocks and expanding the language&#x27;s functionality according to the requirements of your project.<p>The Podlite specification is published under the Artistic license 2.0.<p>Site: <a href=""https:&#x2F;&#x2F;podlite.org"" rel=""nofollow"">https:&#x2F;&#x2F;podlite.org</a>
Thank You!"
frays,26.0,40162877,"[40165407, 40164086, 40164376, 40164389, 40166136]",60,1714078416,Atlassian co-CEO stepping down after 23 years,story,https://twitter.com/scottfarkas/status/1783590261173694971,
