by,descendants,id,kids,score,time,title,type,url,text
tolgaarslan,18.0,40168519,"[40169746, 40169818, 40169299, 40168998, 40169616, 40168935, 40169010, 40168566, 40168520]",89,1714134195,I'm creating PBR Textures and 3D models since 2018 and sharing them for free,story,https://www.sharetextures.com/,
tosh,44.0,40167884,"[40169065, 40169308, 40168567, 40169850, 40169349, 40167921, 40168619, 40168934, 40168565, 40168793, 40169675, 40168623]",93,1714129317,Qwen1.5-110B,story,https://qwenlm.github.io/blog/qwen1.5-110b/,
dp-hackernews,50.0,40167905,"[40169134, 40168709, 40169948, 40169255, 40169234, 40169805, 40169995, 40169924, 40168642, 40169101, 40169260, 40168823, 40169935, 40168873, 40168769, 40169223]",80,1714129569,Cult of the Dead Cow – Veilid (2023),story,https://cultdeadcow.com/tools/veilid.html,
dwighttk,37.0,40168030,"[40170042, 40168288, 40168942, 40169232, 40168966, 40168480, 40168992, 40168049]",37,1714130637,The Universe as a Computer,story,https://dabacon.org/pontiff/2024/04/26/the-universe-as-a-computer-john-archibald-wheeler/,
linmi,5.0,40156698,"[40170066, 40169933, 40170093, 40170027]",7,1714048301,Show HN: Meegle – Jira alternative with workflow visualization,story,https://www.meegle.com/index,
tosh,86.0,40166690,"[40169665, 40167544, 40169631, 40167621, 40169294, 40167583, 40168280, 40168594, 40168990, 40167471, 40167601, 40167600, 40167607, 40168641, 40167803, 40168951, 40166807, 40166962]",148,1714115844,OpenVoice: Instant Voice Cloning,story,https://github.com/myshell-ai/OpenVoice,
zerojames,5.0,40143800,"[40169883, 40169977, 40170091, 40169509, 40169322]",22,1713963400,Removing Reflections from Raw Photos,story,https://arxiv.org/abs/2404.14414,
cimnine,41.0,40166736,"[40168017, 40167522, 40166747, 40167704, 40168491]",129,1714116494,"Radicle is an open source, peer-to-peer code collaboration stack built on Git",story,https://radicle.xyz/,
rntn,50.0,40168765,"[40169416, 40169610, 40169804, 40169577, 40169601, 40169159, 40169404, 40169488, 40169456, 40168959, 40169136]",68,1714135547,UK's Investigatory Powers Bill to become law despite tech world opposition,story,https://www.theregister.com/2024/04/26/investigatory_powers_bill/,
labrador,15.0,40169621,"[40169934, 40170022, 40170036, 40170085, 40170001, 40170069, 40169999, 40169848, 40169888]",18,1714140508,Google is feeling pretty pumped about a new way of showing you ads on YouTube,story,https://www.androidauthority.com/youtube-pause-ads-3437531/,
xkriva11,26.0,40167742,"[40168479, 40168166, 40168036, 40169561, 40168652, 40168033]",101,1714128065,Pharo 12,story,https://pharo.org/news/2024-04-26-pharo12-released.html,
ankitdce,,40168284,,1,1714132828,Aviator (YC S21) is hiring engineers to build a dev productivity platform,job,https://www.ycombinator.com/companies/aviator/jobs,
internetter,32.0,40166468,"[40169913, 40169241, 40168157, 40168175, 40168664, 40169732]",112,1714112962,It's Been a Year and Georgia.gov Continues to Be Hacked,story,https://boehs.org/node/medicicnes,
GalaxySnail,14.0,40168242,"[40169320, 40170122, 40169328, 40169967, 40168944, 40169026, 40169014]",54,1714132514,PEP 686 – Make UTF-8 mode default,story,https://peps.python.org/pep-0686/,
ndiddy,266.0,40163405,"[40166432, 40164361, 40164128, 40169939, 40169880, 40164420, 40169507, 40164672, 40163671, 40169760, 40163949, 40165445, 40163781, 40169363, 40163544, 40163943, 40163608, 40163532, 40166983, 40167125, 40164098, 40165073, 40164099, 40168687, 40167358, 40167221, 40165848, 40164485, 40164535, 40168715, 40163898, 40166976, 40167309, 40165526, 40163849, 40164271, 40164235, 40166354, 40164536, 40164594, 40163708, 40164498, 40164004, 40167127, 40163507, 40166897, 40165083, 40166796, 40163766, 40163900, 40166624, 40166261]",637,1714081326,Open Sourcing DOS 4,story,https://www.hanselman.com/blog/open-sourcing-dos-4,
redbell,11.0,40155022,"[40169336, 40168962, 40169605]",21,1714034635,Hotel WiFi JavaScript Injection (2012),story,https://justinsomnia.org/2012/04/hotel-wifi-javascript-injection/,
retskrad,7.0,40169692,"[40169931, 40170102, 40170073]",8,1714140803,Apple's Regular Mac Base RAM Boosts Ended When Tim Cook Took Over,story,https://www.macrumors.com/2024/04/26/apple-mac-base-ram-boosts-ended-tim-cook/,
chrisjj,19.0,40168740,"[40169550, 40169366, 40170051, 40168758]",23,1714135446,GMB launches legal action against 'out of control' Amazon at Coventry warehouse,story,https://www.theguardian.com/technology/2024/apr/26/gmb-launches-legal-action-against-out-of-control-amazon-at-coventry-warehouse,
paulpauper,19.0,40169180,"[40169820, 40169652, 40169761, 40169799]",18,1714138457,Crypto Mixer Samourai Wallet's Co-Founders Arrested for Money Laundering,story,https://www.wsj.com/articles/crypto-mixer-samourai-wallets-co-founders-arrested-for-money-laundering-df237a4e,
ingve,253.0,40166268,"[40167042, 40170015, 40167418, 40168236, 40166908, 40166975, 40167854, 40169644, 40167131, 40167357, 40168321, 40167676, 40166982, 40166922, 40169053, 40166903, 40169473, 40167329, 40169484, 40167115, 40167204, 40167034, 40169084, 40168898, 40168820, 40168795, 40169503, 40167128, 40166862, 40167274, 40168752, 40167701, 40168505, 40168022, 40166907, 40169980, 40168839, 40168153, 40166952, 40167589, 40167056, 40166994, 40167989, 40167873, 40166914, 40166887, 40167005, 40166919, 40167120, 40166844, 40167121, 40167288, 40168125, 40167139, 40168588, 40167198, 40167147, 40167275, 40167910, 40168770, 40167111, 40167129, 40167116, 40168004, 40168190, 40166881, 40167851, 40167569, 40167109, 40167486]",211,1714110380,Multiple Displays on a Mac Sucks,story,https://wadetregaskis.com/multiple-displays-on-a-mac-sucks/,
KylleV,7.0,40167406,"[40168748, 40169753, 40168452, 40168456]",30,1714123936,Show HN: Mendeleej.com - an Interactive Periodic Table,story,http://mendeleej.com/,"An interactive periodic table website i made some time ago, allowing visualization of a large number of elemental properties.<p>Note : not very optimized for mobile use"
rguldener,74.0,40158481,"[40158836, 40159153, 40165925, 40158817, 40159871, 40159999, 40160270, 40159817, 40159688, 40165976, 40158716, 40158692, 40165414, 40160769, 40158976, 40161431, 40161044, 40160606, 40161292, 40161562, 40160047, 40166189, 40161174, 40163499, 40160097, 40165128, 40158715, 40159080, 40158784, 40159026, 40159115, 40160418]",177,1714057742,Launch HN: Nango (YC W23) – Source-available unified API,story,,"Hey everyone, we are Bastien and Robin from Nango (<a href=""https:&#x2F;&#x2F;www.nango.dev"">https:&#x2F;&#x2F;www.nango.dev</a>). We take care of the annoyances of external APIs (167 and counting) so you can quickly build custom integrations for your SaaS, while retaining full control over how they work.
2 min demo video: <a href=""https:&#x2F;&#x2F;www.loom.com&#x2F;share&#x2F;d04c67b47e284e86b91b4b99fba548ec"" rel=""nofollow"">https:&#x2F;&#x2F;www.loom.com&#x2F;share&#x2F;d04c67b47e284e86b91b4b99fba548ec</a><p>SaaS engineering teams face a tough choice: they can build each integration in-house from scratch, which gives them full control but takes a lot of time and maintenance effort. Or they can use pre-built solutions, which are fast and easy but less flexible and might not fulfill all customer needs.<p>Nango combines the best of both worlds. We let you quickly ship custom integrations without building complex infrastructure or diving deep into the quirks of each API. You control the business logic, data models, and customer-specific configurations, like custom field mappings. We handle (O)Auth and run your integrations reliably in production.<p>Under the hood, your integrations run as typescript “lambdas” on Nango. A typical integration has 3-5 lambdas of 20-50 lines of code each. These lambdas live inside your git repo, are version-controlled with the rest of your app, and get deployed to Nango with a CLI (<a href=""https:&#x2F;&#x2F;docs.nango.dev&#x2F;understand&#x2F;core-concepts"">https:&#x2F;&#x2F;docs.nango.dev&#x2F;understand&#x2F;core-concepts</a>).<p>Our runtime has a built-in scheduler for continuous background syncs, monitoring to know if your integrations run as expected, detailed logging of everything that happens in Nango, and pre-built infrastructure to deal with (O)auth, retries, rate-limit handling, webhook floods, data caching, de-duplication, etc. More here: <a href=""https:&#x2F;&#x2F;docs.nango.dev&#x2F;understand&#x2F;architecture"">https:&#x2F;&#x2F;docs.nango.dev&#x2F;understand&#x2F;architecture</a><p>We have found that ChatGPT and Copilot let you build integrations on Nango very fast without having to learn each API’s intricacies. LLMs are great at figuring out which endpoint to use, what parameters it takes, etc. Paired with our runtime, this lets you build complex, high-scale integrations in hours instead of weeks.<p>We’ve put a ton of effort into dealing with API complexities, so you don’t have to. Even integrations that looked simple at first ended up forcing us to extend our infra to deal with their quirks and gotchas.<p>For example, we had to figure out 100+ different OAuth implementations (see <a href=""https:&#x2F;&#x2F;www.nango.dev&#x2F;blog&#x2F;why-is-oauth-still-hard"">https:&#x2F;&#x2F;www.nango.dev&#x2F;blog&#x2F;why-is-oauth-still-hard</a> and <a href=""https:&#x2F;&#x2F;news.ycombinator.com&#x2F;item?id=35713518"">https:&#x2F;&#x2F;news.ycombinator.com&#x2F;item?id=35713518</a>). We had to deal with a half-dozen non-standard auth methods (Github apps, Stripe apps, Netsuite, etc.), expiring webhooks, ways to deal with data dependencies, weird pagination methods, API keys that change with every API call, dozens of different ways to register for webhooks, etc. It’s a constantly moving target, but it is a challenge we have come to love, and we think the approach makes sense: we specialize in finicky details that vary from API to API—you specialize in making your product great and offering more integrations to your users.<p>Last but not least, Nango is open source (<a href=""https:&#x2F;&#x2F;github.com&#x2F;NangoHQ&#x2F;nango"">https:&#x2F;&#x2F;github.com&#x2F;NangoHQ&#x2F;nango</a>) under the ELv2 license (allows most use cases, except for direct copy-cats). Anybody can contribute new APIs &amp; share their integration templates with the community.<p>The fastest way to see Nango in action is with our interactive demo here (no signup required): <a href=""https:&#x2F;&#x2F;app.nango.dev&#x2F;hn-demo"">https:&#x2F;&#x2F;app.nango.dev&#x2F;hn-demo</a><p>Or take a look at our docs: <a href=""https:&#x2F;&#x2F;docs.nango.dev"">https:&#x2F;&#x2F;docs.nango.dev</a><p>We would love to hear your feedback and look forward to the comments!"
Tomte,113.0,40166670,"[40166802, 40167415, 40167819, 40167458, 40168671, 40169772, 40167543, 40167551, 40167194, 40167793, 40167495, 40168981, 40167440, 40168181, 40167663, 40168222, 40167769, 40168813]",145,1714115607,A BSD person tries Alpine Linux,story,https://rubenerd.com/a-bsd-pserson-trying-alpine-linux/,
saturn5k,47.0,40149961,"[40166548, 40167570, 40167974, 40166579]",51,1713994374,The construction of the mafioso social capital and the Sack of Palermo (2023),story,https://onlinelibrary.wiley.com/doi/full/10.1111/issj.12464,
uaemar,45.0,40168052,"[40168606, 40168185, 40168259, 40168195, 40168553, 40169319, 40168174, 40168194, 40168598, 40168889, 40168577, 40168132, 40168165]",72,1714130789,What We Train Our Brains For,story,https://michaeldehaan.substack.com/p/what-we-train-our-brains-for,
ColinWright,44.0,40167163,"[40169873, 40169620, 40169523, 40169188, 40169475, 40169876, 40169384, 40169877, 40169998, 40169783, 40169470, 40169414]",36,1714121083,I Rewired My Brain to Become Fluent in Math (2014),story,https://nautil.us/how-i-rewired-my-brain-to-become-fluent-in-math-235085/,
Bromeo,91.0,40164337,"[40166135, 40165589, 40166010, 40165897, 40165896, 40165588, 40165919, 40166641, 40165766, 40167379, 40165932, 40167144, 40166326, 40166365, 40166602, 40165785, 40165886, 40167211, 40165380, 40166766, 40167736, 40165930, 40166521, 40165629, 40165101]",114,1714087927,Visualizing malicious IP addresses,story,https://romeov.github.io/malicious_ip_addresses/malicious_ip_analysis.html,
ludovicianul,44.0,40154731,"[40167560, 40168050, 40168812, 40167764, 40169076, 40168838, 40168855, 40169024, 40167944, 40167760, 40168850]",44,1714031953,Stripe de-couples payments from the rest of its stack,story,https://techcrunch.com/2024/04/24/stripe-doubling-down-on-embedded-finance-de-couples-payments-from-the-rest-of-its-stack/,
luu,30.0,40154189,"[40169908, 40166682, 40168663, 40167375, 40168762, 40169648, 40167299, 40167024, 40167422, 40166512, 40167547]",43,1714026973,DayLight Computer,story,https://in-silo.com/daylight_computer,
drdee,47.0,40153765,"[40168637, 40169986, 40154098, 40167114, 40169054, 40167827, 40166870, 40167563, 40168123, 40167579, 40167554, 40167650]",30,1714022789,Philosophy Is an Art,story,https://aeon.co/essays/philosophical-theories-are-like-good-stories-margaret-macdonald,
rntn,71.0,40169341,"[40169617, 40170061, 40169722, 40169535, 40170115, 40169780, 40169611, 40169462, 40169747, 40169418, 40169628]",40,1714139205,GM collects driver behavior data then sells access to insurance companies,story,https://www.techdirt.com/2024/04/26/people-are-slowly-realizing-their-auto-insurance-rates-are-skyrocketing-because-their-car-is-covertly-spying-on-them/,
agubelu,1.0,40144309,[40168739],14,1713966140,Patching requests for fun and (concurrent) profit,story,https://blog.borrego.dev/entries/patching-requests-for-fun-and-concurrent-profit.html,
ArchAndStarch,58.0,40159278,"[40161202, 40161232, 40165402, 40164635, 40162604, 40162371, 40162214, 40165768, 40167489, 40164785, 40161537, 40162114, 40161952, 40164776, 40161224, 40162651, 40164674, 40161489, 40162997, 40164933, 40161492, 40161394]",346,1714061285,Show HN: I made a programmable computer from NAND gates,story,https://github.com/ArhanChaudhary/NAND,"I am proud to present my solo hobby project NAND. This year-long undertaking follows the completed Nand to Tetris course, but ported to the web with its own runtime, user interface, and IDE. Using the &quot;Load example program&quot; selector, you can try out some programs I wrote on NAND&#x27;s emulated hardware such as 2048, a genetic algorithm, and a manual stack overflow to corrupt the screen.<p>Check out NAND at <a href=""https:&#x2F;&#x2F;nand.arhan.sh"" rel=""nofollow"">https:&#x2F;&#x2F;nand.arhan.sh</a><p>Additionally, I&#x27;ve authored an extensive writeup about the project. Read about it on the GitHub repository&#x27;s readme."
nmjenkins,320.0,40165998,"[40170138, 40167519, 40166723, 40167039, 40167296, 40167096, 40167424, 40166756, 40166883, 40166998, 40168353, 40166691, 40167374, 40167243, 40168778, 40167175, 40168786, 40167464, 40167623, 40166742, 40168508, 40168368, 40166631, 40166605, 40168846, 40167670, 40166803, 40166750, 40167234, 40167807, 40167071, 40166665, 40167950, 40166597, 40166648, 40167975, 40168468, 40167859, 40167200, 40166639]",352,1714106199,Passkeys: A Shattered Dream,story,https://fy.blackhats.net.au/blog/2024-04-26-passkeys-a-shattered-dream/,
jackflintermann,108.0,40161794,"[40163828, 40162406, 40162260, 40166125, 40163540, 40166249, 40163119, 40162068, 40163845, 40163427, 40167530, 40164972, 40169059, 40162366, 40164416, 40163152, 40167090, 40165669, 40162922, 40163485, 40164999, 40163424]",287,1714072511,No Abstractions: our API design principle,story,https://increase.com/articles/no-abstractions,
AnimalMuppet,1.0,40169827,[40169857],4,1714141544,Ask HN: What's Up with This HN Article?,story,,"https:&#x2F;&#x2F;news.ycombinator.com&#x2F;item?id=40169178<p>It is on the front page, it has 30 upvotes, it&#x27;s not flagged, but it seems impossible to comment on it.  Is it just me?"
alphabettsy,44.0,40168755,"[40169423, 40170121, 40169651, 40169490, 40169695, 40169442, 40169595, 40169721, 40169585, 40169875]",47,1714135502,"Three women contract HIV from dirty ""vampire facials"" at unlicensed spa",story,https://arstechnica.com/science/2024/04/dirty-vampire-facials-behind-first-hiv-outbreak-linked-to-spa-treatments/,
todsacerdoti,26.0,40142427,"[40167889, 40169655, 40165609, 40169332, 40166924, 40165759, 40166797, 40165146]",98,1713952442,GQL: A New ISO Standard in Graph Query Language,story,https://www.tigergraph.com/blogs/gsql/the-rise-of-gql-a-new-iso-standard-in-graph-query-language/,
throwup238,487.0,40160429,"[40161991, 40160899, 40168381, 40163743, 40160645, 40166092, 40164956, 40160829, 40164037, 40166394, 40164411, 40160676, 40162066, 40166786, 40160582, 40166328, 40163692, 40165274, 40160910, 40165986, 40168815, 40164547, 40161353, 40161701, 40162006, 40160755, 40161435, 40161993, 40160547, 40163009, 40160857, 40162669, 40163596, 40161096, 40161098, 40160937, 40162397, 40160978]",874,1714065780,FCC votes to restore net neutrality rules,story,https://www.nytimes.com/2024/04/25/technology/fcc-net-neutrality-open-internet.html,
pjmlp,23.0,40142039,"[40165700, 40163813, 40166383, 40164434, 40164038]",172,1713948294,The Optimizations in Erlang/OTP 27,story,https://www.erlang.org/blog/optimizations/,
thunderbong,111.0,40156534,"[40163665, 40156974, 40159527, 40157479, 40157183, 40161257, 40161646, 40160041, 40157029, 40161082, 40160095, 40157436, 40157557, 40160093, 40157768]",275,1714047231,Tribler: An attack-resilient micro-economy for media,story,https://github.com/Tribler/tribler/wiki,
bauruine,66.0,40154395,"[40158677, 40160229, 40164008, 40160944, 40160853, 40160506, 40165850, 40163163]",208,1714028839,Tor: From the Dark Web to the Future of Privacy,story,https://direct.mit.edu/books/oa-monograph/5761/TorFrom-the-Dark-Web-to-the-Future-of-Privacy,
skilled,22.0,40167226,"[40167499, 40168392, 40167503, 40167481, 40167507, 40168760, 40167450]",46,1714121659,European privacy regulator will stop using its own social media platforms,story,https://www.edps.europa.eu/press-publications/press-news/press-releases/2024/edps-decentralised-social-media-pilot-end-successful-story_en,
fanf2,22.0,40159766,"[40162714, 40162276, 40161121, 40160973]",189,1714063325,DDC OLED (2022),story,https://mitxela.com/projects/ddc-oled,
coloneltcb,247.0,40164199,"[40164724, 40164477, 40164897, 40164750, 40164857, 40169557, 40164639, 40164782, 40164495, 40165294, 40165899, 40164504, 40166697, 40165870, 40164614, 40166203, 40166852, 40164927, 40164733, 40164847, 40164729, 40164703, 40168808, 40168278, 40163120, 40165122, 40165085, 40164584, 40167932, 40164468, 40162807, 40167053, 40164636, 40165792, 40164721, 40166180, 40165797, 40162586, 40164786, 40164853, 40165264, 40165571, 40165383, 40164655, 40164690, 40164868]",327,1714086674,Jeff Lawson buys The Onion,story,https://www.nytimes.com/2024/04/25/business/media/the-onion-sold.html,
PaulHoule,13.0,40156890,"[40158911, 40160266, 40159599, 40159891, 40165942]",216,1714049504,Rust Stream API visualized and exposed,story,https://github.com/alexpusch/rust-magic-patterns/blob/master/rust-stream-visualized/Readme.md,
vermaden,3.0,40169521,"[40170136, 40169870, 40169686]",10,1714140089,I am So Disappointed with Ubuntu 24.04,story,https://news.itsfoss.com/ubuntu-24-04-disappointment/,
jaysonelliot,26.0,40169178,"[40170005, 40169890, 40169749, 40169706, 40169733, 40169950, 40169859, 40169809]",55,1714138435,"Balaji Srinivasan calls for tech to ""exit democracy"" and seize local governments",story,https://newrepublic.com/article/180487/balaji-srinivasan-network-state-plutocrat,
mxmzb,29.0,40162915,"[40167230, 40169079, 40166311, 40166894, 40164874, 40164970, 40166671, 40166179, 40169272, 40167210, 40166142]",25,1714078584,Why AI is failing at giving good advice,story,https://maximzubarev.com/why-ai-is-failing-at-giving-good-advice,
thunderbong,138.0,40152682,"[40153734, 40154994, 40156136, 40157356, 40154062, 40158164, 40154584, 40157046, 40159778, 40158684, 40155597, 40153726, 40153608, 40156962, 40153859, 40153727, 40158644, 40153940, 40153827, 40156041, 40155820, 40153422, 40153920]",353,1714012450,HTML Attributes vs. DOM Properties,story,https://jakearchibald.com/2024/attributes-vs-properties/,
divbzero,180.0,40167315,"[40168507, 40168307, 40168657, 40168277, 40168154, 40168203, 40168148, 40168257, 40168383, 40168348, 40168342, 40168387, 40168449]",110,1714122793,H5N1 prevalence in milk suggest US bird flu outbreak in cows is widespread,story,https://www.statnews.com/2024/04/25/h5n1-bird-flu-cows-outbreak-likely-widespread/,
agomez314,89.0,40161697,"[40162660, 40164842, 40162105, 40162491, 40169009, 40163726, 40163429, 40163049, 40162135, 40162025, 40165193, 40162414]",340,1714072018,Start Your Own ISP,story,https://startyourownisp.com/,
fgblanch,66.0,40153815,"[40157484, 40156291, 40155728, 40159092, 40156803, 40157347, 40155413, 40155586, 40156821]",270,1714023365,Tiny GPU: A minimal GPU implementation in Verilog,story,https://github.com/adam-maj/tiny-gpu,
onnnon,57.0,40150045,"[40156983, 40158053, 40163825, 40165607, 40166481]",164,1713994828,Autotuner: How to speed up your Rails app,story,https://railsatscale.com/2024-04-24-autotuner-how-to-speed-up-your-rails-app/,
lightlyused,96.0,40164793,"[40165192, 40165081, 40165509, 40165345, 40165685, 40165118, 40166569, 40166672, 40165425, 40165393, 40165493, 40165182, 40165810, 40165399, 40165533, 40166418, 40165149]",146,1714092652,MFJ is ceasing its on-site production,story,https://mailchi.mp/62e24f2ccc99/a-heavy-sad-heart,
spathak,9.0,40160467,"[40164425, 40162065]",72,1714065876,Parallel Snapshotting: make pg_dump and pg_restore multi-threaded per table,story,https://blog.peerdb.io/how-can-we-make-pgdump-and-pgrestore-5-times-faster,
docdeek,78.0,40166653,"[40168013, 40168007, 40167812, 40168051, 40169152, 40167652, 40167886, 40167883, 40168897, 40168314, 40168059, 40168983, 40167512, 40168006, 40167885, 40167915, 40168296, 40169664, 40168231]",96,1714115380,Minister defends arrest power for people feared to commit a hate crime in future,story,https://www.theglobeandmail.com/politics/article-justice-minister-defends-house-arrest-power-for-people-feared-to/,
perihelions,177.0,40162433,"[40162936, 40163323, 40166205, 40163611, 40163549, 40168027, 40164904, 40164372, 40162869, 40164395, 40163720]",201,1714076050,Judge acquits Backpage co-founder Michael Lacey on most counts,story,https://reason.com/2024/04/25/judge-acquits-backpage-co-founder-michael-lacey-on-most-counts/,
conanxin,4.0,40164308,"[40168092, 40168658]",8,1714087663,Discovering an antimalarial drug in Mao's China,story,https://www.asimov.press/p/antimalarial-drug,
epilys,4.0,40154104,"[40158967, 40161673]",81,1714026146,Chime Design and Build,story,http://leehite.org/Chimes.htm,
Xeophon,1.0,40165994,[40169627],6,1714106151,How I Search in 2024,story,https://vickiboykis.com/2024/04/25/how-i-search-in-2024/,
redda,1.0,40168817,[40168929],6,1714135836,"Nearly 1,300 stores are closing across the US in 2024. Here's the list",story,https://www.yahoo.com/news/nearly-1-300-stores-closing-100701081.html,
mpweiher,10.0,40163104,"[40166958, 40165783, 40165174, 40168191, 40164652, 40164579]",81,1714079632,A Logic Language for Distributed SQL Queries,story,https://www.osohq.com/post/logic-language-distributed-sql-queries,
satvikpendem,70.0,40150159,"[40155148, 40154659, 40156093, 40150861, 40154671, 40156075, 40154311, 40154589, 40155199, 40167613, 40154453, 40160383, 40164027, 40154643, 40153103]",85,1713995425,Make invalid states unrepresentable (2023),story,https://geeklaunch.io/blog/make-invalid-states-unrepresentable/,
davikr,78.0,40151982,"[40154714, 40155382, 40153619, 40156003, 40152738, 40154483, 40156446, 40153229, 40154089, 40153630, 40158583, 40153481, 40152909, 40153482, 40154131, 40153869, 40156064, 40155253]",241,1714006992,A Beginner's Guide to the ESP8266 (2017),story,https://tttapa.github.io/ESP8266/Chap01%20-%20ESP8266.html,
neel8986,249.0,40162354,"[40162569, 40164519, 40162563, 40163629, 40162439, 40162722, 40166233, 40166552, 40163811, 40163593, 40166428, 40163764, 40162468, 40166611, 40163932, 40164513, 40162861, 40166047, 40162373, 40163877, 40164091, 40162571]",149,1714075641,Google Earning Q1 2024 [pdf],story,https://abc.xyz/assets/91/b3/3f9213d14ce3ae27e1038e01a0e0/2024q1-alphabet-earnings-release-pdf.pdf,
xk3,1.0,40142659,[40165492],10,1713954541,Notions Classic: Spring 1990,story,http://www.absurdnotions.org/S1990.html,
montgomery_r,60.0,40157530,"[40158316, 40160538, 40158135, 40161048, 40158265, 40158367, 40159882, 40164699, 40162481, 40158912, 40158334, 40158279, 40159335, 40158189, 40164026, 40157922, 40159452, 40157531, 40157962, 40161740]",135,1714052788,Digital Wood Joints,story,https://openup.design/we-learn/50-digital-wood-joints/,
dcgoss,389.0,40152049,"[40154103, 40153192, 40160376, 40156671, 40152797, 40152585, 40160900, 40154113, 40154084, 40154707, 40158843, 40156016, 40158184, 40160453, 40153092, 40152882, 40152316, 40168399, 40158926, 40157332, 40154566, 40165560, 40156714, 40152773, 40152786, 40159035, 40158497, 40156038, 40152531, 40152535, 40153190, 40152564, 40154645]",238,1714007476,"Air Force picks Anduril, General Atomics to develop unmanned fighter jets",story,https://breakingdefense.com/2024/04/air-force-picks-anduril-general-atomics-for-next-round-of-cca-work/,
blini2077,113.0,40156330,"[40157382, 40157413, 40157754, 40168466, 40158378, 40156598, 40159641, 40158320, 40156618, 40159467, 40159375, 40157152, 40157092, 40156474, 40163691, 40156838, 40157489, 40163529, 40157200, 40156736, 40157715, 40163128, 40156764, 40163951, 40161167, 40158326, 40158444, 40158462, 40160333, 40159370, 40157202, 40158142, 40157166, 40158995, 40156727, 40161281, 40158582, 40158038, 40158249, 40156978]",449,1714045984,A useful front-end confetti animation library,story,https://github.com/catdad/canvas-confetti,
