by,descendants,id,kids,score,time,title,type,url,text
todsacerdoti,0.0,40158980,,6,1714060196,Getting your Haskell executable statically linked without Nix,story,https://hasufell.github.io/posts/2024-04-21-static-linking.html,
cglong,1.0,40154024,[40169205],7,1714025398,TIS-100: Tessellated Intelligence System,story,https://www.zachtronics.com/tis-100/,
cuuupid,211.0,40146088,"[40146293, 40146489, 40146686, 40146640, 40148383, 40146316, 40147388, 40148008, 40147761, 40158163, 40148176, 40146477, 40147762, 40146551, 40146354, 40149756, 40146350, 40146319, 40146443]",305,1713974978,"Snowflake Arctic Instruct (128x3B MoE), largest open source model",story,https://replicate.com/snowflake/snowflake-arctic-instruct,
wslh,1.0,40164660,[40169207],12,1714091248,Alphabet hails 'once-in-a-generation' AI opportunity as revenue rises,story,https://www.theguardian.com/technology/2024/apr/25/google-revenue-quarter-one,
thunderbong,0.0,40155326,,5,1714037670,"OpenBAO: Manage, store, distribute sensitive data – secrets, certificates, keys",story,https://github.com/openbao/openbao,
brandur,61.0,40146505,"[40147718, 40147492, 40147087, 40147281, 40147760, 40148315, 40148108, 40147713, 40147114, 40150952, 40148971, 40147464, 40148430, 40150284, 40147537, 40147885, 40149505, 40147304, 40148354, 40149675, 40148301, 40147146, 40148052, 40153718, 40147122, 40147360, 40147208, 40147667, 40147670, 40150617, 40148019, 40147643, 40147021, 40147278, 40147186, 40147108, 40146995, 40151421]",214,1713976475,The Stainless SDK Generator,story,https://www.stainlessapi.com/blog/announcing-the-stainless-sdk-generator,
simonebrunozzi,26.0,40136440,"[40138268, 40138507, 40138806, 40138191, 40137810, 40142061]",143,1713901845,Digitized Continuous Magnetic Recordings for the 1859 Carrington Event,story,https://agupubs.onlinelibrary.wiley.com/doi/10.1029/2023SW003807,
panabee,143.0,40161811,"[40164252, 40162344, 40162031, 40162133, 40163786, 40163014, 40162261, 40163465, 40162626, 40163254, 40164398, 40164832, 40165360, 40162766, 40163000, 40163732, 40162897, 40162891, 40163804, 40165006, 40162587, 40162029, 40162710, 40163094, 40163282]",134,1714072612,Asian American women are getting lung cancer despite never smoking,story,https://www.nbcnews.com/news/us-news/asian-american-women-lung-cancer-rcna138895,
whereistimbo,4.0,40162699,"[40163116, 40164223, 40163452, 40164709, 40165323]",56,1714077533,Virtual Machine Administration Using QEMU Monitor,story,https://documentation.suse.com/sles/12-SP5/html/SLES-all/cha-qemu-monitor.html,
Brajeshwar,9.0,40156565,"[40159783, 40158767, 40160267, 40161681, 40161665]",39,1714047380,Over a billion users could be at risk from keyboard logging app security flaw,story,https://www.techradar.com/pro/security/over-a-billion-users-could-be-at-risk-from-keyboard-logging-app-security-flaw,
xkgt,3.0,40164309,"[40167469, 40164905, 40165957, 40164656]",24,1714087669,Snowflake Launches Text-Embedding Model for Retrieval Use Cases,story,https://www.snowflake.com/blog/introducing-snowflake-arctic-embed-snowflakes-state-of-the-art-text-embedding-family-of-models/,
swores,3.0,40156642,"[40166352, 40166853]",9,1714047939,"Cost of developing new drugs may be far lower than industry claims,trial reveals",story,https://www.theguardian.com/global-development/2024/apr/25/cost-of-developing-new-drugs-may-be-far-lower-than-industry-claims-trial-reveals,
rolstenhouse,4.0,40150312,"[40166492, 40163266]",9,1713996158,Show HN: Practice for the YC interview,story,https://mock-yc.vercel.app/,"I&#x27;ve been blown away by speech-to-speech LLMs lately and was looking for a fun little website to build. Enter mock YC interviews.<p>When I first applied to YC, I used iPG (<a href=""https:&#x2F;&#x2F;jamescun.github.io&#x2F;iPG&#x2F;"" rel=""nofollow"">https:&#x2F;&#x2F;jamescun.github.io&#x2F;iPG&#x2F;</a>) to practice and get comfortable with the YC-style interview. Spoiler: I ended up getting in.<p>This took me a few hours to go from scratch to production. Would highly suggest playing around with some of the latest products (this uses Vapi.ai&#x2F;elevenlabs.io)"
thunderbong,0.0,40156508,,3,1714047088,Direct-Style Effects Explained,story,https://www.inner-product.com/posts/direct-style-effects/,
divbzero,17.0,40150386,"[40156795, 40152739, 40154754, 40152193, 40151161, 40151364, 40154775, 40153580]",61,1713996445,Amsterdam roofs that not only grow plants but also capture water for residents,story,https://www.wired.com/story/blue-green-roofs-amsterdam-resilio-climate-adaptation-sponge-cities/,
optimalsolver,0.0,40148861,,7,1713988728,True Detective: A Deep Abductive Reasoning Benchmark,story,https://arxiv.org/abs/2212.10114,
zerojames,7.0,40140002,"[40140784, 40143842]",115,1713927646,"Maxtext: A simple, performant and scalable Jax LLM",story,https://github.com/google/maxtext,
nateb2022,58.0,40143669,"[40145408, 40145220, 40144543, 40145614, 40144626, 40144263, 40154275, 40145705, 40143909, 40144819, 40144738, 40144573, 40150942, 40145810, 40144547]",225,1713962469,Faer-rs: Linear algebra foundation for Rust,story,https://github.com/sarah-ek/faer-rs,
retskrad,0.0,40158288,,14,1714056733,TSMC Unveils Advanced 1.6nm Process for 2026 Chips,story,https://www.macrumors.com/2024/04/25/tsmc-unveils-1-6nm-process/,
goksan,63.0,40158266,"[40164335, 40162951, 40160452, 40165996, 40164325, 40163508, 40164685, 40163561, 40161265, 40163464, 40160764, 40160438, 40159952, 40161599, 40160007, 40160677, 40166594, 40164334, 40163571]",90,1714056613,Show HN: I built a self-hosted status page and monitoring tool for my projects,story,https://github.com/goksan/Statusnook,"Hey HN! I&#x27;m excited to share Statusnook - a status page and monitoring tool.<p>I built Statusnook for my own projects, but I soon began incorporating bits of feedback from friends &amp; colleagues.<p>My goal was to create a tool with a solid essential feature set, and to make it easy to self-host.<p>I welcome any feedback or suggestions."
paulpauper,0.0,40164442,,11,1714089152,How to teach your two-year-old to read,story,https://www.theintrinsicperspective.com/p/how-to-teach-your-two-year-old-to,
lioeters,65.0,40156867,"[40157197, 40157314, 40157554, 40168227, 40157394, 40166949, 40157242, 40158034, 40157597, 40161809]",55,1714049414,Serious flaws in SQL (1990),story,https://dl.acm.org/doi/10.5555/77708.C1065772,
donsupreme,10.0,40162400,"[40162494, 40163503, 40163647, 40163886]",33,1714075924,"Alphabet shares jump 12% on earnings beat, first-ever dividend",story,https://www.cnbc.com/2024/04/25/alphabet-set-to-report-first-quarter-results-after-market-close.html,
magoghm,10.0,40163684,"[40165220, 40167917, 40167966, 40165282, 40165331]",29,1714082932,A look at the early impact of Meta Llama 3,story,https://ai.meta.com/blog/meta-llama-3-update/,
toss1,293.0,40143814,"[40145830, 40144764, 40144043, 40144689, 40168137, 40148028, 40144328, 40144153, 40145405, 40167878, 40144765, 40151381, 40144143, 40144695, 40144216, 40145665, 40144326, 40146653, 40144349, 40146182]",287,1713963486,The Basque Country’s Mondragón Corporation is the largest industrial co-op,story,https://www.theguardian.com/lifeandstyle/2024/apr/24/in-the-us-they-think-were-communists-the-70000-workers-showing-the-world-another-way-to-earn-a-living,
thunderbong,3.0,40166039,"[40167016, 40166501]",40,1714107023,What's new for .NET in Ubuntu 24.04,story,https://devblogs.microsoft.com/dotnet/whats-new-for-dotnet-in-ubuntu-2404/,
thenorthbay,23.0,40156219,"[40158120, 40156302, 40166558, 40166784, 40161131, 40157624, 40166440, 40160588, 40159135, 40159461, 40162783, 40166702, 40158209, 40157970, 40157229, 40157757, 40158501, 40158323, 40158110]",17,1714045312,Ask HN: Wouldn't it be cool to have a Supabase for SQLite?,story,,"Wouldn&#x27;t it be cool to have a Supabase for SQLite?<p>The core idea here is: let SQLite run next to your application on the server; but have all features a client-server database give you.<p>What&#x27;s the spec for this?<p>- SQLite runs next to server as production database<p>- That way, reads and writes are very fast<p>- In dev, some sort of worker auto-copies the prod DB to the local repo. Production bugs can be reproduced easily and code fixed quickly<p>- Have an interface that lets you access, view, and modify data in the production DB, kind of like Firebase. Might need a server of its own... or couldn&#x27;t that just be the app server itself?<p>- SQLite auto-backs up to a bucket (like Litestream)<p>I kinda really want this, but haven&#x27;t found anything quite like it. I&#x27;ve seen Turso, but it seems they focus more on global replication instead of the OSS developer experience I&#x27;m looking for.<p>What do you think? What am I missing?"
langcss,127.0,40143498,"[40145800, 40146904, 40147747, 40145653, 40146913, 40147258, 40152132, 40147120, 40148139, 40146842, 40148285, 40147058, 40145612, 40147324, 40146657, 40145913, 40151323, 40146169, 40147224, 40144686, 40147962, 40145613, 40151776, 40147709, 40145607, 40148010, 40147988, 40152673, 40146230, 40147265, 40145523, 40150853, 40147320, 40147890, 40150395, 40147204, 40145770, 40150832, 40147945, 40149897, 40147949, 40147318, 40146026, 40145917, 40145615, 40145872, 40145947, 40147377, 40146690, 40145403]",107,1713961232,Show HN: LangCSS – An AI Assistant for Tailwind,story,https://langcss.com/,"Hi All<p>This is my personal project that is an IDE and AI assistant for creating tailwind components and pages. You can chat to create designs, then make small edits yourself, and continue chatting to refine them. I am always working to improve the UX.<p>I have a time limited demo page here: <a href=""https:&#x2F;&#x2F;langcss.com&#x2F;demo"" rel=""nofollow"">https:&#x2F;&#x2F;langcss.com&#x2F;demo</a><p>Please let me know what you think! Feedback is welcome.<p>Tech wise, this just uses NextJS (Hosted on Docker) and Azure Open AI."
samspenc,1.0,40162423,[40162449],9,1714076017,Microsoft announces results for quarter ended March 31,story,https://www.microsoft.com/en-us/investor/earnings/fy-2024-q3/press-release-webcast,
babuskov,10.0,40161334,"[40161871, 40161987, 40161863, 40161942, 40162425]",137,1714070161,Xz sshd backdoor collecting usernames from logs,story,https://isc.sans.edu/diary/30802,
HieronymusBosch,18.0,40155981,"[40156357, 40156550, 40156651, 40156926]",72,1714043398,Researchers Showcase Decentralized AI-Powered Torrent Search Engine,story,https://torrentfreak.com/researchers-showcase-decentralized-ai-powered-torrent-search-engine-240425/,
soferio,15.0,40138193,"[40140460, 40138553, 40138712, 40138604, 40138640, 40142302, 40149821, 40138817, 40138194, 40138724, 40142321, 40151677]",80,1713912132,Scooping the Loop Snooper (2000),story,http://www.lel.ed.ac.uk/~gpullum/loopsnoop.html,
zach_g,15.0,40146623,"[40147473, 40153474, 40151403, 40149953, 40146624]",61,1713976818,How we manage individual user concurrencies with Nginx and Lua,story,https://www.browserless.io/blog/managing-concurrencies-with-nginx-and-lua,
pseudolus,50.0,40139880,"[40143584, 40143579, 40142377, 40143313, 40145775, 40143101, 40145107, 40142283, 40142905, 40144011]",63,1713926500,AI Starts to Sift Through String Theory's Near-Endless Possibilities,story,https://www.quantamagazine.org/ai-starts-to-sift-through-string-theorys-near-endless-possibilities-20240423/,
8BitArmour,52.0,40155240,"[40155716, 40156967, 40156388, 40156638, 40156921, 40160881, 40156073, 40155915]",130,1714036825,"Boeing retaliated against its own engineers working for FAA, union says",story,https://www.seattletimes.com/business/boeing-aerospace/boeing-retaliated-against-its-own-engineers-working-for-faa-union-says/,
kiyanwang,13.0,40141175,"[40141952, 40142780]",80,1713938905,Golang PGO builds using GitHub Actions,story,https://www.dolthub.com/blog/2024-04-19-golang-pgo-builds-using-github-actions/,
tie-in,30.0,40162747,"[40164670, 40163269, 40163285, 40165973, 40163200, 40163146, 40163064, 40163748, 40162801, 40163166]",31,1714077744,"A Response to ""Have Single-Page Apps Ruined the Web?"" (2021)",story,https://htmx.org/essays/a-response-to-rich-harris/,
gaws,115.0,40148833,"[40152889, 40149377, 40149439, 40154407, 40149733, 40149647, 40150154, 40149362, 40149729, 40149051, 40153125, 40149716, 40149433, 40153279, 40153766, 40157674, 40151344, 40151514, 40152547, 40154508, 40165659, 40149978, 40151123, 40154952, 40150709, 40151961, 40153074, 40151088, 40154445, 40151134, 40150605, 40149945, 40149411, 40154420, 40153138, 40150588, 40150516, 40149426, 40150036, 40150965, 40149466, 40155603, 40154594, 40153064, 40152999, 40149353]",221,1713988600,The Rise and Fall of the LAN Party,story,https://aftermath.site/lan-party-merritt-k-book-read-only-memory-rom,
jmsflknr,115.0,40144235,"[40144828, 40144865, 40144366, 40145639, 40144434, 40144825, 40145896, 40145260, 40144318, 40146754, 40144882]",182,1713965817,Nvidia to Acquire Run:AI,story,https://blogs.nvidia.com/blog/runai/,
cebert,8.0,40163755,"[40164063, 40164534, 40166489, 40165333]",30,1714083444,Spotify CEO is shocked by negative impact of recent layoffs,story,https://www.thestreet.com/employment/spotify-ceo-is-shocked-by-negative-impact-of-recent-layoffs,
kissgyorgy,0.0,40162601,,6,1714076931,'Escape from Tarkov' Fans Are Outraged at New $250 Pay-to-Win Edition,story,https://www.forbes.com/sites/mikestubbs/2024/04/25/escape-from-tarkov-fans-are-outraged-at-new-250-pay-to-win-edition/,
anigbrowl,23.0,40160292,"[40161674, 40161556, 40161815, 40162925, 40161401]",148,1714065286,"Big telecom used fake and dead people to fight net neutrality, New York AG says",story,https://www.vice.com/en/article/3aqq7b/big-telecom-used-fake-and-dead-people-to-fight-net-neutrality-ny-ag-says,
dejobaan,14.0,40164512,"[40165162, 40165218, 40165236, 40165641, 40165357, 40165187, 40165497]",21,1714089836,The Surprising Number of Steam Games That Use GenAI,story,https://www.totallyhuman.io/blog/the-surprising-number-of-steam-games-that-use-genai,
ngetchell,143.0,40160331,"[40162325, 40161887, 40161088, 40162117, 40161308, 40161472, 40162016, 40161270, 40160442, 40161919, 40162896, 40162779, 40164837, 40162169, 40162752, 40161470, 40162555, 40163683, 40165633, 40162836, 40161970, 40161536, 40162096, 40161479, 40161216, 40164991, 40161406, 40166338, 40162933, 40161372, 40161194]",217,1714065401,Jeff Geerling: Corporate Open Source Is Dead,story,https://www.jeffgeerling.com/blog/2024/corporate-open-source-dead,
freedomben,34.0,40164391,"[40164771, 40165321, 40164982, 40164880, 40165054, 40165119, 40165096, 40164751, 40165319, 40164706]",92,1714088527,Nintendo forces Garry's Mod to delete 20 years of content,story,https://www.tomshardware.com/video-games/pc-gaming/nintendo-forces-garrys-mod-to-delete-20-years-of-content-garry-confirms-nintendo-is-behind-steam-workshop-purge,
IFR,33.0,40160326,"[40160590, 40160327, 40161200, 40161615, 40164816, 40162428, 40161045]",30,1714065391,New evidence found for Planet 9,story,https://phys.org/news/2024-04-evidence-planet.html,
rasengan,2.0,40162223,"[40165967, 40162254]",4,1714074893,Ubuntu 24.04 LTS,story,https://ubuntu.com/blog/tag/ubuntu-24-04-lts,
margorczynski,0.0,40143753,,7,1713963047,SpaceByte: Towards Deleting Tokenization from Large Language Modeling,story,https://arxiv.org/abs/2404.14408,
N19PEDL2,0.0,40166240,,5,1714109739,Russia vetoes U.N. resolution on nuclear weapons in space,story,https://spacenews.com/russia-vetoes-u-n-resolution-on-nuclear-weapons-in-space/,
jfantl,0.0,40164054,,5,1714085505,Interplanetary Transport Network,story,https://en.wikipedia.org/wiki/Interplanetary_Transport_Network,
thiagomg,1.0,40140874,[40166909],8,1713936087,Show HN: A blogging platform based on Markdown and HTML (written in Rust),story,https://crates.io/crates/texted,"A blogging platform where content are markdown files and html files, written in Rust"
amateurhuman,368.0,40149095,"[40150272, 40149508, 40153142, 40149472, 40149259, 40150326, 40149181, 40149715, 40149225, 40149550, 40149602, 40152245, 40149172, 40149228, 40149643, 40153401, 40149178, 40149370, 40149193, 40149985, 40149599, 40149279, 40149183, 40150081, 40149301, 40150238, 40150108, 40149790, 40163145, 40158181, 40149262, 40149308, 40149403, 40153426, 40150913, 40152363, 40151073, 40151931, 40153243, 40150507, 40159742, 40150374, 40149484, 40149384, 40149498, 40149632, 40150692, 40151956, 40149221, 40150194, 40149678, 40152207, 40149205, 40149398, 40150177, 40149477, 40152500, 40149634, 40149233, 40152615, 40151360, 40149641, 40155192, 40165299, 40165368, 40149410, 40149855, 40149852, 40149460, 40149502, 40149303, 40149425, 40152962]",524,1713990092,IBM to buy HashiCorp in $6.4B deal,story,https://www.reuters.com/markets/deals/ibm-buy-hashicorp-64-billion-deal-expand-cloud-software-2024-04-24/,
Unfrozen0688,36.0,40137783,"[40142134, 40144010, 40140673, 40142637, 40139397, 40142356, 40142130, 40142145, 40143651, 40147437, 40154055]",89,1713909167,EU Police Chiefs want an end to end-to-end encryption,story,https://www.europol.europa.eu/media-press/newsroom/news/european-police-chiefs-call-for-industry-and-governments-to-take-action-against-end-to-end-encryption-roll-out,
pseudolus,169.0,40148707,"[40150419, 40154958, 40152749, 40149805, 40152813, 40149622, 40154325, 40166305, 40151190, 40150018, 40150777, 40153515, 40153345, 40154058, 40150435, 40154023, 40150277, 40152433, 40151542, 40154898, 40151550, 40150666, 40150928, 40152208, 40149624, 40149443]",220,1713987887,Nearsightedness is at epidemic levels – and the problem begins in childhood,story,https://theconversation.com/nearsightedness-is-at-epidemic-levels-and-the-problem-begins-in-childhood-225255,
thunderbong,0.0,40140223,,12,1713929512,Porting a cross-platform GUI application to Rust,story,https://hacks.mozilla.org/2024/04/porting-a-cross-platform-gui-application-to-rust/,
PaulHoule,0.0,40152384,,19,1714009764,Viral Kickstarter Telephoto Camera Makes Impossible Promises,story,https://petapixel.com/2024/04/18/this-viral-kickstarter-telephoto-camera-makes-impossible-promises/,
paulpauper,6.0,40164924,"[40165176, 40165222, 40165594]",11,1714094146,"US White-Collar Job Growth Stalls, Even in Pandemic Boomtowns",story,https://www.bloomberg.com/news/articles/2024-04-25/white-collar-hiring-stalls-out-in-miami-austin-job-markets,
rvz,41.0,40161378,"[40163052, 40162716, 40162613, 40161916, 40168943, 40161935, 40163618, 40163038, 40162032]",48,1714070368,Stripe to start taking crypto payments starting with USDC stablecoin,story,https://techcrunch.com/2024/04/25/after-6-year-hiatus-stripe-to-start-taking-crypto-payments-starting-with-usdc-stablecoin/,
aragonite,9.0,40143549,"[40148086, 40165798, 40165816, 40144758, 40147678]",44,1713961615,Key Defendant in Anna's Archive Lawsuit Denies Any Involvement with the Site,story,https://torrentfreak.com/key-defendant-in-annas-archive-lawsuit-denies-any-involvement-with-the-site-240416/,
toomuchtodo,2.0,40160488,"[40165179, 40160497]",6,1714065961,"CATL unveils LFP battery with 4C ultra-fast charging, 370 miles in 10 min",story,https://electrek.co/2024/04/25/catl-unveils-worlds-first-lfp-battery-4c-ultra-fast-charging/,
tosh,0.0,40155405,,11,1714038357,Laws of Tech: Commoditize Your Complement (2022),story,https://gwern.net/complement,
kryster,9.0,40149218,"[40151419, 40151907]",24,1713990731,Moderate Exercise Linked to Lower Depression Risk,story,https://neurosciencenews.com/depression-exercise-25976/,
jinjin2,1.0,40166630,[40167136],6,1714115066,The Gift of Ambition,story,https://world.hey.com/dhh/the-gift-of-ambition-e7b41ffc,
pseudolus,7.0,40139887,"[40148275, 40140243, 40148239, 40165465]",24,1713926591,Old Macdonald Had a Drone: Inside Farming's Tech Boom,story,https://thewalrus.ca/inside-farmings-tech-boom/,
timcobb,79.0,40158183,"[40158579, 40158596, 40159187, 40158731, 40158801, 40158993, 40159171, 40158541, 40158714, 40164697, 40159610, 40158806, 40158597, 40160653, 40158619, 40158561, 40159654, 40158753, 40158681]",182,1714056207,Ex-athletic director arrested for framing principal with AI-generated voice,story,https://www.thebaltimorebanner.com/education/k-12-schools/eric-eiswert-ai-audio-baltimore-county-YBJNJAS6OZEE5OQVF5LFOFYN6M/,
nsainsbury,1.0,40165941,[40166519],7,1714105522,Global Sea Surface Temperature – New Record,story,https://twitter.com/EliotJacobson/status/1783512618151666064,
alvivar,69.0,40152908,"[40155667, 40157491, 40155069, 40155720, 40155690, 40156222, 40155349, 40155707, 40155782, 40157657, 40157829, 40155447, 40157020, 40155766, 40155278, 40155375, 40155580, 40156443, 40158330, 40157185]",101,1714014219,"The ""it"" in AI models is the dataset",story,https://nonint.com/2023/06/10/the-it-in-ai-models-is-the-dataset/,
tosh,70.0,40162309,"[40162362, 40162757, 40162887, 40162460, 40163276, 40162558, 40164490, 40162959, 40163118, 40164295, 40162998, 40162497, 40163319, 40163053, 40162520, 40163177, 40162579, 40162471, 40162575, 40162724]",89,1714075379,John Carmack on Meta Horizon OS,story,https://twitter.com/ID_AA_Carmack/status/1782826465207165288,
rbanffy,41.0,40156133,"[40157338, 40158712, 40157861, 40157863, 40159701, 40158155]",62,1714044598,More on x86 – The Chip Letter,story,https://thechipletter.substack.com/p/more-on-x86,
sbt567,53.0,40153291,"[40155202, 40156623, 40155270, 40154782, 40154609, 40154932, 40157724, 40155133, 40155772, 40156250, 40157792, 40154724]",72,1714017780,JSR Is Not Another Package Manager,story,https://deno.com/blog/jsr-is-not-another-package-manager,
awkwardpotato,0.0,40162040,,3,1714073937,Garry's Mod working on removing all 20 years of Nintendo related content,story,https://store.steampowered.com/news/app/4000/view/4200245595694413052,
mikeywazowski,15.0,40139708,"[40143263, 40155422, 40143295, 40154069, 40143455]",12,1713924887,"Show HN: WP Foundry, a desktop WordPress management tool",story,https://wpfoundry.app/,
SurfTokyo,0.0,40161979,,3,1714073520,"Nintendo Emulator, Delta, Hits 4.4M Downloads in Its First Week",story,https://www.pocketgamer.biz/news/83878/everyone-loves-nintendo-delta-emulator-hits-44-million-downloads-in-its-first-week/,
lumpa,27.0,40142603,"[40145783, 40144822, 40145877, 40145664, 40144843, 40147439, 40150028]",111,1713953931,PyPy v7.3.16,story,https://www.pypy.org/posts/2024/04/pypy-v7316-release.html,
bilsbie,55.0,40150910,"[40153472, 40153171, 40154740, 40153732, 40161753, 40158920]",57,1713999522,Modern EV Batteries Rarely Fail: Study,story,https://insideevs.com/news/717187/ev-battery-replacements-due-failure-study/,
LopRabbit,112.0,40139681,"[40151210, 40151030, 40141165, 40140285, 40156221, 40147200, 40139986, 40140755, 40140452, 40141025, 40141056, 40140303, 40142518, 40140744]",84,1713924667,"Senate passes TikTok ban bill, sending it to President Biden's desk",story,https://www.theverge.com/2024/4/23/24137638/senate-passes-tiktok-ban-bill-divest-bytedance-foreign-aid,
bjackman,47.0,40142791,"[40159202, 40163203, 40148116, 40163050, 40162374, 40167195, 40164441, 40163873, 40162980, 40162645, 40163871, 40155557, 40162515, 40164007, 40163559, 40162769, 40163295, 40163690, 40163856, 40162566, 40163368, 40162568, 40163876, 40142842, 40163502, 40163513, 40163260, 40164036, 40163445, 40163960, 40163572, 40164401, 40163595, 40163221, 40165003, 40164822, 40162458, 40163086]",48,1713955691,Ask HN: Any tool for managing large and variable command lines?,story,,"I often find myself building up big complex command lines for testing my code, which live in my shell history.<p>Sometimes it&#x27;s possible to just wrap these up in scripts but often my invocations of that script get so variable that I need many flags etc and now the commandline gets really long and I&#x27;m back at square one.<p>A little hard to describe in the abstract so here&#x27;s a present example:<p>- I wanna compile a kernel and boot it up in QEMU, then SSH into it.<p>- But sometimes, I wanna skip the build (it takes a few seconds to detect that the tree is unchanged)<p>- Sometimes, I wanna boot with a different special disk file.<p>- Sometimes, I wanna change the networking setup. Sometimes this requires me to charge the part of the commandline that SHH&#x27;s into the VM, to match the changes I made to the QEMU commandline.<p>- etc etc<p>So I just have a huge command line in my shell history and I bring it up and manually edit it each time.<p>But I think it&#x27;s possible to make this process more convenient. An inspiration for this is Magit, an Emacs plugin that allows (among many other things) building up and stringing together lots of complex git commandlines with varying flags, via a few keypresses in a discoverable text UI.<p>I wonder if something like this already exists? If not I think it could be a fun design challenge. By looking at the shell history and using heuristics about common CLI design patterns perhaps you could automatically create keyboard shortcuts."
jseliger,0.0,40151438,,20,1714002886,Zoning Out American Families,story,https://www.discoursemagazine.com/p/zoning-out-american-families,
lxm,93.0,40138474,"[40138931, 40138907, 40138886, 40138543, 40138802, 40160673, 40139516, 40139074, 40139080, 40149430, 40139082, 40139507, 40139168, 40138877, 40139078, 40138834, 40139133, 40138875, 40165605, 40138956, 40138973, 40147522, 40139108, 40138992, 40146264, 40138860, 40139384]",55,1713914105,"California could ban Clear, which lets travelers skip TSA lines",story,https://www.cbsnews.com/news/airport-security-line-california-clear-ban-tsa/,
geox,17.0,40164743,"[40165039, 40164916, 40165084, 40165327]",30,1714092124,Survey reveals translators and illustrators losing work to AI,story,https://www2.societyofauthors.org/2024/04/11/soa-survey-reveals-a-third-of-translators-and-quarter-of-illustrators-losing-work-to-ai/,
zzulus,19.0,40163530,"[40163738, 40163890, 40163655, 40163771, 40163531, 40163985, 40163921, 40163788, 40163913, 40163979]",47,1714081942,The Nimble File Format by Meta,story,https://github.com/facebookexternal/nimble,
